url,type,timeretrieved,title
"http://www.news.com.au/national/victoria/news/police-raids-in-melbournes-northern-suburbs/news-story/135a23d342de22b6abedc7203b02d04f,https://www.reddit.com/user/thehunter699",World,24/12/2016-18:30:43,AUSTRALIAN POLICE FOIL TERRORIST PLANS FOR CHRISTMAS DAY ATTACK WITH RAIDSTHEHUNTER699
"http://www.news.com.au/national/victoria/police-raids-in-melbournes-northern-suburbs/news-story/db1180edd34e3f80479335a5ae1f5d38,https://www.reddit.com/user/ToastedCheesy",World,24/12/2016-18:30:43,"AUSTRALIAN POLICE RAID AND THWART A CHRISTMAS DAY BOMB ATTACK PLAN IN MELBOURNE, VICTORIATOASTEDCHEESY"
"http://english.yonhapnews.co.kr/news/2016/12/23/0200000000AEN20161223005553315.html,https://www.reddit.com/user/nicksatdown",World,24/12/2016-18:30:43,NORTH KOREA LIKELY TO CONDUCT NUKE TEST AROUND SOUTH KOREA'S PRESIDENTIAL RACE.NICKSATDOWN
"http://www.havanatimes.org/?p=122778,https://www.reddit.com/user/imnoidiot5",World,24/12/2016-18:30:43,RECENT ALLEGATIONS OF CORRUPTION AGAINST THE HUGE BRAZILIAN CONSTRUCTION COMPANY ODEBRECHT SHOOK POLITICAL SPHERES OF SEVERAL LATIN AMERICAN COUNTRIES INVOLVED IN THE ALLEGED PAYMENT OF BRIBEIMNOIDIOT5
"http://timesofindia.indiatimes.com/business/india-business/Retail-sales-blues-for-auto-industry-post-demonetisation/articleshow/55732624.cms,https://www.reddit.com/user/hornseat91herzig",World,24/12/2016-18:30:43,DIFFERENT TYPES OF CAR INSURANCE YOU CAN PURCHASEHORNSEAT91HERZIG
"https://www.theguardian.com/world/2016/dec/24/israeli-ambassador-to-new-zealand-recalled-in-protest-at-un-vote-role,https://www.reddit.com/user/ionised",World,24/12/2016-18:30:43,ISRAELI AMBASSADOR TO NEW ZEALAND RECALLED IN PROTEST AT UN VOTE ROLEIONISED
"https://conspiracytalk.info/order-of-malta-rejects-popes-investigation-of-condom-scandal/9812705/,https://www.reddit.com/user/wickster1",World,24/12/2016-18:30:43,ORDER OF MALTA REJECTS POPE’S INVESTIGATION OF CONDOM SCANDALWICKSTER1
"http://www.reuters.com/article/us-nigeria-security-idUSKBN14D09L?il=0,https://www.reddit.com/user/Hypatia_Alexandria_",World,24/12/2016-18:30:43,NIGERIA'S BUHARI SAYS ARMY HAS CAPTURED KEY BOKO HARAM CAMPHYPATIA_ALEXANDRIA_
"http://www.dailymail.co.uk/wires/afp/article-4063792/Nigerian-army-crushes-Boko-Haram-one-strongholds-Buhari.html,https://www.reddit.com/user/middleeastnewsman",World,24/12/2016-18:30:43,NIGERIAN ARMY 'CRUSHES' BOKO HARAM IN ONE OF LAST STRONGHOLDS: BUHARIMIDDLEEASTNEWSMAN
"https://www.alaraby.co.uk/english/news/2016/12/23/yemen-saudi-led-coalition-using-banned-brazilian-made-cluster-bombs,https://www.reddit.com/user/ionised",World,24/12/2016-18:30:43,YEMEN: SAUDI-LED COALITION 'USING BANNED BRAZILIAN-MADE CLUSTER BOMBS'IONISED
"http://www.news.com.au/world/middle-east/us-rebuke-allows-un-condemnation-of-settlements/news-story/23a943b5de64203b4d7dc509224e6191,https://www.reddit.com/user/malana680",World,24/12/2016-18:30:43,ISRAEL DECISION: UN VOTE DEEMS ISRAEL SETTLEMENTS IN PALESTINE ÂILLEGALÂMALANA680
"http://www.turkishminute.com/2016/12/22/isil-allegedly-burns-2-turkish-soldiers-death/,https://www.reddit.com/user/sylezjusz",World,24/12/2016-18:30:43,ISIS BURNS 2 TURKISH SOLDIERS TO DEATHSYLEZJUSZ
"http://www.presstv.com/Detail/2016/12/23/503185/Yemen-Saudi-Arabia-airstrike-Jizan-Taizz-Jawf,https://www.reddit.com/user/Chamran",World,24/12/2016-18:30:43,"YEMENI RETALIATORY ATTACKS LEAVE 16 SAUDI TROOPS, MERCS DEADCHAMRAN"
"http://timesofindia.indiatimes.com/world/rest-of-world/malta-hijack-ends-peacefully-as-gaddafi-loyalists-surrender/articleshow/56144270.cms,https://www.reddit.com/user/Zigzaglife",World,24/12/2016-18:30:43,"LIBYAN PLANE HIJACK ENDS PEACEFULLY AT MALTA, HIJACKERS SURRENDERZIGZAGLIFE"
"http://uk.reuters.com/article/uk-mideast-crisis-syria-water-idUKKBN14C20K,https://www.reddit.com/user/legalwanttoright",World,24/12/2016-18:30:43,DAMASCUS WATER SUPPLY CUT AFTER REBELS POLLUTE IT - AUTHORITYLEGALWANTTORIGHT
"http://www.indiatvnews.com/news/world-obama-signs-usd-618-billion-defence-bill-boosts-security-cooperation-with-india-362286,https://www.reddit.com/user/EarlymanX215",World,24/12/2016-18:30:43,OBAMA SIGNS USD 618 BILLION DEFENCE BILL; BOOSTS SECURITY COOPERATION WITH INDIAEARLYMANX215
"http://www.asahi.com/sp/ajw/articles/AJ201612180034.html,https://www.reddit.com/user/commieflirt",World,24/12/2016-18:30:43,OKINAWANS CALL FOR WITHDRAWAL OF OSPREYS IN PROTEST RALLYCOMMIEFLIRT
"https://www.dubainewspost.com/pictures-of-syria-before-and-after-war/,https://www.reddit.com/user/improvin",World,24/12/2016-18:30:43,PICTURES OF SYRIA BEFORE AND AFTER WARIMPROVIN
"http://edition.cnn.com/2016/12/23/politics/israel-official-rips-obama-un-settlements/index.html,https://www.reddit.com/user/peaceseeker1988",World,24/12/2016-18:30:43,US ABSTAINS AS UN DEMANDS END TO ISRAELI SETTLEMENTSPEACESEEKER1988
"http://www.reuters.com/article/us-libya-airplane-idUSKBN14C12E?il=0,https://www.reddit.com/user/mileyscience",World,24/12/2016-18:30:43,MALTA HIJACK ENDS PEACEFULLY AS GADDAFI LOYALISTS SURRENDERMILEYSCIENCE
"http://economictimes.indiatimes.com/news/international/world-news/us-abstaining-at-unsc-despicable-shameful-israel/articleshow/56157329.cms,https://www.reddit.com/user/myotcworld",World,24/12/2016-18:30:43,"US' ABSTAINING AT UNSC DESPICABLE, SHAMEFUL: ISRAELMYOTCWORLD"
"http://www.usnews.com/news/world/articles/2016-12-21/us-returning-thousands-of-acres-on-okinawa-to-japan,https://www.reddit.com/user/TacoBenderz",World,24/12/2016-18:30:43,"THE UNITED STATES IS RETURNING OVER 9,000 ACRES OF LAND ON OKINAWA TO THE JAPANESE GOVERNMENT, ACREAGE IT HAS HELD SINCE THE CONCLUSION OF WORLD WAR IITACOBENDERZ"
"https://www.yahoo.com/news/u-forces-embedding-more-help-iraqis-retake-mosul-172052699.html,https://www.reddit.com/user/guilelessgull",World,24/12/2016-18:30:45,"U.S. FORCES EMBEDDING MORE TO HELP IRAQIS RETAKE MOSUL - MORE THAN 5,000 AMERICAN SERVICE MEMBERS ARE CURRENTLY DEPLOYED IN IRAQGUILELESSGULL"
"http://www.aljazeera.com/news/2016/12/damascus-accuses-rebels-polluting-water-supplies-161224053913652.html,https://www.reddit.com/user/safdarabs",World,24/12/2016-18:30:45,DAMASCUS ACCUSES REBELS OF POLLUTING WATER SUPPLIESSAFDARABS
"http://www.independent.co.uk/news/world/europe/berlin-christmas-market-attack-anis-amri-killed-trying-reach-accomplices-a7493321.html,https://www.reddit.com/user/peaceseeker1988",World,24/12/2016-18:30:45,BERLIN CHRISTMAS MARKET ATTACKER 'KILLED WHILE TRYING TO REACH ACCOMPLICES’PEACESEEKER1988
"http://www.china.org.cn/china/2016-12/24/content_39976770.htm,https://www.reddit.com/user/imnoidiot5",World,24/12/2016-18:30:45,"A DIALOGUE BETWEEN THE COMMUNIST PARTY OF CHINA AND THE KUOMINTANG (KMT) PARTY WAS HELD ON FRIDAY IN BEIJING, DISCUSSING WAYS TO STRENGTHEN CROSS-STRAIT TIES.IMNOIDIOT5"
"https://asiancorrespondent.com/2016/12/india-anti-sex-trade-campaign-targets-rural-fathers-help-stop-trafficking-girls/,https://www.reddit.com/user/ionised",World,24/12/2016-18:30:45,FATHERS IN RURAL INDIA ARE THE TARGET OF A NEW CAMPAIGN TO STOP TRAFFICKERS ENSNARING YOUNG GIRLS INTO THE SEX TRADE | RESEARCH SHOWS THE AVERAGE AGE OF GIRLS FORCED INTO PROSTITUTION HAS DROPPED TO AGE 10 TO 14 IN RECENT YEARS FROM 14 TO 16 IN THE PAST.IONISED
"http://www.southsudannewsagency.com/index.php/2016/12/23/rights-groups-slam-un-failure-adopt-south-sudan-arms-embargo/,https://www.reddit.com/user/imnoidiot5",World,24/12/2016-18:30:45,RIGHTS GROUPS SLAM UN FOR FAILURE TO ADOPT SOUTH SUDAN ARMS EMBARGO RESOLUTIONIMNOIDIOT5
"https://electrek.co/2016/12/23/tesla-powerpack-microgrid-fiji-island/,https://www.reddit.com/user/peacebypiecebuypeas",World,24/12/2016-18:30:45,TESLA DELIVERS MORE POWERPACKS FOR YET ANOTHER MICROGRID PROJECT – A RESORT IN THE FIJI ISLANDSPEACEBYPIECEBUYPEAS
"http://www.latimes.com/health/la-he-sanjay-gupta-interview-20151205-column.html,https://www.reddit.com/user/bagelshade2tammera",World,24/12/2016-18:30:45,SUGGESTIONS THAT IS BENEFICIAL TO GETTING FITBAGELSHADE2TAMMERA
"http://www.reuters.com/article/us-congo-politics-idUSKBN14D03E?il=0,https://www.reddit.com/user/Miyamiank",World,24/12/2016-18:30:45,CONGO TALKS PAUSE CLOSE TO DEAL FOR KABILA TO STEP DOWN IN 2017MIYAMIANK
"http://www.santatracker2016.org/2016/10/santa-tracker-2016.html,https://www.reddit.com/user/sebootyAK47",World,24/12/2016-18:30:45,SANTA TRACKER 2016 IS LIVE AS SANTA BEGINS HIS JOURNEY.SEBOOTYAK47
"http://www.bbc.co.uk/news/uk-politics-38417101,https://www.reddit.com/user/Makdranon",World,24/12/2016-18:30:45,MAY CHRISTMAS MESSAGE URGES UNITY AFTER BREXIT VOTE - BBC NEWSMAKDRANON
"http://www.timesofisrael.com/pakistani-defense-minister-in-nuclear-threat-to-israel/,https://www.reddit.com/user/polymute",World,24/12/2016-18:30:45,"PAKISTAN MAKES NUCLEAR THREAT TO ISRAEL, IN RESPONSE TO FAKE NEWSPOLYMUTE"
"http://www.france24.com/en/20161224-officials-raid-brazil-conglomerates-ecuador-office,https://www.reddit.com/user/EightRoundsRapid",World,24/12/2016-18:30:45,"ECUADORIAN AUTHORITIES HAVE RAIDED THE GUAYAQUIL OFFICES OF SCANDAL-PLAGUED BRAZILIAN CONGLOMERATE ODEBRECHT, THE AG'S OFFICE SAID. THE SEARCH CAME DAYS AFTER THE DOJ REVEALED THAT THEY HAD PAID $33.5 MILLION TO ECUADORIAN OFFICIALS BETWEEN 2007-16 AS PART OF AN INTERNATIONAL BRIBERY SCHEME.EIGHTROUNDSRAPID"
"http://www.usatoday.com/story/news/world/2016/12/23/un-mediterranean-death-toll-tops-record-5000-year/95786964/,https://www.reddit.com/user/matt-sanders",World,24/12/2016-18:30:45,"U.N.: MIGRANT DEATHS IN MEDITERRANEAN TOPS RECORD 5,000 THIS YEARMATT-SANDERS"
"http://www.reuters.com/article/us-nigeria-security-idUSKBN14D09L,https://www.reddit.com/user/Xaltonali",World,24/12/2016-18:30:45,NIGERIA'S BUHARI SAYS ARMY HAS CAPTURED KEY BOKO HARAM CAMPXALTONALI
"http://www.reuters.com/article/us-thailand-china-defense-idUSKBN14A0HM,https://www.reddit.com/user/oooompa",World,24/12/2016-18:30:45,THAILAND SEEKS TO DEVELOP MILITARY PRODUCTION FACILITIES WITH CHINAOOOOMPA
"https://www.theguardian.com/world/2016/dec/23/forces-on-standby-to-oust-gambian-president-yahya-jammeh,https://www.reddit.com/user/madam1",World,24/12/2016-18:30:45,"WEST AFRICAN TROOPS WILL OUST THE GAMBIAN PRESIDENT IF HE DOES NOT STEP DOWN WHEN HIS TERM ENDS IN JANUARY, THE CHAIR OF THE REGIONAL BLOC HAS SAID. MARCEL DE SOUZA, THE HEAD OF THE ECOWAS COMMISSION, SAID THAT “IF HE LOVES HIS PEOPLE”, YAHYA JAMMEH WOULD NEGOTIATE A PEACEFUL EXITMADAM1"
"http://www.dw.com/en/dutch-journalist-ornstein-freed-on-defamation-charges-in-panama/a-36900282,https://www.reddit.com/user/EightRoundsRapid",World,24/12/2016-18:30:45,DUTCH JOURNALIST ORNSTEIN FREED ON DEFAMATION CHARGES IN PANAMA | PANAMA'S PRESIDENT HAS SIGNED AN EXECUTIVE DECREE TO RELEASE A DUTCH JOURNALIST JAILED ON CRIMINAL DEFAMATION CHARGES. OKKE ORNSTEIN WAS ARRESTED FOR SLANDER AND LIBEL ON NOVEMBER 15 ON HIS RETURN TO PANAMA.EIGHTROUNDSRAPID
"http://www.sciencealert.com/scientists-find-4-million-year-old-bacteria-that-antibiotics-can-t-touch,https://www.reddit.com/user/centralvapors",World,24/12/2016-18:30:45,4-MILLION-YEAR-OLD BACTERIA HAVE BEEN FOUND IN ONE OF THE DEEPEST CAVES ON EARTHCENTRALVAPORS
"http://www.koreaherald.com/view.php?ud=20161224000026,https://www.reddit.com/user/imnoidiot5",World,24/12/2016-18:30:45,"SOUTH KOREA AND RUSSIA AGREED FRIDAY TO WORK CLOSELY TOGETHER TO ENFORCE UN SECURITY COUNCIL SANCTIONS ON NORTH KOREA AS THE TWO COUNTRIES HELD HIGH-LEVEL STRATEGIC TALKS IN MOSCOW, A SENIOR SOUTH KOREAN DIPLOMAT SAID.IMNOIDIOT5"
"http://www.independent.co.uk/news/world/americas/amazon-people-tribes-indigenous-ban-oil-company-land-peru-block-64-geopark-petroperu-rainforest-a7489696.html,https://www.reddit.com/user/austinzzz",World,24/12/2016-18:30:45,INDIGENOUS AMAZON PEOPLE BAN OIL COMPANY FROM THEIR LAND AND PLEDGE TO PHYSICALLY BLOCK DEVELOPERSAUSTINZZZ
"http://www.latimes.com/projects/la-fg-immigration-trek-america-mexico/#nt=oft01a-1la1,https://www.reddit.com/user/Ripaelly",World,24/12/2016-18:30:45,"TRAVERSING THE RIO SUCHIATE: BETWEEN AFRICA AND THE U.S., AN ILLICIT RIVER CROSSING IN LATIN AMERICARIPAELLY"
"https://www.theguardian.com/world/2016/dec/24/israeli-ambassador-to-new-zealand-recalled-in-protest-at-un-vote-role,https://www.reddit.com/user/Amanda680",World,24/12/2016-18:30:45,ISRAELI AMBASSADOR TO NEW ZEALAND RECALLED IN PROTEST AT UN VOTE ROLE | WORLD NEWSAMANDA680
"http://www.businessinsider.com/germany-wants-to-speed-up-deportation-of-failed-asylum-seekers-2016-12,https://www.reddit.com/user/faguzzi",World,24/12/2016-18:30:45,GERMANY TELLS TUNISIA IT WANTS TO SPEED UP THE DEPORTATION OF FAILED ASYLUM SEEKERSFAGUZZI
"https://www.washingtonpost.com/world/national-security/us-declines-to-veto-un-security-council-resolution-for-israel-to-stop-jewish-settlement-activity/2016/12/23/cd4efe72-c939-11e6-bf4b-2c064d32a4bf_story.html,https://www.reddit.com/user/Franzfka",World,24/12/2016-18:30:45,U.S. DECLINES TO VETO U.N. SECURITY COUNCIL RESOLUTION FOR ISRAEL TO STOP JEWISH SETTLEMENT ACTIVITYFRANZFKA
"http://www.expatica.com/es/news/Catalan-separatists-gather-prepare-independence-vote_871960.html,https://www.reddit.com/user/imnoidiot5",World,24/12/2016-18:30:47,"CATALAN SEPARATISTS GATHER, PREPARE INDEPENDENCE VOTEIMNOIDIOT5"
"http://www.bbc.co.uk/news/entertainment-arts-38170579,https://www.reddit.com/user/jetgas25darius",World,24/12/2016-18:30:47,SOME QUICK HOME ENHANCEMENT TIPS THAT WILL HELP YOUJETGAS25DARIUS
"http://www.foxnews.com/world/2016/12/23/exclusive-more-chinese-missiles-bound-for-disputed-islands.html,https://www.reddit.com/user/bob21doh",World,24/12/2016-18:30:47,MORE CHINESE MISSILES BOUND FOR DISPUTED ISLANDSBOB21DOH
"http://dailycaller.com/2016/12/23/north-korean-rights-abusers-beg-for-mercy-at-unprecedented-conference/,https://www.reddit.com/user/dcismia",World,24/12/2016-18:30:47,NORTH KOREAN RIGHTS ABUSERS BEG FOR MERCY AT UNPRECEDENTED CONFERENCEDCISMIA
"https://www.theguardian.com/world/2016/dec/23/shanghai-water-supply-hit-by-100-tonne-wave-of-garbage,https://www.reddit.com/user/EightRoundsRapid",World,24/12/2016-18:30:47,"SHANGHAI WATER SUPPLY HIT BY 100-TONNE WAVE OF GARBAGE | THE SUSPECTED CULPRITS ARE TWO SHIPS THAT HAVE BEEN DUMPING WASTE UPSTREAM IN THE YANGTZE RIVER. IT HAS THEN FLOWED DOWNSTREAM TO THE RESERVOIR ON SHANGHAI’S CHONGMING ISLAND WHICH IS ALSO HOME TO 700,000 PEOPLE.EIGHTROUNDSRAPID"
"http://uk.reuters.com/article/idUKKBN14C1YQ,https://www.reddit.com/user/ManiaforBeatles",World,24/12/2016-18:30:47,"HOMELESSNESS ON THE RISE, SAYS BRITISH CHARITY AS CHRISTMAS SHELTERS OPEN - MORE THAN 4,000 HOMELESS PEOPLE IN BRITAIN ARE EXPECTED TO USE TEMPORARY SHELTERS SET UP OVER CHRISTMAS BY CHARITY CRISIS, WHICH SAID THE NUMBER OF PEOPLE SLEEPING ROUGH WAS RISING SHARPLY.MANIAFORBEATLES"
"http://www.straitstimes.com/asia/east-asia/china-names-and-shames-industrial-polluters,https://www.reddit.com/user/imnoidiot5",World,24/12/2016-18:30:47,CHINA NAMES AND SHAMES INDUSTRIAL POLLUTERSIMNOIDIOT5
"http://www.arabnews.com/node/1027546/saudi-arabia?ref=yfp,https://www.reddit.com/user/SomeDudem8",World,24/12/2016-18:30:47,RODRIGO DUTERTE VISITS SAUDI ARABIA NEXT YEARSOMEDUDEM8
"http://www.mirror.co.uk/news/world-news/gangs-overwhelm-cocaine-capital-europe-9508753,https://www.reddit.com/user/imnoidiot5",World,24/12/2016-18:30:47,GANGS OVERWHELM THE COCAINE CAPITAL OF EUROPE THAT USED TO BE FAMED FOR ITS DIAMONDSIMNOIDIOT5
"http://gulfnews.com/news/uae/crime/maid-arrested-for-giving-birth-to-illegitimate-baby-1.1947750,https://www.reddit.com/user/Kim-Jong-ll",World,24/12/2016-18:30:47,"UNMARRIED MAID ARRESTED FOR GIVING BIRTH TO ILLEGITIMATE BABY IN DUBAI. THE POLICE SAID THE HOSPITAL SHOULD HAVE INFORMED THEM IMMEDIATELY. “THEY SHOULD NOT ACCEPT SUCH CASES OF UNMARRIED PREGNANT WOMEN,” POLICE SAID.KIM-JONG-LL"
"http://time.com/4616802/ukraine-corruption-president-poroshenko/,https://www.reddit.com/user/crea7or",World,24/12/2016-18:30:47,UKRAINE PARLIAMENT MEMBER: PRESIDENT POROSHENKO IS CORRUPTCREA7OR
"http://www.nbcnews.com/storyline/europes-border-crisis/britain-s-prince-charles-says-anti-immigrant-populism-echoes-nazis-n698996,https://www.reddit.com/user/coreyliebkind",World,24/12/2016-18:30:47,PRINCE CHARLES SAY RISE OF ANTI-IMMIGRANT POPULISM ECHOES NAZISCOREYLIEBKIND
"https://www.middleeastmonitor.com/20161224-palestinian-prisoners-end-hunger-strikes-after-90-days/,https://www.reddit.com/user/middleeastnewsman",World,24/12/2016-18:30:47,PALESTINIAN PRISONERS END HUNGER STRIKES AFTER 90 DAYSMIDDLEEASTNEWSMAN
"http://www.presstv.ir/Detail/2016/12/09/497153/Iran-Israel-Palestine-West-Bank-Bahram-Qassemi-settlement-bill,https://www.reddit.com/user/articundo1",World,24/12/2016-18:30:47,ISRAELI SETTLEMENT EXPANSION BLATANT VIOLATION OF INTERNATIONAL LAW: IRANARTICUNDO1
"http://m.dw.com/en/merkel-orders-massive-security-review-after-berlin-attack/a-36898009,https://www.reddit.com/user/ManiaforBeatles",World,24/12/2016-18:30:47,MERKEL ORDERS MASSIVE SECURITY REVIEW AFTER BERLIN ATTACK - THE GERMAN CHANCELLOR HAS CALLED FOR A SWIFT AND FAR-REACHING PROBE INTO THE COUNTRY'S SECURITY APPARATUS AFTER A TERRORIST WAS ABLE TO EVADE AUTHORITIES. ANIS AMRI WAS KILLED IN ITALY IN A SHOOTOUT WITH POLICE.MANIAFORBEATLES
"http://www.metro.us/news/u-s-senator-threatens-to-curb-aid-over-u-n-resolution-on-israel/krjplw---YHZY_cqwjIvM6rQsVAR27g/,https://www.reddit.com/user/commieflirt",World,24/12/2016-18:30:47,U.S. SENATOR THREATENS TO CURB AID OVER U.N. RESOLUTION ON ISRAELCOMMIEFLIRT
"http://www.presstv.com/Detail/2016/12/24/503214/Yemen-Saudi-Arabia-airstrikes-Ibb-civilians,https://www.reddit.com/user/middleeastnewsman",World,24/12/2016-18:30:47,SAUDI AIRSTRIKES KILL NINE YEMENI CIVILIANSMIDDLEEASTNEWSMAN
"http://www.stuff.co.nz/world/87931970/israeli-ambassador-to-new-zealand-recalled-after-un-security-resolution,https://www.reddit.com/user/steppenwolf86",World,24/12/2016-18:30:47,ISRAELI AMBASSADOR TO NEW ZEALAND RECALLED AFTER UN SECURITY RESOLUTIONSTEPPENWOLF86
"https://www.sciencenews.org/article/more-fast-radio-bursts-detected-same-location,https://www.reddit.com/user/yetanotherpenguin",World,24/12/2016-18:30:47,MORE FAST RADIO BURSTS DETECTED FROM SAME LOCATION.YETANOTHERPENGUIN
"http://www.reuters.com/article/us-turkey-russia-diplomat-assailant-idUSKBN14C1FM,https://www.reddit.com/user/safdarabs",World,24/12/2016-18:30:47,"RUSSIAN ENVOY'S KILLER REMEMBERED AS LONELY BOY, NOT ANGRY JIHADISTSAFDARABS"
"http://www.independent.co.uk/news/uk/politics/tuition-fees-rise-pounds-250-9000-9250-existing-students-all-a7491351.html,https://www.reddit.com/user/ManiaforBeatles",World,24/12/2016-18:30:47,UK GOVERNMENT SNEAKS OUT £250 TUITION FEE RISE FOR EXISTING STUDENTS - REGULATIONS FOR THE RISE WERE PUT TO LEGISLATION WITHOUT AN ANNOUNCEMENTMANIAFORBEATLES
"http://www.dailysabah.com/europe/2016/12/24/mediterranean-death-toll-tops-record-5000-this-year-un-says,https://www.reddit.com/user/imnoidiot5",World,24/12/2016-18:30:47,"MEDITERRANEAN DEATH TOLL TOPS RECORD 5,000 THIS YEAR, UN SAYSIMNOIDIOT5"
"https://www.joe.ie/news/warning-of-winds-of-up-to-120-kmh-as-ireland-braces-itself-for-storm-barbara/571497,https://www.reddit.com/user/Dervanah",World,24/12/2016-18:30:47,WARNING OF WINDS OF UP TO 120 KM/H AS IRELAND BRACES ITSELF FOR STORM BARBARADERVANAH
"http://indianexpress.com/article/world/us-defends-decision-to-abstain-from-unsc-vote-on-israel-4442688/,https://www.reddit.com/user/maverick8496",World,24/12/2016-18:30:47,US DEFENDS DECISION TO ABSTAIN FROM UNSC VOTE ON ISRAELMAVERICK8496
"http://english.astroawani.com/world-news/indonesia-mulls-withdrawing-several-international-bodies-126724,https://www.reddit.com/user/imnoidiot5",World,24/12/2016-18:30:47,"THE INDONESIAN GOVERNMENT WILL CONSIDER PULLING OUT FROM SEVERAL INTERNATIONAL ORGANISATIONS, RETAINING THE MEMBERSHIP OF ONLY THOSE THAT GIVE REAL BENEFITS TO THE NATION'S INTERESTSIMNOIDIOT5"
"https://www.theguardian.com/world/2016/dec/24/israel-rejects-shameful-un-resolution-amid-criticism-of-netanyahu,https://www.reddit.com/user/austinzzz",World,24/12/2016-18:30:49,ISRAEL REJECTS 'SHAMEFUL' UN RESOLUTION AMID CRITICISM OF NETANYAHUAUSTINZZZ
"http://www.reuters.com/article/us-israel-palestinians-un-idUSKBN14C1IV,https://www.reddit.com/user/orthodoor",World,24/12/2016-18:30:49,U.N. SECURITY COUNCIL TO VOTE TODAY ON END TO ISRAELI SETTLEMENTSORTHODOOR
"http://www.npr.org/sections/thetwo-way/2016/12/23/506740713/arms-embargo-on-south-sudan-fails-u-n-vote,https://www.reddit.com/user/temporarycreature",World,24/12/2016-18:30:49,ARMS EMBARGO ON SOUTH SUDAN FAILS U.N. VOTETEMPORARYCREATURE
"https://www.theguardian.com/world/2016/dec/23/us-abstention-allows-un-to-demand-end-to-israeli-settlements,https://www.reddit.com/user/rosalinekarr",World,24/12/2016-18:30:49,US ABSTENTION ALLOWS UN TO DEMAND END TO ISRAELI SETTLEMENTSROSALINEKARR
"http://www.cnn.com/2016/12/23/world/germany-foiled-terror-plot/index.html,https://www.reddit.com/user/Somali_Pir8",World,24/12/2016-18:30:49,GERMAN POLICE ARREST TWO BROTHERS SUSPECTED OF PLOTTING SHOPPING MALL ATTACKSOMALI_PIR8
"http://news.nationalgeographic.com/2016/12/uncontacted-tribe-amazon-brazil-photos/,https://www.reddit.com/user/OpTicDyno",World,24/12/2016-18:30:49,PHOTOS OF AN UNCONTACTED TRIBE IN THE AMAZONOPTICDYNO
"http://www.independent.co.uk/news/world/asia/japan-birth-rate-sex-decline-below-million-first-time-century-1899-a7489741.html,https://www.reddit.com/user/orthodoor",World,24/12/2016-18:30:49,JAPANESE BIRTH RATE TO DROP BELOW 1 MILLION FOR FIRST TIME SINCE RECORDS BEGAN IN 1899ORTHODOOR
"https://www.theguardian.com/environment/2016/dec/23/zimbabwe-ships-live-elephants-to-wildlife-parks-in-china?CMP=twt_gu,https://www.reddit.com/user/golden430",World,24/12/2016-18:30:49,ZIMBABWE SHIPS LIVE ELEPHANTS TO WILDLIFE PARKS IN CHINAGOLDEN430
"http://www.freep.com/story/money/cars/general-motors/2016/12/23/china-general-motors-monopoly/95788648/,https://www.reddit.com/user/bob21doh",World,24/12/2016-18:30:49,CHINA FINES GM $29M FOR VIOLATING ANTI-MONOPOLY RULESBOB21DOH
"http://www.aljazeera.com/news/2016/12/google-launches-public-toilet-locator-delhi-161224070747030.html,https://www.reddit.com/user/safdarabs",World,24/12/2016-18:30:49,GOOGLE LAUNCHES PUBLIC TOILET LOCATOR IN DELHISAFDARABS
"https://www.washingtonpost.com/world/europe/after-berlin-market-attack-europe-faces-grim-future-with-terrorism-as-fact-of-life/2016/12/23/6f2f6536-c84c-11e6-acda-59924caa2450_story.html?hpid=hp_hp-top-table-main_europeterror-250am%3Ahomepage%2Fstory&utm_term=.950fc9d0f827,https://www.reddit.com/user/Muzzie_dont_surf",World,24/12/2016-18:30:49,EUROPE EUROPE MAY FACE A GRIM FUTURE WITH TERRORISM AS A FACT OF LIFEMUZZIE_DONT_SURF
"http://www.huffingtonpost.com/advertising-week/living-your-brand--health_b_10443002.html,https://www.reddit.com/user/shrinepear0cyrus",World,24/12/2016-18:30:49,GET ONE OF THE MOST OUT OF YOUR WORKOUT REGIMEN WITH THESE BASIC TIPSSHRINEPEAR0CYRUS
"http://www.aljazeera.com/news/2016/12/gambia-africa-bloc-vows-send-troops-jammeh-stays-161223180431769.html,https://www.reddit.com/user/guanaco55",World,24/12/2016-18:30:49,GAMBIA: AFRICA BLOC VOWS TO SEND TROOPS IF JAMMEH STAYS -- WEST AFRICAN STATES PLEDGE TO INTERVENE MILITARILY IF YAHYA JAMMEH DOES NOT STEP DOWN BY JANUARY 19 AFTER ELECTION LOSSGUANACO55
"http://www.bbc.com/news/world-latin-america-38422022,https://www.reddit.com/user/smilyflower",World,24/12/2016-18:30:49,CHILE PINOCHET: ANGER AS JAILED ABUSERS ASK FORGIVENESSSMILYFLOWER
"http://www.straitstimes.com/world/europe/in-world-first-man-born-without-hand-gets-one-from-deceased-donor-poland-surgeons-say,https://www.reddit.com/user/The_Revolver",World,24/12/2016-18:30:49,HUGE MEDICINE BREAKTHROUGH. POLISH SURGEONS ATTACH A HAND TO A MAN BORN WITHOUT ONE.THE_REVOLVER
"http://www.telesurtv.net/english/news/After-Privatizing-Oil-Mexico-Becomes-Net-Importer-of-US-Fuel--20161223-0007.html,https://www.reddit.com/user/discocrisco",World,24/12/2016-18:30:49,"AFTER PRIVATIZING OIL, MEXICO BECOMES NET IMPORTER OF US FUELDISCOCRISCO"
"https://www.theguardian.com/world/2016/dec/24/cruise-liner-abandons-search-for-british-woman-who-fell-overboard?CMP=Share_AndroidApp_%ED%81%B4%EB%A6%BD%EB%B3%B4%EB%93%9C%EC%97%90_%EB%B3%B5%EC%82%AC,https://www.reddit.com/user/ManiaforBeatles",World,24/12/2016-18:30:49,"CRUISE LINER ABANDONS SEARCH FOR BRITISH WOMAN WHO FELL OVERBOARD - THE 74-YEAR-OLD WOMAN WAS REPORTED MISSING ON FRIDAY MORNING, 100 NAUTICAL MILES OFF THE US COASTMANIAFORBEATLES"
"http://dailycaller.com/2016/12/22/north-korea-says-us-should-expect-imminent-war-over-sanctions/,https://www.reddit.com/user/dcismia",World,24/12/2016-18:30:49,NORTH KOREA SAYS US SHOULD EXPECT ‘IMMINENT WAR’ OVER SANCTIONSDCISMIA
"http://www.cbc.ca/news/canada/montreal/dog-meat-montreal-saved-1.3910596,https://www.reddit.com/user/Risiko19",World,24/12/2016-18:30:49,"SAVED FROM DOG MEAT FESTIVAL, 37 DOGS EN ROUTE TO MONTREALRISIKO19"
"https://www.theguardian.com/world/2016/dec/22/photographer-shows-first-images-of-uncontacted-amazon-tribe?utm_source=esp&utm_medium=Email&utm_campaign=GU+Today+main+NEW+H+categories&utm_term=205466&subid=20069068&CMP=EMCNEWEML6619I2,https://www.reddit.com/user/asburyw",World,24/12/2016-18:30:49,PHOTOGRAPHER CAPTURES IMAGES OF UNCONTACTED AMAZON TRIBEASBURYW
"https://globalnation.inquirer.net/150867/duterte-warning-pact-us-baffles-aides,https://www.reddit.com/user/gentlemansincebirth",World,24/12/2016-18:30:49,PRESIDENT DUTERTE THREATENS TO BURN DOWN THE UN HQ IN NYCGENTLEMANSINCEBIRTH
"https://sputniknews.com/business/201612211048816585-china-uk-nuclear-cooperation/,https://www.reddit.com/user/oooompa",World,24/12/2016-18:30:49,CHINA TO BOOST NUCLEAR ENERGY COOPERATION WITH UKOOOOMPA
"http://www.freemalaysiatoday.com/category/nation/2016/12/24/oic-protests-against-rohingya-oppression-must-go-on/,https://www.reddit.com/user/imnoidiot5",World,24/12/2016-18:30:49,OIC: PROTESTS AGAINST ROHINGYA OPPRESSION MUST GO ONIMNOIDIOT5
