url,type,timeretrieved,title
"http://www.timesofisrael.com/israel-busts-hamas-cell-planning-suicide-bombings-in-jerusalem-haifa/,https://www.reddit.com/user/orthodoor",World,24/12/2016-18:31:03,"ISRAEL BUSTS HAMAS CELL PLANNING SUICIDE BOMBINGS IN JERUSALEM, HAIFAORTHODOOR"
"https://asiancorrespondent.com/2016/12/philippines-duterte-calls-u-n-rights-official-idiot-murder-probe-call/,https://www.reddit.com/user/ionised",World,24/12/2016-18:31:03,RODRIGO DUTERTE HAS CALLED A TOP UN OFFICIAL AN “IDIOT” AND “JOKER” FOR URGING THAT MURDER INVESTIGATIONS BE LAUNCHED AGAINST THE PRESIDENT AFTER HE ADMITTED PERSONALLY KILLING PEOPLEIONISED
"http://www.nytimes.com/2016/12/23/world/europe/vladimir-putin-russia-press-conference.html?ref=world,https://www.reddit.com/user/malana680",World,24/12/2016-18:31:03,"VLADIMIR PUTIN, UNSURPRISED BY TRUMPÂS REMARKS, SAYS RUSSIA WANTS NO NUCLEAR ARMS RACEMALANA680"
"https://www.theguardian.com/us-news/2016/dec/23/trump-intervenes-to-sideline-obama-over-israeli-settlements,https://www.reddit.com/user/psioni",World,24/12/2016-18:31:03,EGYPT POSTPONES UN SECURITY COUNCIL VOTE ON CRITICAL RESOLUTION AFTER ISRAELI PM ASKS TRUMP’S TRANSITION TEAM FOR HELPPSIONI
"https://www.rt.com/uk/371488-queen-disappointed-may-brexit/,https://www.reddit.com/user/bob21doh",World,24/12/2016-18:31:03,NOT AMUSED: QUEEN ‘DISAPPOINTED’ MAY WON’T SPILL BREXIT SECRETSBOB21DOH
"http://www.reuters.com/article/us-goldman-sachs-cftc-idUSKBN14A1PO?il=0,https://www.reddit.com/user/mossbergGT",World,24/12/2016-18:31:03,GOLDMAN SACHS ORDERED TO PAY $120 MILLION PENALTY FOR RATE MANIPULATIONMOSSBERGGT
"http://www.euractiv.com/section/languages-culture/news/vw-ditches-german-as-official-language-angers-linguists/,https://www.reddit.com/user/Pilast",World,24/12/2016-18:31:03,"VW DITCHES GERMAN AS OFFICIAL LANGUAGE, ANGERS LINGUISTSPILAST"
"https://www.theguardian.com/world/2016/dec/22/philippines-journalist-killed-after-criticising-officials-over-illegal-drug-lab,https://www.reddit.com/user/moldgh",World,24/12/2016-18:31:03,PHILIPPINES JOURNALIST KILLED AFTER CRITICISING OFFICIALS OVER ILLEGAL DRUG LAB. PROVINCIAL NEWSPAPER PUBLISHER SHOT DEAD AFTER WRITING A COLUMN ALLEGING OFFICIAL NEGLIGENCEMOLDGH
"http://www.bbc.com/news/world-africa-38391998,https://www.reddit.com/user/judeharte",World,24/12/2016-18:31:03,"'PLASTIC RICE' SEIZED IN NIGERIA. IT WAS VERY STICKY AFTER BOILED AND ""ONLY GOD KNOWS WHAT WOULD HAVE HAPPENED"" IF PEOPLE ATE IT. IT HAD BEEN BRANDED AS ""BEST TOMATO RICE"".JUDEHARTE"
"https://972mag.com/idf-soldiers-who-killed-unarmed-palestinian-set-for-community-service/123801/,https://www.reddit.com/user/Rafael87",World,24/12/2016-18:31:04,IDF SOLDIERS WHO KILLED UNARMED PALESTINIAN TEEN SET FOR COMMUNITY SERVICERAFAEL87
"http://www.bbc.com/news/world-europe-38402506,https://www.reddit.com/user/Aimeewhitemore",World,24/12/2016-18:31:04,RUSSIA USED SYRIA AS LIVE-FIRE TRAINING - US GENERAL - BBC NEWSAIMEEWHITEMORE
"https://www.bloomberg.com/news/articles/2016-12-23/president-xi-open-to-growth-in-china-falling-below-6-5,https://www.reddit.com/user/ManiaforBeatles",World,24/12/2016-18:31:04,"PRESIDENT XI OPEN TO GROWTH IN CHINA FALLING BELOW 6.5% - PRESIDENT XI JINPING IS OPEN TO CHINA'S ECONOMIC GROWTH FALLING BELOW THE GOVERNMENT'S 6.5% TARGET, BLOOMBERG NEWS REPORTED.MANIAFORBEATLES"
"https://watchers.news/2016/12/21/geomagnetic-storm-december-21-2016/,https://www.reddit.com/user/Boris740",World,24/12/2016-18:31:04,G2 GEOMAGNETIC STORM IN PROGRESSBORIS740
"http://www.bbc.com/news/world-middle-east-38412079,https://www.reddit.com/user/phuocnguyen286",World,24/12/2016-18:31:04,EGYPT DELAYS UN RESOLUTION ON ISRAEL AS TRUMP TALKS TO PRESIDENT SISI - BBC NEWSPHUOCNGUYEN286
"http://www.independent.co.uk/news/uk/home-news/swaleside-prison-sixty-inmates-take-control-of-wing-latest-updates-kent-isle-of-sheppey-a7491326.html,https://www.reddit.com/user/ManiaforBeatles",World,24/12/2016-18:31:04,UK SWALESIDE PRISON: SIXTY INMATES TAKE CONTROL OF WING AND LIGHT FIRES - PRISONS REPORT DESCRIBED HMP SWALESIDE AS 'DANGEROUS' WITH 'FAR TOO HIGH' LEVELS OF VIOLENCEMANIAFORBEATLES
"http://www.nbcnews.com/news/world/philippine-president-rodrigo-duterte-should-face-murder-probe-un-chief-n698586,https://www.reddit.com/user/SharonSussmann",World,24/12/2016-18:31:04,"THE PRESIDENT OF THE PHILIPPINES RODRIGO DUTERTE SHOULD BE INVESTIGATED FOR MURDER AFTER BOASTING HE ""PERSONALLY"" KILLED THREE SUSPECTED CRIMINALS, A TOP UNITED NATIONS OFFICIAL SAID.SHARONSUSSMANN"
"http://news.sky.com/story/is-inspired-melbourne-christmas-day-terror-plot-foiled-10705613,https://www.reddit.com/user/khtanzeel",World,24/12/2016-18:31:04,IS-INSPIRED' MELBOURNE CHRISTMAS DAY TERROR PLOT FOILEDKHTANZEEL
"http://www.wnyc.org/story/un-expresses-concern-over-possible-genocide-south-sudan/,https://www.reddit.com/user/Public_Fucking_Media",World,24/12/2016-18:31:04,U.N. FEARS POSSIBLE GENOCIDE IN SOUTH SUDANPUBLIC_FUCKING_MEDIA
"https://article.wn.com/view/2016/12/23/Deutsche_Bank_to_pay_72_billion_to_settle_US_subprime_case/,https://www.reddit.com/user/raytrace75",World,24/12/2016-18:31:04,DEUTSCHE BANK TO PAY $7.2 BILLION TO SETTLE US SUBPRIME CASERAYTRACE75
"http://indianexpress.com/article/world/pakistan-to-attend-trilateral-meet-with-russia-and-china-4440521/,https://www.reddit.com/user/WetFireBrand",World,24/12/2016-18:31:04,PAKISTAN TO ATTEND TRILATERAL MEET WITH RUSSIA AND CHINAWETFIREBRAND
"http://www.itv.com/news/2016-12-23/german-police-detain-kosovan-brothers-for-planning-attack-on-countrys-biggest-shopping-centre/,https://www.reddit.com/user/ionised",World,24/12/2016-18:31:04,GERMAN POLICE DETAIN KOSOVAN BROTHERS FOR 'PLANNING ATTACK' ON COUNTRY'S BIGGEST SHOPPING CENTREIONISED
"http://timesofindia.indiatimes.com/city/thane/mystery-metal-9kg-uranium-costing-rs-27cr-seized-in-thane/articleshow/56114422.cms?utm_source=toiandroidapp&utm_medium=others&utm_campaign,https://www.reddit.com/user/Studr47",World,24/12/2016-18:31:04,"9 KILOS OF DEPLETED URANIUM CAUGHT IN THANE ,INDIA .STUDR47"
"http://www.cnn.com/2016/12/22/asia/australia-police-thwart-terrorist-attack/index.html?adkey=bn,https://www.reddit.com/user/Shinranshonin",World,24/12/2016-18:31:04,AUSTRALIAN POLICE THWART ATTACK POSSIBLY PLANNED FOR CHRISTMAS DAYSHINRANSHONIN
"https://www.theguardian.com/world/2016/dec/22/thousands-of-refugees-left-in-cold-as-un-and-eu-accused-of-mismanagement,https://www.reddit.com/user/CaptainDickByrne",World,24/12/2016-18:31:04,"THOUSANDS OF REFUGEES LEFT IN COLD, AS UN AND EU ACCUSED OF MISMANAGEMENTCAPTAINDICKBYRNE"
"http://www.watoday.com.au/wa-news/claremont-serial-killer-man-appears-in-court-charged-with-claremont-murders-20161223-gth517.html,https://www.reddit.com/user/Erikthered65",World,24/12/2016-18:31:04,"AUSTRALIA - CHARGES BROUGHT AGAINST MAN FOR THE CLAREMONT SERIAL KILLINGS, WHICH OCCURRED 20 YEARS AGO.ERIKTHERED65"
"https://www.theguardian.com/world/2016/dec/22/final-evacuees-leave-eastern-aleppo-as-assad-regime-takes-control,https://www.reddit.com/user/tricknbit",World,24/12/2016-18:31:04,FINAL EVACUEES LEAVE EASTERN ALEPPO AS ASSAD REGIME TAKES CONTROLTRICKNBIT
"https://www.theguardian.com/world/2016/dec/21/india-renewable-energy-paris-climate-summit-target,https://www.reddit.com/user/moldgh",World,24/12/2016-18:31:04,"THE INDIAN GOVERNMENT HAS FORECAST THAT IT WILL EXCEED THE RENEWABLE ENERGY TARGETS SET IN PARIS LAST YEAR BY NEARLY HALF AND THREE YEARS AHEAD OF SCHEDULE. 57% OF ELECTRICITY WILL COME FROM RENEWABLE SOURCES BY 2027, ABOVE 40% TARGET AGREED AT CLIMATE SUMMITMOLDGH"
"http://www.bbc.com/news/world-europe-38410731,https://www.reddit.com/user/smilyflower",World,24/12/2016-18:31:04,RUSSIA JOSEF STALIN: OUTSPOKEN GRANDSON IS 'FOUND DEAD'SMILYFLOWER
"http://www.france24.com/en/20161222-putin-calls-strengthening-russias-military-nuclear-potential,https://www.reddit.com/user/flashlight2",World,24/12/2016-18:31:04,PUTIN CALLS FOR STRENGTHENING RUSSIA'S MILITARY NUCLEAR POTENTIAFLASHLIGHT2
"http://www.abc.net.au/news/2016-12-23/syrian-iraqi-refugees-to-be-settled-in-four-se-qld-cities/8143972,https://www.reddit.com/user/frenzy3",World,24/12/2016-18:31:04,"THOUSANDS OF SYRIAN, IRAQI REFUGEES TO BE SETTLED IN FOUR SOUTH-EAST QUEENSLAND CITIESFRENZY3"
"http://www.bbc.com/news/world-latin-america-38412126,https://www.reddit.com/user/Pajaritaroja",World,24/12/2016-18:31:04,MEXICO PRESIDENT PENA NIETO TO REBUILD TULTEPEC FIREWORKS MARKETPAJARITAROJA
"http://uatoday.tv/society/russian-hackers-malware-used-to-track-ukrainian-artillery-units-in-donbas-report-says-851768.html,https://www.reddit.com/user/thumbsdrivesmecrazy",World,24/12/2016-18:31:04,"RUSSIAN MALWARE USED TO TRACK UKRAINIAN ARTILLERY UNITS IN DONBAS, REPORT SAYSTHUMBSDRIVESMECRAZY"
"http://newatlas.com/dubai-police-crime-prediction-software/47092/,https://www.reddit.com/user/azazqadir",World,24/12/2016-18:31:04,CRIME PREDICTION SOFTWARE JOINS DUBAI POLICE FORCEAZAZQADIR
"http://globalnews.ca/news/3143404/ikea-warns-customers-in-canada-not-to-attempt-sleepovers-in-its-stores/,https://www.reddit.com/user/adoway",World,24/12/2016-18:31:04,IKEA WARNS CUSTOMERS IN CANADA NOT TO ATTEMPT SLEEPOVERS IN ITS STORESADOWAY
"https://www.theguardian.com/us-news/2016/dec/22/nseers-arab-muslim-tracking-system-dismantled-obama,https://www.reddit.com/user/malana680",World,24/12/2016-18:31:06,REGISTRY USED TO TRACK ARABS AND MUSLIMS DISMANTLED BY OBAMA ADMINISTRATION | US NEWSMALANA680
"http://www.independent.co.uk/news/world/europe/supervolcano-naples-italy-eruption-dormant-reawaken-geologists-a7488806.html,https://www.reddit.com/user/zsreport",World,24/12/2016-18:31:06,'VERY DANGEROUS' SUPERVOLCANO UNDER NAPLES SHOWING SIGNS OF REAWAKENINGZSREPORT
"http://www.reuters.com/article/idUSKBN14B033,https://www.reddit.com/user/donteatgrains",World,24/12/2016-18:31:06,"EGYPT DELAYS VOTE ON SETTLEMENTS AFTER ISRAELI PRESSURE, TRUMP TWEET | REUTERSDONTEATGRAINS"
"http://www.9news.com.au/national/2016/12/23/07/19/police-raids-underway-in-melbourne-suburb,https://www.reddit.com/user/avatar1209",World,24/12/2016-18:31:06,POLICE SAY THEY HAVE FOILED A TERROR PLOT LIKELY PLANNED FOR CHRISTMAS DAY IN MELBOURNEAVATAR1209
"http://www.reuters.com/article/us-volkswagen-emissions-idUSKBN14B28G,https://www.reddit.com/user/Promotiontext",World,24/12/2016-18:31:06,"VOLKSWAGEN REACHES DEAL WITH 80,000 U.S. 3.0-LITER VEHICLE OWNERSPROMOTIONTEXT"
"http://www.scmp.com/news/china/diplomacy-defence/article/2056498/mongolia-pledges-halt-visits-dalai-lama,https://www.reddit.com/user/bob21doh",World,24/12/2016-18:31:06,MONGOLIA PLEDGES TO HALT VISITS BY THE DALAI LAMABOB21DOH
"http://www.cbc.ca/news/world/queen-elizabeth-prince-philip-leave-for-christmas-holiday-1.3908543,https://www.reddit.com/user/bob21doh",World,24/12/2016-18:31:06,"QUEEN ELIZABETH, PRINCE PHILIP LEAVE FOR CHRISTMAS HOLIDAYBOB21DOH"
"http://news.nationalpost.com/news/world/cold-war-2-0-trump-wants-to-greatly-strengthen-nuclear-arsenal-after-putin-talks-of-doing-the-same,https://www.reddit.com/user/Buck-Nasty",World,24/12/2016-18:31:06,COLD WAR 2.0: TRUMP WANTS TO ‘GREATLY STRENGTHEN’ NUCLEAR ARSENAL AFTER PUTIN TALKS OF DOING THE SAMEBUCK-NASTY
"http://abcnews.go.com/International/syrian-government-recaptures-aleppo-rebels-state-tv-reports/story?id=44351803,https://www.reddit.com/user/austinzzz",World,24/12/2016-18:31:06,"SYRIAN GOVERNMENT RECAPTURES ALL OF ALEPPO FROM REBELS, STATE TV REPORTSAUSTINZZZ"
"http://www.bbc.co.uk/news/world-africa-38414337?ocid=socialflow_twitter,https://www.reddit.com/user/discodolly",World,24/12/2016-18:31:06,NIGERIA DENIES 'PLASTIC RICE' REPORTS - BBC NEWSDISCODOLLY
"http://mobile.reuters.com/article/idUSKBN14B0AA?il=0,https://www.reddit.com/user/Langosta_9er",World,24/12/2016-18:31:06,"CHINA FOREIGN MINISTER SAYS TIES WITH USA FACE NEW UNCERTAINTIES, BUT ""ONE INDIVIDUAL"" WILL NOT IMPEDE TIES.LANGOSTA_9ER"
"http://motherboard.vice.com/read/-france-becomes-first-federal-postal-service-to-use-drones-to-deliver-mail,https://www.reddit.com/user/Zeronimicroman",World,24/12/2016-18:31:06,FRANCE BECOMES FIRST FEDERAL POSTAL SERVICE TO USE DRONES TO DELIVER MAILZERONIMICROMAN
"http://www.reuters.com/article/us-mideast-crisis-syria-russia-shoigu-idUSKBN14B1AC,https://www.reddit.com/user/avivi_",World,24/12/2016-18:31:06,"RUSSIA DEFENCE MINISTER SERGEI SHOIGU SAYS ITS AIR STRIKES IN SYRIA ""HAVE KILLED 35,000 REBELS""AVIVI_"
"http://www.cnn.com/2016/12/21/travel/sahara-snow/,https://www.reddit.com/user/yetanotherpenguin",World,24/12/2016-18:31:06,SNOW IN THE SAHARA FOR THE FIRST TIME IN 37 YEARS.YETANOTHERPENGUIN
"http://www.irishtimes.com/business/technology/google-saved-3-6bn-in-tax-in-2015-via-double-irish-strategy-1.2914681,https://www.reddit.com/user/bluegerm",World,24/12/2016-18:31:06,GOOGLE SAVED $3.6BN IN TAX IN 2015 VIA ‘DOUBLE IRISH’ STRATEGYBLUEGERM
"http://www.reuters.com/article/us-china-economy-policy-idUSKBN14B2HU,https://www.reddit.com/user/dcismia",World,24/12/2016-18:31:06,LIMITED ROOM FOR CHINA TO TIGHTEN POLICY AS DEBT FEAR GROWSDCISMIA
"http://www.upi.com/Business_News/Security-Industry/2016/12/22/US-missile-deal-for-Poland-finalized/6261482423176/,https://www.reddit.com/user/kuba85",World,24/12/2016-18:31:06,U.S. MISSILE DEAL FOR POLAND FINALIZEDKUBA85
"http://www.news.com.au/world/asia/fire-on-the-sea-of-japan-coast-rips-through-140-buildings/news-story/bd1354d3ab9d1667c120e9ad3ed7c6ee,https://www.reddit.com/user/bob21doh",World,24/12/2016-18:31:06,FIRE ON THE SEA OF JAPAN COAST RIPS THROUGH 140 BUILDINGSBOB21DOH
"http://abcnews.go.com/Health/wireStory/pope-denounces-resistance-reform-christmas-greeting-44341665?yptr=yahoo,https://www.reddit.com/user/Indysteeler",World,24/12/2016-18:31:06,POPE IN CHRISTMAS SPEECH BLASTS VATICAN RESISTANCE TO REFORMINDYSTEELER
"http://abcnews.go.com/International/wireStory/china-cooperate-trump-warns-taiwan-44341223,https://www.reddit.com/user/bob21doh",World,24/12/2016-18:31:06,CHINA SAYS IT WILL COOPERATE WITH TRUMP BUT WARNS ON TAIWANBOB21DOH
"http://abcnews.go.com/International/wireStory/north-korea-ridicules-chiefs-presidential-ambitions-44358286,https://www.reddit.com/user/austinzzz",World,24/12/2016-18:31:06,NORTH KOREA RIDICULES UN CHIEF'S PRESIDENTIAL AMBITIONSAUSTINZZZ
"http://www.abc.net.au/news/2016-12-23/police-foil-alleged-christmas-day-'terrorist-plot'-in-melbourne/8143762,https://www.reddit.com/user/d1ngal1ng",World,24/12/2016-18:31:06,SEVEN HELD OVER ALLEGED CHRISTMAS DAY TERRORIST PLOT IN MELBOURNED1NGAL1NG
"http://www.ctvnews.ca/world/north-korea-ridicules-ban-ki-moon-s-presidential-ambitions-1.3215312,https://www.reddit.com/user/bob21doh",World,24/12/2016-18:31:06,NORTH KOREA RIDICULES BAN KI-MOON'S PRESIDENTIAL AMBITIONSBOB21DOH
"http://www.bbc.co.uk/news/world-middle-east-38408548,https://www.reddit.com/user/Grimpler",World,24/12/2016-18:31:06,ALEPPO BACK UNDER GOVERNMENT CONTROL.GRIMPLER
"https://www.airsassociation.org/services-new/airs-knowledge-network-n/airs-articles/item/17450-earth-s-molten-core-has-its-own-jet-stream,https://www.reddit.com/user/MavraSay",World,24/12/2016-18:31:06,EARTH'S MOLTEN CORE HAS ITS OWN JET STREAMMAVRASAY
"https://informnapalm.org/en/hague-court-recognizes-war-ukraine-crimea-annexation-international-armed-conflict/,https://www.reddit.com/user/thumbsdrivesmecrazy",World,24/12/2016-18:31:08,THE HAGUE COURT RECOGNIZES THE WAR IN UKRAINE AND CRIMEA ANNEXATION AS AN INTERNATIONAL ARMED CONFLICTTHUMBSDRIVESMECRAZY
"http://www.sciencealert.com/watch-this-robot-captured-rare-footage-beneath-the-antarctic-sea-ice,https://www.reddit.com/user/purabossa",World,24/12/2016-18:31:08,SCIENTISTS HAVE DISCOVERED A COLOURFUL WONDERLAND BENEATH THE ANTARCTIC ICEPURABOSSA
"http://news.abs-cbn.com/news/12/22/16/81-pct-of-pinoys-have-much-trust-in-duterte-sws,https://www.reddit.com/user/filipinotruther",World,24/12/2016-18:31:08,81 PCT OF PINOYS HAVE 'MUCH TRUST' IN DUTERTE: SWSFILIPINOTRUTHER
"https://www.yahoo.com/news/putin-calls-strengthening-russias-military-nuclear-potential-101800687.html,https://www.reddit.com/user/TheRootsCrew",World,24/12/2016-18:31:08,PUTIN URGES RUSSIAN NUCLEAR WEAPONS BOOSTTHEROOTSCREW
"http://www.marketwatch.com/story/and-2016s-best-performing-commodity-is-bitcoin-2016-12-22,https://www.reddit.com/user/BobsBurgers3Bitcoin",World,24/12/2016-18:31:08,AND 2016’S BEST-PERFORMING COMMODITY IS ... BITCOIN?BOBSBURGERS3BITCOIN
"http://www.forbes.com/sites/kurtbadenhausen/2016/12/21/sweden-heads-the-best-countries-for-business-for-2017/#4a1addc31cdc,https://www.reddit.com/user/vriggy",World,24/12/2016-18:31:08,"""SWEDEN HEADS THE BEST COUNTRIES FOR BUSINESS FOR 2017"" - FORBESVRIGGY"
"http://abcnews.go.com/International/wireStory/140-buildings-fire-wind-swept-blaze-japan-44341052,https://www.reddit.com/user/ballb33",World,24/12/2016-18:31:08,RAMEN NOODLE SHOP FIRE BURNS 140 HOMESBALLB33
"http://www.npr.org/sections/parallels/2016/12/22/506550227/fearing-arrest-at-home-turkish-military-officers-seek-asylum-in-u-s,https://www.reddit.com/user/Public_Fucking_Media",World,24/12/2016-18:31:08,"FEARING ARREST AT HOME, TURKISH MILITARY OFFICERS SEEK ASYLUM IN U.S.PUBLIC_FUCKING_MEDIA"
"http://www.laht.com/article.asp?ArticleId=2427676&CategoryId=10717,https://www.reddit.com/user/dcismia",World,24/12/2016-18:31:08,VENEZUELA MORTGAGES US REFINERY CITGO TO RUSSIA'S ROSNEFTDCISMIA
"http://www.reuters.com/article/us-mideast-crisis-syria-aleppo-army-idUSKBN14B26G?il=0,https://www.reddit.com/user/Rocktone",World,24/12/2016-18:31:08,SYRIAN ARMY SAYS THEY HAVE RETAKEN ALEPPOROCKTONE
"http://www.jpost.com/Arab-Israeli-Conflict/Israel-Palestinian-lawyer-reach-agreement-to-free-hunger-strikers-476198,https://www.reddit.com/user/orthodoor",World,24/12/2016-18:31:08,"ISRAEL, PALESTINIAN LAWYER REACH AGREEMENT TO FREE HUNGER STRIKERSORTHODOOR"
"http://www.bbc.co.uk/news/uk-england-38411140,https://www.reddit.com/user/69thworldproblems",World,24/12/2016-18:31:08,BBC NEWS: SWALESIDE PRISON: INMATES 'TAKE OVER' JAIL WING69THWORLDPROBLEMS
"http://www.bbc.com/news/world-europe-38402743,https://www.reddit.com/user/cristina248",World,24/12/2016-18:31:08,BERLIN ATTACK: CHRISTMAS MARKET REOPENS FOLLOWING LORRY RAMPAGE - BBC NEWSCRISTINA248
"https://www.theguardian.com/business/2016/dec/22/bitcoin-circulation-hits-record-high-of-14bn,https://www.reddit.com/user/identiifiication",World,24/12/2016-18:31:08,VALUE OF BITCOINS IN CIRCULATION HITS RECORD HIGH OF $14BNIDENTIIFIICATION
"http://www.somalispot.com/threads/somali-womens-basketball-tournament-is-unislamic.17031/,https://www.reddit.com/user/bobbbiee",World,24/12/2016-18:31:08,"THE INFLUENTIAL SOMALI RELIGIOUS COUNCIL (SRC) HAS SAID THAT THE NATIONAL WOMEN’S BASKETBALL TOURNAMENT, WHICH STARTS TODAY IN SOMALIA, IS “UNISLAMIC”BOBBBIEE"
"https://intercontinentalcry.org/perus-amazon-tribes-will-risk-lives-stop-oil-drilling/,https://www.reddit.com/user/norristh",World,24/12/2016-18:31:08,PERU’S AMAZON TRIBES WILL RISK THEIR LIVES TO STOP OIL DRILLINGNORRISTH
"https://www.theguardian.com/world/2016/dec/21/smog-refugees-flee-chinese-cities-as-airpocalypse-blights-half-a-billion?CMP=share_btn_tw,https://www.reddit.com/user/slightlights",World,24/12/2016-18:31:08,SMOG REFUGEES FLEE CHINESE CITIES AS 'AIRPOCALYPSE' BLIGHTS HALF A BILLIONSLIGHTLIGHTS
"https://www.alaraby.co.uk/english/news/2016/12/22/iraq-to-receive-1-5bn-world-bank-loan?utm_source=twitter&utm_medium=sf,https://www.reddit.com/user/KERD_ONE",World,24/12/2016-18:31:08,IRAQ TO RECEIVE $1.5BN WORLD BANK LOANKERD_ONE
"http://www.bbc.com/news/world-middle-east-38408548,https://www.reddit.com/user/Trussed_Up",World,24/12/2016-18:31:08,ALEPPO BATTLE: SYRIAN CITY 'BACK UNDER GOVERNMENT CONTROL' - BBC NEWSTRUSSED_UP
"http://www.pri.org/stories/2016-12-22/nigeria-seizes-shipment-fake-plastic-rice-food-prices-soar,https://www.reddit.com/user/techagent",World,24/12/2016-18:31:08,NIGERIA SEIZES SHIPMENT OF FAKE PLASTIC RICE AS FOOD PRICES SOARTECHAGENT
"http://www.independent.co.uk/environment/fishing-fleet-billion-less-fish-fewer-climate-change-fight-conservation-stocks-quotas-global-warming-a7491001.html,https://www.reddit.com/user/golden430",World,24/12/2016-18:31:08,WORLD'S FISHING FLEET TO CATCH 25 BILLION FEWER FISH A YEAR BY 2100 UNLESS MORE IS DONE TO STOP CLIMATE CHANGEGOLDEN430
"http://www.reuters.com/article/us-germany-truck-dashcam-exclusive-idUSKBN14B2CV,https://www.reddit.com/user/purabossa",World,24/12/2016-18:31:08,DASHCAM SHOWS TRUCK SPEED INTO BERLIN CHRISTMAS MARKETPURABOSSA
"http://www.cbsnews.com/news/queen-elizabeth-prince-philip-royals-delay-christmas-plans-over-cold-health-concerns/,https://www.reddit.com/user/raknor88",World,24/12/2016-18:31:08,QUEEN ELIZABETH DEPARTS FOR CHRISTMAS TRIP AFTER HEALTH-RELATED DELAYRAKNOR88
"http://www.dailysabah.com/war-on-terror/2016/12/22/total-of-1005-daesh-terrorists-killed-in-operation-euphrates-shield-defense-min-says,https://www.reddit.com/user/CeFurkan",World,24/12/2016-18:31:08,"TOTAL OF 1,005 DAESH TERRORISTS KILLED IN OPERATION EUPHRATES SHIELD, DEFENSE MIN. SAYSCEFURKAN"
"http://www.bbc.co.uk/news/world-middle-east-38412079,https://www.reddit.com/user/ionised",World,24/12/2016-18:31:08,"EGYPT HAS SUDDENLY DELAYED A VOTE ON ITS UN RESOLUTION CONDEMNING ISRAELI SETTLEMENTS IN THE WEST BANK AS DONALD TRUMP INTERVENED IN THE DEBATE | A US OFFICIAL TOLD THE BBC THAT IT HAD BEEN CONSIDERING AN ABSTENTION, WHICH WOULD HAVE ALLOWED THE MOTION TO PASS.IONISED"
"https://www.rt.com/viral/371176-nasa-space-laser-ocea-phytoplankton/,https://www.reddit.com/user/NinjaDiscoJesus",World,24/12/2016-18:31:09,"A TINY ORGANISM AT THE BASE OF THE FOOD CHAIN, BUT VITAL FOR LIFE TO EXIST ON EARTH, IS UNDER THREAT, ACCORDING TO DATA COLLECTED BY A NASA SATELLITE THAT HAS BEEN FIRING A LASER INTO THE OCEAN FOR A DECADE.NINJADISCOJESUS"
"http://www.reuters.com/article/us-israel-palestinians-un-postponed-idUSKBN14B1UR?il=0,https://www.reddit.com/user/DelScipio",World,24/12/2016-18:31:09,"U.N VOTE ON ISRAELI SETTLEMENT POSTPONED, 'POTENTIALLY INDEFINITELY'DELSCIPIO"
"https://www.apnews.com/c3bab902049648a9a876f000bfefcd6c/The-Latest:-Tunisian-suspect's-fingerprints-found-in-truck,https://www.reddit.com/user/itseasytorecall",World,24/12/2016-18:31:09,GERMAN MINISTER CONFIRMS TUNISIAN SUSPECT'S FINGERPRINTS FOUND IN CAB OF BERLIN ATTACK TRUCK.ITSEASYTORECALL
"http://www.independent.co.uk/life-style/gadgets-and-tech/facebook-social-media-make-unhappy-jealous-people-particularly-sad-copenhagen-university-study-a7490816.html,https://www.reddit.com/user/ManiaforBeatles",World,24/12/2016-18:31:09,"FACEBOOK MAKES YOU UNHAPPY AND MAKES JEALOUS PEOPLE PARTICULARLY SAD, STUDY FINDS - REPORT RECOMMENDS THOSE SUFFERING ENVY SHOULD QUIT SOCIAL MEDIAMANIAFORBEATLES"
"http://www.aljazeera.com/news/2016/12/syria-government-recaptures-aleppo-161222184428465.html,https://www.reddit.com/user/Mellowde",World,24/12/2016-18:31:09,SYRIA'S GOVERNMENT RECAPTURES ALL OF ALEPPOMELLOWDE
"https://apnews.com/a419b994ccf14a42977665a9af966ec3/Report:-Russians-regularly-shelled-eastern-Ukraine-in-2014,https://www.reddit.com/user/Sonnyjimmy",World,24/12/2016-18:31:10,REPORT: RUSSIANS REGULARLY SHELLED EASTERN UKRAINE IN 2014SONNYJIMMY
"http://thehill.com/policy/cybersecurity/311471-dnc-breach-further-connected-to-russia-through-hacks-on-ukrainian,https://www.reddit.com/user/StrictScrutiny",World,24/12/2016-18:31:10,DNC BREACH FURTHER LINKED TO RUSSIA THROUGH UKRAINIAN ARTILLERY HACKSTRICTSCRUTINY
"http://www.foxnews.com/world/2016/12/22/north-korea-ridicules-un-chiefs-presidential-ambitions.html,https://www.reddit.com/user/dcismia",World,24/12/2016-18:31:10,NORTH KOREA RIDICULES UN CHIEF'S PRESIDENTIAL AMBITIONSDCISMIA
"https://www.middleeastmonitor.com/20161222-us-drone-strike-in-yemen-kills-3-al-qaeda-terrorists/,https://www.reddit.com/user/bitoffreshair",World,24/12/2016-18:31:10,US DRONE STRIKE IN YEMEN KILLS 3 AL-QAEDA TERRORISTSBITOFFRESHAIR
"http://kotaku.com/it-looks-like-caroline-kennedy-cosplayed-as-an-anime-ch-1790395983,https://www.reddit.com/user/lightsareonbut",World,24/12/2016-18:31:10,US AMBASSADOR TO JAPAN COSPLAYS AS ANIME CHARACTERLIGHTSAREONBUT
"http://www.cnn.com/2016/12/21/asia/japan-okinawa-land-handover-us-military/,https://www.reddit.com/user/zsreport",World,24/12/2016-18:31:10,US RETURNS LAND IT'S CONTROLLED SINCE WWII TO JAPAN AMID LOCAL ANGERZSREPORT
"http://www.bbc.com/news/world-europe-38392128,https://www.reddit.com/user/ManiaforBeatles",World,24/12/2016-18:31:10,TUNISIAN 'SOUGHT OVER BERLIN ATTACK' - GERMAN POLICE ARE SEARCHING FOR A TUNISIAN MAN NAMED AS ANIS A OVER BERLIN MARKET ATTACK - REPORTSMANIAFORBEATLES
"http://www.jpost.com/Arab-Israeli-Conflict/Hamas-suicide-bombing-plots-in-Haifa-Jerusalem-foiled-by-Israel-476216,https://www.reddit.com/user/manniefabian",World,24/12/2016-18:31:10,"HAMAS SUICIDE BOMBING PLOTS IN HAIFA, JERUSALEM FOILED BY ISRAELMANNIEFABIAN"
"http://tribune.com.pk/story/1271603/us-charges-pakistani-executive-140-million-fake-diploma-scheme/,https://www.reddit.com/user/Another-Chance",World,24/12/2016-18:31:10,AXACT EXECUTIVE CHARGED IN US OVER $140 MILLION FAKE DIPLOMA SCHEMEANOTHER-CHANCE
"http://www.mirror.co.uk/news/world-news/isis-confirms-commander-bloodthirsty-sinai-9502895,https://www.reddit.com/user/golden430",World,24/12/2016-18:31:10,ISIS CONFIRMS COMMANDER OF ITS BLOODTHIRSTY SINAI ARM WAS KILLED IN AIRSTRIKEGOLDEN430
"http://www.upi.com/Top_News/World-News/2016/12/21/North-Korea-running-moonshine-operations-in-Qatar-report-says/4021482348932/?spt=sec&or=tn,https://www.reddit.com/user/Imnaha2",World,24/12/2016-18:31:10,NORTH KOREA RUNNING MOONSHINE OPERATIONS IN QATARIMNAHA2
"http://www.foxnews.com/world/2016/12/22/lawyer-for-u-s-man-jailed-in-venezuela-has-not-seen-him-in-weeks-claims.html,https://www.reddit.com/user/dcismia",World,24/12/2016-18:31:10,LAWYER FOR U.S. MAN JAILED IN VENEZUELA HAS NOT SEEN HIM IN WEEKSDCISMIA
