url,type,timeretrieved,title
"http://www.nytimes.com/2016/12/24/world/europe/intent-on-unsettling-eu-russia-taps-foot-soldiers-from-the-fringe.html?,https://www.reddit.com/user/WhiteRussianChaser",World,24/12/2016-18:30:34,"INTENT ON UNSETTLING E.U., RUSSIA TAPS FOOT SOLDIERS FROM THE FRINGEWHITERUSSIANCHASER"
"http://www.bbc.co.uk/news/science-environment-38417198?ocid=socialflow_facebook&ns_mchannel=social&ns_campaign=bbcnews&ns_source=facebook,https://www.reddit.com/user/HDLiveSport",World,24/12/2016-18:30:34,ARCTIC HEATWAVE COULD BREAK RECORDS - BBC NEWSHDLIVESPORT
"http://www.france24.com/en/20161224-bolivia-president-pardons-1800-prisoners?ref=tw_i,https://www.reddit.com/user/golden430",World,24/12/2016-18:30:34,"BOLIVIA PRESIDENT PARDONS 1,800 PRISONERSGOLDEN430"
"https://www.rt.com/news/371597-philippine-duterte-burn-un/,https://www.reddit.com/user/golden430",World,24/12/2016-18:30:34,DUTERTE THREATENS TO ‘BURN DOWN’ UN BUILDING IN AMERICAGOLDEN430
"http://www.arabamericannews.com/news/news/id_13454/Rabbis-in-Israel-call-for-ban-on-Christmas-celebrations.html,https://www.reddit.com/user/toomuchredditing",World,24/12/2016-18:30:34,RABBIS IN ISRAEL CALL FOR BAN ON CHRISTMAS CELEBRATIONSTOOMUCHREDDITING
"http://www.theglobeandmail.com/news/national/dogs-once-destined-to-become-food-in-china-have-found-a-new-home-in-canada/article33428187/,https://www.reddit.com/user/dcismia",World,24/12/2016-18:30:34,DOGS ONCE DESTINED TO BECOME FOOD IN CHINA HAVE FOUND A NEW HOME IN CANADADCISMIA
"http://www.bbc.com/news/science-environment-38417198,https://www.reddit.com/user/NinjaDiscoJesus",World,24/12/2016-18:30:34,"TEMPERATURES AT THE NORTH POLE COULD BE UP TO 20 DEGREES HIGHER THAN AVERAGE THIS CHRISTMAS EVE, IN WHAT SCIENTISTS SAY IS A RECORD-BREAKING HEATWAVE.NINJADISCOJESUS"
"https://themoscowtimes.com/news/russia-deploys-military-police-battalion-to-aleppo-56635,https://www.reddit.com/user/Neo2199",World,24/12/2016-18:30:34,RUSSIA DEPLOYS MILITARY POLICE BATTALION TO ALEPPONEO2199
"http://in.reuters.com/article/idINKBN14C11V,https://www.reddit.com/user/TROLL_CALIBER",World,24/12/2016-18:30:34,"SECURITY FORCES KILL AT LEAST 40, INJURE 170, AND ARREST 460 AFTER PRESIDENT KABILA REFUSES TO STEP DOWN AT THE END OF HIS TERM IN THE CONGOTROLL_CALIBER"
"http://www.dailymail.co.uk/news/article-4064026/Russia-questions-US-grip-reality-sanctions.html,https://www.reddit.com/user/dcismia",World,24/12/2016-18:30:34,RUSSIA QUESTIONS US 'GRIP ON REALITY' AFTER SANCTIONSDCISMIA
"https://www.theguardian.com/world/2016/dec/23/vladimir-putin-defeated-democrats-blame-game-not-very-dignified-trump,https://www.reddit.com/user/abidmalana",World,24/12/2016-18:30:34,VLADIMIR PUTIN: DEFEATED DEMOCRATS' BLAME GAME 'NOT VERY DIGNIFIED' | WORLD NEWSABIDMALANA
"http://www.ynetnews.com/articles/0,7340,L-4897837,00.html,https://www.reddit.com/user/GuacamoleFanatic",World,24/12/2016-18:30:34,NETANYAHU: UNSC RESOLUTION DETERMINES WESTERN WALL IS OCCUPIED TERRITORYGUACAMOLEFANATIC
"http://www.rappler.com/nation/156543-cotabato-midsayap-christmas-eve-blast,https://www.reddit.com/user/schwarzlowexix",World,24/12/2016-18:30:35,"12 HURT IN CHRISTMAS EVE BLAST IN MIDSAYAP, COTABATO, PHILIPPINESSCHWARZLOWEXIX"
"http://www.independent.co.uk/news/world/middle-east/israel-rejects-un-resolution-settlements-donald-trump-netanyahu-us-veto-a7493456.html,https://www.reddit.com/user/urwonderful",World,24/12/2016-18:30:35,ISRAEL REJECTS UN RESOLUTION OVER SETTLEMENTS AND SAYS IT WON'T ABIDE BY TERMSURWONDERFUL
"https://www.theguardian.com/world/live/2016/dec/23/berlin-market-attack-suspect-anis-amri-killed-in-milan-reports-say-live-coverage,https://www.reddit.com/user/Pommerz",World,24/12/2016-18:30:35,"BERLIN MARKET ATTACK SUSPECT KILLED IN MILAN, REPORTS SAYPOMMERZ"
"https://thinkprogress.org/india-new-clean-energy-electricity-targets-d7773b884968#.s8goqs9bn,https://www.reddit.com/user/monsoony",World,24/12/2016-18:30:35,INDIA EXPECTS TO GET ALMOST 60% OF ITS ELECTRICITY FROM CLEAN ENERGY BY 2027MONSOONY
"http://www.jpost.com/Israel-News/Benjamin-Netanyahu/Netanyahu-Israel-will-stop-funding-the-UNs-institutions-476412?utm_source=dlvr.it&utm_medium=twitter,https://www.reddit.com/user/manniefabian",World,24/12/2016-18:30:35,NETANYAHU: ISRAEL WILL STOP FUNDING THE UN'S INSTITUTIONSMANNIEFABIAN
"http://www.al-monitor.com/pulse/originals/2016/12/christmas-iraq-christians-minorities.html,https://www.reddit.com/user/sylezjusz",World,24/12/2016-18:30:35,IRAQ'S MUSLIMS CELEBRATE CHRISTMAS IN SOLIDARITY WITH CHRISTIANSSYLEZJUSZ
"http://time.com/4617751/israel-netanyahu-obama-un-vote/,https://www.reddit.com/user/Hrodebert54",World,24/12/2016-18:30:35,ISRAEL VOTE AT UN: NETANYAHU LASHES OUT AT OBAMA ON 'AMBUSH'HRODEBERT54
"http://www.dw.com/en/germany-plans-creation-of-center-of-defense-against-fake-news-report-says/a-36887455,https://www.reddit.com/user/vin567",World,24/12/2016-18:30:35,"GERMANY PLANS CREATION OF 'CENTER OF DEFENSE' AGAINST FAKE NEWS, REPORT SAYSVIN567"
"http://www.bbc.com/news/world-africa-38416189,https://www.reddit.com/user/jonsnowknowthings",World,24/12/2016-18:30:35,A FILM BEING SHOT AT MALTA AIRPORT ABOUT A PLANE HIJACKING WAS DISRUPTED AMID THE REAL HIJACKING OF A LIBYAN AIRBUS A320JONSNOWKNOWTHINGS
"http://www.msn.com/en-us/news/crime/executions-and-death-sentences-plummeted-this-year/ar-BBxwtyO?li=BBnb7Kz,https://www.reddit.com/user/BravoRelentless",World,24/12/2016-18:30:35,EXECUTIONS AND DEATH SENTENCES PLUMMETED THIS YEARBRAVORELENTLESS
"http://www.reuters.com/article/us-israel-palestinians-un-idUSKBN14C1IV?il=0,https://www.reddit.com/user/Reddit-Is-Love",World,24/12/2016-18:30:35,"DEFYING PRESSURE, U.S. LETS U.N. DENOUNCE ISRAELI SETTLEMENTSREDDIT-IS-LOVE"
"http://www.jpost.com/Israel-News/Pakistani-Defense-Minister-threatens-Israel-following-fake-news-report-476401,https://www.reddit.com/user/DrBoomkin",World,24/12/2016-18:30:35,PAKISTANI DEFENSE MINISTER THREATENS ISRAEL WITH NUCLEAR WEAPONS FOLLOWING FAKE NEWS REPORTDRBOOMKIN
"http://m.france24.com/en/20161224-nigeria-army-capture-boko-haram-stronghold-sambisa-forest-buhari,https://www.reddit.com/user/juliarobison",World,24/12/2016-18:30:35,NIGERIAN ARMY CLAIMS CAPTURE OF BOKO HARAM STRONGHOLDJULIAROBISON
"http://www.dhakatribune.com/bangladesh/crime/2016/12/24/bangladesh-sees-first-female-suicide-bomber/,https://www.reddit.com/user/darklordind",World,24/12/2016-18:30:36,BANGLADESH SEES FIRST FEMALE SUICIDE BOMBERDARKLORDIND
"http://ifpnews.com/news/world/middle-east/2016/12/senior-member-of-turkish-ruling-party-killed-in-armed-attack/,https://www.reddit.com/user/middleeastnewsman",World,24/12/2016-18:30:36,SENIOR MEMBER OF TURKISH RULING PARTY KILLED IN ARMED ATTACKMIDDLEEASTNEWSMAN
"http://www.cnn.com/2016/12/24/asia/south-korean-protests-park-geun-hye/,https://www.reddit.com/user/oooompa",World,24/12/2016-18:30:36,'SANTAS' MARCH AGAINST SOUTH KOREA'S IMPEACHED PRESIDENTOOOOMPA
"https://www.geo.tv/latest/124662-Three-Chikungunya-cases-confirmed-in-Karachi,https://www.reddit.com/user/Another-Chance",World,24/12/2016-18:30:36,THREE CHIKUNGUNYA CASES CONFIRMED IN KARACHIANOTHER-CHANCE
"http://abcnews.go.com/International/wireStory/iran-powers-make-public-restricted-nuke-deal-documents-44374112,https://www.reddit.com/user/norwer",World,24/12/2016-18:30:36,"IN AN UNUSUAL MOVE IRAN, 6 POWERS MAKE PUBLIC RESTRICTED NUKE DEAL DOCUMENTSNORWER"
"http://www.bbc.com/news/world-africa-38427938,https://www.reddit.com/user/SyrianSimba",World,24/12/2016-18:30:36,FREED CHIBOK GIRLS REUNITED WITH THEIR FAMILIES FOR CHRISTMASSYRIANSIMBA
"http://www.theverge.com/2016/12/22/14066082/us-customs-border-patrol-social-media-account-facebook-twitter,https://www.reddit.com/user/Junistry2344567",World,24/12/2016-18:30:37,US GOVERNMENT STARTS ASKING FOREIGN TRAVELERS TO DISCLOSE THEIR SOCIAL MEDIA ACCOUNTSJUNISTRY2344567
"http://www.thestar.com.my/news/nation/2016/12/24/indonesian-maid-to-stay-at-embassy-woman-placed-there-amid-abuse-probe/,https://www.reddit.com/user/MassiveDiarrhea",World,24/12/2016-18:30:37,INDONESIAN MAID TO STAY AT EMBASSYMASSIVEDIARRHEA
"http://inhabitat.com/france-officially-opens-worlds-first-solar-panel-road/,https://www.reddit.com/user/poleco1",World,24/12/2016-18:30:37,FRANCE OFFICIALLY OPENS WORLD'S FIRST SOLAR PANEL ROADPOLECO1
"http://www.reuters.com/article/us-germany-truck-italy-security-idUSKBN14D0D9?il=0,https://www.reddit.com/user/Rioto",World,24/12/2016-18:30:37,"SECURITY STEPPED UP IN ITALY, AT VATICAN AFTER TRUCK ATTACK SUSPECT KILLEDRIOTO"
"http://qz.com/871373/kfc-and-baidu-are-applying-facial-recognition-and-pseudoscience-to-predict-food-orders/,https://www.reddit.com/user/EightRoundsRapid",World,24/12/2016-18:30:37,KFC AND BAIDU ARE APPLYING FACIAL RECOGNITION AND PSEUDOSCIENCE TO PREDICT FOOD ORDERSEIGHTROUNDSRAPID
"http://reuters.com/article/idUSKBN14D0J3,https://www.reddit.com/user/SRW90",World,24/12/2016-18:30:37,"POPE SAYS CHRISTMAS 'HOSTAGE' TO MATERIALISM, GOD IN SHADOWSSRW90"
"https://www.apnews.com/8c026337a97640309f4bdb530bf6cd07,https://www.reddit.com/user/oooompa",World,24/12/2016-18:30:37,MONGOLIA SAYS DALAI LAMA WILL NOT BE ALLOWED FUTURE VISITSOOOOMPA
"http://www.timesofmalta.com/articles/view/20161223/local/hijacked-libyan-plane-lands-in-malta.634664,https://www.reddit.com/user/gurdijak",World,24/12/2016-18:30:37,'HIJACKED' LIBYAN PLANE LANDS IN MALTAGURDIJAK
"http://zeenews.india.com/news/world/us-approves-sale-of-night-vision-equipment-to-pakistan-report_1961336.html,https://www.reddit.com/user/redhatGizmo",World,24/12/2016-18:30:37,US APPROVES SALE OF NIGHT VISION EQUIPMENT TO PAKISTAN: REPORTREDHATGIZMO
"http://abc7chicago.com/news/nephew-of-berlin-terror-suspect-2-others-arrested-in-tunisia/1671741/,https://www.reddit.com/user/The-Lying-Tree",World,24/12/2016-18:30:37,"NEPHEW OF BERLIN TERROR SUSPECT ANSI AMRI, 2 OTHERS ARRESTED IN TUNISIATHE-LYING-TREE"
"http://metro.co.uk/2016/12/23/us-army-blew-up-bodies-that-were-donated-for-medical-research-6342644/#ixzz4ThBwfpb7,https://www.reddit.com/user/YachiruTheKittyKat",World,24/12/2016-18:30:37,US ARMY BLEW UP BODIES THAT WERE DONATED FOR MEDICAL RESEARCHYACHIRUTHEKITTYKAT
"http://yle.fi/uutiset/osasto/news/finnish_police_aim_to_ban_neo-nazi_group/9369070,https://www.reddit.com/user/75000_Tokkul",World,24/12/2016-18:30:37,FINNISH POLICE AIM TO BAN NEO-NAZI GROUP75000_TOKKUL
"http://www.ynetnews.com/articles/0,7340,L-4897627,00.html,https://www.reddit.com/user/articundo1",World,24/12/2016-18:30:37,NETANYAHU: ISRAEL WILL NOT ADHERE TO UN SETTLEMENTS RESOLUTIONARTICUNDO1
"http://www.dawn.com/news/1304048,https://www.reddit.com/user/heretolearnenglish",World,24/12/2016-18:30:37,A PAKISTANI HINDU GIRL IS SNATCHED AWAY AS PAYMENT FOR A FAMILY DEBTHERETOLEARNENGLISH
"http://edition.cnn.com/2016/12/24/asia/south-korean-protests-park-geun-hye/index.html,https://www.reddit.com/user/Elisegay",World,24/12/2016-18:30:37,''SANTAS' MARCH AGAINST SOUTH KOREA'S IMPEACHED PRESIDENTELISEGAY
"http://www.bbc.com/news/world-middle-east-38429385,https://www.reddit.com/user/Surax",World,24/12/2016-18:30:37,NETANYAHU ORDERS UN TIES REVIEWSURAX
"http://www.muslimpress.com/en/tiny/news-106935,https://www.reddit.com/user/KevanKing",World,24/12/2016-18:30:37,SAYYED NASRALLAH: WAHHABI IDEOLOGY IS AN OFFENSE TO ISLAMKEVANKING
"https://www.nytimes.com/2016/12/24/world/europe/intent-on-unsettling-eu-russia-taps-foot-soldiers-from-the-fringe.amp.html,https://www.reddit.com/user/pipsdontsqueak",World,24/12/2016-18:30:37,"INTENT ON UNSETTLING E.U., RUSSIA TAPS FOOT SOLDIERS FROM THE FRINGEPIPSDONTSQUEAK"
"http://www.japantimes.co.jp/culture/2016/12/24/films/japanese-movies-may-set-ties-china-motion-2017/,https://www.reddit.com/user/ManiaforBeatles",World,24/12/2016-18:30:37,"JAPANESE MOVIES MAY SET TIES WITH CHINA IN MOTION IN 2017 - JAPANESE MOVIES HAVE THE POTENTIAL TO GIVE FRESH IMPETUS TO EFFORTS BY TOKYO AND BEIJING TO WARM POLITICAL RELATIONS IN 2017, AS EVIDENCED BY THE RECENT SMASH-HIT ANIMATION “YOUR NAME.” IN CHINA.MANIAFORBEATLES"
"http://www.commondreams.org/news/2016/12/22/historic-decision-canada-declares-internet-access-fundamental-right-all,https://www.reddit.com/user/anutensil",World,24/12/2016-18:30:38,"IN HISTORIC DECISION, CANADA DECLARES INTERNET ACCESS A FUNDAMENTAL RIGHT FOR ALLANUTENSIL"
"http://www.npr.org/sections/thetwo-way/2016/12/24/506819645/nigerian-government-pushes-boko-haram-out-of-stronghold-president-says,https://www.reddit.com/user/CaptainBrant",World,24/12/2016-18:30:38,"NIGERIAN GOVERNMENT PUSHES BOKO HARAM OUT OF STRONGHOLD, PRESIDENT SAYSCAPTAINBRANT"
"http://www.wsj.com/articles/three-arrested-in-tunisia-linked-to-berlin-attack-suspect-1482584571,https://www.reddit.com/user/golden430",World,24/12/2016-18:30:38,TUNISIA ARRESTS NEPHEW OF BERLIN ATTACK SUSPECTGOLDEN430
"http://www.miamiherald.com/news/nation-world/world/americas/venezuela/article122692819.html,https://www.reddit.com/user/dcismia",World,24/12/2016-18:30:38,"DESPERATE FOR MEDICAL ATTENTION, VENEZUELANS FLOOD INTO COLOMBIADCISMIA"
"http://www.middleeasteye.net/news/european-court-dismisses-moroccos-claim-western-sahara-1193098035,https://www.reddit.com/user/lebeardnekk",World,24/12/2016-18:30:38,MOROCCO'S CLAIM TO WESTERN SAHARA DISMISSED BY EUROPEAN COURTLEBEARDNEKK
"http://www.nytimes.com/2016/12/23/world/europe/vladimir-putin-russia-press-conference.html?_r=0,https://www.reddit.com/user/Snupholuphagus",World,24/12/2016-18:30:38,VLADIMIR PUTIN: RUSSIA WANTS NO NUCLEAR ARMS RACESNUPHOLUPHAGUS
"http://www.sixthtone.com/news/henan-court-auctions-fake-louis-vuitton-bag,https://www.reddit.com/user/b0red",World,24/12/2016-18:30:38,HENAN COURT AUCTIONS FAKE LOUIS VUITTON BAGB0RED
"http://www.presstv.ir/Detail/2016/12/24/503226/UK-homeless-households,https://www.reddit.com/user/mileyscience",World,24/12/2016-18:30:38,UK HOMELESSNESS RISES 40% SINCE 2010: REPORTMILEYSCIENCE
"https://www.theguardian.com/world/2016/dec/24/nigerian-army-captures-last-boko-haram-camp-in-sambisa-forest,https://www.reddit.com/user/abidmalana",World,24/12/2016-18:30:38,NIGERIAN ARMY CAPTURES LAST BOKO HARAM CAMP IN FORMER STRONGHOLD | WORLD NEWSABIDMALANA
"http://www.upi.com/Top_News/World-News/2016/12/23/Former-South-Korean-comfort-women-to-get-financial-reparations-from-Japan/1401482510217/,https://www.reddit.com/user/bob21doh",World,24/12/2016-18:30:38,FORMER SOUTH KOREAN 'COMFORT WOMEN' TO GET FINANCIAL REPARATIONS FROM JAPANBOB21DOH
"https://apnews.com/e8ea7c029aa348d5a6791b217ef7fabe/Explosion-rocks-Syria's-Aleppo-as-residents-return,https://www.reddit.com/user/StevenSanders90210",World,24/12/2016-18:30:38,EXPLOSION ROCKS SYRIA'S ALEPPO AS RESIDENTS RETURNSTEVENSANDERS90210
"https://www.thesun.co.uk/news/2468916/isis-release-video-of-berlin-attacker-anis-amri-pledging-allegiance-to-terror-leader-abu-bakr-al-baghdadi/,https://www.reddit.com/user/r721",World,24/12/2016-18:30:38,ISIS RELEASE VIDEO OF BERLIN ATTACKER ANIS AMRI PLEDGING ALLEGIANCE TO TERROR LEADER ABU BAKR AL-BAGHDADIR721
"http://www.reuters.com/article/us-turkey-security-internet-idUSKBN14D0E8?feedType=RSS&feedName=worldNews&utm_source=Twitter&utm_medium=Social&utm_campaign=Feed%3A+Reuters%2FworldNews+%28Reuters+World+News%29,https://www.reddit.com/user/umutk",World,24/12/2016-18:30:38,"TURKISH AUTHORITIES INVESTIGATING 10,000 SOCIAL MEDIA USERSUMUTK"
"http://ifpnews.com/translation-iran/2016/12/damascus-water-supply-cut-after-being-polluted-by-militants/,https://www.reddit.com/user/middleeastnewsman",World,24/12/2016-18:30:38,DAMASCUS WATER SUPPLY CUT AFTER BEING POLLUTED BY MILITANTSMIDDLEEASTNEWSMAN
"http://www.reuters.com/article/us-indonesia-security-idUSKBN14C0X3?feedType=RSS&feedName=worldNews,https://www.reddit.com/user/Herodriver",World,24/12/2016-18:30:38,FIGHTING BACK: HOW INDONESIA'S ELITE POLICE TURNED THE TIDE ON TERRORISTSHERODRIVER
"http://www.scmp.com/news/hong-kong/law-crime/article/2056955/judge-criticises-hong-kongs-human-trafficking-regime-after,https://www.reddit.com/user/EightRoundsRapid",World,24/12/2016-18:30:38,"JUDGE CRITICISES HONG KONG’S HUMAN TRAFFICKING REGIME AFTER OFFICIALS IGNORED FORCED LABOUR VICTIM | A 32-YEAR-OLD PAKISTANI MAN SPENT THREE YEARS IN THE CITY WORKING AN UNRELENTING SCHEDULE, WITHOUT PAY, BEFORE HE WAS SENT HOME TO PAKISTANEIGHTROUNDSRAPID"
"http://www.digitaljournal.com/news/world/nigerian-army-crushes-boko-haram-in-one-of-last-strongholds-buhari/article/482321,https://www.reddit.com/user/rollsterribleblunts",World,24/12/2016-18:30:39,NIGERIAN ARMY 'CRUSHES' BOKO HARAM IN KEY STRONGHOLDROLLSTERRIBLEBLUNTS
"http://www.radionz.co.nz/news/national/321193/nz's-israel-resolution-peacemakers-seldom-win-friends,https://www.reddit.com/user/steppenwolf86",World,24/12/2016-18:30:39,NZ'S ISRAEL RESOLUTION: PEACEMAKERS SELDOM WIN FRIENDSSTEPPENWOLF86
"http://china-underground.com/2016/12/24/chinese-catholics/,https://www.reddit.com/user/subsonico",World,24/12/2016-18:30:39,'UNDERGROUND' CATHOLICS POSE CHALLENGE FOR POPE'S HOPES OF BETTER RELATIONS WITH CHINASUBSONICO
"http://www.bbc.com/news/world-africa-38427469,https://www.reddit.com/user/mjlourens",World,24/12/2016-18:30:39,TUNISIA ARRESTS BERLIN ATTACKER'S NEPHEW - BBC NEWSMJLOURENS
"https://www.theguardian.com/world/2016/dec/24/israel-rejects-shameful-un-resolution-amid-criticism-of-netanyahu,https://www.reddit.com/user/malana680",World,24/12/2016-18:30:39,ISRAEL REJECTS 'SHAMEFUL' UN RESOLUTION AMID CRITICISM OF NETANYAHU | WORLD NEWSMALANA680
"http://www.dailymail.co.uk/wires/reuters/article-4061600/Underground-Catholics-pose-challenge-Popes-hopes-better-relations-China.html,https://www.reddit.com/user/middleeastnewsman",World,24/12/2016-18:30:39,"""UNDERGROUND"" CATHOLICS POSE CHALLENGE FOR POPE'S HOPES OF BETTER RELATIONS WITH CHINAMIDDLEEASTNEWSMAN"
"http://www.reuters.com/article/us-mideast-crisis-turkey-syria-idUSKBN14D07D,https://www.reddit.com/user/badibatu",World,24/12/2016-18:30:39,TURKEY-BACKED REBELS KILL 68 ISLAMIC STATE FIGHTERS NEAR SYRIA'S AL-BAB: STATE MEDIABADIBATU
"https://www.yahoo.com/news/snatched-night-pakistani-girl-enslaved-debt-064114925.html,https://www.reddit.com/user/mysticrust",World,24/12/2016-18:30:39,"A PAKISTANI GIRL IS SNATCHED AWAY, PAYMENT FOR A FAMILY DEBTMYSTICRUST"
"http://www.france24.com/en/20161224-china-fines-gm-unit-29-million-price-fixing,https://www.reddit.com/user/EightRoundsRapid",World,24/12/2016-18:30:39,"BEIJING HAS FINED THE CHINESE UNIT OF GENERAL MOTORS NEARLY $29 MILLION FOR ""INFRINGING ON THE RIGHTS OF CONSUMERS AND ITS COMPETITORS"" VIA PRICE-FIXING, SHANGHAI AUTHORITIES SAID.EIGHTROUNDSRAPID"
"http://www.hellenicshippingnews.com/iranian-port-aims-for-silk-road-registration/,https://www.reddit.com/user/oooompa",World,24/12/2016-18:30:41,"THE CENTRAL IRANIAN DRY PORT OF YAZD IS PUSHING FOR REGISTRATION IN THE SILK ROAD PLAN, SAID A SENIOR OFFICIAL IN A REPORTOOOOMPA"
"https://www.rt.com/news/371579-saudi-yemen-brazilian-bombs/,https://www.reddit.com/user/Hypatia_Alexandria_",World,24/12/2016-18:30:41,SAUDI-LED FORCES USED BRAZILIAN-MADE CLUSTER ROCKETS TO HIT YEMEN SCHOOLS – HRWHYPATIA_ALEXANDRIA_
"http://www.dailystar.com.lb/News/Middle-East/2016/Dec-23/386585-damascus-water-supply-cut-after-rebels-pollute-it-with-diesel.ashx,https://www.reddit.com/user/ICASL",World,24/12/2016-18:30:41,"DAMASCUS WATER SUPPLY CUT AFTER REBELS POLLUTE IT WITH DIESEL | NEWS , MIDDLE EASTICASL"
"http://time.com/4617309/philippines-duterte-un-rights-chief-idiot/,https://www.reddit.com/user/oooompa",World,24/12/2016-18:30:41,"PHILIPPINE PRESIDENT RODRIGO DUTERTE LASHED OUT AT THE U.N.’S HUMAN RIGHTS CHIEF, ZEID RA’AD AL-HUSSEIN, CALLING HIM AN “IDIOT” AFTER HE URGED THE COUNTRY’S AUTHORITIES TO INVESTIGATE DUTERTE FOR MURDEROOOOMPA"
"http://www.pri.org/stories/2016-12-22/germany-finds-itself-center-cyberstorm,https://www.reddit.com/user/Public_Fucking_Media",World,24/12/2016-18:30:41,GERMANY FINDS ITSELF IN THE CENTER OF THE CYBERSTORMPUBLIC_FUCKING_MEDIA
"http://abcnews.go.com/International/wireStory/singapore-teen-critic-held-us-appealing-asylum-44379029,https://www.reddit.com/user/opahfish",World,24/12/2016-18:30:41,SINGAPORE TEEN CRITIC IN US REPORTEDLY WANTS ASYLUMOPAHFISH
"http://bigstory.ap.org/article/ed3e585528e144f2b8fceab5b450eb97/turkey-arrests-1656-social-media-users-summer,https://www.reddit.com/user/grepnork",World,24/12/2016-18:30:41,"TURKEY ARRESTS 1,656 SOCIAL MEDIA USERS SINCE SUMMER, 10,000 OTHERS UNDER INVESTIGATIONGREPNORK"
"http://www.bbc.com/news/world-europe-38406965,https://www.reddit.com/user/Henkersjunge",World,24/12/2016-18:30:41,AUGSBURG WW2 BOMB FORCES MASS EVACUATION ON CHRISTMAS DAYHENKERSJUNGE
"https://www.theguardian.com/world/2016/dec/24/philippines-braces-for-severe-typhoon-on-christmas-day,https://www.reddit.com/user/KRISHNA53",World,24/12/2016-18:30:41,PHILIPPINES BRACES FOR SEVERE TYPHOON ON CHRISTMAS DAYKRISHNA53
"http://www.yenisafak.com/en/news/turkeys-erdogan-releases-message-marking-christmas-2585947,https://www.reddit.com/user/LetMeHideMyselfFirst",World,24/12/2016-18:30:41,PRESIDENT RECEP TAYYIP ERDOĞAN EXTENDS SEASON'S GREETINGS TO TURKEY'S CHRISTIANS AND THE WIDER CHRISTIAN WORLDLETMEHIDEMYSELFFIRST
"https://news.google.co.uk/news/amp?caurl=http%3A%2F%2Fm.economictimes.com%2Fmagazines%2Fpanache%2Fover-half-the-population-of-women-in-brazil-shunning-pregnancy-for-zika-fear%2Famp_articleshow%2F56140264.cms#pt0-163038,https://www.reddit.com/user/Makdranon",World,24/12/2016-18:30:41,OVER HALF THE POPULATION OF WOMEN IN BRAZIL SHUNNING PREGNANCY FOR ZIKA FEARMAKDRANON
"http://www.cnn.com/2016/12/24/asia/typhoon-nock-ten-nina-philippines/index.html,https://www.reddit.com/user/MischiefDame",World,24/12/2016-18:30:41,TYPHOON EXPECTED TO WALLOP PHILIPPINES ON CHRISTMASMISCHIEFDAME
"http://www.bbc.com/news/world-europe-38429388,https://www.reddit.com/user/fafurrukh",World,24/12/2016-18:30:41,POPE FRANCIS MARKS CHRISTMAS MASS AT VATICANFAFURRUKH
"http://www.timesofisrael.com/white-house-netanyahus-choices-led-to-anti-settlement-un-resolution/,https://www.reddit.com/user/meteorblade",World,24/12/2016-18:30:41,WHITE HOUSE: NETANYAHU’S CHOICES LED TO ANTI-SETTLEMENT UN RESOLUTIONMETEORBLADE
"http://www.reuters.com/article/us-egypt-economy-military-idUSKBN14D087,https://www.reddit.com/user/Astr0naut0",World,24/12/2016-18:30:41,EGYPT'S SISI SAYS MILITARY ACCOUNTS FOR 1.5-2 PERCENT OF ECONOMYASTR0NAUT0
"http://dailytimes.com.pk/business/24-Dec-16/chinas-war-on-smog-sends-shivers-across-commodities-sector,https://www.reddit.com/user/imnoidiot5",World,24/12/2016-18:30:41,"CHINA'S CRACKDOWN ON EXHAUST-SPEWING FACTORIES THAT SHUT OR SLASHED OUTPUT THIS WEEK AT SITES INCLUDING STEEL MILLS, TEXTILE AND CEMENT FACTORIES AND COAL-FIRED POWER PLANTS WILL RIPPLE ACROSS MAJOR BULK COMMODITY MARKETS INTO 2017.IMNOIDIOT5"
"http://www.nytimes.com/aponline/2016/12/24/world/middleeast/ap-ml-israel-us.html,https://www.reddit.com/user/JohnTheGenius43",World,24/12/2016-18:30:41,ISRAEL'S NETANYAHU LASHES OUT AT OBAMA OVER UN VOTEJOHNTHEGENIUS43
"https://www.theguardian.com/world/2016/dec/23/israeli-official-accuses-barack-obama-shameful-move-un,https://www.reddit.com/user/FrenzyBiscuit",World,24/12/2016-18:30:41,ISRAELI OFFICIAL ACCUSES BARACK OBAMA OF 'SHAMEFUL MOVE AT UN'FRENZYBISCUIT
"http://ifpnews.com/news/society/religions/2016/12/christians-in-northern-iraq-celebrate-first-christmas-after-isis-pushback/,https://www.reddit.com/user/middleeastnewsman",World,24/12/2016-18:30:41,CHRISTIANS IN NORTHERN IRAQ CELEBRATE FIRST CHRISTMAS AFTER ISIS PUSHBACKMIDDLEEASTNEWSMAN
"http://www.thebubble.com/jujuy-police-beat-fpv-deputy-at-milagro-sala-trial/,https://www.reddit.com/user/Woosung_lala",World,24/12/2016-18:30:41,ARGENTINE DEPUTY VIOLENTLY BEATEN BY THE POLICE DURING SOCIAL LEADER MILAGRO SALA'S TRIALWOOSUNG_LALA
"http://www.reuters.com/article/us-china-blast-idUSKBN14D0EE?il=0,https://www.reddit.com/user/MichelleGaither",World,24/12/2016-18:30:41,"FIREWORK BLAST HITS CHINA'S TANGSHAN, TWO REPORTED DEADMICHELLEGAITHER"
"http://www.bbc.com/news/world-middle-east-38421026?ns_mchannel=social&ns_campaign=bbc_breaking&ns_source=twitter&ns_linkname=news_central,https://www.reddit.com/user/Daniela561",World,24/12/2016-18:30:41,UN URGES END TO THE ISRAELI SETTLEMENTSDANIELA561
"http://www.bbc.com/news/world-middle-east-38425512,https://www.reddit.com/user/MichelleGaither",World,24/12/2016-18:30:41,ISRAEL SETTLEMENTS: NETANYAHU REJECTS 'SHAMEFUL' UN VOTE - BBC NEWSMICHELLEGAITHER
"http://www.thehindu.com/todays-paper/tp-international/China-open-to-India-joining-economic-corridor/article16935400.ece,https://www.reddit.com/user/imnoidiot5",World,24/12/2016-18:30:41,CHINA ON FRIDAY SIGNALLED THAT IT WAS READY TO CONSIDER INDIA’S PARTICIPATION IN THE CHINA PAKISTAN ECONOMIC CORRIDOR (CPEC) AFTER A PAKISTANI GENERAL COUNSELLED NEW DELHI TO SHED ENMITY AND JOIN THE PROJECTIMNOIDIOT5
"http://uk.reuters.com/article/idUKKBN14D073,https://www.reddit.com/user/ManiaforBeatles",World,24/12/2016-18:30:41,"FIREWORK BLAST HITS CHINA'S TANGSHAN, TWO REPORTED DEAD - TWO PEOPLE HAVE BEEN REPORTED KILLED AFTER A FIREWORK EXPLOSION ON THE OUTSKIRTS OF TANGSHAN IN NORTHERN CHINA'S HEBEI PROVINCE ON SATURDAY.MANIAFORBEATLES"
"http://www.bbc.co.uk/news/world-africa-38427469,https://www.reddit.com/user/discodolly",World,24/12/2016-18:30:43,TUNISIA ARRESTS BERLIN ATTACKER'S NEPHEW - BBC NEWSDISCODOLLY
"http://www.reuters.com/article/us-mideast-crisis-iraq-mosul-idUSKBN14C1RW?il=0,https://www.reddit.com/user/Reddit-Is-Love",World,24/12/2016-18:30:43,U.S. FORCES EMBEDDING MORE TO HELP IRAQIS RETAKE MOSUL: COMMANDERREDDIT-IS-LOVE
"http://www.investors.com/news/china-fines-gm-29-million-for-price-fixing/,https://www.reddit.com/user/commieflirt",World,24/12/2016-18:30:43,CHINA FINES GENERAL MOTORS $29 MILLION FOR PRICE FIXINGCOMMIEFLIRT
