url,type,timeretrieved,title
"http://fox40.com/2016/12/22/ebola-vaccine-gives-100-percent-protection-study-finds/,https://www.reddit.com/user/BigAstra",World,24/12/2016-18:30:49,"AN EXPERIMENTAL VACCINE AGAINST THE EBOLA VIRUS WAS FOUND TO BE 100 PERCENT EFFECTIVE, ACCORDING TO A STUDY PUBLISHED IN THE LANCET ON THURSDAY.BIGASTRA"
"http://news.abs-cbn.com/business/12/22/16/duterte-says-to-order-closure-of-all-online-gaming,https://www.reddit.com/user/pilipin_espawrts_lol",World,24/12/2016-18:30:49,PHILIPPINE PRESIDENT DUTERTE ORDERS CLOSURE OF ALL ONLINE GAMINGPILIPIN_ESPAWRTS_LOL
"http://www.bbc.com/news/world-middle-east-38408548?ocid=socialflow_facebook&ns_mchannel=social&ns_campaign=bbcnews&ns_source=facebook,https://www.reddit.com/user/lorenn_garcia",World,24/12/2016-18:30:51,ALEPPO 'BACK UNDER GOVERNMENT CONTROL' - BBC NEWSLORENN_GARCIA
"http://www.upi.com/Top_News/World-News/2016/12/23/Human-rights-agency-to-investigate-Dutertes-admission-he-killed-three/9711482501253/?spt=sec&or=tn,https://www.reddit.com/user/Imnaha2",World,24/12/2016-18:30:51,HUMAN RIGHTS AGENCY TO INVESTIGATE DUTERTE'S ADMISSION HE KILLED THREEIMNAHA2
"http://www.bbc.com/news/world-europe-38414478,https://www.reddit.com/user/Mariamlotte",World,24/12/2016-18:30:51,RUSSIA 'STRONGER THAN ANY AGGRESSOR' - PRESIDENT PUTIN - BBC NEWSMARIAMLOTTE
"http://www.aljazeera.com/news/2016/12/egypt-arrests-al-jazeera-news-producer-vacation-161223171209633.html,https://www.reddit.com/user/AdviseMyAdvice",World,24/12/2016-18:30:51,EGYPT ARRESTS AL JAZEERA NEWS PRODUCER DURING VACATIONADVISEMYADVICE
"http://www.foxnews.com/world/2016/12/22/north-korea-ridicules-un-chief-presidential-ambitions.html,https://www.reddit.com/user/ManiaforBeatles",World,24/12/2016-18:30:51,"NORTH KOREA RIDICULES UN CHIEF'S PRESIDENTIAL AMBITIONS - NORTH KOREA ON FRIDAY MOCKED OUTGOING UNITED NATIONS SECRETARY-GENERAL BAN KI-MOON OVER HIS APPARENT AMBITIONS TO RUN FOR SOUTH KOREAN PRESIDENT, CALLING HIM AN OPPORTUNISTIC ""CHAMELEON IN A HUMAN MASK"" WHO'S DREAMING A ""HOLLOW DREAM.""MANIAFORBEATLES"
"http://www.scmp.com/news/hong-kong/politics/article/2056899/president-xi-jinping-praises-hong-kong-leader-curbing,https://www.reddit.com/user/bob21doh",World,24/12/2016-18:30:51,PRESIDENT XI JINPING PRAISES HONG KONG LEADER FOR ‘CURBING INDEPENDENCE’BOB21DOH
"http://www.foxnews.com/world/2016/12/24/officials-canine-gets-loose-shot-dead-on-south-korea-runway.html,https://www.reddit.com/user/Hypatia_Alexandria_",World,24/12/2016-18:30:51,"OFFICIALS: CANINE GETS LOOSE, SHOT DEAD ON SOUTH KOREA RUNWAYHYPATIA_ALEXANDRIA_"
"https://www.thesun.co.uk/news/2469333/berlin-terror-trucker-anis-amri-pictured-with-other-migrants-on-italian-island-of-lampedusa-in-2011-after-escaping-arab-spring-in-his-native-tunisia/,https://www.reddit.com/user/KierDiddly69",World,24/12/2016-18:30:51,"BERLIN TERRORIST ANIS AMRI PICTURED ARRIVING WITH OTHER MIGRANTS IN ITALY, 2011KIERDIDDLY69"
"http://www.independent.com.mt/articles/2016-12-23/local-news/BREAKING-NEWS-Aircraft-changes-course-abruptly-to-land-in-Malta-6736168271,https://www.reddit.com/user/ManiaforBeatles",World,24/12/2016-18:30:51,FINAL CREW MEMBERS DISEMBARK FROM HIJACKED PLANE; HIJACKER IN CUSTODY - THE MALTA INDEPENDENTMANIAFORBEATLES
"https://www.bloomberg.com/news/articles/2016-12-22/world-s-worst-air-has-mongolians-seeing-red-planning-protest,https://www.reddit.com/user/ManiaforBeatles",World,24/12/2016-18:30:51,"WORLD’S WORST AIR HAS MONGOLIANS SEEING RED, PLANNING ACTION - LEVELS OF PARTICULATE MATTER IN THE AIR HAVE RISEN TO ALMOST 80 TIMES THE RECOMMENDED SAFETY LEVEL SET BY THE WORLD HEALTH ORGANIZATION -- AND FIVE TIMES WORSE THAN BEIJING DURING THE PAST WEEK’S BOUT WITH THE WORST SMOG OF THE YEAR.MANIAFORBEATLES"
"http://www.cbc.ca/news/world/un-west-bank-settlement-israel-1.3910741,https://www.reddit.com/user/Trussed_Up",World,24/12/2016-18:30:51,SECURITY COUNCIL APPROVES MOTION DEMANDING END TO ISRAELI SETTLEMENTS - US ABSTAINSTRUSSED_UP
"http://www.cbc.ca/news/canada/toronto/holocaust-syria-war-crimes-1.3907326,https://www.reddit.com/user/Jamie--Gib",World,24/12/2016-18:30:51,HOLOCAUST SURVIVORS CALL ON WORLD TO INDICT THOSE RESPONSIBLE FOR SYRIAN ATROCITIESJAMIE--GIB
"http://www.sbs.com.au/news/article/2016/12/23/sea-shepherd-finds-japanese-whaler-hiding-behind-iceberg,https://www.reddit.com/user/Cropitekus",World,24/12/2016-18:30:51,SEA SHEPHERD FINDS JAPANESE WHALER 'HIDING BEHIND ICEBERG'CROPITEKUS
"http://www.reuters.com/article/us-southkorea-politics-idUSKBN14D04H,https://www.reddit.com/user/middleeastnewsman",World,24/12/2016-18:30:51,SOUTH KOREAN PRESIDENT'S FRIEND AT HEART OF SCANDAL SUMMONED FOR QUESTIONINGMIDDLEEASTNEWSMAN
"http://www.independent.co.uk/news/uk/home-news/muslims-christians-homeless-people-christmas-london-streetlytes-dinner-al-khair-a7490016.html,https://www.reddit.com/user/finixz",World,24/12/2016-18:30:51,MUSLIM AND CHRISTIAN GROUPS WORKING TOGETHER TO HELP HOMELESS AT CHRISTMASFINIXZ
"http://www.aljazeera.com/news/2016/12/libyan-plane-hijack-ends-peacefully-malta-161223145040091.html,https://www.reddit.com/user/safdarabs",World,24/12/2016-18:30:51,LIBYAN PLANE HIJACK ENDS PEACEFULLY IN MALTASAFDARABS
"http://zeenews.india.com/news/world/china-tells-companies-to-abide-by-un-north-korea-sanctions_1961205.html,https://www.reddit.com/user/ManiaforBeatles",World,24/12/2016-18:30:51,"CHINA TELLS COMPANIES TO ABIDE BY UN NORTH KOREA SANCTIONS - CHINA TOLD ITS COMPANIES ON FRIDAY THEY NEED TO PAY ATTENTION TO THE LATEST UN SANCTIONS ON NORTH KOREA, ESPECIALLY THOSE RELATED TO COAL, TO AVOID ANY UNNECESSARY ECONOMIC LOSSES.MANIAFORBEATLES"
"http://www.jpost.com/Breaking-News/Israel-calls-back-for-consultations-ambassadors-to-New-Zealand-and-Senegal-476372,https://www.reddit.com/user/lilamin2010",World,24/12/2016-18:30:51,ISRAEL CALLS BACK FOR CONSULTATIONS AMBASSADORS TO NEW ZEALAND AND SENEGAL - BREAKING NEWSLILAMIN2010
"http://www.reuters.com/article/idUSKBN14B1PC,https://www.reddit.com/user/VTKP-Yu",World,24/12/2016-18:30:51,LITHUANIA SAID FOUND RUSSIAN SPYWARE ON ITS GOVERNMENT COMPUTERSVTKP-YU
"http://www.nytimes.com/2016/12/23/world/middleeast/israel-settlements-un-vote.html,https://www.reddit.com/user/juliarobart",World,24/12/2016-18:30:51,U.S. ABSTAINS AS U.N. SECURITY COUNCIL VOTES TO CONDEMN ISRAELI SETTLEMENTSJULIAROBART
"https://www.rt.com/news/371573-china-fireworks-factory-blast/,https://www.reddit.com/user/yumcentral",World,24/12/2016-18:30:51,PILLARS OF SMOKE FROM SITE OF REPORTED BLAST AT ILLEGAL FIRECRACKER FACTORY IN CHINAYUMCENTRAL
"http://ifpnews.com/news/world/asia/2016/12/bans-presidential-ambitions-hollow-dream-north-korea/,https://www.reddit.com/user/mileyscience",World,24/12/2016-18:30:51,BAN’S PRESIDENTIAL AMBITIONS ‘HOLLOW DREAM’: NORTH KOREAMILEYSCIENCE
"http://www.nytimes.com/aponline/2016/12/23/world/europe/ap-eu-germany-christmas-market-the-latest.html,https://www.reddit.com/user/ScotHibb",World,24/12/2016-18:30:51,"THE LATEST: FRANCE TIGHTENS BORDERS, STILL MISSES SUSPECTSCOTHIBB"
"http://www.cbsnews.com/news/zara-tindall-mike-tindall-queen-elizabeth-granddaughter-miscarriage/,https://www.reddit.com/user/ManiaforBeatles",World,24/12/2016-18:30:51,"QUEEN'S GRANDDAUGHTER ZARA TINDALL SUFFERS MISCARRIAGE - OFFICIALS SAY QUEEN ELIZABETH II’S GRANDDAUGHTER, ZARA TINDALL, HAS SUFFERED A MISCARRIAGE.MANIAFORBEATLES"
"http://www.cbc.ca/beta/news/canada/prince-edward-island/excavator-stops-driver-1.3910172,https://www.reddit.com/user/adoway",World,24/12/2016-18:30:51,ALLEGED IMPAIRED DRIVER STOPPED BY AN EXCAVATOR IN CANADAADOWAY
"http://www.cbc.ca/beta/news/canada/saskatchewan/ahmadiyya-muslim-community-food-bank-donation-1.3910555,https://www.reddit.com/user/EliteHunting",World,24/12/2016-18:30:52,REGINA AHMADIYYA MUSLIM COMMUNITY MEMBERS ARE DONATING HUNDREDS OF KILOGRAMS OF FOOD TO THE REGINA FOOD BANK TODAY AS A THANK-YOU FOR THEIR NEW PLACE OF WORSHIP.ELITEHUNTING
"http://abcnews.go.com/International/wireStory/belgian-troops-neutralize-suspicious-bag-turkish-center-44374222,https://www.reddit.com/user/latvri",World,24/12/2016-18:30:52,"BELGIAN AUTHORITIES SUMMONED SOLDIERS TO EXAMINE THE CONTENTS OF A PACKAGE LEFT OUTSIDE THE OFFICES OF THE TURKISH FEDERATION IN BRUSSELS, AMID FEARS IT MIGHT HAVE BEEN A BOMB.LATVRI"
"http://time.com/4617295/china-smog-smoking-environment-air-pollution/,https://www.reddit.com/user/Balkan4",World,24/12/2016-18:30:52,"CHINA'S SMOG IS AS DEADLY AS SMOKING, NEW RESEARCH CLAIMSBALKAN4"
"http://www.cnn.com/2016/12/23/politics/israel-official-rips-obama-un-settlements/,https://www.reddit.com/user/chicknlil",World,24/12/2016-18:30:52,US ABSTAINS AS UN DEMANDS END TO ISRAELI SETTLEMENTSCHICKNLIL
"http://newsinfo.inquirer.net/855781/duterte-to-corrupt-amlc-execs-quit-or-ill-treat-you-like-druggies,https://www.reddit.com/user/jonsnowknowthings",World,24/12/2016-18:30:52,"PRESIDENT RODRIGO DUTERTE ON THURSDAY ASSAILED THE EXECUTIVES OF THE ANTI-MONEY LAUNDERING COUNCIL (AMLC) AND TOLD THEM TO RESIGN. “YOU KNOW, I’M GOING TO CHARGE ALL OF YOU THERE, CRIMINALLY. I’LL COUNT ONE TO THREE, AND IF YOU DON’T RESIGN, I WILL TREAT YOU AS A DRUG ADDICT,”JONSNOWKNOWTHINGS"
"https://www.japantoday.com/category/national/view/japan-pays-funds-for-unesco-after-halt-over-nanjing-row-with-china,https://www.reddit.com/user/ManiaforBeatles",World,24/12/2016-18:30:52,"JAPAN PAYS FUNDS FOR UNESCO AFTER HALT OVER NANJING ROW WITH CHINA - JAPAN HAS PAID ITS ANNUAL CONTRIBUTION FOR UNESCO AFTER WITHHOLDING THE FUNDS OVER ITS DECISION TO INCLUDE DOCUMENTS ON THE 1937 NANJING MASSACRE, FOREIGN MINISTER SAID, CITING UNESCO REFORMS AS THE REASON FOR THE CHANGE OF HEART.MANIAFORBEATLES"
"http://tribune.com.pk/story/1271833/pakistan-railways-launches-special-christmas-train/,https://www.reddit.com/user/chargingpoint",World,24/12/2016-18:30:52,PAKISTAN RAILWAYS LAUNCHES SPECIAL CHRISTMAS TRAIN - THE EXPRESS TRIBUNECHARGINGPOINT
"http://money.cnn.com/2016/12/23/investing/china-crackdown-gm-automakers/index.html,https://www.reddit.com/user/Daily_News_updates",World,24/12/2016-18:30:52,CHINA HITS GM JOINT VENTURE WITH $29 MILLION FINE AFTER PRICE-FIXING PROBEDAILY_NEWS_UPDATES
"http://www.timesofmalta.com/articles/view/20161223/local/two-pistols-hand-grenade-used-in-hijack-muscat.634672,https://www.reddit.com/user/Mario_lib",World,24/12/2016-18:30:52,WEAPONS USED TO HIJACK LIBYAN AIRCRAFT IN MALTA TURNED TO BE FAKEMARIO_LIB
"https://www.bloomberg.com/news/articles/2016-12-23/xi-said-to-express-openness-to-growth-below-6-5-as-debt-climbs-ix1qz3tz,https://www.reddit.com/user/bob21doh",World,24/12/2016-18:30:52,PRESIDENT XI OPEN TO GROWTH IN CHINA FALLING BELOW 6.5%BOB21DOH
"http://www.upi.com/Top_News/World-News/2016/12/23/233-detained-without-bail-over-recent-violence-looting-riots-in-Venezuela/5871482507159/,https://www.reddit.com/user/dcismia",World,24/12/2016-18:30:53,"233 DETAINED WITHOUT BAIL OVER RECENT VIOLENCE, LOOTING, RIOTS IN VENEZUELADCISMIA"
"https://www.theguardian.com/world/2016/dec/22/tsai-ing-wen-taiwan-president-us-visit-china-donald-trump,https://www.reddit.com/user/austinzzz",World,24/12/2016-18:30:53,TAIWAN'S PRESIDENT TO VISIT US DESPITE OBJECTIONS FROM CHINAAUSTINZZZ
"https://www.adn.com/arctic/2016/12/22/oil-companies-in-limbo-after-canada-puts-freeze-on-arctic-drilling/,https://www.reddit.com/user/proctorberlin",World,24/12/2016-18:30:53,OIL COMPANIES IN LIMBO AFTER CANADA PUTS FREEZE ON ARCTIC DRILLINGPROCTORBERLIN
"http://webtv.un.org/live-now,https://www.reddit.com/user/donteatgrains",World,24/12/2016-18:30:53,"SECURITY COUNCIL: THE SITUATION IN THE MIDDLE EAST, INCLUDING THE PALESTINIAN QUESTION (7853RD MEETING)DONTEATGRAINS"
"https://www.theguardian.com/uk-news/2016/dec/24/queens-granddaughter-zara-tindall-miscarriage,https://www.reddit.com/user/itstimmehc",World,24/12/2016-18:30:53,QUEEN'S GRANDDAUGHTER ZARA TINDALL DISCLOSES MISCARRIAGEITSTIMMEHC
"http://www.upi.com/Top_News/World-News/2016/12/23/Former-South-Korean-comfort-women-to-get-financial-reparations-from-Japan/1401482510217/?spt=sec&or=tn,https://www.reddit.com/user/Imnaha2",World,24/12/2016-18:30:53,FORMER SOUTH KOREAN 'COMFORT WOMEN' TO GET FINANCIAL REPARATIONS FROM JAPANIMNAHA2
"http://www.reuters.com/article/us-europe-migrants-toll-idUSKBN14C0YL?il=0,https://www.reddit.com/user/ShamanontheMoon",World,24/12/2016-18:30:53,"MEDITERRANEAN DEATH TOLL IS RECORD 5,000 MIGRANTS THIS YEAR: AGENCIESSHAMANONTHEMOON"
"http://www.breitbart.com/national-security/2016/12/22/report-kuwaiti-minister-orders-removal-christmas-tree-deemed-unislamci/,https://www.reddit.com/user/KevanKing",World,24/12/2016-18:30:53,KUWAITI MINISTER ORDERS REMOVAL OF 'UN-ISLAMIC' CHRISTMAS TREEKEVANKING
"http://abcnews.go.com/International/wireStory/snatched-night-pakistani-girl-enslaved-debt-44362040,https://www.reddit.com/user/Marcuuniu",World,24/12/2016-18:30:53,"SNATCHED IN THE NIGHT, PAKISTANI GIRL IS ENSLAVED FOR A DEBTMARCUUNIU"
"http://www.reuters.com/article/us-israel-palestinians-un-idUSKBN14C1IV,https://www.reddit.com/user/humanforever",World,24/12/2016-18:30:53,"U.N. SECURITY COUNCIL DEMANDS END TO ISRAELI SETTLEMENTS, U.S. ABSTAINSHUMANFOREVER"
"https://www.washingtonpost.com/world/europe/troubled-berlin-attack-suspect-sought-better-life-in-europe/2016/12/22/fc2af1fc-c875-11e6-acda-59924caa2450_story.html?utm_term=.c26094fc3fb2,https://www.reddit.com/user/Tsarlya",World,24/12/2016-18:30:53,TROUBLED BERLIN ATTACK SUSPECT SOUGHT BETTER LIFE IN EUROPETSARLYA
"http://www.israelnationalnews.com/News/News.aspx/222158,https://www.reddit.com/user/leaxor",World,24/12/2016-18:30:53,TURKISH AIR STRIKES IN SYRIA KILL 47 CIVILIANSLEAXOR
"http://mobile.nytimes.com/2016/12/23/world/middleeast/israel-settlements-un-vote.html,https://www.reddit.com/user/songbolt",World,24/12/2016-18:30:53,U.S. ABSTAINS AS U.N. SECURITY COUNCIL VOTES TO CONDEMN ISRAELI SETTLEMENTSSONGBOLT
"http://www.bbc.com/news/world-europe-38422612,https://www.reddit.com/user/viralbasic",World,24/12/2016-18:30:53,MAN DRIVES THROUGH AIRPORT TERMINAL 'FOR LOVE' - BBC NEWSVIRALBASIC
"http://www.bbc.com/news/world-africa-38414790,https://www.reddit.com/user/am_god_",World,24/12/2016-18:30:53,GAMBIA CRISIS: SENEGAL TROOPS 'ON ALERT' IF JAMMEH STAYS ONAM_GOD_
"http://www.nytimes.com/2016/12/23/world/europe/vladimir-putin-russia-press-conference.html,https://www.reddit.com/user/WooBoost",World,24/12/2016-18:30:54,"PUTIN UNSURPRISED BY TRUMP'S REMARKS, SAYS RUSSIA WANTS NO NUCLEAR ARMS RACEWOOBOOST"
"http://www.scmp.com/news/hong-kong/law-crime/article/2056945/singapore-issues-sixth-call-hong-kong-return-nine-military,https://www.reddit.com/user/bob21doh",World,24/12/2016-18:30:54,SINGAPORE ISSUES SIXTH CALL FOR HONG KONG TO RETURN NINE MILITARY VEHICLES SEIZED BY CUSTOMSBOB21DOH
"http://www.pri.org/stories/2016-12-22/germany-finds-itself-center-cyberstorm?utm_campaign=TheWorld&utm_source=Facebook&utm_medium=SocialFlow,https://www.reddit.com/user/Pentijing",World,24/12/2016-18:30:54,GERMANY FINDS ITSELF IN THE CENTER OF THE CYBERSTORMPENTIJING
"https://asiancorrespondent.com/2016/12/philippines-journalist-slain-dutertes-war-drugs/,https://www.reddit.com/user/ionised",World,24/12/2016-18:30:54,"A PHILIPPINES PROVINCIAL NEWSPAPER PUBLISHER HAS BEEN SHOT DEAD AFTER WRITING A COLUMN ALLEGING OFFICIAL NEGLIGENCE OVER A RECENTLY DISCOVERED METHAMPHETAMINE LABORATORY, IN THE FIRST KILLING OF A JOURNALIST DURING THE COUNTRY’S WAR ON DRUGS.IONISED"
"http://presstv.com//Detail/2016/12/24/503229/Iran-IRGC-Jafari-sustainable-security,https://www.reddit.com/user/AllenDono",World,24/12/2016-18:30:54,"IRAN ENJOYING SECURITY WITHIN, OUTSIDE BORDERS: IRGC COMMANDERALLENDONO"
"http://www.sciencealert.com/the-supervolcano-that-caused-one-of-the-biggest-eruptions-in-history-has-started-to-stir,https://www.reddit.com/user/jonsnowknowthings",World,24/12/2016-18:30:54,THE SUPERVOLCANO THAT CAUSED ONE OF THE BIGGEST ERUPTIONS IN HISTORY HAS STARTED TO STIR.JONSNOWKNOWTHINGS
"http://www.cbc.ca/beta/news/business/dollar-loonie-prediction-1.3909519,https://www.reddit.com/user/adoway",World,24/12/2016-18:30:54,CANADIAN LOONIE PREDICTED TO FALL TO 65 CENTS IN THE NEW YEARADOWAY
"http://gulfnews.com/news/europe/russia/putin-says-al-assad-iran-turkey-have-agreed-to-attend-syria-peace-talks-1.1950555,https://www.reddit.com/user/MrChopiano",World,24/12/2016-18:30:54,"PUTIN SAYS AL ASSAD, IRAN, TURKEY HAVE AGREED TO ATTEND SYRIA PEACE TALKSMRCHOPIANO"
"http://www.radionz.co.nz/news/national/321137/nz-to-investigate-chinese-steel,https://www.reddit.com/user/bob21doh",World,24/12/2016-18:30:54,NEW ZEALAND HAS LAUNCHED AN ANTI-DUMPING INVESTIGATION INTO CHINESE STEEL.BOB21DOH
"http://www.cnbc.com/2016/12/23/china-reports-first-two-human-fatalities-from-bird-flu-this-winter.html,https://www.reddit.com/user/bob21doh",World,24/12/2016-18:30:54,CHINA REPORTS FIRST TWO HUMAN FATALITIES FROM BIRD FLU THIS WINTERBOB21DOH
"http://www.bbc.co.uk/news/uk-38427565,https://www.reddit.com/user/Undercover5051",World,24/12/2016-18:30:54,ZARA AND MIKE TINDALL LOSE THEIR BABYUNDERCOVER5051
"http://www.bbc.com/news/world-asia-38403977,https://www.reddit.com/user/mossbergGT",World,24/12/2016-18:30:54,PHILIPPINES PRESIDENT DUTERTE FACES INVESTIGATION OVER KILLINGS CLAIMMOSSBERGGT
"http://www.cnbc.com/2016/12/22/google-ties-up-the-indian-government-to-develop-toilet-locator-app.html,https://www.reddit.com/user/Phuc-Dat_Bich",World,24/12/2016-18:30:54,GOOGLE TEAMS UP WITH THE INDIAN GOVERNMENT TO DEVELOP TOILET LOCATOR APPPHUC-DAT_BICH
"http://www.upi.com/Top_News/World-News/2016/12/23/Mexico-to-rebuild-fireworks-market-extortion-a-possible-cause-for-explosions/2551482496047/?spt=sec&or=tn,https://www.reddit.com/user/Imnaha2",World,24/12/2016-18:30:54,MEXICO TO REBUILD FIREWORKS MARKET; EXTORTION A POSSIBLE CAUSE FOR EXPLOSIONSIMNAHA2
"http://news.nationalgeographic.com/2016/12/supervolcano-campi-flegrei-stirs-under-naples-italy/?utm_source=Twitter&utm_medium=Social&utm_content=link_tw20161223news-italyvolcano&utm_campaign=Content&sf47977328=1,https://www.reddit.com/user/Pegacornpower",World,24/12/2016-18:30:54,ITALIAN SUPERVOLCANO MAY BE AWAKENINGPEGACORNPOWER
"http://www.aljazeera.com/news/2016/12/drc-kabila-opposition-deal-close-161223104741928.html,https://www.reddit.com/user/safdarabs",World,24/12/2016-18:30:54,DRC: KABILA-OPPOSITION DEAL MAY BE CLOSESAFDARABS
"http://www.thenews.pl/1/10/Artykul/286058,Putin-Smolensk-plane-crash-‘should-not-be-used-for-political-gain’,https://www.reddit.com/user/TheRootsCrew",World,24/12/2016-18:30:54,PUTIN: SMOLENSK PLANE CRASH ‘SHOULD NOT BE USED FOR POLITICAL GAIN’THEROOTSCREW
"http://www.theglobeandmail.com/news/politics/elections-commissioner-urged-to-investigate-cash-for-access-allegations/article33413168/,https://www.reddit.com/user/ryeshoes",World,24/12/2016-18:30:54,[CAN] ELECTIONS COMMISSIONER URGED TO INVESTIGATE CASH-FOR-ACCESS ALLEGATIONSRYESHOES
"http://www.cbc.ca/news/world/un-west-bank-settlement-israel-1.3910741,https://www.reddit.com/user/_Deep_Thought",World,24/12/2016-18:30:54,SECURITY COUNCIL TO VOTE ON END TO ISRAELI SETTLEMENTS_DEEP_THOUGHT
"http://m.koreaherald.com/view.php?ud=20161223000120#cb,https://www.reddit.com/user/ManiaforBeatles",World,24/12/2016-18:30:54,"N. KOREA RANKS NO. 1 FOR MILITARY SPENDING RELATIVE TO GDP - NORTH KOREA RANKED NO. 1 IN THE WORLD FOR MILITARY EXPENDITURES RELATIVE TO ITS GROSS DOMESTIC PRODUCT BETWEEN 2004-2014, SPENDING NEARLY A QUARTER OF ITS GDP ON THE ARMED FORCES, AN ANNUAL STATE DEPARTMENT REPORT SHOWED THURSDAY.MANIAFORBEATLES"
"https://www.theguardian.com/technology/2016/dec/23/cyber-security-breach-brian-krebs-crime,https://www.reddit.com/user/viralbasic",World,24/12/2016-18:30:54,WAVE OF CYBERSECURITY BREACHES IS NO SURPRISE TO EXPERT EXPOSING ONLINE CRIME | TECHNOLOGYVIRALBASIC
"http://www.radiomagonline.com/around-the-world/0020/denmark-to-add-nationwide-digital-radio-network-capacity/38474,https://www.reddit.com/user/Philo1927",World,24/12/2016-18:30:54,DENMARK TO ADD NATIONWIDE DIGITAL RADIO NETWORK CAPACITY. THERE WILL BE CAPACITY FOR MULTIPLE RADIO STATIONS TO HAVE NATION-WIDE ACCESSPHILO1927
"http://www.newsheads.in/world/news/three-countries-test-pm-narendra-modi-demonetisation-idea/article/1623.html,https://www.reddit.com/user/sandy309",World,24/12/2016-18:30:54,THREE COUNTRIES TEST INDIAN PM NARENDRA MODI’S DEMONETISATION IDEASANDY309
"http://www.bbc.com/news/uk-38419488,https://www.reddit.com/user/smilyflower",World,24/12/2016-18:30:54,SYRIA AID CONVOYS: TWO GUILTY OVER TERROR FUNDINGSMILYFLOWER
"http://www.bbc.co.uk/news/world-europe-38414478,https://www.reddit.com/user/FrenzyBiscuit",World,24/12/2016-18:30:54,RUSSIA 'STRONGER THAN ANY AGGRESSOR' SAYS VLADIMIR PUTINFRENZYBISCUIT
"http://focustaiwan.tw/news/aipl/201612230013.aspx,https://www.reddit.com/user/bob21doh",World,24/12/2016-18:30:56,FORMER TAIWANESE PREMIER TO HEAD DELEGATION TO TRUMP INAUGURATION CEREMONYBOB21DOH
"http://www.foxnews.com/world/2016/12/23/more-chinese-missiles-bound-for-disputed-islands.html,https://www.reddit.com/user/Hypatia_Alexandria_",World,24/12/2016-18:30:56,MORE CHINESE MISSILES BOUND FOR DISPUTED ISLANDSHYPATIA_ALEXANDRIA_
"https://www.theguardian.com/world/2016/dec/23/philippines-to-investigate-president-dutertes-claims-he-killed-suspects,https://www.reddit.com/user/missileguy",World,24/12/2016-18:30:56,THE PHILIPPINES’ INDEPENDENT RIGHTS WATCHDOG HAS SAID IT WILL INVESTIGATE PRESIDENT RODRIGO DUTERTE’S BOASTS HE KILLED CRIMINALS YEARS AGO AS MAYOR OF THE CITY OF DAVAO.MISSILEGUY
"http://www.hindustantimes.com/india-news/pakistan-to-release-439-indian-fishermen/story-NHd2iIFDXBCT1WIvOdvzCM.html,https://www.reddit.com/user/Phuc-Dat_Bich",World,24/12/2016-18:30:56,PAKISTAN TO RELEASE 439 INDIAN FISHERMENPHUC-DAT_BICH
"http://hosted.ap.org/dynamic/stories/M/ML_ISRAEL_UNITED_NATIONS?SITE=AP&SECTION=HOME&TEMPLATE=DEFAULT&CTIME=2016-12-23-12-09-24,https://www.reddit.com/user/milangdo",World,24/12/2016-18:30:56,ISRAEL ACCUSES OBAMA OF ANTI-ISRAELI 'SHAMEFUL MOVE' AT UNMILANGDO
"http://www.thedailybeast.com/articles/2016/12/23/isis-we-burned-two-soldiers-alive.html,https://www.reddit.com/user/darthaditya",World,24/12/2016-18:30:56,ISIS: WE BURNED TWO SOLDIERS ALIVEDARTHADITYA
"http://www.independent.co.uk/news/world/middle-east/un-security-council-vote-postpone-israel-gaza-settlements-west-bank-donald-trump-resolution-a7491916.html/,https://www.reddit.com/user/articundo1",World,24/12/2016-18:30:56,UN POSTPONES VOTE ON ISRAELI SETTLEMENTS RESOLUTION 'AFTER NETANYAHU PERSUADES TRUMP TO INTERVENE'ARTICUNDO1
"http://www.bbc.com/news/uk-scotland-highlands-islands-38407450,https://www.reddit.com/user/safdarabs",World,24/12/2016-18:30:56,DISRUPTION AS STORM BARBARA STARTS MOVING ACROSS SCOTLANDSAFDARABS
"https://www.moroccoworldnews.com/2016/12/204265/moroccan-intelligence-services-informed-germany-about-tunisian-suspect/,https://www.reddit.com/user/owlaura",World,24/12/2016-18:30:56,MOROCCAN INTELLIGENCE SERVICES INFORMED GERMANY ABOUT TUNISIAN SUSPECTOWLAURA
"https://www.theguardian.com/world/2016/dec/22/philippines-journalist-killed-after-criticising-officials-over-illegal-drug-lab?CMP=twt_gu,https://www.reddit.com/user/thesteveway",World,24/12/2016-18:30:56,PHILIPPINES JOURNALIST KILLED AFTER CRITICISING OFFICIALS OVER ILLEGAL DRUG LABTHESTEVEWAY
"http://www.independent.co.uk/news/world/europe/romania-first-muslim-woman-prime-minister-sevil-shhaideh-tartar-social-democratic-party-psd-a7490006.html,https://www.reddit.com/user/austinzzz",World,24/12/2016-18:30:56,ROMANIA SET FOR FIRST WOMAN AND FIRST MUSLIM AS PRIME MINISTERAUSTINZZZ
"https://www.bloomberg.com/news/articles/2016-12-23/urgent-the-latest-malta-tv-hijackers-threaten-to-blow-up-plane,https://www.reddit.com/user/ronnie1211",World,24/12/2016-18:30:56,HIJACKERS OF LIBYAN PLANE RELEASE HOSTAGES AND SURRENDER- MALTA PMRONNIE1211
"http://time.com/4616114/japan-defense-budget-spending-china-military/,https://www.reddit.com/user/itseasytorecall",World,24/12/2016-18:30:56,JAPAN JUST APPROVED A RECORD $43.6 BILLION MILITARY BUDGET TO COUNTER CHINA AND NORTH KOREA.ITSEASYTORECALL
"http://www.reuters.com/article/us-tunisia-security-idUSKBN14C1ZO?il=0,https://www.reddit.com/user/Hypatia_Alexandria_",World,24/12/2016-18:30:56,SUDAN EXTRADITES SENIOR TUNISIAN ISLAMIC STATE SUSPECT: STATE MEDIAHYPATIA_ALEXANDRIA_
"http://www.ibtimes.co.uk/ties-between-putin-le-pen-probed-amid-claims-front-national-gets-kremlin-linked-funds-1597665,https://www.reddit.com/user/CitronBleu",World,24/12/2016-18:30:56,TIES BETWEEN PUTIN AND LE PEN PROBED AMID CLAIMS FRONT NATIONAL GETS KREMLIN-LINKED FUNDSCITRONBLEU
"https://www.thesun.co.uk/news/2468847/uk-terror-threat-london-city-ring-of-steel/,https://www.reddit.com/user/MyGamerProfile",World,24/12/2016-18:30:56,LONDON TO BE PROTECTED FROM TERROR ATTACK BY NEW £5M 'RING OF STEEL' BUILT AROUND THE CITYMYGAMERPROFILE
"http://www.independent.co.uk/news/world/asia/japan-nuclear-reactor-scrap-monju-fast-breeder-250-days-shut-dream-government-a7489776.html,https://www.reddit.com/user/austinzzz",World,24/12/2016-18:30:56,JAPAN SCRAPS NUCLEAR REACTOR THAT COST £7 BILLION AFTER JUST 250 DAYS' OPERATIONAUSTINZZZ
"http://www.bbc.com/news/world-europe-38416112?ocid=socialflow_facebook&ns_mchannel=social&ns_campaign=bbcnews&ns_source=facebook,https://www.reddit.com/user/lorenn_garcia",World,24/12/2016-18:30:56,LIBYA MALTA HIJACK: HIJACKERS ARRESTED - BBC NEWSLORENN_GARCIA
"http://www.nytimes.com/aponline/2016/12/23/world/middleeast/ap-ml-islamic-state.html,https://www.reddit.com/user/Lebneneh",World,24/12/2016-18:30:56,TURKEY BRIEFLY RESTRICTS INTERNET AFTER RELEASE OF IS VIDEOLEBNENEH
"http://www.news18.com/news/world/chinese-consortium-buys-40-stake-in-pakistan-stock-exchange-1326631.html,https://www.reddit.com/user/soonwar",World,24/12/2016-18:30:56,CHINESE CONSORTIUM BUYS 40% STAKE IN PAKISTAN STOCK EXCHANGESOONWAR
