url,type,timeretrieved,title
http://www.cnbc.com/2016/12/22/the-biggest-hedge-fund-in-the-world-is-creating-a-secret-algorithm-to-automate-management.html,General,25/12/2016-12:30:21,THE WORLD'S BIGGEST HEDGE FUND IS CREATING A SECRET ALGORITHM TO AUTOMATE MANAGEMENT
https://www.yahoo.com/news/teddy-bear-takes-detroit-airport-adventure-being-found-165438396.html,General,25/12/2016-12:30:21,TEDDY BEAR TAKES DETROIT AIRPORT ADVENTURE AFTER BEING FOUND
https://www.yahoo.com/news/brazil-sees-murders-soar-rio-drop-sao-paulo-184146886.html,General,25/12/2016-12:30:21,"HOMICIDES CLAIMED MORE LIVES IN BRAZIL FROM 2011 TO 2015 THAN THE SYRIAN CIVIL WAR DURING THE SAME PERIOD, ACCORDING TO THE BRAZILIAN PUBLIC SECURITY FORUM: 278,839 FOR BRAZIL, AGAINST 256,124 IN SYRIA."
http://bigstory.ap.org/article/1c2e6b52f237492bbbe8ca25a3cf5e56/california-pursues-new-pimping-charges-against-backpagecom,General,25/12/2016-12:30:21,CALIFORNIA PURSUES NEW PIMPING CHARGES AGAINST BACKPAGE.COM
http://www.independent.co.uk/news/world/americas/pregnant-waitress-900-tip-christmas-arizona-sarah-clark-a7493246.html,General,25/12/2016-12:30:21,PREGNANT WAITRESS GETS $900 TIP JUST DAYS BEFORE CHRISTMAS
http://www.bbc.co.uk/news/world-us-canada-38423942,General,25/12/2016-12:30:21,TRUMP OFFICIAL PALADINO UNDER FIRE OVER CRUDE OBAMA REMARKS
https://www.hrw.org/news/2016/12/23/yemen-brazil-made-cluster-munitions-harm-civilians,General,25/12/2016-12:30:21,YEMEN: BRAZIL-MADE CLUSTER MUNITIONS HARM CIVILIANS
http://bigstory.ap.org/article/35acbb4e1d334d35b4cc0db05be6dec8/alaskas-bogoslof-volcano-aleutian-islands-erupts-again,General,25/12/2016-12:30:21,ALASKA'S BOGOSLOF VOLCANO IN ALEUTIAN ISLANDS ERUPTS AGAIN
https://www.cnet.com/news/worlds-first-solar-road-opens-in-france/,General,25/12/2016-12:30:21,WORLD'S FIRST SOLAR ROAD OPENS IN FRANCE
http://www.livescience.com/57298-worlds-oldest-gorilla-turns-60.html?,General,25/12/2016-12:30:21,THE FIRST GORILLA BORN IN HUMAN CARE TURNED 60 TODAY (DEC. 22) AT HER HOME IN THE COLUMBUS ZOO AND AQUARIUM IN OHIO.
http://www.foxnews.com/us/2016/12/22/video-shows-texas-officer-forcibly-arresting-woman-daughter.html,General,25/12/2016-12:30:21,"TEXAS OFFICER ON RESTRICTED DUTY AFTER VIDEO SHOWS FORCIBLE ARRESTS OF MOTHER, DAUGHTER"
http://www.npr.org/sections/thetwo-way/2016/12/22/506629695/trump-team-asks-state-dept-to-name-those-working-on-gender-equality,General,25/12/2016-12:30:21,TRUMP TEAM ASKS STATE DEPT. TO NAME THOSE WORKING ON GENDER EQUALITY
http://www.detroitnews.com/story/news/local/michigan/2016/12/21/snyder-signs-historic-energy-plan-law/95705658/,General,25/12/2016-12:30:21,MICHIGAN PASSES LAW REQUIRING UTILITIES TO BUY OR PRODUCE AT LEAST 15 PERCENT OF THEIR ENERGY FROM RENEWABLE SOURCES BY 2022
http://www.aljazeera.com/news/2016/12/egypt-arrests-al-jazeera-news-producer-vacation-161223171209633.html,General,25/12/2016-12:30:21,EGYPT ARRESTS AL JAZEERA NEWS PRODUCER DURING VACATION. SECURITY OFFICIALS SAY MAHMOUD HUSSEIN IS ACCUSED OF ATTEMPTING TO OVERTHROW PRESIDENT ABDEL FATAH EL-SISI'S GOVERNMENT.
http://www.csmonitor.com/World/Making-a-difference/2016/1222/This-woman-has-helped-more-than-4-500-disabled-people-get-jobs,General,25/12/2016-12:30:21,"THIS WOMAN HAS HELPED MORE THAN 4,500 DISABLED PEOPLE GET JOBS"
http://www.cbc.ca/news/canada/montreal/dog-meat-montreal-saved-1.3910596,General,25/12/2016-12:30:21,"SAVED FROM DOG MEAT FESTIVAL, 37 DOGS EN ROUTE TO MONTREAL"
http://www.wifr.com/content/news/Roscoe-boys-unusual-Christmas-wish-catches-the-attention-of-Gustafsons-Furniture-407974845.html,General,25/12/2016-12:30:21,AUTISTIC ROSCOE BOY'S UNUSUAL CHRISTMAS WISH CATCHES THE ATTENTION OF GUSTAFSON'S FURNITURE
http://www.cantonrep.com/news/20161221/stark-man-guilty-of-tainting-womans-orange-juice,General,25/12/2016-12:30:21,MAN MASTURBATES IN WOMAN'S BOTTLE OF ORANGE JUICE. CAUGHT ON SECURITY CAMERA.
http://www.seattletimes.com/seattle-news/environment/another-puget-sound-killer-whale-dies-5th-in-past-year/,General,25/12/2016-12:30:21,ANOTHER PUGET SOUND ORCA DIES — 5TH IN A YEAR
http://www.digitaltrends.com/cars/uber-moves-autonomous-cars-to-az-news-details-quotes/,General,25/12/2016-12:30:21,UBER MOVES ITS SELF-DRIVING CARS TO ARIZONA TO ESCAPE CALIFORNIA REGULATORS
https://financialtribune.com/articles/economy-business-and-markets/56003/private-sector-integral-to-sustainable-economic-growth,General,25/12/2016-12:30:21,PRIVATE SECTOR INTEGRAL TO SUSTAINABLE ECONOMIC GROWTH
https://www.washingtonpost.com/news/to-your-health/wp/2016/12/22/can-a-hearing-test-identify-a-concussion/,General,25/12/2016-12:30:21,A HEARING TEST MAY BE ABLE TO IDENTIFY A CONCUSSION
https://www.thelocal.de/20161223/live-police-believe-suspect-amri-still-in-berlin-report,General,25/12/2016-12:30:21,ISIS RELEASE VIDEO OF ANIS AMRI SWEARING THEM HIS ALLEGIANCE
https://www.washingtonpost.com/local/public-safety/a-street-sale-of-jordan-shoes-erupts-in-gunfire/2016/11/16/ab866814-ac0d-11e6-a31b-4b6397e625d0_story.html?utm_term=.adf0a6ed1884,General,25/12/2016-12:30:21,A STREET SALE OF JORDAN SHOES ERUPTS IN GUNFIRE
http://www.nzherald.co.nz/world/news/article.cfm?c_id=2&objectid=11772679,General,25/12/2016-12:30:23,"RUSSIAN MAN DRIVES INTO AIRPORT, SAYS HE DID IT FOR LOVE"
http://nbc4i.com/2016/12/23/cleveland-police-officers-2-year-old-son-dies-after-shooting-himself/,General,25/12/2016-12:30:23,CLEVELAND POLICE OFFICER'S 2-YEAR-OLD SON DIES AFTER REPORTEDLY SHOOTING HIMSELF WITH FATHER’S SERVICE WEAPON
http://www.chron.com/news/us/article/The-Latest-Trucker-in-standoff-at-Missouri-rest-10815811.php,General,25/12/2016-12:30:23,THE LATEST: TRUCKER ARRESTED AFTER MISSOURI FREEWAY STANDOFF
http://www.king5.com/tech/science/environment/drone-video-shows-orcas-killing-shark/376306698,General,25/12/2016-12:30:23,DRONE VIDEO SHOWS ORCAS KILLING SHARK
http://www.belfasttelegraph.co.uk/news/world-news/black-man-daryl-davis-convinces-200-ku-klux-klansmen-to-leave-white-supremacist-group-by-befriending-them-35315250.html,General,25/12/2016-12:30:23,BLACK MAN DARYL DAVIS CONVINCES 200 KU KLUX KLANSMEN TO LEAVE WHITE SUPREMACIST GROUP BY BEFRIENDING THEM
http://www.msn.com/en-us/money/markets/meet-the-chinese-billionaire-whos-moving-manufacturing-to-the-us-to-cut-costs/ar-BBxr39m?li=BBmkt5R&ocid=spartandhp,General,25/12/2016-12:30:23,MEET THE CHINESE BILLIONAIRE WHO'S MOVING MANUFACTURING TO THE U.S. TO CUT COSTS
http://ktla.com/2016/12/23/husband-suspected-of-slitting-throats-of-wife-infant-son-at-texas-home-arrested-in-colorado/,General,25/12/2016-12:30:23,"HUSBAND SUSPECTED OF SLITTING THROATS OF WIFE, INFANT SON AT TEXAS HOME ARRESTED IN COLORADO"
http://www.reuters.com/article/us-usa-cyber-china-exclusive-idUSKBN14C1UJ?feedType=RSS&feedName=topNews&utm_source=twitter&utm_medium=Social,General,25/12/2016-12:30:23,"THE FBI IS INVESTIGATING HOW HACKERS INFILTRATED COMPUTERS AT THE FEDERAL DEPOSIT INSURANCE CORPORATION FOR SEVERAL YEARS BEGINNING IN 2010 IN A BREACH SENIOR FDIC OFFICIALS BELIEVE WAS SPONSORED BY CHINA'S MILITARY, PEOPLE WITH KNOWLEDGE OF THE MATTER SAID."
http://www.usatoday.com/story/money/2016/12/21/mcdonalds-sued-because-extra-value-meal-41-cents-more/95697780/,General,25/12/2016-12:30:23,MCDONALD'S SUED BECAUSE 'EXTRA VALUE MEAL' IS 41 CENTS MORE
http://www.timesofmalta.com/articles/view/20161223/local/hijacked-libyan-plane-lands-in-malta.634664,General,25/12/2016-12:30:23,'HIJACKED' LIBYAN PLANE LANDS IN MALTA
http://bigstory.ap.org/article/e07057c8e863431abf7472d8da0e11a0/after-online-threats-gaming-engineer-plans-run-congress,General,25/12/2016-12:30:23,"AFTER ONLINE THREATS, GAMING ENGINEER PLANS RUN FOR CONGRESS"
http://arstechnica.com/science/2016/12/medical-marijuana-laws-linked-to-fewer-fatal-car-crashes/,General,25/12/2016-12:30:23,STATES THAT ENACT MEDICAL MARIJUANA LAWS SEE DIPS IN FATAL CAR CRASHES
http://www.cbc.ca/beta/news/canada/prince-edward-island/excavator-stops-driver-1.3910172,General,25/12/2016-12:30:23,"DRUNK DRIVER IN CANADA STOPPED BY MAN IN EXCAVATOR, HELD UNTIL POLICE ARRIVED"
http://www.foxnews.com/health/2016/12/23/oklahoma-mom-says-was-shamed-for-using-handicap-spot-while-carrying-disabled-son.html,General,25/12/2016-12:30:23,OKLAHOMA MOM SAYS SHE WAS SHAMED FOR USING HANDICAP SPOT WHILE CARRYING DISABLED SON
http://woodtv.com/2016/12/23/gov-rick-snyder-signs-law-authorizing-michigan-wolf-hunting/,General,25/12/2016-12:30:23,GOV. RICK SNYDER SIGNS LAW AUTHORIZING MICHIGAN WOLF HUNTING
http://www.ajc.com/news/national/man-kills-roommate-fight-over-chores-police-say/xX0lyZ2TADIImQ2eadWaZL/,General,25/12/2016-12:30:23,"MAN KILLS ROOMMATE IN FIGHT OVER CHORES, POLICE SAY"
http://earthquake.usgs.gov/earthquakes/eventpage/us10007mbu#map,General,25/12/2016-12:30:23,"4.5 EARTHQUAKE IN CIMARRON, NEW MEXICO"
http://www.chicagotribune.com/news/laquanmcdonald/ct-laquan-mcdonald-shooting-inspector-general-report-met-20161222-story.html,General,25/12/2016-12:30:23,"TOP POLICE BRASS DEFENDED LAQUAN MCDONALD SHOOTING AFTER SEEING VIDEO, RECORDS SHOW"
http://www.mlive.com/news/ann-arbor/index.ssf/2016/12/video_shows_drunken_driving_ar.html,General,25/12/2016-12:30:23,VIDEO SHOWS DRUNKEN-DRIVING ARREST OF WASHTENAW POLICE LIEUTENANT
http://www.independent.co.uk/news/100-migrants-drown-italy-death-toll-united-nations-highest-ever-a7493206.html,General,25/12/2016-12:30:23,"100 PEOPLE FEARED DEAD IN MEDITERRANEAN TAKING TOLL FOR 2016 TO 5,000 – THE HIGHEST EVER"
https://www.engadget.com/2016/12/22/usa-foreign-travelers-social-media/,General,25/12/2016-12:30:23,US STARTS ASKING FOREIGN TRAVELERS FOR THEIR SOCIAL MEDIA INFO
http://ksnt.com/2016/12/23/parents-charged-with-shooting-heroin-in-walmart-parking-lot-with-2-kids-in-car/,General,25/12/2016-12:30:23,PARENTS CHARGED WITH SHOOTING HEROIN IN WALMART PARKING LOT WITH 2 KIDS IN CAR
http://www.9news.com.au/national/2016/12/23/07/19/police-raids-underway-in-melbourne-suburb,General,25/12/2016-12:30:23,POLICE SAY THEY HAVE FOILED A TERROR PLOT LIKELY PLANNED FOR CHRISTMAS DAY IN MELBOURNE
http://www.wbrz.com/news/terrebonne-substitute-teacher-arrested-for-having-sex-with-teens,General,25/12/2016-12:30:23,TERREBONNE SUBSTITUTE TEACHER ARRESTED FOR HAVING SEX WITH TEENS
http://ktla.com/2016/12/23/norcal-gas-station-employee-burned-alive-at-work-in-brutal-attack-assailant-sought/,General,25/12/2016-12:30:23,NORCAL GAS STATION EMPLOYEE BURNED ALIVE AT WORK IN BRUTAL ATTACK; ASSAILANT SOUGHT
http://mainichi.jp/english/articles/20161223/p2a/00m/0na/006000c,General,25/12/2016-12:30:26,"OVER 5,000 TEACHERS IN JAPAN TOOK SICK LEAVE FOR MENTAL ILLNESS IN 2015 SCHOOL YEAR"
http://www.usatoday.com/story/news/2016/12/22/retailers-reporting-strong-marijuana-sales-holidays/95762702/,General,25/12/2016-12:30:26,RETAILERS REPORTING STRONG MARIJUANA SALES FOR THE HOLIDAYS
http://www.fox2detroit.com/news/local-news/225288983-story?utm_source=dlvr.it&utm_medium=twitter,General,25/12/2016-12:30:26,"POLICE: WOMAN BEATS SONS, 9 AND 7, FOR OPENING CHRISTMAS GIFTS EARLY"
http://www.nytimes.com/2016/12/22/health/ebola-vaccine.html?_r=0,General,25/12/2016-12:30:26,NEW EBOLA VACCINE GIVES 100 PERCENT PROTECTION
http://www.theglobeandmail.com/report-on-business/canadian-economy-shrank-03-per-cent-in-october/article33421218/,General,25/12/2016-12:30:26,CANADA’S ECONOMY CONTRACTS ON WEAKEST FACTORY OUTPUT SINCE 2013
http://www.reuters.com/investigates/special-report/usa-bodybrokers-industry/,General,25/12/2016-12:30:26,HOW A GREAT-GRANDMOTHER’S BODY CAME TO BE USED IN AN ARMY BLAST TEST
https://www.cnet.com/news/galaxy-note-7-wi-fi-hotspot-virgin-america-flight-lucas-wojciechowski/,General,25/12/2016-12:30:26,GALAXY NOTE 7 HOTSPOT NAME FREAKS OUT A FLIGHT
http://www.bbc.co.uk/news/uk-38386088,General,25/12/2016-12:30:26,"ROUGH SLEEPERS 'URINATED ON' BY PUBLIC, SURVEY FINDS - BBC NEWS."
http://www.wsbtv.com/news/trending-now/church-facing-12000-fine-for-letting-homeless-people-sleep-on-property_/477981262,General,25/12/2016-12:30:26,"CHURCH FACING $12,000 FINE FOR LETTING HOMELESS PEOPLE SLEEP ON PROPERTY."
http://www.9news.com/mb/life/pets/shelter-staff-celebrates-empty-kennels-after-successful-adoptions/374187601,General,25/12/2016-12:30:26,SHELTER STAFF CELEBRATES EMPTY KENNELS AFTER SUCCESSFUL ADOPTIONS
http://www.nytimes.com/2016/12/23/health/cancer-trials-immunotherapy.html,General,25/12/2016-12:30:26,"IN CANCER TRIALS, MINORITIES FACE EXTRA HURDLES"
http://www.reuters.com/article/us-usa-trump-passenger-idUSKBN14B25I,General,25/12/2016-12:30:26,PASSENGER REMOVED FROM FLIGHT AFTER CONFRONTATION WITH IVANKA TRUMP.
http://www.timesofisrael.com/fatah-uses-facebook-to-celebrate-murders-of-over-100-israelis/,General,25/12/2016-12:30:26,FATAH TAKES TO FACEBOOK TO CELEBRATE MURDERS OF OVER 100 ISRAELIS
https://www.theguardian.com/us-news/2016/dec/22/texas-mother-daughter-arrest-fort-worth-jacqueline-craig,General,25/12/2016-12:30:26,MOTHER AND DAUGHTER WHO REPORT CHILD'S ASSAULT ARE AGGRESSIVELY ARRESTED ON TAPE
http://www.wgal.com/article/family-of-bears-killed-in-pa-after-eating-poisonous-plant/8531790,General,25/12/2016-12:30:26,FAMILY OF BEARS KILLED IN PA. AFTER EATING POISONOUS PLANT
http://www.independent.co.uk/news/world/americas/las-vegas-is-now-completely-powered-by-renewable-energy-a7491321.html,General,25/12/2016-12:30:26,LAS VEGAS IS NOW COMPLETELY POWERED BY RENEWABLE ENERGY
http://www.foxnews.com/world/2016/12/22/2-american-hikers-find-black-box-1985-plane-crash-in-bolivia-hand-it-to-ntsb.html,General,25/12/2016-12:30:26,"2 AMERICAN HIKERS FIND BLACK BOX OF 1985 PLANE CRASH IN BOLIVIA, HAND IT TO NTSB"
https://www.bloomberg.com/news/videos/2016-12-23/shkreli-price-increase-has-stuck-happy-with-that,General,25/12/2016-12:30:26,"SHKRELI: PRICE INCREASE HAS STUCK, HAPPY WITH THAT"
http://www.walesonline.co.uk/news/wales-news/arsonists-devastate-allotment-site-run-12364453,General,25/12/2016-12:30:26,ARSONISTS DEVASTATE ALLOTMENT SITE RUN BY PEOPLE WITH LEARNING NEEDS
http://www.bbc.com/news/uk-england-oxfordshire-38420960,General,25/12/2016-12:30:26,POLISH WOMAN ACCUSED OF CONTEMPT OF COURT GIVEN CHRISTMAS REPRIEVE
http://www.wisn.com/article/milwaukee-man-accused-of-stockpiling-weapons-in-suburbs/8526691,General,25/12/2016-12:30:26,MILWAUKEE MAN ACCUSED OF STOCKPILING WEAPONS IN SUBURBS
http://www.independent.co.uk/news/world/europe/drunk-driver-car-thruough-russia-airport-terminal-kazan-international-a7491951.html,General,25/12/2016-12:30:26,DRUNK MAN DRIVES CAR THROUGH RUSSIAN AIRPORT TERMINAL
http://www.independent.co.uk/news/uk/crime/police-officer-sex-rape-victim-mcdonalds-toilet-charlotte-peters-london-protection-assign-a7489926.html,General,25/12/2016-12:30:26,POLICE OFFICER WHO HAD SEX WITH RAPE VICTIM IN MCDONALD'S TOILET IS JAILED
http://www.straitstimes.com/asia/east-asia/villager-in-china-uses-grenade-to-crack-open-walnuts-for-25-years,General,25/12/2016-12:30:26,VILLAGER IN CHINA USES GRENADE TO CRACK OPEN WALNUTS FOR 25 YEARS
http://www.nbcnews.com/news/us-news/white-texas-cop-s-arrest-three-black-women-appears-racist-n699416,General,25/12/2016-12:30:26,WHITE TEXAS COP'S ARREST OF THREE BLACK WOMEN APPEARS RACIST: LAWYER
https://www.bloomberg.com/news/articles/2016-12-23/xi-said-to-express-openness-to-growth-below-6-5-as-debt-climbs-ix1qz3tz,General,25/12/2016-12:30:28,PRESIDENT XI OPEN TO GROWTH IN CHINA FALLING BELOW 6.5%
http://reuters.com/article/idINKBN14C1VZ,General,25/12/2016-12:30:28,FBI PROBES FDIC HACK LINKED TO CHINA'S MILITARY - SOURCES
https://www.theguardian.com/technology/2016/dec/21/oracle-executive-resigns-ceo-safra-catz-donald-trump,General,25/12/2016-12:30:28,ORACLE EXECUTIVE PUBLICLY RESIGNS AFTER CEO JOINS TRUMP'S TRANSITION TEAM
http://www.courant.com/community/manchester/hc-manchester-school-slide-1215-20161214-story.html,General,25/12/2016-12:30:28,RIFT OVER PLANNED INDOOR SLIDE AT ELEMENTARY SCHOOL
http://www.cbc.ca/news/canada/calgary/calgary-daniel-boria-balloon-man-plea-1.3908793,General,25/12/2016-12:30:28,MAN WHO FLEW OVER CALGARY ON A LAWN CHAIR TIED TO 120 BALLOONS FOUND GUILTY
http://www.aljazeera.com/news/2016/12/isil-burns-turkish-soldiers-alive-shocking-video-161223035619947.html,General,25/12/2016-12:30:28,ISIL VIDEO SHOWS 'TURKISH SOLDIERS BURNED ALIVE'
https://www.theguardian.com/us-news/2016/dec/22/california-police-kern-county-investigation-kamala-harris,General,25/12/2016-12:30:28,TWO 'DEADLIEST' POLICE DEPARTMENTS IN US TO BE INVESTIGATED IN CALIFORNIA
http://www.fox4news.com/news/225061979-story,General,25/12/2016-12:30:28,FORT WORTH WOMAN BEING ARRESTED AFTER CALLING POLICE TO REPORT THAT A MAN HAD CHOKED HER 7-YEAR-OLD SON
http://www.telegraph.co.uk/news/2016/12/22/sexoffenderbanned-approaching-women-life/,General,25/12/2016-12:30:28,SEX OFFENDER BANNED FROM APPROACHING WOMEN FOR LIFE
http://www.cnn.com/2016/12/22/us/fort-worth-police-facebook/index.html,General,25/12/2016-12:30:28,FORT WORTH POLICE INVESTIGATE ARREST CAUGHT ON VIDEO
http://www.chicagotribune.com/news/nationworld/midwest/ct-wisconsin-dells-water-slide-death-20161222-story.html,General,25/12/2016-12:30:28,BOY DIES AFTER FALL FROM WATER SLIDE IN WISCONSIN DELLS AREA
http://www.calgarysun.com/2016/12/22/pennsylvania-man-89-heads-out-to-store-ends-up-in-alabama,General,25/12/2016-12:30:28,"PENNSYLVANIA MAN, 89, HEADS OUT TO STORE, ENDS UP IN ALABAMA"
http://www.nbcchicago.com/news/local/Something-Terrible-is-Going-to-Happen-Police-Investigate-After-Cards-Found-on-Hundreds-of-Cars-in-Chicago-Suburbs-407965345.html?_osource=SocialFlowFB_CHBrand,General,25/12/2016-12:30:28,'SOMETHING TERRIBLE IS GOING TO HAPPEN': POLICE INVESTIGATE AFTER CARDS FOUND ON HUNDREDS OF CARS IN CHICAGO SUBURBS
https://www.theguardian.com/us-news/2016/dec/22/robber-freed-90-years-early-by-mistake-says-he-reformed-while-free,General,25/12/2016-12:30:28,"A ROBBER SENT BACK TO PRISON AFTER BEING MISTAKENLY RELEASED EIGHT YEARS INTO HIS 98-YEAR SENTENCE ASKED A JUDGE ON WEDNESDAY TO SET HIM FREE AGAIN, ARGUING HE HAD STARTED A FAMILY, GOT A STEADY JOB AND REFORMED HIMSELF"
http://www.bbc.com/news/world-africa-38414060,General,25/12/2016-12:30:28,SUCCESSFUL EBOLA VACCINE WILL BE FAST-TRACKED FOR USE
http://www.bbc.com/news/education-38392802,General,25/12/2016-12:30:28,"FACEBOOK LURKING MAKES YOU MISERABLE, SAYS STUDY"
http://www.fox2detroit.com/news/local-news/225066115-story,General,25/12/2016-12:30:28,NFL PLAYER ADOPTS FAMILY OF FALLEN POLICE OFFICER FOR CHRISTMAS.
http://www.bbc.co.uk/news/world-europe-38416112,General,25/12/2016-12:30:28,LIBYAN PLANE IN 'POTENTIAL HIJACK'
http://www.cnbc.com/2016/12/23/consumer-sentiment-reports-for-december-2016.html,General,25/12/2016-12:30:28,CONSUMER SENTIMENT REPORTS FOR DECEMBER 2016
http://www.kare11.com/news/9th-dui-gets-woman-5-years-in-prison/376805722,General,25/12/2016-12:30:28,9TH DUI GETS WOMAN 5 YEARS IN PRISON
http://www.reuters.com/article/us-health-birdflu-china-idUSKBN14C0CX,General,25/12/2016-12:30:28,CHINA REPORTS FIRST TWO HUMAN DEATHS FROM BIRD FLU THIS WINTER
http://www.mcclatchydc.com/news/nation-world/national/national-security/article122259174.html,General,25/12/2016-12:30:28,POLICE USE OF CELL-TOWER SIMULATOR TRACKING DEVICES DRAWS CONCERN
http://www.bbc.co.uk/news/world-us-canada-38410027,General,25/12/2016-12:30:28,BBC NEWS: TRUMP WANTS EXPANDED NUCLEAR CAPABILITY
http://wfla.com/2016/12/21/pinellas-veteran-claims-40-year-cover-up-by-u-s-a-f/,General,25/12/2016-12:30:28,SCOTT NELMS CLAIMS A 40-YEAR COVER UP BY THE AIR FORCE MAY HAVE COST VETERANS AND THEIR FAMILIES DEARLY. NELMS SAID THE USAF SPRAYED SIGNIFICANT AMOUNTS OF THE TOXIC DEFOLIANT AGENT ORANGE AT BASES IN THAILAND.
http://www.msn.com/en-us/travel/news/delta-air-lines-changes-policy-after-black-doctor-was-stopped-from-helping-on-flight/ar-BBxpnUF?li=BBmkt5R&ocid=spartanntp_edu,General,25/12/2016-12:30:28,DELTA AIR LINES CHANGES POLICY AFTER BLACK DOCTOR WAS STOPPED FROM HELPING ON FLIGHT
http://www.independent.co.uk/news/people/barack-obama-prank-white-house-snowman-fear-phobia-instagram-photos-a7490796.html,General,25/12/2016-12:30:30,BARACK OBAMA PRANKED BY WHITE HOUSE STAFF OVER SNOWMAN FEARS
http://www.military.com/daily-news/2016/12/20/ecstasy-one-step-closer-approval-ptsd-treatment.html?ESRC=eb_161221.nl,General,25/12/2016-12:30:30,ECSTASY ONE STEP CLOSER TO APPROVAL AS PTSD TREATMENT
http://www.cbc.ca/news/canada/nova-scotia/human-trafficking-nova-scotia-gibson-skeir-threat-halifax-court-1.3907219,General,25/12/2016-12:30:30,HUMAN TRAFFICKER ARRESTED AND CHARGED. THREATENS 14 YEAR OLD VICTIM WHILE EXITING COURT
http://www.telegraph.co.uk/news/2016/12/23/three-british-airways-passengers-treated-like-rock-stars-found/,General,25/12/2016-12:30:30,THREE BRITISH AIRWAYS PASSENGERS TREATED LIKE 'ROCK STARS' WHEN THEY FOUND THEY WERE THE ONLY PEOPLE ON BOARD THEIR FLIGHT
http://www.mlive.com/news/grand-rapids/index.ssf/2016/12/he_terrified_a_lot_of_people_w.html,General,25/12/2016-12:30:30,"'HE TERRIFIED A LOT OF PEOPLE:' WITNESS WONDERS WHY FBI AGENT WAVED GUN, SHOT AT COPS"
http://www.cbc.ca/beta/news/canada/windsor/serial-animal-killer-london-1.3909757,General,25/12/2016-12:30:30,"ANIMAL SERIAL KILLER ON HE LOOSE IN LONDON, ONTARIO."
http://www.nbcnews.com/news/us-news/congress-calls-edward-snowden-liar-new-report-n699121,General,25/12/2016-12:30:30,CONGRESS REPORT CALLS SNOWDEN A LIAR WHO'S IN TOUCH WITH RUSSIAN SPIES
https://www.engadget.com/2016/12/22/peter-thiels-startup-helps-authorities-track-illegal-immigrant/,General,25/12/2016-12:30:30,PETER THIEL'S STARTUP HELPS AUTHORITIES TRACK ILLEGAL IMMIGRANTS
http://www.usatoday.com/story/money/cars/2016/12/22/volkswagen-group-3-liter-diesel-scandal-settlement-substantial/95711452/,General,25/12/2016-12:30:30,JUDGE WARNS VW OWNERS NOT TO STRIP DIESEL CARS FOR BUYBACKS
https://www.theguardian.com/world/2016/dec/23/german-police-arrest-men-alleged-shopping-centre-plot-oberhausen,General,25/12/2016-12:30:30,GERMAN POLICE ARREST TWO MEN OVER ALLEGED PLOT TO ATTACK SHOPPING CENTRE
http://www.nytimes.com/2016/12/22/nyregion/obama-to-dismantle-visitor-registry-before-trump-can-revive-it.html,General,25/12/2016-12:30:30,OBAMA TO DISMANTLE VISITOR REGISTRY BEFORE TRUMP CAN REVIVE IT
https://www.justice.gov/usao-edny/pr/odebrecht-and-braskem-plead-guilty-and-agree-pay-least-35-billion-global-criminal,General,25/12/2016-12:30:30,ODEBRECHT AND BRASKEM PLEAD GUILTY AND AGREE TO PAY AT LEAST $3.5 BILLION IN GLOBAL CRIMINAL PENALTIES TO RESOLVE LARGEST FOREIGN BRIBERY CASE IN HISTORY
http://turnto10.com/news/local/man-orders-gift-from-amazon-for-child-receives-sex-toy-instead,General,25/12/2016-12:30:30,"MAN ORDERS GIFTS FROM AMAZON FOR CHILDREN, SAYS HE RECEIVES SEX TOYS INSTEAD"
https://www.airforcetimes.com/articles/air-force-track-review,General,25/12/2016-12:30:30,AIR FORCE FINDS 17 BASES HAVE TOO-LONG PT TRACKS; PROMISES REMEDY FOR WRONGFUL FAILURES
http://www.kwch.com/content/news/Body-cam-video-shows--407962085.html,General,25/12/2016-12:30:30,VIDEO SHOWS DEPUTY USE TASER ON MAN AT NURSING HOME
http://www.telegraph.co.uk/money/consumer-affairs/whirlpool-dryer-scandal-watchdogs-face-legal-action-failures/,General,25/12/2016-12:30:30,WHIRLPOOL DRYER SCANDAL: WATCHDOGS FACE LEGAL ACTION OVER 'FAILURES'
http://www.reuters.com/investigates/special-report/usa-uncounted-outbreaks/,General,25/12/2016-12:30:30,"HOW HOSPITALS, NURSING HOMES KEEP DEADLY 'SUPERBUG' OUTBREAKS SECRET"
http://www.bbc.co.uk/news/health-38392548,General,25/12/2016-12:30:30,MULTIPLE SCLEROSIS DRUG 'A LANDMARK'
https://apnews.com/4e14f73be8df4caf90643cd2d757054c/Arrest-in-'Vote-Trump'-burning-of-Mississippi-black-church,General,25/12/2016-12:30:30,ARREST IN 'VOTE TRUMP' BURNING OF MISSISSIPPI BLACK CHURCH
https://www.washingtonpost.com/news/post-nation/wp/2016/12/22/a-black-mother-told-police-a-white-man-assaulted-her-child-they-arrested-her-instead/?utm_term=.5cbae98b766e,General,25/12/2016-12:30:30,A BLACK MOTHER TOLD POLICE A WHITE MAN ASSAULTED HER CHILD. THEY ARRESTED HER INSTEAD.
http://www.msn.com/en-us/news/other/stray-dog-found-carrying-child-remains-in-mouth/ar-BBxo9Wk?ocid=spartandhp,General,25/12/2016-12:30:30,STRAY DOG FOUND CARRYING CHILD REMAINS IN MOUTH
http://www.reuters.com/article/2016/12/22/us-barclays-mortgages-idUSKBN14B29A?utm_source=applenews,General,25/12/2016-12:30:30,U.S. SUES BARCLAYS FOR MORTGAGE SECURITIES FRAUD
http://www.fox16.com/news/local-news/breakingarrest-made-in-death-of-three-year-old-acen-king/630504745,General,25/12/2016-12:30:30,"ARREST MADE IN DEATH OF THREE-YEAR-OLD, ACEN KING"
http://www.bbc.com/news/world/europe,General,25/12/2016-12:30:30,GERMANY ARRESTS TWO ON TERROR CHARGES
https://endpts.com/the-senate-autopsies-martin-shkrelis-scheme-to-grab-a-1b-windfall/,General,25/12/2016-12:30:30,THE SENATE AUTOPSIES MARTIN SHKRELI’S SCHEME TO GRAB A $1B WINDFALL
http://www.nbcnewyork.com/news/national-international/Austin-Man-Fatally-Stabs-Stepmom-Gloating-About-Cowboys-Win-407823115.html,General,25/12/2016-12:30:32,WOMAN KILLED AFTER 'GLOATING' OVER COWBOYS' WIN: POLICE
http://www.kansascity.com/news/local/article122430344.html,General,25/12/2016-12:30:32,"THREATS, BULLYING HIT FAMILY OF KC TRANSGENDER GIRL ON COVER OF NATIONAL GEOGRAPHIC."
http://www.star-telegram.com/news/local/community/fort-worth/article122405439.html,General,25/12/2016-12:30:32,"FORT WORTH POLICE ARREST WOMEN AFTER UGLY CONFRONTATION, WHICH WAS CAUGHT ON VIDEO"
http://montreal.ctvnews.ca/spca-will-stop-accepting-montreal-dogs-this-spring-1.3214263,General,25/12/2016-12:30:32,SPCA WILL STOP ACCEPTING MONTREAL DOGS THIS SPRING
http://abcnews.go.com/International/wireStory/authorities-godfather-grass-arrested-canada-44357946,General,25/12/2016-12:30:32,AUTHORITIES: 'GODFATHER OF GRASS' ARRESTED IN CANADA
http://abcnews.go.com/Health/wireStory/pope-denounces-resistance-reform-christmas-greeting-44341665,General,25/12/2016-12:30:32,POPE IN CHRISTMAS SPEECH BLASTS VATICAN RESISTANCE TO REFORM
