url,type,timeretrieved,title
http://pix11.com/2016/12/22/police-find-55-pounds-of-fentanyl-in-traffic-stop-in-connecticut/,General,24/12/2016-06:30:08,POLICE FIND 55 POUNDS OF FENTANYL IN TRAFFIC STOP IN CONNECTICUT.
https://gma.yahoo.com/suspect-road-rage-killing-3-old-boy-said-220104775--abc-news-topstories.html#,General,24/12/2016-06:30:08,SUSPECT IN ROAD RAGE KILLING OF 3-YEAR-OLD BOY SAID CAR WAS FOLLOWING TOO CLOSE
http://www.9news.com/news/local/report-finds-blacks-disproportionately-arrested-in-colorado/377386544,General,24/12/2016-06:30:08,REPORT FINDS BLACKS DISPROPORTIONATELY ARRESTED IN COLORADO
http://www.latimes.com/local/lanow/la-me-ln-shasta-gas-station-burned-20161223-story.html,General,24/12/2016-06:30:08,KILLER DOUSED GAS STATION CLERK IN FLAMMABLE LIQUID AND THEN BURNED HIM
http://www.espn.com/nfl/story/_/id/18341736/minnesota-vikings-plane-skids-runway-safe-landing,General,24/12/2016-06:30:08,MINNESOTA VIKINGS PLANE SLIDES OFF RUNWAY
http://www.usatoday.com/story/news/nation-now/2016/12/21/4-bodies-nicholas-tartaglione/95687736/,General,24/12/2016-06:30:08,4 BODIES FOUND AT PROPERTY OF RETIRED N.Y. COP
http://abcnews.go.com/Entertainment/wireStory/backlash-kicked-rockettes-picked-inauguration-44367911,General,24/12/2016-06:30:08,ROCKETTES' OWNERS SAY ATTENDANCE AT INAUGURATION IS A CHOICE
http://talkasia.net/2016/12/24/woman-arrested-for-giving-birth-to-illegitimate-baby-in-uae/,General,24/12/2016-06:30:08,WOMAN ARRESTED FOR GIVING BIRTH TO ‘ILLEGITIMATE’ BABY IN UAE
http://www.wbtv.com/story/34109723/revised-mo-statute-increases-punishment-on-grade-school-fights,General,24/12/2016-06:30:08,"NEW MISSOURI LAW MAKES GRADE SCHOOL FIGHTS A FELONY, RESULTING IN UP TO A 4 YEAR SENTENCE"
http://ktla.com/2016/12/07/n-c-firefighter-admitted-to-starting-blazes-so-he-could-be-paid-to-extinguish-them/,General,24/12/2016-06:30:08,N.C. FIREFIGHTER ADMITTED TO STARTING BLAZES SO HE COULD BE PAID TO EXTINGUISH THEM
http://www.cbsnews.com/news/gene-anthony-quinones-rivera-cops-dad-admits-killing-infant-leaving-body-in-woods/,General,24/12/2016-06:30:08,"COPS: DAD CONFESSES TO KILLING INFANT, LEAVING BODY IN WOODS"
http://www.telegraph.co.uk/news/2016/12/23/fbi-warns-islamic-state-targeting-us-churches-holiday-gatherings/,General,24/12/2016-06:30:08,FBI WARNS ISLAMIC STATE TARGETING US CHURCHES AND HOLIDAY GATHERINGS
https://apnews.com/f8e9d98928db41d18f3f12385a3cb0b2,General,24/12/2016-06:30:08,"OBAMA SIGNS DEFENSE POLICY BILL, OBJECTS ON GUANTANAMO"
https://www.theguardian.com/world/live/2016/dec/23/berlin-market-attack-suspect-anis-amri-killed-in-milan-reports-say-live-coverage,General,24/12/2016-06:30:08,"BERLIN MARKET ATTACK SUSPECT KILLED IN MILAN, REPORTS SAY"
http://www.nbcnews.com/news/us-news/ex-lottery-security-chief-charged-rigging-wisconsin-jackpot-n699556,General,24/12/2016-06:30:08,EX-LOTTERY SECURITY CHIEF CHARGED WITH RIGGING WISCONSIN JACKPOT
http://www.latinpost.com/articles/124210/20160922/dianey-santos-mom-of-two-girls-shot-dead-at-bus-stop-in-june-now-la-police-announce-50-000-reward.htm,General,24/12/2016-06:30:09,"DIANEY SANTOS, MOM OF TWO GIRLS, SHOT DEAD AT BUS STOP IN JUNE; NOW, LA POLICE ANNOUNCE $50,000 REWARD"
https://www.washingtonpost.com/news/post-nation/wp/2016/12/22/a-black-mother-told-police-a-white-man-assaulted-her-child-they-arrested-her-instead/?hpid=hp_hp-cards_hp-card-national%3Ahomepage%2Fcard&utm_term=.0ce0a50fffa0,General,24/12/2016-06:30:09,"BLACK MOTHER TOLD POLICE A WHITE MAN ASSAULTED HER CHILD, GETS ARRESTED"
http://www.cnn.com/videos/tv/2016/12/23/fbi-issues-warning-on-isis-threats-in-u-s-lead-perez-live.cnn,General,24/12/2016-06:30:09,FBI WARNS ABOUT ISIS THREAT TO CHURCHES
http://www.cnbc.com/2016/12/22/the-biggest-hedge-fund-in-the-world-is-creating-a-secret-algorithm-to-automate-management.html,General,24/12/2016-06:30:09,THE WORLD'S BIGGEST HEDGE FUND IS CREATING A SECRET ALGORITHM TO AUTOMATE MANAGEMENT
http://bigstory.ap.org/article/57acbd588ea54782a470d79e6fe815fe/family-nypd-raided-home-mistake-posted-snapchat-photos,General,24/12/2016-06:30:09,"FAMILY: NYPD RAIDED HOME BY MISTAKE, POSTED SNAPCHAT PHOTOS"
http://abc7news.com/news/first-civil-lawsuits-filed-in-ghost-ship-warehouse-fire--/1670353/,General,24/12/2016-06:30:09,FIRST CIVIL LAWSUITS FILED IN OAKLAND GHOST SHIP WAREHOUSE FIRE
https://www.yahoo.com/news/brazil-sees-murders-soar-rio-drop-sao-paulo-184146886.html,General,24/12/2016-06:30:09,"HOMICIDES CLAIMED MORE LIVES IN BRAZIL FROM 2011 TO 2015 THAN THE SYRIAN CIVIL WAR DURING THE SAME PERIOD, ACCORDING TO THE BRAZILIAN PUBLIC SECURITY FORUM: 278,839 FOR BRAZIL, AGAINST 256,124 IN SYRIA."
http://www.independent.co.uk/news/world/americas/pregnant-waitress-900-tip-christmas-arizona-sarah-clark-a7493246.html,General,24/12/2016-06:30:09,PREGNANT WAITRESS GETS $900 TIP JUST DAYS BEFORE CHRISTMAS
https://www.yahoo.com/gma/tennessee-couple-dies-just-hours-apart-nearly-64-045539728--abc-news-topstories.html#,General,24/12/2016-06:30:09,COUPLE DIES HOURS APART AFTER 64 YEARS OF MARRIAGE
http://bigstory.ap.org/article/1c2e6b52f237492bbbe8ca25a3cf5e56/california-pursues-new-pimping-charges-against-backpagecom,General,24/12/2016-06:30:09,CALIFORNIA PURSUES NEW PIMPING CHARGES AGAINST BACKPAGE.COM
http://gizmodo.com/holiday-flight-canceled-after-jabroni-names-wi-fi-netwo-1790425625,General,24/12/2016-06:30:10,HOLIDAY FLIGHT CANCELED AFTER JABRONI NAMES WI-FI NETWORK 'GALAXY NOTE 7'
https://www.cnet.com/news/worlds-first-solar-road-opens-in-france/,General,24/12/2016-06:30:10,WORLD'S FIRST SOLAR ROAD OPENS IN FRANCE
http://www.foxnews.com/us/2016/12/22/video-shows-texas-officer-forcibly-arresting-woman-daughter.html,General,24/12/2016-06:30:10,"TEXAS OFFICER ON RESTRICTED DUTY AFTER VIDEO SHOWS FORCIBLE ARRESTS OF MOTHER, DAUGHTER"
http://www.funorlife.com/2016/12/us-approves-sale-of-night-vision.html,General,24/12/2016-06:30:10,US APPROVES SALE OF NIGHT VISION EQUIPMENT TO PAKISTAN
http://www.npr.org/sections/thetwo-way/2016/12/22/506629695/trump-team-asks-state-dept-to-name-those-working-on-gender-equality,General,24/12/2016-06:30:10,TRUMP TEAM ASKS STATE DEPT. TO NAME THOSE WORKING ON GENDER EQUALITY
http://www.detroitnews.com/story/news/local/michigan/2016/12/21/snyder-signs-historic-energy-plan-law/95705658/,General,24/12/2016-06:30:10,MICHIGAN PASSES LAW REQUIRING UTILITIES TO BUY OR PRODUCE AT LEAST 15 PERCENT OF THEIR ENERGY FROM RENEWABLE SOURCES BY 2022
https://www.washingtonpost.com/national/for-women-heavy-drinking-has-been-normalized-thats-dangerous/2016/12/23/0e701120-c381-11e6-9578-0054287507db_story.html?hpid=hp_hp-top-table-main_bigvino-12pm%3Ahomepage%2Fstory&utm_term=.772bfab26cd0,General,24/12/2016-06:30:10,"FOR WOMEN, HEAVY DRINKING HAS BEEN NORMALIZED. THAT’S DANGEROUS."
http://www.livescience.com/57298-worlds-oldest-gorilla-turns-60.html?,General,24/12/2016-06:30:10,THE FIRST GORILLA BORN IN HUMAN CARE TURNED 60 TODAY (DEC. 22) AT HER HOME IN THE COLUMBUS ZOO AND AQUARIUM IN OHIO.
http://www.omaha.com/news/crime/man-dies-after-being-shot-during-suspected-robbery-at-millard/article_5e6abef0-c96c-11e6-8e50-138ef248854d.html,General,24/12/2016-06:30:10,2 MEN WEARING CLOWN MASK GUN DOWN OMAHA MAN IN ATTEMPTED ROBBERY.
http://www.csmonitor.com/World/Making-a-difference/2016/1222/This-woman-has-helped-more-than-4-500-disabled-people-get-jobs,General,24/12/2016-06:30:10,"THIS WOMAN HAS HELPED MORE THAN 4,500 DISABLED PEOPLE GET JOBS"
http://www.aljazeera.com/news/2016/12/egypt-arrests-al-jazeera-news-producer-vacation-161223171209633.html,General,24/12/2016-06:30:10,EGYPT ARRESTS AL JAZEERA NEWS PRODUCER DURING VACATION. SECURITY OFFICIALS SAY MAHMOUD HUSSEIN IS ACCUSED OF ATTEMPTING TO OVERTHROW PRESIDENT ABDEL FATAH EL-SISI'S GOVERNMENT.
http://amp.timeinc.net/time/4617295/china-smog-smoking-environment-air-pollution/?source=dam,General,24/12/2016-06:30:10,"CHINA’S SMOG MAY BE RESPONSIBLE FOR 1 IN 3 DEATHS IN THE COUNTRY, NEW RESEARCH SUGGESTS"
http://www.seattletimes.com/seattle-news/environment/another-puget-sound-killer-whale-dies-5th-in-past-year/,General,24/12/2016-06:30:10,ANOTHER PUGET SOUND ORCA DIES — 5TH IN A YEAR
http://www.cbc.ca/news/canada/montreal/dog-meat-montreal-saved-1.3910596,General,24/12/2016-06:30:10,"SAVED FROM DOG MEAT FESTIVAL, 37 DOGS EN ROUTE TO MONTREAL"
http://www.cantonrep.com/news/20161221/stark-man-guilty-of-tainting-womans-orange-juice,General,24/12/2016-06:30:10,MAN MASTURBATES IN WOMAN'S BOTTLE OF ORANGE JUICE. CAUGHT ON SECURITY CAMERA.
http://www.digitaltrends.com/cars/uber-moves-autonomous-cars-to-az-news-details-quotes/,General,24/12/2016-06:30:10,UBER MOVES ITS SELF-DRIVING CARS TO ARIZONA TO ESCAPE CALIFORNIA REGULATORS
http://www.reloadpacks.com/new-moneypak-scam-impersonating-police-officers/,General,24/12/2016-06:30:10,NEW MONEYPAK SCAM INVOLVING IMPERSONATING REAL POLICE OFFICERS
http://bigstory.ap.org/article/35acbb4e1d334d35b4cc0db05be6dec8/alaskas-bogoslof-volcano-aleutian-islands-erupts-again,General,24/12/2016-06:30:10,ALASKA'S BOGOSLOF VOLCANO IN ALEUTIAN ISLANDS ERUPTS AGAIN
https://www.washingtonpost.com/news/to-your-health/wp/2016/12/22/can-a-hearing-test-identify-a-concussion/,General,24/12/2016-06:30:10,A HEARING TEST MAY BE ABLE TO IDENTIFY A CONCUSSION
https://www.washingtonpost.com/local/public-safety/a-street-sale-of-jordan-shoes-erupts-in-gunfire/2016/11/16/ab866814-ac0d-11e6-a31b-4b6397e625d0_story.html?utm_term=.adf0a6ed1884,General,24/12/2016-06:30:10,A STREET SALE OF JORDAN SHOES ERUPTS IN GUNFIRE
http://nbc4i.com/2016/12/23/cleveland-police-officers-2-year-old-son-dies-after-shooting-himself/,General,24/12/2016-06:30:10,CLEVELAND POLICE OFFICER'S 2-YEAR-OLD SON DIES AFTER REPORTEDLY SHOOTING HIMSELF WITH FATHER’S SERVICE WEAPON
https://www.thelocal.de/20161223/live-police-believe-suspect-amri-still-in-berlin-report,General,24/12/2016-06:30:10,ISIS RELEASE VIDEO OF ANIS AMRI SWEARING THEM HIS ALLEGIANCE
http://www.belfasttelegraph.co.uk/news/world-news/black-man-daryl-davis-convinces-200-ku-klux-klansmen-to-leave-white-supremacist-group-by-befriending-them-35315250.html,General,24/12/2016-06:30:10,BLACK MAN DARYL DAVIS CONVINCES 200 KU KLUX KLANSMEN TO LEAVE WHITE SUPREMACIST GROUP BY BEFRIENDING THEM
http://www.msn.com/en-us/money/markets/meet-the-chinese-billionaire-whos-moving-manufacturing-to-the-us-to-cut-costs/ar-BBxr39m?li=BBmkt5R&ocid=spartandhp,General,24/12/2016-06:30:10,MEET THE CHINESE BILLIONAIRE WHO'S MOVING MANUFACTURING TO THE U.S. TO CUT COSTS
http://www.king5.com/tech/science/environment/drone-video-shows-orcas-killing-shark/376306698,General,24/12/2016-06:30:10,DRONE VIDEO SHOWS ORCAS KILLING SHARK
http://www.chron.com/news/us/article/The-Latest-Trucker-in-standoff-at-Missouri-rest-10815811.php,General,24/12/2016-06:30:12,THE LATEST: TRUCKER ARRESTED AFTER MISSOURI FREEWAY STANDOFF
http://www.nzherald.co.nz/world/news/article.cfm?c_id=2&objectid=11772679,General,24/12/2016-06:30:12,"RUSSIAN MAN DRIVES INTO AIRPORT, SAYS HE DID IT FOR LOVE"
http://www.usatoday.com/story/money/2016/12/21/mcdonalds-sued-because-extra-value-meal-41-cents-more/95697780/,General,24/12/2016-06:30:12,MCDONALD'S SUED BECAUSE 'EXTRA VALUE MEAL' IS 41 CENTS MORE
http://bigstory.ap.org/article/e07057c8e863431abf7472d8da0e11a0/after-online-threats-gaming-engineer-plans-run-congress,General,24/12/2016-06:30:12,"AFTER ONLINE THREATS, GAMING ENGINEER PLANS RUN FOR CONGRESS"
http://www.wdrb.com/story/34123704/cornbread-mafia-fugitive-found-in-canada-after-nearly-a-decade,General,24/12/2016-06:30:12,'CORNBREAD MAFIA' FUGITIVE FOUND IN CANADA AFTER NEARLY A DECADE
http://www.timesofmalta.com/articles/view/20161223/local/hijacked-libyan-plane-lands-in-malta.634664,General,24/12/2016-06:30:12,'HIJACKED' LIBYAN PLANE LANDS IN MALTA
http://www.reuters.com/article/us-usa-cyber-china-exclusive-idUSKBN14C1UJ?feedType=RSS&feedName=topNews&utm_source=twitter&utm_medium=Social,General,24/12/2016-06:30:12,"THE FBI IS INVESTIGATING HOW HACKERS INFILTRATED COMPUTERS AT THE FEDERAL DEPOSIT INSURANCE CORPORATION FOR SEVERAL YEARS BEGINNING IN 2010 IN A BREACH SENIOR FDIC OFFICIALS BELIEVE WAS SPONSORED BY CHINA'S MILITARY, PEOPLE WITH KNOWLEDGE OF THE MATTER SAID."
http://ktla.com/2016/12/23/husband-suspected-of-slitting-throats-of-wife-infant-son-at-texas-home-arrested-in-colorado/,General,24/12/2016-06:30:12,"HUSBAND SUSPECTED OF SLITTING THROATS OF WIFE, INFANT SON AT TEXAS HOME ARRESTED IN COLORADO"
http://arstechnica.com/science/2016/12/medical-marijuana-laws-linked-to-fewer-fatal-car-crashes/,General,24/12/2016-06:30:12,STATES THAT ENACT MEDICAL MARIJUANA LAWS SEE DIPS IN FATAL CAR CRASHES
http://www.cbc.ca/beta/news/canada/prince-edward-island/excavator-stops-driver-1.3910172,General,24/12/2016-06:30:12,"DRUNK DRIVER IN CANADA STOPPED BY MAN IN EXCAVATOR, HELD UNTIL POLICE ARRIVED"
http://www.cbc.ca/news/canada/newfoundland-labrador/stjohns-looks-for-more-cardboard-to-be-recycled-1.3909248,General,24/12/2016-06:30:12,"'TIS THE SEASON TO RECYCLE? ST. JOHN'S LAUNCHES #DEBOXINGDAY - NEWFOUNDLAND & LABRADOR, CANADA"
http://www.mlive.com/news/ann-arbor/index.ssf/2016/12/video_shows_drunken_driving_ar.html,General,24/12/2016-06:30:12,VIDEO SHOWS DRUNKEN-DRIVING ARREST OF WASHTENAW POLICE LIEUTENANT
https://www.engadget.com/2016/12/22/usa-foreign-travelers-social-media/,General,24/12/2016-06:30:12,US STARTS ASKING FOREIGN TRAVELERS FOR THEIR SOCIAL MEDIA INFO
http://www.chicagotribune.com/news/laquanmcdonald/ct-laquan-mcdonald-shooting-inspector-general-report-met-20161222-story.html,General,24/12/2016-06:30:12,"TOP POLICE BRASS DEFENDED LAQUAN MCDONALD SHOOTING AFTER SEEING VIDEO, RECORDS SHOW"
http://earthquake.usgs.gov/earthquakes/eventpage/us10007mbu#map,General,24/12/2016-06:30:12,"4.5 EARTHQUAKE IN CIMARRON, NEW MEXICO"
http://www.funorlife.com/2016/12/china-wants-to-know-indias-response-to.html,General,24/12/2016-06:30:12,CHINA WANTS TO KNOW INDIA'S RESPONSE TO PAKISTAN'S CPEC OFFER
http://woodtv.com/2016/12/23/gov-rick-snyder-signs-law-authorizing-michigan-wolf-hunting/,General,24/12/2016-06:30:12,GOV. RICK SNYDER SIGNS LAW AUTHORIZING MICHIGAN WOLF HUNTING
http://www.9news.com.au/national/2016/12/23/07/19/police-raids-underway-in-melbourne-suburb,General,24/12/2016-06:30:12,POLICE SAY THEY HAVE FOILED A TERROR PLOT LIKELY PLANNED FOR CHRISTMAS DAY IN MELBOURNE
http://www.ajc.com/news/national/man-kills-roommate-fight-over-chores-police-say/xX0lyZ2TADIImQ2eadWaZL/,General,24/12/2016-06:30:12,"MAN KILLS ROOMMATE IN FIGHT OVER CHORES, POLICE SAY"
http://ksnt.com/2016/12/23/parents-charged-with-shooting-heroin-in-walmart-parking-lot-with-2-kids-in-car/,General,24/12/2016-06:30:12,PARENTS CHARGED WITH SHOOTING HEROIN IN WALMART PARKING LOT WITH 2 KIDS IN CAR
http://www.foxnews.com/health/2016/12/23/oklahoma-mom-says-was-shamed-for-using-handicap-spot-while-carrying-disabled-son.html,General,24/12/2016-06:30:12,OKLAHOMA MOM SAYS SHE WAS SHAMED FOR USING HANDICAP SPOT WHILE CARRYING DISABLED SON
http://www.nbcnews.com/news/weather/vikings-plane-slides-runway-ice-washington-amid-holiday-winter-blast-n699721,General,24/12/2016-06:30:12,"VIKINGS PLANE SLIDES OFF RUNWAY, ICE IN WEST AMID HOLIDAY WINTER BLAST"
http://www.independent.co.uk/news/100-migrants-drown-italy-death-toll-united-nations-highest-ever-a7493206.html,General,24/12/2016-06:30:12,"100 PEOPLE FEARED DEAD IN MEDITERRANEAN TAKING TOLL FOR 2016 TO 5,000 – THE HIGHEST EVER"
http://www.nytimes.com/2016/12/22/health/ebola-vaccine.html?_r=0,General,24/12/2016-06:30:12,NEW EBOLA VACCINE GIVES 100 PERCENT PROTECTION
http://www.essex-fire.gov.uk/incidents/i6422/#585e359b33e06,General,24/12/2016-06:30:12,FATAL HOUSE FIRE - A REMINDER TO OTHERS TAKE CARE WITH CANDLES THIS TIME OF YEAR.
https://financialtribune.com/articles/economy-business-and-markets/56003/private-sector-integral-to-sustainable-economic-growth,General,24/12/2016-06:30:15,PRIVATE SECTOR INTEGRAL TO SUSTAINABLE ECONOMIC GROWTH
http://www.wbrz.com/news/terrebonne-substitute-teacher-arrested-for-having-sex-with-teens,General,24/12/2016-06:30:15,TERREBONNE SUBSTITUTE TEACHER ARRESTED FOR HAVING SEX WITH TEENS
http://mainichi.jp/english/articles/20161223/p2a/00m/0na/006000c,General,24/12/2016-06:30:15,"OVER 5,000 TEACHERS IN JAPAN TOOK SICK LEAVE FOR MENTAL ILLNESS IN 2015 SCHOOL YEAR"
http://www.theglobeandmail.com/report-on-business/canadian-economy-shrank-03-per-cent-in-october/article33421218/,General,24/12/2016-06:30:15,CANADA’S ECONOMY CONTRACTS ON WEAKEST FACTORY OUTPUT SINCE 2013
http://www.usatoday.com/story/news/2016/12/22/retailers-reporting-strong-marijuana-sales-holidays/95762702/,General,24/12/2016-06:30:15,RETAILERS REPORTING STRONG MARIJUANA SALES FOR THE HOLIDAYS
http://ktla.com/2016/12/23/norcal-gas-station-employee-burned-alive-at-work-in-brutal-attack-assailant-sought/,General,24/12/2016-06:30:15,NORCAL GAS STATION EMPLOYEE BURNED ALIVE AT WORK IN BRUTAL ATTACK; ASSAILANT SOUGHT
https://www.yahoo.com/news/teddy-bear-takes-detroit-airport-adventure-being-found-165438396.html,General,24/12/2016-06:30:15,TEDDY BEAR TAKES DETROIT AIRPORT ADVENTURE AFTER BEING FOUND
http://www.reuters.com/investigates/special-report/usa-bodybrokers-industry/,General,24/12/2016-06:30:15,HOW A GREAT-GRANDMOTHER’S BODY CAME TO BE USED IN AN ARMY BLAST TEST
http://www.wsbtv.com/news/trending-now/church-facing-12000-fine-for-letting-homeless-people-sleep-on-property_/477981262,General,24/12/2016-06:30:15,"CHURCH FACING $12,000 FINE FOR LETTING HOMELESS PEOPLE SLEEP ON PROPERTY."
http://www.9news.com/mb/life/pets/shelter-staff-celebrates-empty-kennels-after-successful-adoptions/374187601,General,24/12/2016-06:30:15,SHELTER STAFF CELEBRATES EMPTY KENNELS AFTER SUCCESSFUL ADOPTIONS
http://www.fox2detroit.com/news/local-news/225288983-story?utm_source=dlvr.it&utm_medium=twitter,General,24/12/2016-06:30:15,"POLICE: WOMAN BEATS SONS, 9 AND 7, FOR OPENING CHRISTMAS GIFTS EARLY"
https://www.cnet.com/news/galaxy-note-7-wi-fi-hotspot-virgin-america-flight-lucas-wojciechowski/,General,24/12/2016-06:30:15,GALAXY NOTE 7 HOTSPOT NAME FREAKS OUT A FLIGHT
http://www.bbc.co.uk/news/uk-38386088,General,24/12/2016-06:30:15,"ROUGH SLEEPERS 'URINATED ON' BY PUBLIC, SURVEY FINDS - BBC NEWS."
http://www.reuters.com/article/us-usa-trump-passenger-idUSKBN14B25I,General,24/12/2016-06:30:15,PASSENGER REMOVED FROM FLIGHT AFTER CONFRONTATION WITH IVANKA TRUMP.
http://www.independent.co.uk/arts-entertainment/music/tis-the-season-christmas-carols-google-doodle-holidays-2016-tradition-caroling-eve-day-a7491216.html,General,24/12/2016-06:30:15,TIS THE SEASON: WHERE OUR FAVOURITE CHRISTMAS CAROLS COME FROM
https://www.theguardian.com/us-news/2016/dec/22/texas-mother-daughter-arrest-fort-worth-jacqueline-craig,General,24/12/2016-06:30:15,MOTHER AND DAUGHTER WHO REPORT CHILD'S ASSAULT ARE AGGRESSIVELY ARRESTED ON TAPE
http://www.nytimes.com/2016/12/23/health/cancer-trials-immunotherapy.html,General,24/12/2016-06:30:15,"IN CANCER TRIALS, MINORITIES FACE EXTRA HURDLES"
http://porashuna.net/jsc-result-2016-bangladesh/,General,24/12/2016-06:30:15,JSC RESULT 2016 WILL BE PUBLISHED WITHIN FEW DAYS
https://www.hrw.org/news/2016/12/23/yemen-brazil-made-cluster-munitions-harm-civilians,General,24/12/2016-06:30:15,YEMEN: BRAZIL-MADE CLUSTER MUNITIONS HARM CIVILIANS
http://www.foxnews.com/world/2016/12/22/2-american-hikers-find-black-box-1985-plane-crash-in-bolivia-hand-it-to-ntsb.html,General,24/12/2016-06:30:15,"2 AMERICAN HIKERS FIND BLACK BOX OF 1985 PLANE CRASH IN BOLIVIA, HAND IT TO NTSB"
http://www.independent.co.uk/news/world/americas/las-vegas-is-now-completely-powered-by-renewable-energy-a7491321.html,General,24/12/2016-06:30:15,LAS VEGAS IS NOW COMPLETELY POWERED BY RENEWABLE ENERGY
http://www.independent.co.uk/news/uk/crime/police-officer-sex-rape-victim-mcdonalds-toilet-charlotte-peters-london-protection-assign-a7489926.html,General,24/12/2016-06:30:15,POLICE OFFICER WHO HAD SEX WITH RAPE VICTIM IN MCDONALD'S TOILET IS JAILED
http://www.straitstimes.com/asia/east-asia/villager-in-china-uses-grenade-to-crack-open-walnuts-for-25-years,General,24/12/2016-06:30:15,VILLAGER IN CHINA USES GRENADE TO CRACK OPEN WALNUTS FOR 25 YEARS
http://www.wisn.com/article/milwaukee-man-accused-of-stockpiling-weapons-in-suburbs/8526691,General,24/12/2016-06:30:15,MILWAUKEE MAN ACCUSED OF STOCKPILING WEAPONS IN SUBURBS
http://www.bbc.com/news/uk-england-oxfordshire-38420960,General,24/12/2016-06:30:15,POLISH WOMAN ACCUSED OF CONTEMPT OF COURT GIVEN CHRISTMAS REPRIEVE
http://www.funorlife.com/2016/12/security-for-pakistani-team-beefed-up.html,General,24/12/2016-06:30:17,SECURITY OF PAKISTAN CRICKET TEAM AND MELBOURNE STADIUM HAS BEEN TIGHTENED
http://www.wifr.com/content/news/Roscoe-boys-unusual-Christmas-wish-catches-the-attention-of-Gustafsons-Furniture-407974845.html,General,24/12/2016-06:30:17,AUTISTIC ROSCOE BOY'S UNUSUAL CHRISTMAS WISH CATCHES THE ATTENTION OF GUSTAFSON'S FURNITURE
https://www.theguardian.com/technology/2016/dec/21/oracle-executive-resigns-ceo-safra-catz-donald-trump,General,24/12/2016-06:30:17,ORACLE EXECUTIVE PUBLICLY RESIGNS AFTER CEO JOINS TRUMP'S TRANSITION TEAM
https://www.bloomberg.com/news/videos/2016-12-23/shkreli-price-increase-has-stuck-happy-with-that,General,24/12/2016-06:30:17,"SHKRELI: PRICE INCREASE HAS STUCK, HAPPY WITH THAT"
http://www.walesonline.co.uk/news/wales-news/arsonists-devastate-allotment-site-run-12364453,General,24/12/2016-06:30:17,ARSONISTS DEVASTATE ALLOTMENT SITE RUN BY PEOPLE WITH LEARNING NEEDS
http://www.wgal.com/article/family-of-bears-killed-in-pa-after-eating-poisonous-plant/8531790,General,24/12/2016-06:30:17,FAMILY OF BEARS KILLED IN PA. AFTER EATING POISONOUS PLANT
http://www.cbc.ca/news/canada/calgary/calgary-daniel-boria-balloon-man-plea-1.3908793,General,24/12/2016-06:30:17,MAN WHO FLEW OVER CALGARY ON A LAWN CHAIR TIED TO 120 BALLOONS FOUND GUILTY
https://www.theguardian.com/us-news/2016/dec/22/california-police-kern-county-investigation-kamala-harris,General,24/12/2016-06:30:17,TWO 'DEADLIEST' POLICE DEPARTMENTS IN US TO BE INVESTIGATED IN CALIFORNIA
http://www.telegraph.co.uk/news/2016/12/22/sexoffenderbanned-approaching-women-life/,General,24/12/2016-06:30:17,SEX OFFENDER BANNED FROM APPROACHING WOMEN FOR LIFE
http://www.fox4news.com/news/225061979-story,General,24/12/2016-06:30:17,FORT WORTH WOMAN BEING ARRESTED AFTER CALLING POLICE TO REPORT THAT A MAN HAD CHOKED HER 7-YEAR-OLD SON
https://www.bloomberg.com/news/articles/2016-12-23/xi-said-to-express-openness-to-growth-below-6-5-as-debt-climbs-ix1qz3tz,General,24/12/2016-06:30:17,PRESIDENT XI OPEN TO GROWTH IN CHINA FALLING BELOW 6.5%
http://www.nbcnews.com/news/us-news/white-texas-cop-s-arrest-three-black-women-appears-racist-n699416,General,24/12/2016-06:30:17,WHITE TEXAS COP'S ARREST OF THREE BLACK WOMEN APPEARS RACIST: LAWYER
http://www.aljazeera.com/news/2016/12/isil-burns-turkish-soldiers-alive-shocking-video-161223035619947.html,General,24/12/2016-06:30:17,ISIL VIDEO SHOWS 'TURKISH SOLDIERS BURNED ALIVE'
http://www.independent.co.uk/news/world/europe/drunk-driver-car-thruough-russia-airport-terminal-kazan-international-a7491951.html,General,24/12/2016-06:30:17,DRUNK MAN DRIVES CAR THROUGH RUSSIAN AIRPORT TERMINAL
http://www.courant.com/community/manchester/hc-manchester-school-slide-1215-20161214-story.html,General,24/12/2016-06:30:17,RIFT OVER PLANNED INDOOR SLIDE AT ELEMENTARY SCHOOL
http://www.nbcchicago.com/news/local/Something-Terrible-is-Going-to-Happen-Police-Investigate-After-Cards-Found-on-Hundreds-of-Cars-in-Chicago-Suburbs-407965345.html?_osource=SocialFlowFB_CHBrand,General,24/12/2016-06:30:17,'SOMETHING TERRIBLE IS GOING TO HAPPEN': POLICE INVESTIGATE AFTER CARDS FOUND ON HUNDREDS OF CARS IN CHICAGO SUBURBS
http://www.timesofisrael.com/fatah-uses-facebook-to-celebrate-murders-of-over-100-israelis/,General,24/12/2016-06:30:17,FATAH TAKES TO FACEBOOK TO CELEBRATE MURDERS OF OVER 100 ISRAELIS
http://www.calgarysun.com/2016/12/22/pennsylvania-man-89-heads-out-to-store-ends-up-in-alabama,General,24/12/2016-06:30:17,"PENNSYLVANIA MAN, 89, HEADS OUT TO STORE, ENDS UP IN ALABAMA"
https://www.theguardian.com/us-news/2016/dec/22/robber-freed-90-years-early-by-mistake-says-he-reformed-while-free,General,24/12/2016-06:30:17,"A ROBBER SENT BACK TO PRISON AFTER BEING MISTAKENLY RELEASED EIGHT YEARS INTO HIS 98-YEAR SENTENCE ASKED A JUDGE ON WEDNESDAY TO SET HIM FREE AGAIN, ARGUING HE HAD STARTED A FAMILY, GOT A STEADY JOB AND REFORMED HIMSELF"
http://www.chicagotribune.com/news/nationworld/midwest/ct-wisconsin-dells-water-slide-death-20161222-story.html,General,24/12/2016-06:30:17,BOY DIES AFTER FALL FROM WATER SLIDE IN WISCONSIN DELLS AREA
http://www.cnn.com/2016/12/22/us/fort-worth-police-facebook/index.html,General,24/12/2016-06:30:17,FORT WORTH POLICE INVESTIGATE ARREST CAUGHT ON VIDEO
http://reuters.com/article/idINKBN14C1VZ,General,24/12/2016-06:30:17,FBI PROBES FDIC HACK LINKED TO CHINA'S MILITARY - SOURCES
http://www.bbc.com/news/education-38392802,General,24/12/2016-06:30:17,"FACEBOOK LURKING MAKES YOU MISERABLE, SAYS STUDY"
http://www.bbc.com/news/world-africa-38414060,General,24/12/2016-06:30:17,SUCCESSFUL EBOLA VACCINE WILL BE FAST-TRACKED FOR USE
http://www.fox2detroit.com/news/local-news/225066115-story,General,24/12/2016-06:30:17,NFL PLAYER ADOPTS FAMILY OF FALLEN POLICE OFFICER FOR CHRISTMAS.
http://www.bbc.co.uk/news/world-europe-38416112,General,24/12/2016-06:30:19,LIBYAN PLANE IN 'POTENTIAL HIJACK'
http://www.cnbc.com/2016/12/23/consumer-sentiment-reports-for-december-2016.html,General,24/12/2016-06:30:19,CONSUMER SENTIMENT REPORTS FOR DECEMBER 2016
http://www.reuters.com/article/us-health-birdflu-china-idUSKBN14C0CX,General,24/12/2016-06:30:19,CHINA REPORTS FIRST TWO HUMAN DEATHS FROM BIRD FLU THIS WINTER
http://www.kare11.com/news/9th-dui-gets-woman-5-years-in-prison/376805722,General,24/12/2016-06:30:19,9TH DUI GETS WOMAN 5 YEARS IN PRISON
