url,type,timeretrieved,title
http://www.wsj.com/articles/u-s-sues-barclays-over-mortgage-securities-in-rare-step-1482437193,General,25/12/2016-12:30:32,U.S. SUES BARCLAYS OVER TOXIC MORTGAGE-BACKED SECURITIES
http://www.wralsportsfan.com/duke-s-allen-says-no-excuse-for-3rd-trip-in-past-year/16361941/,General,25/12/2016-12:30:32,DUKE GIVES ALLEN INDEFINITE SUSPENSION FROM TEAM AFTER TRIP
http://www.foxnews.com/us/2016/12/22/police-private-investigator-shoots-teen-displaying-fake-gun.html,General,25/12/2016-12:30:32,POLICE: PRIVATE INVESTIGATOR SHOOTS TEEN DISPLAYING FAKE GUN
http://www.france24.com/en/20161221-france-police-greater-freedom-guns-security,General,25/12/2016-12:30:32,FRANCE PUSHES TO GIVE POLICE GREATER FREEDOM TO USE THEIR GUNS
https://www.bloomberg.com/news/articles/2016-12-22/u-s-economic-growth-revised-up-to-3-5-pace-in-third-quarter,General,25/12/2016-12:30:32,U.S. ECONOMIC GROWTH REVISED UP TO 3.5% PACE IN THIRD QUARTER
http://www.nytimes.com/2016/12/21/us/north-carolina-fails-to-repeal-bathroom-law-that-prompted-boycotts.html?_r=0,General,25/12/2016-12:30:32,NORTH CAROLINA FAILS TO REPEAL BATHROOM LAW THAT PROMPTED BOYCOTTS
http://www.startribune.com/chiropractors-charged-with-insurance-fraud/407806046/,General,25/12/2016-12:30:32,MINNESOTA CHIROPRACTORS CHARGED WITH 'SIMPLE BUT WIDESPREAD' INSURANCE FRAUD
http://www.wsj.com/articles/percentage-of-young-americans-living-with-parents-rises-to-75-year-high-1482316203,General,25/12/2016-12:30:32,PERCENTAGE OF YOUNG AMERICANS LIVING WITH PARENTS RISES TO 75-YEAR HIGH
