url,type,timeretrieved,title
http://www.mcclatchydc.com/news/nation-world/national/national-security/article122259174.html,General,24/12/2016-06:30:19,POLICE USE OF CELL-TOWER SIMULATOR TRACKING DEVICES DRAWS CONCERN
http://www.bbc.co.uk/news/world-us-canada-38410027,General,24/12/2016-06:30:19,BBC NEWS: TRUMP WANTS EXPANDED NUCLEAR CAPABILITY
http://wfla.com/2016/12/21/pinellas-veteran-claims-40-year-cover-up-by-u-s-a-f/,General,24/12/2016-06:30:19,SCOTT NELMS CLAIMS A 40-YEAR COVER UP BY THE AIR FORCE MAY HAVE COST VETERANS AND THEIR FAMILIES DEARLY. NELMS SAID THE USAF SPRAYED SIGNIFICANT AMOUNTS OF THE TOXIC DEFOLIANT AGENT ORANGE AT BASES IN THAILAND.
http://www.msn.com/en-us/travel/news/delta-air-lines-changes-policy-after-black-doctor-was-stopped-from-helping-on-flight/ar-BBxpnUF?li=BBmkt5R&ocid=spartanntp_edu,General,24/12/2016-06:30:19,DELTA AIR LINES CHANGES POLICY AFTER BLACK DOCTOR WAS STOPPED FROM HELPING ON FLIGHT
http://www.independent.co.uk/news/people/barack-obama-prank-white-house-snowman-fear-phobia-instagram-photos-a7490796.html,General,24/12/2016-06:30:19,BARACK OBAMA PRANKED BY WHITE HOUSE STAFF OVER SNOWMAN FEARS
http://www.military.com/daily-news/2016/12/20/ecstasy-one-step-closer-approval-ptsd-treatment.html?ESRC=eb_161221.nl,General,24/12/2016-06:30:19,ECSTASY ONE STEP CLOSER TO APPROVAL AS PTSD TREATMENT
http://www.cbc.ca/news/canada/nova-scotia/human-trafficking-nova-scotia-gibson-skeir-threat-halifax-court-1.3907219,General,24/12/2016-06:30:19,HUMAN TRAFFICKER ARRESTED AND CHARGED. THREATENS 14 YEAR OLD VICTIM WHILE EXITING COURT
http://www.telegraph.co.uk/news/2016/12/23/three-british-airways-passengers-treated-like-rock-stars-found/,General,24/12/2016-06:30:19,THREE BRITISH AIRWAYS PASSENGERS TREATED LIKE 'ROCK STARS' WHEN THEY FOUND THEY WERE THE ONLY PEOPLE ON BOARD THEIR FLIGHT
http://www.mlive.com/news/grand-rapids/index.ssf/2016/12/he_terrified_a_lot_of_people_w.html,General,24/12/2016-06:30:19,"'HE TERRIFIED A LOT OF PEOPLE:' WITNESS WONDERS WHY FBI AGENT WAVED GUN, SHOT AT COPS"
http://www.cbc.ca/beta/news/canada/windsor/serial-animal-killer-london-1.3909757,General,24/12/2016-06:30:19,"ANIMAL SERIAL KILLER ON HE LOOSE IN LONDON, ONTARIO."
https://www.engadget.com/2016/12/22/peter-thiels-startup-helps-authorities-track-illegal-immigrant/,General,24/12/2016-06:30:19,PETER THIEL'S STARTUP HELPS AUTHORITIES TRACK ILLEGAL IMMIGRANTS
http://www.nbcnews.com/news/us-news/congress-calls-edward-snowden-liar-new-report-n699121,General,24/12/2016-06:30:19,CONGRESS REPORT CALLS SNOWDEN A LIAR WHO'S IN TOUCH WITH RUSSIAN SPIES
http://www.usatoday.com/story/money/cars/2016/12/22/volkswagen-group-3-liter-diesel-scandal-settlement-substantial/95711452/,General,24/12/2016-06:30:19,JUDGE WARNS VW OWNERS NOT TO STRIP DIESEL CARS FOR BUYBACKS
http://www.nytimes.com/2016/12/22/nyregion/obama-to-dismantle-visitor-registry-before-trump-can-revive-it.html,General,24/12/2016-06:30:19,OBAMA TO DISMANTLE VISITOR REGISTRY BEFORE TRUMP CAN REVIVE IT
https://www.justice.gov/usao-edny/pr/odebrecht-and-braskem-plead-guilty-and-agree-pay-least-35-billion-global-criminal,General,24/12/2016-06:30:19,ODEBRECHT AND BRASKEM PLEAD GUILTY AND AGREE TO PAY AT LEAST $3.5 BILLION IN GLOBAL CRIMINAL PENALTIES TO RESOLVE LARGEST FOREIGN BRIBERY CASE IN HISTORY
https://www.theguardian.com/world/2016/dec/23/german-police-arrest-men-alleged-shopping-centre-plot-oberhausen,General,24/12/2016-06:30:19,GERMAN POLICE ARREST TWO MEN OVER ALLEGED PLOT TO ATTACK SHOPPING CENTRE
http://turnto10.com/news/local/man-orders-gift-from-amazon-for-child-receives-sex-toy-instead,General,24/12/2016-06:30:19,"MAN ORDERS GIFTS FROM AMAZON FOR CHILDREN, SAYS HE RECEIVES SEX TOYS INSTEAD"
https://www.airforcetimes.com/articles/air-force-track-review,General,24/12/2016-06:30:19,AIR FORCE FINDS 17 BASES HAVE TOO-LONG PT TRACKS; PROMISES REMEDY FOR WRONGFUL FAILURES
http://www.reuters.com/investigates/special-report/usa-uncounted-outbreaks/,General,24/12/2016-06:30:19,"HOW HOSPITALS, NURSING HOMES KEEP DEADLY 'SUPERBUG' OUTBREAKS SECRET"
http://www.bbc.co.uk/news/health-38392548,General,24/12/2016-06:30:19,MULTIPLE SCLEROSIS DRUG 'A LANDMARK'
http://www.kwch.com/content/news/Body-cam-video-shows--407962085.html,General,24/12/2016-06:30:19,VIDEO SHOWS DEPUTY USE TASER ON MAN AT NURSING HOME
https://apnews.com/4e14f73be8df4caf90643cd2d757054c/Arrest-in-'Vote-Trump'-burning-of-Mississippi-black-church,General,24/12/2016-06:30:21,ARREST IN 'VOTE TRUMP' BURNING OF MISSISSIPPI BLACK CHURCH
http://www.msn.com/en-us/news/other/stray-dog-found-carrying-child-remains-in-mouth/ar-BBxo9Wk?ocid=spartandhp,General,24/12/2016-06:30:21,STRAY DOG FOUND CARRYING CHILD REMAINS IN MOUTH
http://www.reuters.com/article/2016/12/22/us-barclays-mortgages-idUSKBN14B29A?utm_source=applenews,General,24/12/2016-06:30:21,U.S. SUES BARCLAYS FOR MORTGAGE SECURITIES FRAUD
http://www.fox16.com/news/local-news/breakingarrest-made-in-death-of-three-year-old-acen-king/630504745,General,24/12/2016-06:30:21,"ARREST MADE IN DEATH OF THREE-YEAR-OLD, ACEN KING"
http://www.bbc.com/news/world/europe,General,24/12/2016-06:30:21,GERMANY ARRESTS TWO ON TERROR CHARGES
http://www.telegraph.co.uk/money/consumer-affairs/whirlpool-dryer-scandal-watchdogs-face-legal-action-failures/,General,24/12/2016-06:30:21,WHIRLPOOL DRYER SCANDAL: WATCHDOGS FACE LEGAL ACTION OVER 'FAILURES'
https://www.washingtonpost.com/news/post-nation/wp/2016/12/22/a-black-mother-told-police-a-white-man-assaulted-her-child-they-arrested-her-instead/?utm_term=.5cbae98b766e,General,24/12/2016-06:30:21,A BLACK MOTHER TOLD POLICE A WHITE MAN ASSAULTED HER CHILD. THEY ARRESTED HER INSTEAD.
https://endpts.com/the-senate-autopsies-martin-shkrelis-scheme-to-grab-a-1b-windfall/,General,24/12/2016-06:30:21,THE SENATE AUTOPSIES MARTIN SHKRELI’S SCHEME TO GRAB A $1B WINDFALL
http://www.nbcnewyork.com/news/national-international/Austin-Man-Fatally-Stabs-Stepmom-Gloating-About-Cowboys-Win-407823115.html,General,24/12/2016-06:30:21,WOMAN KILLED AFTER 'GLOATING' OVER COWBOYS' WIN: POLICE
http://www.kansascity.com/news/local/article122430344.html,General,24/12/2016-06:30:21,"THREATS, BULLYING HIT FAMILY OF KC TRANSGENDER GIRL ON COVER OF NATIONAL GEOGRAPHIC."
http://www.star-telegram.com/news/local/community/fort-worth/article122405439.html,General,24/12/2016-06:30:21,"FORT WORTH POLICE ARREST WOMEN AFTER UGLY CONFRONTATION, WHICH WAS CAUGHT ON VIDEO"
http://montreal.ctvnews.ca/spca-will-stop-accepting-montreal-dogs-this-spring-1.3214263,General,24/12/2016-06:30:21,SPCA WILL STOP ACCEPTING MONTREAL DOGS THIS SPRING
http://abcnews.go.com/International/wireStory/authorities-godfather-grass-arrested-canada-44357946,General,24/12/2016-06:30:21,AUTHORITIES: 'GODFATHER OF GRASS' ARRESTED IN CANADA
http://abcnews.go.com/Health/wireStory/pope-denounces-resistance-reform-christmas-greeting-44341665,General,24/12/2016-06:30:21,POPE IN CHRISTMAS SPEECH BLASTS VATICAN RESISTANCE TO REFORM
http://www.wsj.com/articles/u-s-sues-barclays-over-mortgage-securities-in-rare-step-1482437193,General,24/12/2016-06:30:21,U.S. SUES BARCLAYS OVER TOXIC MORTGAGE-BACKED SECURITIES
http://www.wralsportsfan.com/duke-s-allen-says-no-excuse-for-3rd-trip-in-past-year/16361941/,General,24/12/2016-06:30:21,DUKE GIVES ALLEN INDEFINITE SUSPENSION FROM TEAM AFTER TRIP
http://www.foxnews.com/us/2016/12/22/police-private-investigator-shoots-teen-displaying-fake-gun.html,General,24/12/2016-06:30:21,POLICE: PRIVATE INVESTIGATOR SHOOTS TEEN DISPLAYING FAKE GUN
https://kominactie.3fm.nl/actie/lak-aan,General,24/12/2016-06:30:21,SIX-YEAR-OLD TIJN IS TERMINALLY ILL AND WANTS TO RAISE AS MUCH MONEY AS POSSIBLE TO HELP OTHER CHILDREN
http://www.france24.com/en/20161221-france-police-greater-freedom-guns-security,General,24/12/2016-06:30:21,FRANCE PUSHES TO GIVE POLICE GREATER FREEDOM TO USE THEIR GUNS
https://www.bloomberg.com/news/articles/2016-12-22/u-s-economic-growth-revised-up-to-3-5-pace-in-third-quarter,General,24/12/2016-06:30:21,U.S. ECONOMIC GROWTH REVISED UP TO 3.5% PACE IN THIRD QUARTER
http://www.nytimes.com/2016/12/21/us/north-carolina-fails-to-repeal-bathroom-law-that-prompted-boycotts.html?_r=0,General,24/12/2016-06:30:21,NORTH CAROLINA FAILS TO REPEAL BATHROOM LAW THAT PROMPTED BOYCOTTS
http://www.wsj.com/articles/percentage-of-young-americans-living-with-parents-rises-to-75-year-high-1482316203,General,24/12/2016-06:30:21,PERCENTAGE OF YOUNG AMERICANS LIVING WITH PARENTS RISES TO 75-YEAR HIGH
http://www.startribune.com/chiropractors-charged-with-insurance-fraud/407806046/,General,24/12/2016-06:30:21,MINNESOTA CHIROPRACTORS CHARGED WITH 'SIMPLE BUT WIDESPREAD' INSURANCE FRAUD
http://reuters.com/article/idUSKBN14C041?utm_source=applenews,General,24/12/2016-06:30:21,DEUTSCHE BANK AGREES TO $7.2 BILLION MORTGAGE SETTLEMENT WITH U.S.
http://www.nytimes.com/aponline/2016/12/22/world/europe/ap-eu-germany-christmas-market-the-latest.html,General,24/12/2016-06:30:21,THE LATEST: BERLIN ATTACK SUSPECT REPORTED VIDEOED AT MOSQUE
http://www.dallasnews.com/news/crime/2016/12/22/arrest-video-sparks-debate-fort-worth-officer-detained-woman-daughter,General,24/12/2016-06:30:23,"ARREST VIDEO SPARKS OUTRAGE OVER HOW FORT WORTH OFFICER DETAINED WOMAN, DAUGHTER | CRIME"
http://www.clickondetroit.com/news/ann-arbor-police-womans-story-about-being-force-to-remove-hijab-did-not-occur,General,24/12/2016-06:30:23,ANN ARBOR POLICE: WOMAN'S STORY ABOUT BEING FORCED TO REMOVE HIJAB DID NOT OCCUR
https://www.yahoo.com/news/chicago-mayor-releases-1000s-emails-private-accounts-003422656--politics.html,General,24/12/2016-06:30:23,THE CITY OF CHICAGO RELEASED THOUSANDS OF EMAIL MESSAGES FROM MAYOR RAHM EMANUEL'S PERSONAL ACCOUNTS ON WEDNESDAY AS PART OF A SETTLEMENT WITH A GOVERNMENT WATCHDOG ORGANIZATION.
http://www.sfgate.com/crime/article/Pregnant-woman-held-face-down-by-BART-police-said-10812015.php,General,24/12/2016-06:30:23,WOMAN SAYS SHE SUFFERED MISCARRIAGE DUE TO EXCESSIVE USE OF FORCE BY BART POLICE
http://www.foxnews.com/health/2016/12/22/nurse-credited-with-saving-student-who-had-blood-clot-near-brain-stem.html?refresh=true,General,24/12/2016-06:30:23,NURSE CREDITED WITH SAVING STUDENT WHO HAD BLOOD CLOT NEAR BRAIN STEM
https://www.theguardian.com/uk-news/2016/dec/22/activist-can-sue-trump-golf-resort-for-breach-of-privacy-court-rules,General,24/12/2016-06:30:24,"ACTIVIST CAN SUE TRUMP GOLF RESORT FOR BREACH OF PRIVACY, COURT RULES | UK NEWS"
http://www.nytimes.com/2016/12/22/us/usa-population-growth.html?module=WatchingPortal&region=c-column-middle-span-region&pgType=Homepage&action=click&mediaId=thumb_square&state=standard&contentPlacement=1&version=internal&contentCollection=www.nytimes.com&contentId=http%3A%2F%2Fwww.nytimes.com%2F2016%2F12%2F22%2Fus%2Fusa-population-growth.html&eventName=Watching-article-click,General,24/12/2016-06:30:24,GROWTH OF U.S. POPULATION IS AT SLOWEST PACE SINCE 1937
http://www.orlandosentinel.com/news/breaking-news/os-rambo-gator-wins-20161222-story.html,General,24/12/2016-06:30:24,FLORIDA WOMAN PLANS MERRY CHRISTMAS AFTER WINNING RIGHT TO KEEP ALLIGATOR
http://www.usatoday.com/story/news/world/2016/12/22/islamic-state-urges-attacks-us-churches-during-holidays/95746982/,General,24/12/2016-06:30:24,ISIL ISSUES HIT LIST OF U.S. CHURCHES FOR HOLIDAY ATTACKS
http://www.npr.org/sections/goatsandsoda/2016/12/22/506600875/first-ebola-vaccine-likely-to-stop-the-next-outbreak,General,24/12/2016-06:30:24,FIRST EBOLA VACCINE LIKELY TO STOP THE NEXT OUTBREAK
https://www.theguardian.com/world/2016/dec/22/tsai-ing-wen-taiwan-president-us-visit-china-donald-trump,General,24/12/2016-06:30:24,TAIWAN'S PRESIDENT TO VISIT US DESPITE OBJECTIONS FROM CHINA | WORLD NEWS
http://abc7chicago.com/news/mall-elf-charged-after-spraying-family-with-mace/1668707/,General,24/12/2016-06:30:24,MALL ELF CHARGED AFTER SPRAYING FAMILY WITH MACE
http://www.bbc.co.uk/news/uk-england-38411140,General,24/12/2016-06:30:24,ANOTHER PRISON RIOT ONGOING IN KENT
http://www.wsj.com/graphics/1mdb-how-a-malaysian-scandal-spread-across-the-world/,General,24/12/2016-06:30:24,THE WOLF OF WALL STREET MOVIE WAS PARTIALLY FUNDED BY A MALAYSIAN GOVERNMENT SLUSH FUND.
https://www.yahoo.com/style/walmart-pulls-bulletproof-black-lives-matter-shirts-after-police-complain-184102650.html,General,24/12/2016-06:30:24,WALMART PULLS ‘BULLETPROOF: BLACK LIVES MATTER’ SHIRTS AFTER POLICE COMPLAIN
http://www.bbc.co.uk/news/world-africa-38382837,General,24/12/2016-06:30:24,"HUNDREDS OF KENYAN GIRLS ARE PREPARING TO SPEND CHRISTMAS IN SCHOOLS, RATHER THAN WITH THEIR FAMILIES, FEARING THAT THEIR PARENTS WILL FORCE THEM TO UNDERGO FEMALE GENITAL MUTILATION (FGM)."
http://www.npr.org/sections/thesalt/2016/12/21/506319408/soy-almond-coconut-if-its-not-from-a-cow-can-you-legally-call-it-milk,General,24/12/2016-06:30:24,"THE DAIRY INDUSTRY WANTS SOY/HEMP/ALMOND/ETC. MILK TO STOP CALLING THEIR PRODUCTS ""MILK."""
http://www.dispatch.com/content/stories/local/2016/12/20/gas-odor-reports.html,General,24/12/2016-06:30:24,"COLUMBUS, OHIO HAS A STRANGE SMELL LINGERING OVER IT AND NOBODY KNOWS WHERE ITS COMING FROM."
http://www.nbc15.com/content/news/A-boy-is-dead-after-falling-from-a-water-slide-at-Mt-Olympus-Water-Park-407893295.html,General,24/12/2016-06:30:24,FLORIDA TEEN DIES AFTER FALLING FROM A WATER SLIDE AT MT. OLYMPUS WATER PARK
https://article.wn.com/view/2016/12/22/Trove_of_child_rape_videos_found_at_exUSA_Gymnastics_doctor_/,General,24/12/2016-06:30:24,TROVE OF CHILD RAPE VIDEOS FOUND AT EX-USA GYMNASTICS DOCTOR’S HOME: FBI
https://www.washingtonpost.com/local/education/surge-in-foreign-students-might-be-crowding-americans-out-of-elite-colleges/2016/12/21/78d4b65c-b59d-11e6-a677-b608fbb3aaf6_story.html?hpid=hp_hp-top-table-main_foreignenroll-545pm%3Ahomepage%2Fstory&utm_term=.72030220ed76,General,24/12/2016-06:30:24,SURGE IN FOREIGN STUDENTS MAY BE CROWDING AMERICANS OUT OF ELITE COLLEGES
https://www.yahoo.com/tech/700-million-android-phones-spying-firmware-preinstalled-191804977.html,General,24/12/2016-06:30:24,700 MILLION ANDROID PHONES HAVE SPYING FIRMWARE PREINSTALLED
http://www.wafb.com/story/34107040/watch-live-la-to-become-first-state-to-give-body-cams-to-all-state-troopers,General,24/12/2016-06:30:24,LA. TO BECOME FIRST STATE TO GIVE BODY CAMS TO ALL STATE TROOPERS
http://kfor.com/2016/12/22/15-year-old-arrested-for-murder-in-garvin-county/,General,24/12/2016-06:30:24,15-YEAR-OLD ARRESTED FOR MURDER IN GARVIN COUNTY
http://www.independent.co.uk/news/world/americas/climate-change-children-lawsuit-allowed-washington-state-environment-protect-global-warming-a7488166.html,General,24/12/2016-06:30:24,JUDGE RULES SCHOOL CHILDREN CAN PURSUE CLIMATE CHANGE LAWSUIT AGAINST WASHINGTON STATE
http://abcnews.go.com/US/wireStory/53-puppies-die-transport-vehicle-southwest-missouri-44350675,General,24/12/2016-06:30:25,53 PUPPIES DIE IN TRANSPORT VEHICLE IN SOUTHWEST MISSOURI
http://www.npr.org/sections/thetwo-way/2016/12/22/506643217/mistrial-declared-in-corruption-case-against-former-l-a-sheriff-lee-baca,General,24/12/2016-06:30:25,MISTRIAL DECLARED IN CORRUPTION CASE AGAINST FORMER LA SHERIFF LEE BACA
http://www.wsfa.com/story/34099426/montgomery-police-woman-made-up-facebook-post-about-childs-death,General,24/12/2016-06:30:25,MONTGOMERY POLICE: WOMAN MADE UP FACEBOOK POST ABOUT CHILD'S DEATH
http://www.nbcnewyork.com/news/local/Manhattan-High-Rise-Fire-515-West-59-Street-New-York-City-407962925.html,General,24/12/2016-06:30:26,FIREFIGHTERS BATTLE BLAZE AT MANHATTAN HIGH-RISE BUILDING
https://www.bloomberg.com/news/articles/2016-12-22/u-s-mortgage-rates-jump-to-more-than-2-year-high-after-fed-hike,General,24/12/2016-06:30:26,U.S. MORTGAGE RATES JUMP TO MORE THAN 2-YEAR HIGH AFTER FED HIKE
https://www.yahoo.com/news/volkswagen-settles-owner-payouts-figures-still-secret-225744485--finance.html?ref=gs,General,24/12/2016-06:30:26,"VOLKSWAGEN SETTLES OWNER PAYOUTS, BUT FIGURES STILL SECRET"
http://www.marketwatch.com/story/sec-doj-fine-teva-pharmaceutical-519-million-to-settle-foreign-bribery-charges-2016-12-22,General,24/12/2016-06:30:26,"SEC, DOJ FINE TEVA PHARMACEUTICAL $519 MILLION TO SETTLE FOREIGN BRIBERY CHARGES"
http://www.reuters.com/article/us-mideast-crisis-syria-russia-shoigu-idUSKBN14B1AC,General,24/12/2016-06:30:26,"RUSSIA DEFENCE MINISTER SERGEI SHOIGU SAYS ITS AIR STRIKES IN SYRIA ""HAVE KILLED 35,000 REBELS"""
http://www.wafb.com/story/34116319/united-in-blue-fundraiser-nets-60k-for-families-of-baton-rouge-officers,General,24/12/2016-06:30:26,UNITED IN BLUE FUNDRAISER NETS $60K FOR FAMILIES OF BATON ROUGE OFFICERS
http://www.reuters.com/article/us-usa-snowden-idUSKBN14B1QB,General,24/12/2016-06:30:26,SNOWDEN STILL HAS CONTACTS WITH RUSSIAN INTELLIGENCE: U.S. HOUSE REPORT
http://www.nbcnews.com/news/latino/speak-english-you-re-america-woman-tells-latina-shoppers-rant-n698776,General,24/12/2016-06:30:26,"'SPEAK ENGLISH, YOU'RE IN AMERICA,' WOMAN TELLS LATINA SHOPPERS IN RANT CAUGHT ON CAMERA"
http://www.foxnews.com/us/2016/12/21/growing-list-post-election-hate-crimes-turn-out-to-be-hoaxes.html,General,24/12/2016-06:30:26,GROWING LIST OF POST-ELECTION 'HATE CRIMES' TURN OUT TO BE HOAXES
http://www.sfgate.com/business/article/Uber-sending-self-driving-cars-to-Arizona-10813886.php,General,24/12/2016-06:30:26,UBER SENDING SELF-DRIVING CARS TO ARIZONA
http://www.scpr.org/news/2016/12/22/67376/jury-deadlocks-on-obstruction-of-justice-case-agai/,General,24/12/2016-06:30:26,JURY DEADLOCKS ON OBSTRUCTION OF JUSTICE CASE AGAINST FORMER SHERIFF LEE BACA
http://www.reuters.com/article/us-health-birdflu-china-idUSKBN14B04R,General,24/12/2016-06:30:26,"CHINA CONFIRMS THIRD HUMAN BIRD FLU INFECTION, STIRS FEARS OF SPREAD"
https://www.yahoo.com/celebrity/retired-police-officer-charged-quadruple-200908772.html,General,24/12/2016-06:30:26,RETIRED POLICE OFFICER CHARGED WITH QUADRUPLE HOMICIDE IN ALLEGED DRUG DEAL GONE BAD
http://www.kvoa.com/story/34112056/border-patrol-find-marijuana-hidden-in-jam,General,24/12/2016-06:30:26,BORDER PATROL FIND MARIJUANA HIDDEN IN JAM
http://www.nbcnews.com/health/womens-health/texas-makes-new-move-cut-planned-parenthood-n698656,General,24/12/2016-06:30:26,TEXAS IS TRYING AGAIN TO CUT FUNDING TO PLANNED PARENTHOOD CLINICS
https://www.washingtonpost.com/news/acts-of-faith/wp/2016/12/21/i-will-always-put-my-faith-first-catholic-educator-fired-for-refusing-to-teach-birth-control/?utm_term=.e0265643aff9,General,24/12/2016-06:30:26,‘I WILL ALWAYS PUT MY FAITH FIRST’: CATHOLIC HEALTH EDUCATOR FIRED FOR REFUSING TO TEACH BIRTH CONTROL
