url,type,timeretrieved,title
http://www.amherstbulletin.com/With-state-legalization-begun-UMass-bans-pot-from-campus-7009781,General,25/12/2016-12:30:09,"WITH STATEWIDE LEGALIZATION, UMASS BANS MARIJUANA."
http://money.cnn.com/2016/10/26/pf/college/college-tuition-2016-2017/index.html?sr=fbCNN122516college-tuition-2016-20170400AMVODtopLink&linkId=32713241,General,25/12/2016-12:30:09,AVERAGE STATE COLLEGE TUITION ROSE 2.4% THIS YEAR
http://www.digitaljournal.com/news/world/huge-world-war-ii-bomb-forces-mass-evacuation-in-southern-germany/article/482317,General,25/12/2016-12:30:09,HUGE WORLD WAR 2 BOMB FORCES MASS EVACUATION IN SOUTHERN GERMANY
https://www.theguardian.com/us-news/2016/dec/25/blizzard-warning-western-us-north-dakota-south-dakota?CMP=oth_b-aplnews_d-1,General,25/12/2016-12:30:09,BLIZZARD CONDITIONS IN PARTS OF US MAKE TRAVEL 'VERY DANGEROUS IF NOT IMPOSSIBLE'
http://www.independent.co.uk/news/uk/crime/man-charged-deliberately-infecting-men-hiv-brighton-northumbria-scotland-sussex-a7495206.html,General,25/12/2016-12:30:09,MAN CHARGED WITH DELIBERATELY INFECTING MEN WITH HIV
https://www.adn.com/nation-world/2016/12/22/key-officials-switch-sides-from-dea-to-pharmaceutical-industry/,General,25/12/2016-12:30:09,KEY OFFICIALS SWITCH SIDES FROM DEA TO PHARMACEUTICAL INDUSTRY: THE HIRES CAME AFTER THE DEA LAUNCHED AN AGGRESSIVE CAMPAIGN TO CURB A RISING OPIOID EPIDEMIC THAT HAS RESULTED IN THOUSANDS OF OVERDOSE DEATHS EACH YEAR.
http://natives-today.com/2016/12/24/court-rules-police-can-shoot-your-dog-if-it-moves-or-barks/,General,25/12/2016-12:30:09,COURT RULES POLICE CAN SHOOT YOUR DOG IF IT “MOVES” OR “BARKS”
http://www.bangkokpost.com/news/asia/1167604/food-safety-still-poor-in-china,General,25/12/2016-12:30:09,"CHINA REPORTS 500,000 FOOD SAFETY VIOLATIONS IN 9 MONTHS"
http://www.nytimes.com/2016/12/24/world/asia/pearl-harbor-japan-shinzo-abe.html?hp&action=click&pgtype=Homepage&clickSource=story-heading&module=first-column-region&region=top-news&WT.nav=top-news&_r=0,General,25/12/2016-12:30:09,"IN PEARL HARBOR VISIT, A SYMBOL OF RECONCILIATION IN JAPAN"
https://www.washingtonpost.com/world/asia_pacific/chinas-1st-aircraft-carrier-heads-for-western-pacific/2016/12/25/23ec5a82-ca60-11e6-acda-59924caa2450_story.html?utm_term=.030001e1645d,General,25/12/2016-12:30:10,CHINA'S 1ST AIRCRAFT CARRIER HEADS FOR WESTERN PACIFIC
http://www.reuters.com/article/us-germany-truck-fundraising-idUSKBN14D0F5?feedType=RSS&feedName=topNews,General,25/12/2016-12:30:10,"CAMPAIGN RAISES $170,000 FOR FAMILY OF 'HEROIC' POLISH TRUCK DRIVER"
http://www.nytimes.com/2016/12/24/world/asia/pakistan-israel-khawaja-asif-fake-news-nuclear.html,General,25/12/2016-12:30:10,"READING FAKE NEWS, PAKISTANI MINISTER DIRECTS NUCLEAR THREAT AT ISRAEL"
http://money.cnn.com/2016/12/19/technology/china-elevated-bus-teb/index.html?sr=fbCNN122516china-elevated-bus-teb0430AMVODtopLink&linkId=32632378,General,25/12/2016-12:30:10,CHINA'S FAMOUS ELEVATED BUS IS NOW JUST A GIANT ROADBLOCK
http://www.bbc.co.uk/news/world-latin-america-38422022,General,25/12/2016-12:30:10,"OUTRAGE IN CHILE: TEN MEN, SERVING LONG SENTENCES FOR HUMAN RIGHTS ABUSES UNDER PINOCHET REIGN, ASKED FOR FORGIVENESS DURING A SPECIAL CHRISTMAS MASS HELD INSIDE THEIR JAIL. BUT CAMPAIGNERS SAID IF THEY WERE TRULY REPENTANT, THEY WOULD REVEAL WHERE SOME OF THEIR VICTIMS WERE BURIED."
http://www.cnn.com/2016/12/24/middleeast/iraq-bartella-christmas/index.html,General,25/12/2016-12:30:10,"""CHRISTMAS REBORN IN IRAQI TOWN FREED FROM ISIS"" (CNN)"
https://worldthenews.com/2016/12/russian-military-plane-crashes-black-sea-killing-92/29098,General,25/12/2016-12:30:10,RUSSIAN MILITARY PLANE CRASHES AND KILLING 92 PEOPLE
http://www.kcrg.com/content/news/Flooding-stopping-a-Shell-Rock-couple-from-being-home-for-the-holidays-408166025.html,General,25/12/2016-12:30:10,"FLOODING IN SHELL ROCK, IOWA"
http://www.reuters.com/article/us-israel-palestinians-un-idUSKBN14C1IV,General,25/12/2016-12:30:10,NETANYAHU SAYS ISRAEL TO RE-ASSESS ITS U.N. TIES AFTER SETTLEMENT RESOLUTION
http://www.cbsnews.com/news/baby-dies-in-bassinet-after-parents-suspected-drug-overdose-deaths-authorities-say/,General,25/12/2016-12:30:10,"BABY DIES IN BASSINET AFTER PARENTS' SUSPECTED DRUG OVERDOSE DEATHS, AUTHORITIES SAY"
http://www.foxnews.com/world/2016/12/24/after-nearly-year-detained-in-north-korea-little-progress-made-to-free-american-student-otto-warmbier.html,General,25/12/2016-12:30:10,"AFTER NEARLY A YEAR DETAINED IN NORTH KOREA, LITTLE PROGRESS MADE TO FREE AMERICAN STUDENT OTTO WARMBIER"
https://apnews.com/bee64677ffbf4d968b05692a0d86d877,General,25/12/2016-12:30:10,"NIGERIA: BOKO HARAM IS CRUSHED, FORCED OUT OF LAST ENCLAVE"
https://www.yahoo.com/tech/finnish-phone-app-finds-reindeer-helps-avoid-road-152712238.html,General,25/12/2016-12:30:10,"FINNISH PHONE APP FINDS REINDEER, HELPS TO AVOID ROAD KILL"
http://news.sky.com/story/extra-600000-in-line-for-superfast-broadband-under-government-scheme-10704635,General,25/12/2016-12:30:10,"EXTRA 600,000 IN LINE FOR SUPERFAST BROADBAND UNDER GOVERNMENT SCHEME"
http://www.foxnews.com/world/2016/12/24/nigeria-boko-haram-is-crushed-forced-out-last-enclave.html,General,25/12/2016-12:30:10,"NIGERIA: BOKO HARAM IS CRUSHED, FORCED OUT OF LAST ENCLAVE"
http://www.detroitnews.com/story/news/local/macomb-county/2016/12/24/sinkhole-mile-fraser-forces-evacuation/95826974/,General,25/12/2016-12:30:10,"SINKHOLE IN FRASER, MICHIGAN FORCES EVACUATION FROM HOMES ON CHRISTMAS EVE"
http://www.ajc.com/news/local/former-officer-sentenced-life-another-months-prison/UHYcVcYIa2pEGdprkJW85N/,General,25/12/2016-12:30:12,"FORMER OFFICER SENTENCED TO LIFE, ANOTHER TO 18 MONTHS IN PRISON"
http://www.timesofisrael.com/hamas-welcomes-un-vote-on-israel-settlements/,General,25/12/2016-12:30:12,"HAMAS WELCOMES UN VOTE ON ISRAEL SETTLEMENTS - ISLAMIC JIHAD ALSO CELEBRATES SECURITY COUNCIL RESOLUTION, SAYING IT WILL LEAD TO ISRAEL’S ‘ISOLATION’ AND ‘BOYCOTT’"
http://www.timesofisrael.com/pakistani-defense-minister-in-nuclear-threat-to-israel/,General,25/12/2016-12:30:12,"PAKISTAN MAKES NUCLEAR THREAT TO ISRAEL, IN RESPONSE TO FAKE NEWS"
http://reuters.com/article/idUSKBN14B1C8?utm_source=applenews,General,25/12/2016-12:30:12,U.S. PARENTS ACCEPT CHILDREN'S TRANSGENDER IDENTITY BY AGE THREE
http://www.bbc.com/news/world-europe-38427411,General,25/12/2016-12:30:12,"VESNA VULOVIC, STEWARDESS WHO SURVIVED 33,000FT FALL, DIES"
https://www.theguardian.com/uk-news/2016/dec/25/queen-uses-christmas-message-to-urge-britons-to-take-a-deep-breath,General,25/12/2016-12:30:12,QUEEN USES CHRISTMAS MESSAGE TO URGE BRITONS TO 'TAKE A DEEP BREATH' | UK NEWS
http://www.abc15.com/news/region-southeast-valley/chandler/deputy-finds-dog-shot-in-middle-of-the-road-pays-for-surgery,General,25/12/2016-12:30:12,MARICOPA DEPUTY SAVES PIT BULL'S LIFE TWICE
http://abcnews.go.com/US/early-christmas-gift-baby-delivered-roadside-state-trooper/story?id=44386525,General,25/12/2016-12:30:12,EARLY CHRISTMAS GIFT: BABY DELIVERED ROADSIDE BY STATE TROOPER
http://www.wsj.com/articles/chinese-prosecutors-drop-negligence-charges-against-police-officers-in-death-of-man-1482504714,General,25/12/2016-12:30:12,CHINESE PROSECUTORS DROP NEGLIGENCE CHARGES AGAINST POLICE OFFICERS IN DEATH OF MAN
http://www.thetower.org/4343-palestinian-band-warns-jews-to-flee-tel-aviv-or-else-your-body-parts-will-be-collected/,General,25/12/2016-12:30:12,PALESTINIAN BAND WARNS JEWS TO FLEE TEL AVIV “OR ELSE YOUR BODY PARTS WILL BE COLLECTED”
http://www.chicagotribune.com/entertainment/ct-carrie-fisher-heart-attack-20161223-story.html,General,25/12/2016-12:30:12,"""STAR WARS"" ACTRESS CARRIE FISHER IS IN STABLE CONDITION, HER BROTHER SAYS"
http://www.lex18.com/story/34123668/tmz-carrie-fisher-has-heart-attack-on-plane,General,25/12/2016-12:30:12,CARRIE FISHER HAS HEART ATTACK ON PLANE
http://www.usmagazine.com/celebrity-news/news/joey-boots-dead-howard-sterns-wack-packer-dies-at-49-w457731,General,25/12/2016-12:30:12,"JOEY BOOTS, HOWARD STERN'S RADIO WACKPACKER, DEAD AT 49"
http://www.couriermail.com.au/news/queensland/crime-and-justice/queensland-crime-man-tortured-for-20-hours-after-trying-to-buy-motorcycle/news-story/abea7eda12e9b879e8416fcc74b717bf,General,25/12/2016-12:30:12,QUEENSLAND CRIME: MAN TORTURED FOR 20 HOURS AFTER TRYING TO BUY MOTORCYCLE
http://www.nbcnews.com/health/health-news/vet-catches-bird-flu-cat-new-york-n699316,General,25/12/2016-12:30:12,VET CATCHES BIRD FLU FROM A CAT IN NEW YORK
http://adequateman.deadspin.com/what-did-we-get-stuck-in-our-rectums-last-year-1790335507,General,25/12/2016-12:30:12,WHAT DID WE GET STUCK IN OUR RECTUMS LAST YEAR?
https://www.yahoo.com/news/chinas-1st-aircraft-carrier-heads-western-pacific-050501726.html,General,25/12/2016-12:30:12,CHINA'S 1ST AIRCRAFT CARRIER HEADS FOR WESTERN PACIFIC
http://www.dslreports.com/shownews/ATT-West-Coast-Union-Workers-Protest-Offshoring-Vote-to-Strike-138572,General,25/12/2016-12:30:12,"AT&T WEST COAST UNION WORKERS PROTEST OFFSHORING, VOTE TO STRIKE"
http://www.foxnews.com/world/2016/12/25/thousands-people-in-german-town-evacuates-on-christmas-morning-for-wwii-bomb.html,General,25/12/2016-12:30:12,THOUSANDS OF PEOPLE IN GERMAN TOWN EVACUATES ON CHRISTMAS MORNING FOR WWII BOMB
http://fox6now.com/2016/12/22/what-is-that-unidentified-unexplained-large-object-damages-mans-van-on-milwaukees-north-side/,General,25/12/2016-12:30:12,"UNIDENTIFIED, UNEXPLAINED LARGE OBJECT DAMAGES MAN’S VAN ON MILWAUKEE’S NORTH SIDE"
http://www.bbc.com/news/world-us-canada-38429496?ns_mchannel=social&ns_campaign=bbc_breaking&ns_source=twitter&ns_linkname=news_central,General,25/12/2016-12:30:12,TRUMP TO DISSOLVE CONTROVERSIAL CHARITY
https://www.theguardian.com/business/2016/dec/22/bitcoin-circulation-hits-record-high-of-14bn,General,25/12/2016-12:30:12,VALUE OF BITCOINS IN CIRCULATION HITS RECORD HIGH OF $14BN
http://www.atlasobscura.com/articles/wwii-bomb-discovery-sparks-christmas-evacuation,General,25/12/2016-12:30:12,"WWII BOMB DISCOVERY SPARKS CHRISTMAS EVACUATION: 54,000 RESIDENTS OF AUGSBURG WILL HAVE TO LEAVE THEIR HOMES ON CHRISTMAS DAY."
http://www.france24.com/en/breaking/20161225-frances-thomas-coville-sets-new-vendee-globe-round-world-sailing-record-49-days?ns_campaign=reseaux_sociaux&ns_source=twitter&ns_mchannel=social&ns_linkname=breaking&aef_campaign_ref=partage_aef&aef_campaign_date=2016-12-25,General,25/12/2016-12:30:12,FRANCE'S THOMAS COVILLE SETS NEW VENDÉE GLOBE ROUND-THE-WORLD SAILING RECORD OF 49 DAYS
"https://apnews.com/57acbd588ea54782a470d79e6fe815fe/Family:-NYPD-raided-home-by-mistake,-posted-Snapchat-photos",General,25/12/2016-12:30:12,"FAMILY: NYPD RAIDED HOME BY MISTAKE, POSTED SNAPCHAT PHOTOS"
http://www.usatoday.com/story/news/world/2016/12/24/nigeria-boko-haram-crushed-forced-out-last-enclave/95822022/,General,25/12/2016-12:30:14,"NIGERIA: BOKO HARAM CRUSHED, FORCED OUT OF LAST ENCLAVE"
http://money.cnn.com/2016/12/23/news/lockheed-martin-trump-response/,General,25/12/2016-12:30:14,LOCKHEED MARTIN CEO MARILLYN HEWSON PROMISES TRUMP SHE'LL CUT F-35 COSTS
http://www.independent.ie/entertainment/music/status-quo-guitarist-rick-parfitt-has-died-in-hospital-in-spain-35319431.html,General,25/12/2016-12:30:14,STATUS QUO GUITARIST RICK PARFITT HAS DIED IN HOSPITAL IN SPAIN
http://www.sfgate.com/crime/article/Family-of-Oakland-Ghost-Ship-fire-victim-to-file-10816035.php,General,25/12/2016-12:30:14,FAMILIES OF 2 OAKLAND WAREHOUSE FIRE VICTIMS FILE 1ST LAWSUITS
http://www.abcfoxmontana.com/story/34125544/armed-protest-planned-for-whitefish,General,25/12/2016-12:30:14,ARMED PROTEST PLANNED FOR WHITEFISH
http://www.latinpost.com/articles/124210/20160922/dianey-santos-mom-of-two-girls-shot-dead-at-bus-stop-in-june-now-la-police-announce-50-000-reward.htm,General,25/12/2016-12:30:14,"DIANEY SANTOS, MOM OF TWO GIRLS, SHOT DEAD AT BUS STOP IN JUNE; NOW, LA POLICE ANNOUNCE $50,000 REWARD"
http://www.bbc.com/news/world-africa-38427469,General,25/12/2016-12:30:14,BERLIN MARKET ATTACK: TUNISIA ARRESTS SUSPECT AMRI'S NEPHEW
http://www.msn.com/en-us/news/world/celebrated-afghan-woman-pilot-requests-asylum-in-us/ar-BBxw1wv?li=BBmkt5R&ocid=spartandhp,General,25/12/2016-12:30:14,CELEBRATED AFGHAN WOMAN PILOT REQUESTS ASYLUM IN U.S.
http://www.katc.com/story/34127000/baton-rouge-man-gets-51-months-for-threatening-monroe-judge,General,25/12/2016-12:30:14,BATON ROUGE MAN GETS 51 MONTHS FOR THREATENING MONROE JUDGE
http://www.sfgate.com/news/bayarea/article/Political-Consultant-Pleads-Guilty-To-Child-10816824.php,General,25/12/2016-12:30:14,POLITICAL CONSULTANT PLEADS GUILTY TO CHILD PORNOGRAPHY CHARGES
http://www.foxnews.com/world/2016/12/24/order-malta-to-pope-francis-stay-out-our-internal-affairs.html,General,25/12/2016-12:30:14,ORDER OF MALTA TO POPE FRANCIS: STAY OUT OF OUR INTERNAL AFFAIRS
https://www.bloomberg.com/news/articles/2016-12-23/gm-s-china-car-unit-slapped-with-29-million-antitrust-penalty,General,25/12/2016-12:30:14,CHINA SLAPS GM WITH $29 MILLION FINE AMID GROWING TENSIONS
http://www.ndtv.com/world-news/minnesota-pastor-beat-boy-12-with-electrical-cord-because-child-wanted-to-test-god-police-say-1640943,General,25/12/2016-12:30:14,"MINNESOTA PASTOR BEAT BOY, 12, WITH ELECTRICAL CORD BECAUSE CHILD 'WANTED TO TEST GOD,' POLICE SAY"
https://apnews.com/eb9d904e19924f97a0ef855f8c0ab7f9/Coroner:-Baby-died-days-after-parents'-suspected-overdoses,General,25/12/2016-12:30:14,BABY DIES DAYS AFTER PARENTS' SUSPECTED DRUG OVERDOSE DEATHS
http://www.nj.com/bergen/index.ssf/2016/12/infant_dropped_by_babysitter_dies_of_injuries.html#incart_river_index,General,25/12/2016-12:30:14,"3 MONTH OLD DROPPED BY BABYSITTER, PUT ON LIFE SUPPORT, PASSED AWAY 3 DAYS LATER."
https://www.airforcetimes.com/articles/wyche-squadron-commander-reassigned,General,25/12/2016-12:30:14,SQUADRON COMMANDER REASSIGNED AFTER CHIEF'S DRUNK DRIVING ARREST
http://news.softpedia.com/news/microsoft-admits-it-went-too-far-with-aggressive-windows-10-updates-511245.shtml,General,25/12/2016-12:30:14,MICROSOFT ADMITS IT “WENT TOO FAR” WITH AGGRESSIVE WINDOWS 10 UPDATES
http://www.taiwannews.com.tw/en/news/3057566,General,25/12/2016-12:30:14,TAIWAN TELLS SCHOOL TO APOLOGIZE TO ISRAEL OVER NAZI UNIFORMS
https://www.yahoo.com/news/pennsylvania-parents-accused-starving-abusing-three-children-170116833.html,General,25/12/2016-12:30:14,"PENNSYLVANIA PARENTS ACCUSED OF STARVING, ABUSING THREE CHILDREN"
http://ktla.com/2016/12/07/n-c-firefighter-admitted-to-starting-blazes-so-he-could-be-paid-to-extinguish-them/,General,25/12/2016-12:30:15,N.C. FIREFIGHTER ADMITTED TO STARTING BLAZES SO HE COULD BE PAID TO EXTINGUISH THEM
https://www.thestar.com/news/world/2016/12/23/libyan-plane-carrying-118-hijacked-and-diverted-to-malta-reports.html,General,25/12/2016-12:30:15,HIJACKERS SURRENDER AFTER RELEASING HOSTAGES AT MALTA AIRPORT | TORONTO STAR
http://www.nbcchicago.com/news/local/Something-Terrible-is-Going-to-Happen-Police-Investigate-After-Cards-Found-on-Hundreds-of-Cars-in-Chicago-Suburbs-407965345.html?_osource=SocialFlowFB_CHBrand,General,25/12/2016-12:30:15,'SOMETHING TERRIBLE IS GOING TO HAPPEN': POLICE INVESTIGATE AFTER CARDS FOUND ON HUNDREDS OF CARS IN CHICAGO SUBURBS
http://www.reuters.com/article/us-philippines-blast-idUSKBN14D0GE,General,25/12/2016-12:30:15,SIXTEEN HURT IN CHRISTMAS EVE BLAST AT CATHOLIC CHURCH IN PHILIPPINES
http://www.wlox.com/story/34124500/nasa-climate-scientist-and-astronaut-sellers-dies-at-61?utm_source=dlvr.it&utm_medium=twitter,General,25/12/2016-12:30:15,NASA CLIMATE SCIENTIST AND ASTRONAUT SELLERS DIES AT 61
http://www.telegraph.co.uk/news/2016/12/24/one-dead-dozens-injured-new-zealand-bus-crash-onchristmas-eve/,General,25/12/2016-12:30:15,"ONE DEAD, DOZENS INJURED IN NEW ZEALAND BUS CRASH ON CHRISTMAS EVE"
https://www.bloomberg.com/news/articles/2016-12-16/boeing-says-china-plane-orders-support-150-000-u-s-jobs-a-year,General,25/12/2016-12:30:16,"BOEING SAYS CHINA PLANE ORDERS SUPPORT 150,000 U.S. JOBS A YEAR"
http://www.wtsp.com/news/health/holiday-stressers-cause-spike-in-heart-attacks/377652321,General,25/12/2016-12:30:16,HOLIDAY STRESSORS CAUSE SPIKE IN HEART ATTACKS
http://www.city-journal.org/html/ferguson-effect-lives-14919.html,General,25/12/2016-12:30:16,"THE FERGUSON EFFECT LIVES ON. VIOLENCE IN AMERICAN CITIES ROSE AGAIN IN 2016, AS COPS BACKED OFF PROACTIVE POLICING."
http://www.reuters.com/article/us-usa-weather-idUSKBN14C0NL,General,25/12/2016-12:30:16,SNOW STORM BEARS DOWN ON WESTERN U.S. AS HOLIDAY TRAVELERS HIT THE ROADS
http://www.nbcphiladelphia.com/news/local/Strong-Sulfur-Odor-Sweeps-Through-Philadelphia-408111585.html,General,25/12/2016-12:30:16,SULFUR STENCH ENVELOPS PHILLY AREA AFTER ADDITIVE MISHAP
http://www.wdrb.com/story/34123704/cornbread-mafia-fugitive-found-in-canada-after-nearly-a-decade,General,25/12/2016-12:30:16,'CORNBREAD MAFIA' FUGITIVE FOUND IN CANADA AFTER NEARLY A DECADE
http://www.cnn.com/2016/12/23/health/college-course-white-controversy-irpt-trnd,General,25/12/2016-12:30:16,SCHOOL DEFENDS 'PROBLEM OF WHITENESS' COURSE
http://www.stripes.com/news/us/beale-afb-officials-mum-on-outcome-of-court-martial-over-rape-allegations-1.445987,General,25/12/2016-12:30:16,BEALE AFB OFFICIALS MUM ON OUTCOME OF COURT MARTIAL OVER RAPE ALLEGATIONS
http://talkasia.net/2016/12/24/woman-arrested-for-giving-birth-to-illegitimate-baby-in-uae/,General,25/12/2016-12:30:16,WOMAN ARRESTED FOR GIVING BIRTH TO ‘ILLEGITIMATE’ BABY IN UAE
http://www.rrstar.com/news/20161224/3-children-1-dog-found-dead-in-rockford-house-fire,General,25/12/2016-12:30:16,"3 CHILDREN, 1 DOG FOUND DEAD IN ROCKFORD HOUSE FIRE"
http://www.reuters.com/article/us-hedgefunds-platinum-idUSKBN14D0FP?il=0,General,25/12/2016-12:30:16,PLATINUM PARTNERS ARRESTS ARE SCANT CONSOLATION FOR ALLEGED VICTIMS
http://www.myrtlebeachonline.com/news/local/article122828784.html,General,25/12/2016-12:30:17,COMMUNITY MOURNS THREE TEENAGE GIRLS KILLED IN BAY ROAD CRASH
https://www.washingtonpost.com/news/morning-mix/wp/2016/12/23/four-sentenced-in-almost-indescribable-kidnapping-torture-of-n-y-college-students/?utm_term=.7a2e95dc58d1,General,25/12/2016-12:30:17,"FOUR SENTENCED IN ‘ALMOST INDESCRIBABLE’ KIDNAPPING, TORTURE OF N.Y. COLLEGE STUDENTS"
http://www.npr.org/2016/12/23/506653136/radios-diane-rehm-a-mainstay-of-civil-discourse-signs-off,General,25/12/2016-12:30:17,"AFTER 38 YEARS ON NPR, DIANE REHM AIRS HER LAST BROADCAST TODAY"
http://www.nbclosangeles.com/news/national-international/Police-Officers-2-Year-Old-Son-Shot-Himself-With-Dads-Gun--408066305.html?_osource=SocialFlowTwt_LABrand,General,25/12/2016-12:30:17,POLICE: OFFICER'S 2-YEAR-OLD SON SHOT HIMSELF WITH DAD'S GUN
http://www.cbsnews.com/news/drug-overdose-deaths-heroin-opioid-prescription-painkillers-more-than-guns/,General,25/12/2016-12:30:17,DRUG OVERDOSES NOW KILL MORE AMERICANS THAN GUNS.
http://www.dailynews.com/health/20161223/more-measles-cases-in-la-county-reported-health-officials-declare-outbreak,General,25/12/2016-12:30:17,"MORE MEASLES CASES IN LA COUNTY REPORTED, HEALTH OFFICIALS DECLARE OUTBREAK."
http://www.cbc.ca/news/canada/north/wrapping-paper-famine-hits-yellowknife-just-before-christmas-1.3911686,General,25/12/2016-12:30:17,WRAPPING PAPER SHORTAGE IN THE NORTH
http://www.telegraph.co.uk/news/2016/12/23/fbi-warns-islamic-state-targeting-us-churches-holiday-gatherings/,General,25/12/2016-12:30:17,FBI WARNS ISLAMIC STATE TARGETING US CHURCHES AND HOLIDAY GATHERINGS
http://www.fox25boston.com/news/zamboni-crashes-at-boston-winter-skating-rink/478435556,General,25/12/2016-12:30:17,ZAMBONI CRASH THROUGH FENCE AND DOWN THE STAIRS
http://amp.timeinc.net/time/4617295/china-smog-smoking-environment-air-pollution/?source=dam,General,25/12/2016-12:30:17,"CHINA’S SMOG MAY BE RESPONSIBLE FOR 1 IN 3 DEATHS IN THE COUNTRY, NEW RESEARCH SUGGESTS"
http://www.mlive.com/news/index.ssf/2016/12/why_nestle_pays_next_to_nothin.html,General,25/12/2016-12:30:17,WHY NESTLE PAYS NEXT TO NOTHING FOR MICHIGAN GROUNDWATER
http://www.abc15.com/news/crime/isis-sympathizer-in-phoenix-was-plotting-a-lone-wolf-attack,General,25/12/2016-12:30:17,ISIS SYMPATHIZER IN PHOENIX WAS PLOTTING A LONE WOLF ATTACK
http://www.aljazeera.com/news/2016/12/passes-resolution-israeli-settlements-161223192709807.html,General,25/12/2016-12:30:17,UN PASSES RESOLUTION ON ENDING ISRAELI SETTLEMENTS. 14 UN SECURITY COUNCIL MEMBERS VOTE IN FAVOUR AS US ABSTAINS IN DEMANDING ISRAEL HALT SETTLEMENTS ON PALESTINIAN LAND.
http://www.borderlandbeat.com/2016/12/10-years-of-mexicos-war-on-drugs-in.html,General,25/12/2016-12:30:17,"10 YEARS OF MEXICO'S WAR ON DRUGS, 150000+ DEAD"
http://www.essex-fire.gov.uk/incidents/i6422/#585e359b33e06,General,25/12/2016-12:30:19,FATAL HOUSE FIRE - A REMINDER TO OTHERS TAKE CARE WITH CANDLES THIS TIME OF YEAR.
http://abcnews.go.com/US/wireStory/appeals-court-tosses-life-sentence-15-theft-44373388,General,25/12/2016-12:30:19,APPEALS COURT TOSSES LIFE SENTENCE FOR $15 THEFT
http://www.fox5atlanta.com/news/225350409-story?utm_source=dlvr.it&utm_medium=twitter,General,25/12/2016-12:30:19,RIC FLAIR SWORN IN AS CLAYTON COUNTY DEPUTY
http://www.cbsnews.com/news/gene-anthony-quinones-rivera-cops-dad-admits-killing-infant-leaving-body-in-woods/,General,25/12/2016-12:30:19,"COPS: DAD CONFESSES TO KILLING INFANT, LEAVING BODY IN WOODS"
http://www.cnbc.com/2016/12/23/fbi-probes-fdic-hack-linked-to-chinas-military-sources.html,General,25/12/2016-12:30:19,FBI PROBES FDIC HACK LINKED TO CHINA'S MILITARY: SOURCES
http://www.timesofisrael.com/choosing-not-to-veto-obama-lets-anti-settlement-resolution-pass-at-un-security-council/,General,25/12/2016-12:30:19,"CHOOSING NOT TO VETO, OBAMA LETS ANTI-SETTLEMENT RESOLUTION PASS AT UN SECURITY COUNCIL"
http://www.9news.com/ext/news/nation-now/fbi-exgymnastics-team-doctor-had-37k-child-porn-images/73/6MXgbPUFckiOosWEo6SOGa,General,25/12/2016-12:30:19,FBI: EX-GYMNASTICS TEAM DOCTOR HAD 37K CHILD PORN IMAGES
http://www.latimes.com/local/lanow/la-me-ln-shasta-gas-station-burned-20161223-story.html,General,25/12/2016-12:30:19,KILLER DOUSED GAS STATION CLERK IN FLAMMABLE LIQUID AND THEN BURNED HIM
https://gma.yahoo.com/suspect-road-rage-killing-3-old-boy-said-220104775--abc-news-topstories.html#,General,25/12/2016-12:30:19,SUSPECT IN ROAD RAGE KILLING OF 3-YEAR-OLD BOY SAID CAR WAS FOLLOWING TOO CLOSE
http://pix11.com/2016/12/22/police-find-55-pounds-of-fentanyl-in-traffic-stop-in-connecticut/,General,25/12/2016-12:30:19,POLICE FIND 55 POUNDS OF FENTANYL IN TRAFFIC STOP IN CONNECTICUT.
http://www.9news.com/news/local/report-finds-blacks-disproportionately-arrested-in-colorado/377386544,General,25/12/2016-12:30:19,REPORT FINDS BLACKS DISPROPORTIONATELY ARRESTED IN COLORADO
http://www.seattlepi.com/news/education/article/Lawsuit-Washington-teacher-had-sex-with-10817481.php,General,25/12/2016-12:30:19,LAWSUIT: WASHINGTON TEACHER HAD SEX WITH 18-YEAR-OLD STUDENT
http://abc7news.com/news/first-civil-lawsuits-filed-in-ghost-ship-warehouse-fire--/1670353/,General,25/12/2016-12:30:19,FIRST CIVIL LAWSUITS FILED IN OAKLAND GHOST SHIP WAREHOUSE FIRE
https://www.washingtonpost.com/national/for-women-heavy-drinking-has-been-normalized-thats-dangerous/2016/12/23/0e701120-c381-11e6-9578-0054287507db_story.html?hpid=hp_hp-top-table-main_bigvino-12pm%3Ahomepage%2Fstory&utm_term=.772bfab26cd0,General,25/12/2016-12:30:19,"FOR WOMEN, HEAVY DRINKING HAS BEEN NORMALIZED. THAT’S DANGEROUS."
http://www.espn.com/nfl/story/_/id/18341736/minnesota-vikings-plane-skids-runway-safe-landing,General,25/12/2016-12:30:19,MINNESOTA VIKINGS PLANE SLIDES OFF RUNWAY
https://www.yahoo.com/gma/tennessee-couple-dies-just-hours-apart-nearly-64-045539728--abc-news-topstories.html#,General,25/12/2016-12:30:19,COUPLE DIES HOURS APART AFTER 64 YEARS OF MARRIAGE
https://apnews.com/f8e9d98928db41d18f3f12385a3cb0b2,General,25/12/2016-12:30:19,"OBAMA SIGNS DEFENSE POLICY BILL, OBJECTS ON GUANTANAMO"
http://abcnews.go.com/Entertainment/wireStory/backlash-kicked-rockettes-picked-inauguration-44367911,General,25/12/2016-12:30:19,ROCKETTES' OWNERS SAY ATTENDANCE AT INAUGURATION IS A CHOICE
http://www.usatoday.com/story/news/nation-now/2016/12/21/4-bodies-nicholas-tartaglione/95687736/,General,25/12/2016-12:30:19,4 BODIES FOUND AT PROPERTY OF RETIRED N.Y. COP
http://www.wbtv.com/story/34109723/revised-mo-statute-increases-punishment-on-grade-school-fights,General,25/12/2016-12:30:19,"NEW MISSOURI LAW MAKES GRADE SCHOOL FIGHTS A FELONY, RESULTING IN UP TO A 4 YEAR SENTENCE"
http://www.omaha.com/news/crime/man-dies-after-being-shot-during-suspected-robbery-at-millard/article_5e6abef0-c96c-11e6-8e50-138ef248854d.html,General,25/12/2016-12:30:19,2 MEN WEARING CLOWN MASK GUN DOWN OMAHA MAN IN ATTEMPTED ROBBERY.
http://www.nbcnews.com/news/us-news/ex-lottery-security-chief-charged-rigging-wisconsin-jackpot-n699556,General,25/12/2016-12:30:19,EX-LOTTERY SECURITY CHIEF CHARGED WITH RIGGING WISCONSIN JACKPOT
https://www.theguardian.com/world/live/2016/dec/23/berlin-market-attack-suspect-anis-amri-killed-in-milan-reports-say-live-coverage,General,25/12/2016-12:30:19,"BERLIN MARKET ATTACK SUSPECT KILLED IN MILAN, REPORTS SAY"
http://abc11.com/news/reports-of-multiple-people-shot-and-killed-in-wilson-county/1671884/,General,25/12/2016-12:30:19,FOUR PEOPLE SHOT AND KILLED IN WILSON COUNTY
http://www.cnn.com/videos/tv/2016/12/23/fbi-issues-warning-on-isis-threats-in-u-s-lead-perez-live.cnn,General,25/12/2016-12:30:19,FBI WARNS ABOUT ISIS THREAT TO CHURCHES
http://www.cbc.ca/news/canada/newfoundland-labrador/stjohns-looks-for-more-cardboard-to-be-recycled-1.3909248,General,25/12/2016-12:30:21,"'TIS THE SEASON TO RECYCLE? ST. JOHN'S LAUNCHES #DEBOXINGDAY - NEWFOUNDLAND & LABRADOR, CANADA"
