url,type,timeretrieved,title
http://www.ajc.com/news/national/man-kills-roommate-fight-over-chores-police-say/xX0lyZ2TADIImQ2eadWaZL/,General,24/12/2016-18:30:18,"MAN KILLS ROOMMATE IN FIGHT OVER CHORES, POLICE SAY"
http://www.mlive.com/news/ann-arbor/index.ssf/2016/12/video_shows_drunken_driving_ar.html,General,24/12/2016-18:30:18,VIDEO SHOWS DRUNKEN-DRIVING ARREST OF WASHTENAW POLICE LIEUTENANT
http://www.independent.co.uk/news/100-migrants-drown-italy-death-toll-united-nations-highest-ever-a7493206.html,General,24/12/2016-18:30:18,"100 PEOPLE FEARED DEAD IN MEDITERRANEAN TAKING TOLL FOR 2016 TO 5,000 – THE HIGHEST EVER"
http://www.chicagotribune.com/news/laquanmcdonald/ct-laquan-mcdonald-shooting-inspector-general-report-met-20161222-story.html,General,24/12/2016-18:30:18,"TOP POLICE BRASS DEFENDED LAQUAN MCDONALD SHOOTING AFTER SEEING VIDEO, RECORDS SHOW"
https://www.engadget.com/2016/12/22/usa-foreign-travelers-social-media/,General,24/12/2016-18:30:18,US STARTS ASKING FOREIGN TRAVELERS FOR THEIR SOCIAL MEDIA INFO
http://ksnt.com/2016/12/23/parents-charged-with-shooting-heroin-in-walmart-parking-lot-with-2-kids-in-car/,General,24/12/2016-18:30:18,PARENTS CHARGED WITH SHOOTING HEROIN IN WALMART PARKING LOT WITH 2 KIDS IN CAR
http://www.9news.com.au/national/2016/12/23/07/19/police-raids-underway-in-melbourne-suburb,General,24/12/2016-18:30:18,POLICE SAY THEY HAVE FOILED A TERROR PLOT LIKELY PLANNED FOR CHRISTMAS DAY IN MELBOURNE
http://www.wbrz.com/news/terrebonne-substitute-teacher-arrested-for-having-sex-with-teens,General,24/12/2016-18:30:18,TERREBONNE SUBSTITUTE TEACHER ARRESTED FOR HAVING SEX WITH TEENS
http://ktla.com/2016/12/23/norcal-gas-station-employee-burned-alive-at-work-in-brutal-attack-assailant-sought/,General,24/12/2016-18:30:18,NORCAL GAS STATION EMPLOYEE BURNED ALIVE AT WORK IN BRUTAL ATTACK; ASSAILANT SOUGHT
http://www.usatoday.com/story/news/2016/12/22/retailers-reporting-strong-marijuana-sales-holidays/95762702/,General,24/12/2016-18:30:18,RETAILERS REPORTING STRONG MARIJUANA SALES FOR THE HOLIDAYS
http://www.nytimes.com/2016/12/22/health/ebola-vaccine.html?_r=0,General,24/12/2016-18:30:18,NEW EBOLA VACCINE GIVES 100 PERCENT PROTECTION
http://www.theglobeandmail.com/report-on-business/canadian-economy-shrank-03-per-cent-in-october/article33421218/,General,24/12/2016-18:30:18,CANADA’S ECONOMY CONTRACTS ON WEAKEST FACTORY OUTPUT SINCE 2013
http://mainichi.jp/english/articles/20161223/p2a/00m/0na/006000c,General,24/12/2016-18:30:18,"OVER 5,000 TEACHERS IN JAPAN TOOK SICK LEAVE FOR MENTAL ILLNESS IN 2015 SCHOOL YEAR"
http://www.reuters.com/investigates/special-report/usa-bodybrokers-industry/,General,24/12/2016-18:30:18,HOW A GREAT-GRANDMOTHER’S BODY CAME TO BE USED IN AN ARMY BLAST TEST
http://www.fox2detroit.com/news/local-news/225288983-story?utm_source=dlvr.it&utm_medium=twitter,General,24/12/2016-18:30:18,"POLICE: WOMAN BEATS SONS, 9 AND 7, FOR OPENING CHRISTMAS GIFTS EARLY"
https://www.cnet.com/news/galaxy-note-7-wi-fi-hotspot-virgin-america-flight-lucas-wojciechowski/,General,24/12/2016-18:30:18,GALAXY NOTE 7 HOTSPOT NAME FREAKS OUT A FLIGHT
http://www.wsbtv.com/news/trending-now/church-facing-12000-fine-for-letting-homeless-people-sleep-on-property_/477981262,General,24/12/2016-18:30:18,"CHURCH FACING $12,000 FINE FOR LETTING HOMELESS PEOPLE SLEEP ON PROPERTY."
http://www.bbc.co.uk/news/uk-38386088,General,24/12/2016-18:30:18,"ROUGH SLEEPERS 'URINATED ON' BY PUBLIC, SURVEY FINDS - BBC NEWS."
http://www.9news.com/mb/life/pets/shelter-staff-celebrates-empty-kennels-after-successful-adoptions/374187601,General,24/12/2016-18:30:18,SHELTER STAFF CELEBRATES EMPTY KENNELS AFTER SUCCESSFUL ADOPTIONS
http://www.reuters.com/article/us-usa-trump-passenger-idUSKBN14B25I,General,24/12/2016-18:30:18,PASSENGER REMOVED FROM FLIGHT AFTER CONFRONTATION WITH IVANKA TRUMP.
http://www.nytimes.com/2016/12/23/health/cancer-trials-immunotherapy.html,General,24/12/2016-18:30:18,"IN CANCER TRIALS, MINORITIES FACE EXTRA HURDLES"
https://www.theguardian.com/us-news/2016/dec/22/texas-mother-daughter-arrest-fort-worth-jacqueline-craig,General,24/12/2016-18:30:18,MOTHER AND DAUGHTER WHO REPORT CHILD'S ASSAULT ARE AGGRESSIVELY ARRESTED ON TAPE
http://www.timesofisrael.com/fatah-uses-facebook-to-celebrate-murders-of-over-100-israelis/,General,24/12/2016-18:30:18,FATAH TAKES TO FACEBOOK TO CELEBRATE MURDERS OF OVER 100 ISRAELIS
http://www.foxnews.com/world/2016/12/22/2-american-hikers-find-black-box-1985-plane-crash-in-bolivia-hand-it-to-ntsb.html,General,24/12/2016-18:30:20,"2 AMERICAN HIKERS FIND BLACK BOX OF 1985 PLANE CRASH IN BOLIVIA, HAND IT TO NTSB"
http://www.independent.co.uk/news/world/americas/las-vegas-is-now-completely-powered-by-renewable-energy-a7491321.html,General,24/12/2016-18:30:20,LAS VEGAS IS NOW COMPLETELY POWERED BY RENEWABLE ENERGY
http://www.wgal.com/article/family-of-bears-killed-in-pa-after-eating-poisonous-plant/8531790,General,24/12/2016-18:30:20,FAMILY OF BEARS KILLED IN PA. AFTER EATING POISONOUS PLANT
http://www.bbc.com/news/uk-england-oxfordshire-38420960,General,24/12/2016-18:30:20,POLISH WOMAN ACCUSED OF CONTEMPT OF COURT GIVEN CHRISTMAS REPRIEVE
http://www.wisn.com/article/milwaukee-man-accused-of-stockpiling-weapons-in-suburbs/8526691,General,24/12/2016-18:30:20,MILWAUKEE MAN ACCUSED OF STOCKPILING WEAPONS IN SUBURBS
http://www.independent.co.uk/news/world/europe/drunk-driver-car-thruough-russia-airport-terminal-kazan-international-a7491951.html,General,24/12/2016-18:30:20,DRUNK MAN DRIVES CAR THROUGH RUSSIAN AIRPORT TERMINAL
http://www.independent.co.uk/news/uk/crime/police-officer-sex-rape-victim-mcdonalds-toilet-charlotte-peters-london-protection-assign-a7489926.html,General,24/12/2016-18:30:20,POLICE OFFICER WHO HAD SEX WITH RAPE VICTIM IN MCDONALD'S TOILET IS JAILED
http://www.walesonline.co.uk/news/wales-news/arsonists-devastate-allotment-site-run-12364453,General,24/12/2016-18:30:20,ARSONISTS DEVASTATE ALLOTMENT SITE RUN BY PEOPLE WITH LEARNING NEEDS
https://www.bloomberg.com/news/videos/2016-12-23/shkreli-price-increase-has-stuck-happy-with-that,General,24/12/2016-18:30:20,"SHKRELI: PRICE INCREASE HAS STUCK, HAPPY WITH THAT"
http://www.straitstimes.com/asia/east-asia/villager-in-china-uses-grenade-to-crack-open-walnuts-for-25-years,General,24/12/2016-18:30:20,VILLAGER IN CHINA USES GRENADE TO CRACK OPEN WALNUTS FOR 25 YEARS
http://www.nbcnews.com/news/us-news/white-texas-cop-s-arrest-three-black-women-appears-racist-n699416,General,24/12/2016-18:30:20,WHITE TEXAS COP'S ARREST OF THREE BLACK WOMEN APPEARS RACIST: LAWYER
https://www.bloomberg.com/news/articles/2016-12-23/xi-said-to-express-openness-to-growth-below-6-5-as-debt-climbs-ix1qz3tz,General,24/12/2016-18:30:20,PRESIDENT XI OPEN TO GROWTH IN CHINA FALLING BELOW 6.5%
https://www.theguardian.com/technology/2016/dec/21/oracle-executive-resigns-ceo-safra-catz-donald-trump,General,24/12/2016-18:30:20,ORACLE EXECUTIVE PUBLICLY RESIGNS AFTER CEO JOINS TRUMP'S TRANSITION TEAM
http://www.courant.com/community/manchester/hc-manchester-school-slide-1215-20161214-story.html,General,24/12/2016-18:30:20,RIFT OVER PLANNED INDOOR SLIDE AT ELEMENTARY SCHOOL
http://www.cbc.ca/news/canada/calgary/calgary-daniel-boria-balloon-man-plea-1.3908793,General,24/12/2016-18:30:20,MAN WHO FLEW OVER CALGARY ON A LAWN CHAIR TIED TO 120 BALLOONS FOUND GUILTY
http://www.aljazeera.com/news/2016/12/isil-burns-turkish-soldiers-alive-shocking-video-161223035619947.html,General,24/12/2016-18:30:20,ISIL VIDEO SHOWS 'TURKISH SOLDIERS BURNED ALIVE'
https://www.theguardian.com/us-news/2016/dec/22/california-police-kern-county-investigation-kamala-harris,General,24/12/2016-18:30:20,TWO 'DEADLIEST' POLICE DEPARTMENTS IN US TO BE INVESTIGATED IN CALIFORNIA
http://reuters.com/article/idINKBN14C1VZ,General,24/12/2016-18:30:20,FBI PROBES FDIC HACK LINKED TO CHINA'S MILITARY - SOURCES
http://www.fox4news.com/news/225061979-story,General,24/12/2016-18:30:20,FORT WORTH WOMAN BEING ARRESTED AFTER CALLING POLICE TO REPORT THAT A MAN HAD CHOKED HER 7-YEAR-OLD SON
http://www.telegraph.co.uk/news/2016/12/22/sexoffenderbanned-approaching-women-life/,General,24/12/2016-18:30:20,SEX OFFENDER BANNED FROM APPROACHING WOMEN FOR LIFE
http://www.chicagotribune.com/news/nationworld/midwest/ct-wisconsin-dells-water-slide-death-20161222-story.html,General,24/12/2016-18:30:20,BOY DIES AFTER FALL FROM WATER SLIDE IN WISCONSIN DELLS AREA
http://www.calgarysun.com/2016/12/22/pennsylvania-man-89-heads-out-to-store-ends-up-in-alabama,General,24/12/2016-18:30:20,"PENNSYLVANIA MAN, 89, HEADS OUT TO STORE, ENDS UP IN ALABAMA"
http://www.cnn.com/2016/12/22/us/fort-worth-police-facebook/index.html,General,24/12/2016-18:30:20,FORT WORTH POLICE INVESTIGATE ARREST CAUGHT ON VIDEO
http://www.nbcchicago.com/news/local/Something-Terrible-is-Going-to-Happen-Police-Investigate-After-Cards-Found-on-Hundreds-of-Cars-in-Chicago-Suburbs-407965345.html?_osource=SocialFlowFB_CHBrand,General,24/12/2016-18:30:20,'SOMETHING TERRIBLE IS GOING TO HAPPEN': POLICE INVESTIGATE AFTER CARDS FOUND ON HUNDREDS OF CARS IN CHICAGO SUBURBS
https://www.theguardian.com/us-news/2016/dec/22/robber-freed-90-years-early-by-mistake-says-he-reformed-while-free,General,24/12/2016-18:30:20,"A ROBBER SENT BACK TO PRISON AFTER BEING MISTAKENLY RELEASED EIGHT YEARS INTO HIS 98-YEAR SENTENCE ASKED A JUDGE ON WEDNESDAY TO SET HIM FREE AGAIN, ARGUING HE HAD STARTED A FAMILY, GOT A STEADY JOB AND REFORMED HIMSELF"
http://www.bbc.com/news/education-38392802,General,24/12/2016-18:30:22,"FACEBOOK LURKING MAKES YOU MISERABLE, SAYS STUDY"
http://www.bbc.com/news/world-africa-38414060,General,24/12/2016-18:30:22,SUCCESSFUL EBOLA VACCINE WILL BE FAST-TRACKED FOR USE
http://www.fox2detroit.com/news/local-news/225066115-story,General,24/12/2016-18:30:22,NFL PLAYER ADOPTS FAMILY OF FALLEN POLICE OFFICER FOR CHRISTMAS.
http://www.bbc.co.uk/news/world-europe-38416112,General,24/12/2016-18:30:22,LIBYAN PLANE IN 'POTENTIAL HIJACK'
http://www.cnbc.com/2016/12/23/consumer-sentiment-reports-for-december-2016.html,General,24/12/2016-18:30:22,CONSUMER SENTIMENT REPORTS FOR DECEMBER 2016
http://www.kare11.com/news/9th-dui-gets-woman-5-years-in-prison/376805722,General,24/12/2016-18:30:22,9TH DUI GETS WOMAN 5 YEARS IN PRISON
http://www.reuters.com/article/us-health-birdflu-china-idUSKBN14C0CX,General,24/12/2016-18:30:22,CHINA REPORTS FIRST TWO HUMAN DEATHS FROM BIRD FLU THIS WINTER
http://www.mcclatchydc.com/news/nation-world/national/national-security/article122259174.html,General,24/12/2016-18:30:22,POLICE USE OF CELL-TOWER SIMULATOR TRACKING DEVICES DRAWS CONCERN
http://www.bbc.co.uk/news/world-us-canada-38410027,General,24/12/2016-18:30:22,BBC NEWS: TRUMP WANTS EXPANDED NUCLEAR CAPABILITY
http://wfla.com/2016/12/21/pinellas-veteran-claims-40-year-cover-up-by-u-s-a-f/,General,24/12/2016-18:30:22,SCOTT NELMS CLAIMS A 40-YEAR COVER UP BY THE AIR FORCE MAY HAVE COST VETERANS AND THEIR FAMILIES DEARLY. NELMS SAID THE USAF SPRAYED SIGNIFICANT AMOUNTS OF THE TOXIC DEFOLIANT AGENT ORANGE AT BASES IN THAILAND.
http://www.msn.com/en-us/travel/news/delta-air-lines-changes-policy-after-black-doctor-was-stopped-from-helping-on-flight/ar-BBxpnUF?li=BBmkt5R&ocid=spartanntp_edu,General,24/12/2016-18:30:22,DELTA AIR LINES CHANGES POLICY AFTER BLACK DOCTOR WAS STOPPED FROM HELPING ON FLIGHT
http://www.independent.co.uk/news/people/barack-obama-prank-white-house-snowman-fear-phobia-instagram-photos-a7490796.html,General,24/12/2016-18:30:22,BARACK OBAMA PRANKED BY WHITE HOUSE STAFF OVER SNOWMAN FEARS
http://www.military.com/daily-news/2016/12/20/ecstasy-one-step-closer-approval-ptsd-treatment.html?ESRC=eb_161221.nl,General,24/12/2016-18:30:22,ECSTASY ONE STEP CLOSER TO APPROVAL AS PTSD TREATMENT
http://www.cbc.ca/news/canada/nova-scotia/human-trafficking-nova-scotia-gibson-skeir-threat-halifax-court-1.3907219,General,24/12/2016-18:30:22,HUMAN TRAFFICKER ARRESTED AND CHARGED. THREATENS 14 YEAR OLD VICTIM WHILE EXITING COURT
http://www.telegraph.co.uk/news/2016/12/23/three-british-airways-passengers-treated-like-rock-stars-found/,General,24/12/2016-18:30:22,THREE BRITISH AIRWAYS PASSENGERS TREATED LIKE 'ROCK STARS' WHEN THEY FOUND THEY WERE THE ONLY PEOPLE ON BOARD THEIR FLIGHT
http://www.mlive.com/news/grand-rapids/index.ssf/2016/12/he_terrified_a_lot_of_people_w.html,General,24/12/2016-18:30:22,"'HE TERRIFIED A LOT OF PEOPLE:' WITNESS WONDERS WHY FBI AGENT WAVED GUN, SHOT AT COPS"
http://www.nbcnews.com/news/us-news/congress-calls-edward-snowden-liar-new-report-n699121,General,24/12/2016-18:30:22,CONGRESS REPORT CALLS SNOWDEN A LIAR WHO'S IN TOUCH WITH RUSSIAN SPIES
https://www.engadget.com/2016/12/22/peter-thiels-startup-helps-authorities-track-illegal-immigrant/,General,24/12/2016-18:30:22,PETER THIEL'S STARTUP HELPS AUTHORITIES TRACK ILLEGAL IMMIGRANTS
http://www.cbc.ca/beta/news/canada/windsor/serial-animal-killer-london-1.3909757,General,24/12/2016-18:30:22,"ANIMAL SERIAL KILLER ON HE LOOSE IN LONDON, ONTARIO."
http://www.usatoday.com/story/money/cars/2016/12/22/volkswagen-group-3-liter-diesel-scandal-settlement-substantial/95711452/,General,24/12/2016-18:30:22,JUDGE WARNS VW OWNERS NOT TO STRIP DIESEL CARS FOR BUYBACKS
https://www.theguardian.com/world/2016/dec/23/german-police-arrest-men-alleged-shopping-centre-plot-oberhausen,General,24/12/2016-18:30:22,GERMAN POLICE ARREST TWO MEN OVER ALLEGED PLOT TO ATTACK SHOPPING CENTRE
http://www.nytimes.com/2016/12/22/nyregion/obama-to-dismantle-visitor-registry-before-trump-can-revive-it.html,General,24/12/2016-18:30:22,OBAMA TO DISMANTLE VISITOR REGISTRY BEFORE TRUMP CAN REVIVE IT
https://www.justice.gov/usao-edny/pr/odebrecht-and-braskem-plead-guilty-and-agree-pay-least-35-billion-global-criminal,General,24/12/2016-18:30:22,ODEBRECHT AND BRASKEM PLEAD GUILTY AND AGREE TO PAY AT LEAST $3.5 BILLION IN GLOBAL CRIMINAL PENALTIES TO RESOLVE LARGEST FOREIGN BRIBERY CASE IN HISTORY
http://turnto10.com/news/local/man-orders-gift-from-amazon-for-child-receives-sex-toy-instead,General,24/12/2016-18:30:22,"MAN ORDERS GIFTS FROM AMAZON FOR CHILDREN, SAYS HE RECEIVES SEX TOYS INSTEAD"
https://www.airforcetimes.com/articles/air-force-track-review,General,24/12/2016-18:30:22,AIR FORCE FINDS 17 BASES HAVE TOO-LONG PT TRACKS; PROMISES REMEDY FOR WRONGFUL FAILURES
http://www.telegraph.co.uk/money/consumer-affairs/whirlpool-dryer-scandal-watchdogs-face-legal-action-failures/,General,24/12/2016-18:30:24,WHIRLPOOL DRYER SCANDAL: WATCHDOGS FACE LEGAL ACTION OVER 'FAILURES'
http://www.reuters.com/investigates/special-report/usa-uncounted-outbreaks/,General,24/12/2016-18:30:24,"HOW HOSPITALS, NURSING HOMES KEEP DEADLY 'SUPERBUG' OUTBREAKS SECRET"
http://www.kwch.com/content/news/Body-cam-video-shows--407962085.html,General,24/12/2016-18:30:24,VIDEO SHOWS DEPUTY USE TASER ON MAN AT NURSING HOME
http://www.bbc.co.uk/news/health-38392548,General,24/12/2016-18:30:24,MULTIPLE SCLEROSIS DRUG 'A LANDMARK'
https://apnews.com/4e14f73be8df4caf90643cd2d757054c/Arrest-in-'Vote-Trump'-burning-of-Mississippi-black-church,General,24/12/2016-18:30:24,ARREST IN 'VOTE TRUMP' BURNING OF MISSISSIPPI BLACK CHURCH
http://www.msn.com/en-us/news/other/stray-dog-found-carrying-child-remains-in-mouth/ar-BBxo9Wk?ocid=spartandhp,General,24/12/2016-18:30:24,STRAY DOG FOUND CARRYING CHILD REMAINS IN MOUTH
http://www.reuters.com/article/2016/12/22/us-barclays-mortgages-idUSKBN14B29A?utm_source=applenews,General,24/12/2016-18:30:24,U.S. SUES BARCLAYS FOR MORTGAGE SECURITIES FRAUD
http://www.fox16.com/news/local-news/breakingarrest-made-in-death-of-three-year-old-acen-king/630504745,General,24/12/2016-18:30:24,"ARREST MADE IN DEATH OF THREE-YEAR-OLD, ACEN KING"
https://www.washingtonpost.com/news/post-nation/wp/2016/12/22/a-black-mother-told-police-a-white-man-assaulted-her-child-they-arrested-her-instead/?utm_term=.5cbae98b766e,General,24/12/2016-18:30:24,A BLACK MOTHER TOLD POLICE A WHITE MAN ASSAULTED HER CHILD. THEY ARRESTED HER INSTEAD.
http://www.bbc.com/news/world/europe,General,24/12/2016-18:30:24,GERMANY ARRESTS TWO ON TERROR CHARGES
https://endpts.com/the-senate-autopsies-martin-shkrelis-scheme-to-grab-a-1b-windfall/,General,24/12/2016-18:30:24,THE SENATE AUTOPSIES MARTIN SHKRELI’S SCHEME TO GRAB A $1B WINDFALL
http://www.nbcnewyork.com/news/national-international/Austin-Man-Fatally-Stabs-Stepmom-Gloating-About-Cowboys-Win-407823115.html,General,24/12/2016-18:30:24,WOMAN KILLED AFTER 'GLOATING' OVER COWBOYS' WIN: POLICE
http://www.kansascity.com/news/local/article122430344.html,General,24/12/2016-18:30:24,"THREATS, BULLYING HIT FAMILY OF KC TRANSGENDER GIRL ON COVER OF NATIONAL GEOGRAPHIC."
http://www.star-telegram.com/news/local/community/fort-worth/article122405439.html,General,24/12/2016-18:30:24,"FORT WORTH POLICE ARREST WOMEN AFTER UGLY CONFRONTATION, WHICH WAS CAUGHT ON VIDEO"
http://montreal.ctvnews.ca/spca-will-stop-accepting-montreal-dogs-this-spring-1.3214263,General,24/12/2016-18:30:24,SPCA WILL STOP ACCEPTING MONTREAL DOGS THIS SPRING
http://abcnews.go.com/International/wireStory/authorities-godfather-grass-arrested-canada-44357946,General,24/12/2016-18:30:24,AUTHORITIES: 'GODFATHER OF GRASS' ARRESTED IN CANADA
http://abcnews.go.com/Health/wireStory/pope-denounces-resistance-reform-christmas-greeting-44341665,General,24/12/2016-18:30:24,POPE IN CHRISTMAS SPEECH BLASTS VATICAN RESISTANCE TO REFORM
http://www.wsj.com/articles/u-s-sues-barclays-over-mortgage-securities-in-rare-step-1482437193,General,24/12/2016-18:30:24,U.S. SUES BARCLAYS OVER TOXIC MORTGAGE-BACKED SECURITIES
http://www.wralsportsfan.com/duke-s-allen-says-no-excuse-for-3rd-trip-in-past-year/16361941/,General,24/12/2016-18:30:24,DUKE GIVES ALLEN INDEFINITE SUSPENSION FROM TEAM AFTER TRIP
http://www.foxnews.com/us/2016/12/22/police-private-investigator-shoots-teen-displaying-fake-gun.html,General,24/12/2016-18:30:24,POLICE: PRIVATE INVESTIGATOR SHOOTS TEEN DISPLAYING FAKE GUN
http://www.france24.com/en/20161221-france-police-greater-freedom-guns-security,General,24/12/2016-18:30:24,FRANCE PUSHES TO GIVE POLICE GREATER FREEDOM TO USE THEIR GUNS
https://kominactie.3fm.nl/actie/lak-aan,General,24/12/2016-18:30:24,SIX-YEAR-OLD TIJN IS TERMINALLY ILL AND WANTS TO RAISE AS MUCH MONEY AS POSSIBLE TO HELP OTHER CHILDREN
https://www.bloomberg.com/news/articles/2016-12-22/u-s-economic-growth-revised-up-to-3-5-pace-in-third-quarter,General,24/12/2016-18:30:24,U.S. ECONOMIC GROWTH REVISED UP TO 3.5% PACE IN THIRD QUARTER
http://www.nytimes.com/2016/12/21/us/north-carolina-fails-to-repeal-bathroom-law-that-prompted-boycotts.html?_r=0,General,24/12/2016-18:30:24,NORTH CAROLINA FAILS TO REPEAL BATHROOM LAW THAT PROMPTED BOYCOTTS
http://www.wsj.com/articles/percentage-of-young-americans-living-with-parents-rises-to-75-year-high-1482316203,General,24/12/2016-18:30:24,PERCENTAGE OF YOUNG AMERICANS LIVING WITH PARENTS RISES TO 75-YEAR HIGH
http://www.startribune.com/chiropractors-charged-with-insurance-fraud/407806046/,General,24/12/2016-18:30:26,MINNESOTA CHIROPRACTORS CHARGED WITH 'SIMPLE BUT WIDESPREAD' INSURANCE FRAUD
http://reuters.com/article/idUSKBN14C041?utm_source=applenews,General,24/12/2016-18:30:26,DEUTSCHE BANK AGREES TO $7.2 BILLION MORTGAGE SETTLEMENT WITH U.S.
http://www.dallasnews.com/news/crime/2016/12/22/arrest-video-sparks-debate-fort-worth-officer-detained-woman-daughter,General,24/12/2016-18:30:26,"ARREST VIDEO SPARKS OUTRAGE OVER HOW FORT WORTH OFFICER DETAINED WOMAN, DAUGHTER | CRIME"
http://www.clickondetroit.com/news/ann-arbor-police-womans-story-about-being-force-to-remove-hijab-did-not-occur,General,24/12/2016-18:30:26,ANN ARBOR POLICE: WOMAN'S STORY ABOUT BEING FORCED TO REMOVE HIJAB DID NOT OCCUR
http://www.nytimes.com/aponline/2016/12/22/world/europe/ap-eu-germany-christmas-market-the-latest.html,General,24/12/2016-18:30:26,THE LATEST: BERLIN ATTACK SUSPECT REPORTED VIDEOED AT MOSQUE
https://www.yahoo.com/news/chicago-mayor-releases-1000s-emails-private-accounts-003422656--politics.html,General,24/12/2016-18:30:26,THE CITY OF CHICAGO RELEASED THOUSANDS OF EMAIL MESSAGES FROM MAYOR RAHM EMANUEL'S PERSONAL ACCOUNTS ON WEDNESDAY AS PART OF A SETTLEMENT WITH A GOVERNMENT WATCHDOG ORGANIZATION.
http://www.sfgate.com/crime/article/Pregnant-woman-held-face-down-by-BART-police-said-10812015.php,General,24/12/2016-18:30:26,WOMAN SAYS SHE SUFFERED MISCARRIAGE DUE TO EXCESSIVE USE OF FORCE BY BART POLICE
http://www.foxnews.com/health/2016/12/22/nurse-credited-with-saving-student-who-had-blood-clot-near-brain-stem.html?refresh=true,General,24/12/2016-18:30:26,NURSE CREDITED WITH SAVING STUDENT WHO HAD BLOOD CLOT NEAR BRAIN STEM
https://www.theguardian.com/uk-news/2016/dec/22/activist-can-sue-trump-golf-resort-for-breach-of-privacy-court-rules,General,24/12/2016-18:30:26,"ACTIVIST CAN SUE TRUMP GOLF RESORT FOR BREACH OF PRIVACY, COURT RULES | UK NEWS"
http://www.nytimes.com/2016/12/22/us/usa-population-growth.html?module=WatchingPortal&region=c-column-middle-span-region&pgType=Homepage&action=click&mediaId=thumb_square&state=standard&contentPlacement=1&version=internal&contentCollection=www.nytimes.com&contentId=http%3A%2F%2Fwww.nytimes.com%2F2016%2F12%2F22%2Fus%2Fusa-population-growth.html&eventName=Watching-article-click,General,24/12/2016-18:30:26,GROWTH OF U.S. POPULATION IS AT SLOWEST PACE SINCE 1937
http://www.orlandosentinel.com/news/breaking-news/os-rambo-gator-wins-20161222-story.html,General,24/12/2016-18:30:26,FLORIDA WOMAN PLANS MERRY CHRISTMAS AFTER WINNING RIGHT TO KEEP ALLIGATOR
http://www.usatoday.com/story/news/world/2016/12/22/islamic-state-urges-attacks-us-churches-during-holidays/95746982/,General,24/12/2016-18:30:26,ISIL ISSUES HIT LIST OF U.S. CHURCHES FOR HOLIDAY ATTACKS
http://www.npr.org/sections/goatsandsoda/2016/12/22/506600875/first-ebola-vaccine-likely-to-stop-the-next-outbreak,General,24/12/2016-18:30:26,FIRST EBOLA VACCINE LIKELY TO STOP THE NEXT OUTBREAK
https://www.theguardian.com/world/2016/dec/22/tsai-ing-wen-taiwan-president-us-visit-china-donald-trump,General,24/12/2016-18:30:26,TAIWAN'S PRESIDENT TO VISIT US DESPITE OBJECTIONS FROM CHINA | WORLD NEWS
http://abc7chicago.com/news/mall-elf-charged-after-spraying-family-with-mace/1668707/,General,24/12/2016-18:30:26,MALL ELF CHARGED AFTER SPRAYING FAMILY WITH MACE
http://www.bbc.co.uk/news/uk-england-38411140,General,24/12/2016-18:30:26,ANOTHER PRISON RIOT ONGOING IN KENT
http://www.wsj.com/graphics/1mdb-how-a-malaysian-scandal-spread-across-the-world/,General,24/12/2016-18:30:26,THE WOLF OF WALL STREET MOVIE WAS PARTIALLY FUNDED BY A MALAYSIAN GOVERNMENT SLUSH FUND.
https://www.yahoo.com/style/walmart-pulls-bulletproof-black-lives-matter-shirts-after-police-complain-184102650.html,General,24/12/2016-18:30:26,WALMART PULLS ‘BULLETPROOF: BLACK LIVES MATTER’ SHIRTS AFTER POLICE COMPLAIN
http://www.bbc.co.uk/news/world-africa-38382837,General,24/12/2016-18:30:26,"HUNDREDS OF KENYAN GIRLS ARE PREPARING TO SPEND CHRISTMAS IN SCHOOLS, RATHER THAN WITH THEIR FAMILIES, FEARING THAT THEIR PARENTS WILL FORCE THEM TO UNDERGO FEMALE GENITAL MUTILATION (FGM)."
http://www.npr.org/sections/thesalt/2016/12/21/506319408/soy-almond-coconut-if-its-not-from-a-cow-can-you-legally-call-it-milk,General,24/12/2016-18:30:26,"THE DAIRY INDUSTRY WANTS SOY/HEMP/ALMOND/ETC. MILK TO STOP CALLING THEIR PRODUCTS ""MILK."""
http://www.dispatch.com/content/stories/local/2016/12/20/gas-odor-reports.html,General,24/12/2016-18:30:26,"COLUMBUS, OHIO HAS A STRANGE SMELL LINGERING OVER IT AND NOBODY KNOWS WHERE ITS COMING FROM."
http://www.nbc15.com/content/news/A-boy-is-dead-after-falling-from-a-water-slide-at-Mt-Olympus-Water-Park-407893295.html,General,24/12/2016-18:30:26,FLORIDA TEEN DIES AFTER FALLING FROM A WATER SLIDE AT MT. OLYMPUS WATER PARK
https://article.wn.com/view/2016/12/22/Trove_of_child_rape_videos_found_at_exUSA_Gymnastics_doctor_/,General,24/12/2016-18:30:26,TROVE OF CHILD RAPE VIDEOS FOUND AT EX-USA GYMNASTICS DOCTOR’S HOME: FBI
https://www.washingtonpost.com/local/education/surge-in-foreign-students-might-be-crowding-americans-out-of-elite-colleges/2016/12/21/78d4b65c-b59d-11e6-a677-b608fbb3aaf6_story.html?hpid=hp_hp-top-table-main_foreignenroll-545pm%3Ahomepage%2Fstory&utm_term=.72030220ed76,General,24/12/2016-18:30:26,SURGE IN FOREIGN STUDENTS MAY BE CROWDING AMERICANS OUT OF ELITE COLLEGES
https://www.yahoo.com/tech/700-million-android-phones-spying-firmware-preinstalled-191804977.html,General,24/12/2016-18:30:26,700 MILLION ANDROID PHONES HAVE SPYING FIRMWARE PREINSTALLED
http://www.wafb.com/story/34107040/watch-live-la-to-become-first-state-to-give-body-cams-to-all-state-troopers,General,24/12/2016-18:30:27,LA. TO BECOME FIRST STATE TO GIVE BODY CAMS TO ALL STATE TROOPERS
http://kfor.com/2016/12/22/15-year-old-arrested-for-murder-in-garvin-county/,General,24/12/2016-18:30:27,15-YEAR-OLD ARRESTED FOR MURDER IN GARVIN COUNTY
http://www.independent.co.uk/news/world/americas/climate-change-children-lawsuit-allowed-washington-state-environment-protect-global-warming-a7488166.html,General,24/12/2016-18:30:27,JUDGE RULES SCHOOL CHILDREN CAN PURSUE CLIMATE CHANGE LAWSUIT AGAINST WASHINGTON STATE
