url,type,timeretrieved,title
http://fox6now.com/2016/12/22/what-is-that-unidentified-unexplained-large-object-damages-mans-van-on-milwaukees-north-side/,General,24/12/2016-18:30:07,"UNIDENTIFIED, UNEXPLAINED LARGE OBJECT DAMAGES MAN’S VAN ON MILWAUKEE’S NORTH SIDE"
http://www.foxnews.com/world/2016/12/24/after-nearly-year-detained-in-north-korea-little-progress-made-to-free-american-student-otto-warmbier.html,General,24/12/2016-18:30:08,"AFTER NEARLY A YEAR DETAINED IN NORTH KOREA, LITTLE PROGRESS MADE TO FREE AMERICAN STUDENT OTTO WARMBIER"
http://www.independent.ie/entertainment/music/status-quo-guitarist-rick-parfitt-has-died-in-hospital-in-spain-35319431.html,General,24/12/2016-18:30:08,STATUS QUO GUITARIST RICK PARFITT HAS DIED IN HOSPITAL IN SPAIN
http://www.latinpost.com/articles/124210/20160922/dianey-santos-mom-of-two-girls-shot-dead-at-bus-stop-in-june-now-la-police-announce-50-000-reward.htm,General,24/12/2016-18:30:08,"DIANEY SANTOS, MOM OF TWO GIRLS, SHOT DEAD AT BUS STOP IN JUNE; NOW, LA POLICE ANNOUNCE $50,000 REWARD"
http://money.cnn.com/2016/12/23/news/lockheed-martin-trump-response/,General,24/12/2016-18:30:08,LOCKHEED MARTIN CEO MARILLYN HEWSON PROMISES TRUMP SHE'LL CUT F-35 COSTS
http://www.abc15.com/news/region-southeast-valley/chandler/deputy-finds-dog-shot-in-middle-of-the-road-pays-for-surgery,General,24/12/2016-18:30:08,MARICOPA DEPUTY SAVES PIT BULL'S LIFE TWICE
http://www.ndtv.com/world-news/minnesota-pastor-beat-boy-12-with-electrical-cord-because-child-wanted-to-test-god-police-say-1640943,General,24/12/2016-18:30:08,"MINNESOTA PASTOR BEAT BOY, 12, WITH ELECTRICAL CORD BECAUSE CHILD 'WANTED TO TEST GOD,' POLICE SAY"
http://www.usatoday.com/story/news/world/2016/12/24/nigeria-boko-haram-crushed-forced-out-last-enclave/95822022/,General,24/12/2016-18:30:08,"NIGERIA: BOKO HARAM CRUSHED, FORCED OUT OF LAST ENCLAVE"
http://news.softpedia.com/news/microsoft-admits-it-went-too-far-with-aggressive-windows-10-updates-511245.shtml,General,24/12/2016-18:30:08,MICROSOFT ADMITS IT “WENT TOO FAR” WITH AGGRESSIVE WINDOWS 10 UPDATES
http://www.bbc.com/news/world-africa-38427469,General,24/12/2016-18:30:08,BERLIN MARKET ATTACK: TUNISIA ARRESTS SUSPECT AMRI'S NEPHEW
http://www.detroitnews.com/story/news/local/macomb-county/2016/12/24/sinkhole-mile-fraser-forces-evacuation/95826974/,General,24/12/2016-18:30:08,"SINKHOLE IN FRASER, MICHIGAN FORCES EVACUATION FROM HOMES ON CHRISTMAS EVE"
https://www.un.org/press/en/2016/sc12657.doc.htm,General,24/12/2016-18:30:08,"ISRAEL'S SETTLEMENTS HAVE NO LEGAL VALIDITY, CONSTITUTE FLAGRANT VIOLATION OF INTERNATIONAL LAW, SECURITY COUNCIL REAFFIRMS"
https://www.bloomberg.com/news/articles/2016-12-23/gm-s-china-car-unit-slapped-with-29-million-antitrust-penalty,General,24/12/2016-18:30:08,CHINA SLAPS GM WITH $29 MILLION FINE AMID GROWING TENSIONS
http://www.wlox.com/story/34124500/nasa-climate-scientist-and-astronaut-sellers-dies-at-61?utm_source=dlvr.it&utm_medium=twitter,General,24/12/2016-18:30:08,NASA CLIMATE SCIENTIST AND ASTRONAUT SELLERS DIES AT 61
http://www.nbcchicago.com/news/local/Something-Terrible-is-Going-to-Happen-Police-Investigate-After-Cards-Found-on-Hundreds-of-Cars-in-Chicago-Suburbs-407965345.html?_osource=SocialFlowFB_CHBrand,General,24/12/2016-18:30:08,'SOMETHING TERRIBLE IS GOING TO HAPPEN': POLICE INVESTIGATE AFTER CARDS FOUND ON HUNDREDS OF CARS IN CHICAGO SUBURBS
http://www.nj.com/bergen/index.ssf/2016/12/infant_dropped_by_babysitter_dies_of_injuries.html#incart_river_index,General,24/12/2016-18:30:08,"3 MONTH OLD DROPPED BY BABYSITTER, PUT ON LIFE SUPPORT, PASSED AWAY 3 DAYS LATER."
http://ktla.com/2016/12/07/n-c-firefighter-admitted-to-starting-blazes-so-he-could-be-paid-to-extinguish-them/,General,24/12/2016-18:30:08,N.C. FIREFIGHTER ADMITTED TO STARTING BLAZES SO HE COULD BE PAID TO EXTINGUISH THEM
http://www.sfgate.com/news/bayarea/article/Political-Consultant-Pleads-Guilty-To-Child-10816824.php,General,24/12/2016-18:30:08,POLITICAL CONSULTANT PLEADS GUILTY TO CHILD PORNOGRAPHY CHARGES
https://www.bloomberg.com/news/articles/2016-12-16/boeing-says-china-plane-orders-support-150-000-u-s-jobs-a-year,General,24/12/2016-18:30:08,"BOEING SAYS CHINA PLANE ORDERS SUPPORT 150,000 U.S. JOBS A YEAR"
http://www.telegraph.co.uk/news/2016/12/24/one-dead-dozens-injured-new-zealand-bus-crash-onchristmas-eve/,General,24/12/2016-18:30:08,"ONE DEAD, DOZENS INJURED IN NEW ZEALAND BUS CRASH ON CHRISTMAS EVE"
http://www.reuters.com/article/us-usa-crime-starvation-idUSKBN14D0G6,General,24/12/2016-18:30:08,"PENNSYLVANIA PARENTS ACCUSED OF STARVING, ABUSING THREE CHILDREN"
http://www.cnn.com/2016/12/23/health/college-course-white-controversy-irpt-trnd,General,24/12/2016-18:30:08,SCHOOL DEFENDS 'PROBLEM OF WHITENESS' COURSE
http://www.msn.com/en-us/news/world/celebrated-afghan-woman-pilot-requests-asylum-in-us/ar-BBxw1wv?li=BBmkt5R&ocid=spartandhp,General,24/12/2016-18:30:08,CELEBRATED AFGHAN WOMAN PILOT REQUESTS ASYLUM IN U.S.
http://www.abcfoxmontana.com/story/34125544/armed-protest-planned-for-whitefish,General,24/12/2016-18:30:08,ARMED PROTEST PLANNED FOR WHITEFISH
http://www.wdrb.com/story/34123704/cornbread-mafia-fugitive-found-in-canada-after-nearly-a-decade,General,24/12/2016-18:30:08,'CORNBREAD MAFIA' FUGITIVE FOUND IN CANADA AFTER NEARLY A DECADE
http://www.reuters.com/article/us-philippines-blast-idUSKBN14D0GE,General,24/12/2016-18:30:10,SIXTEEN HURT IN CHRISTMAS EVE BLAST AT CATHOLIC CHURCH IN PHILIPPINES
http://talkasia.net/2016/12/24/woman-arrested-for-giving-birth-to-illegitimate-baby-in-uae/,General,24/12/2016-18:30:10,WOMAN ARRESTED FOR GIVING BIRTH TO ‘ILLEGITIMATE’ BABY IN UAE
https://apnews.com/eb9d904e19924f97a0ef855f8c0ab7f9/Coroner:-Baby-died-days-after-parents'-suspected-overdoses,General,24/12/2016-18:30:10,BABY DIES DAYS AFTER PARENTS' SUSPECTED DRUG OVERDOSE DEATHS
http://www.foxnews.com/world/2016/12/24/order-malta-to-pope-francis-stay-out-our-internal-affairs.html,General,24/12/2016-18:30:10,ORDER OF MALTA TO POPE FRANCIS: STAY OUT OF OUR INTERNAL AFFAIRS
http://www.nbcphiladelphia.com/news/local/Strong-Sulfur-Odor-Sweeps-Through-Philadelphia-408111585.html,General,24/12/2016-18:30:10,SULFUR STENCH ENVELOPS PHILLY AREA AFTER ADDITIVE MISHAP
https://www.yahoo.com/news/pennsylvania-parents-accused-starving-abusing-three-children-170116833.html,General,24/12/2016-18:30:10,"PENNSYLVANIA PARENTS ACCUSED OF STARVING, ABUSING THREE CHILDREN"
https://www.washingtonpost.com/news/morning-mix/wp/2016/12/23/four-sentenced-in-almost-indescribable-kidnapping-torture-of-n-y-college-students/?utm_term=.7a2e95dc58d1,General,24/12/2016-18:30:10,"FOUR SENTENCED IN ‘ALMOST INDESCRIBABLE’ KIDNAPPING, TORTURE OF N.Y. COLLEGE STUDENTS"
http://www.couriermail.com.au/news/queensland/crime-and-justice/queensland-crime-man-tortured-for-20-hours-after-trying-to-buy-motorcycle/news-story/abea7eda12e9b879e8416fcc74b717bf,General,24/12/2016-18:30:10,QUEENSLAND CRIME: MAN TORTURED FOR 20 HOURS AFTER TRYING TO BUY MOTORCYCLE
http://www.bbc.com/news/world-us-canada-38429496?ns_mchannel=social&ns_campaign=bbc_breaking&ns_source=twitter&ns_linkname=news_central,General,24/12/2016-18:30:10,TRUMP TO DISSOLVE CONTROVERSIAL CHARITY
http://www.city-journal.org/html/ferguson-effect-lives-14919.html,General,24/12/2016-18:30:10,"THE FERGUSON EFFECT LIVES ON. VIOLENCE IN AMERICAN CITIES ROSE AGAIN IN 2016, AS COPS BACKED OFF PROACTIVE POLICING."
http://www.npr.org/2016/12/23/506653136/radios-diane-rehm-a-mainstay-of-civil-discourse-signs-off,General,24/12/2016-18:30:10,"AFTER 38 YEARS ON NPR, DIANE REHM AIRS HER LAST BROADCAST TODAY"
http://www.nbclosangeles.com/news/national-international/Police-Officers-2-Year-Old-Son-Shot-Himself-With-Dads-Gun--408066305.html?_osource=SocialFlowTwt_LABrand,General,24/12/2016-18:30:10,POLICE: OFFICER'S 2-YEAR-OLD SON SHOT HIMSELF WITH DAD'S GUN
http://www.rrstar.com/news/20161224/3-children-1-dog-found-dead-in-rockford-house-fire,General,24/12/2016-18:30:10,"3 CHILDREN, 1 DOG FOUND DEAD IN ROCKFORD HOUSE FIRE"
http://www.wtsp.com/news/health/holiday-stressers-cause-spike-in-heart-attacks/377652321,General,24/12/2016-18:30:10,HOLIDAY STRESSORS CAUSE SPIKE IN HEART ATTACKS
http://www.reuters.com/article/us-hedgefunds-platinum-idUSKBN14D0FP?il=0,General,24/12/2016-18:30:10,PLATINUM PARTNERS ARRESTS ARE SCANT CONSOLATION FOR ALLEGED VICTIMS
http://www.katc.com/story/34127000/baton-rouge-man-gets-51-months-for-threatening-monroe-judge,General,24/12/2016-18:30:10,BATON ROUGE MAN GETS 51 MONTHS FOR THREATENING MONROE JUDGE
http://www.cbsnews.com/news/drug-overdose-deaths-heroin-opioid-prescription-painkillers-more-than-guns/,General,24/12/2016-18:30:10,DRUG OVERDOSES NOW KILL MORE AMERICANS THAN GUNS.
http://www.taiwannews.com.tw/en/news/3057566,General,24/12/2016-18:30:10,TAIWAN TELLS SCHOOL TO APOLOGIZE TO ISRAEL OVER NAZI UNIFORMS
http://www.dailynews.com/health/20161223/more-measles-cases-in-la-county-reported-health-officials-declare-outbreak,General,24/12/2016-18:30:10,"MORE MEASLES CASES IN LA COUNTY REPORTED, HEALTH OFFICIALS DECLARE OUTBREAK."
https://www.airforcetimes.com/articles/wyche-squadron-commander-reassigned,General,24/12/2016-18:30:10,SQUADRON COMMANDER REASSIGNED AFTER CHIEF'S DRUNK DRIVING ARREST
http://www.fox25boston.com/news/zamboni-crashes-at-boston-winter-skating-rink/478435556,General,24/12/2016-18:30:10,ZAMBONI CRASH THROUGH FENCE AND DOWN THE STAIRS
http://www.cbc.ca/news/canada/north/wrapping-paper-famine-hits-yellowknife-just-before-christmas-1.3911686,General,24/12/2016-18:30:10,WRAPPING PAPER SHORTAGE IN THE NORTH
http://www.reuters.com/article/us-usa-weather-idUSKBN14C0NL,General,24/12/2016-18:30:10,SNOW STORM BEARS DOWN ON WESTERN U.S. AS HOLIDAY TRAVELERS HIT THE ROADS
http://www.telegraph.co.uk/news/2016/12/23/fbi-warns-islamic-state-targeting-us-churches-holiday-gatherings/,General,24/12/2016-18:30:10,FBI WARNS ISLAMIC STATE TARGETING US CHURCHES AND HOLIDAY GATHERINGS
http://www.seattlepi.com/news/education/article/Lawsuit-Washington-teacher-had-sex-with-10817481.php,General,24/12/2016-18:30:10,LAWSUIT: WASHINGTON TEACHER HAD SEX WITH 18-YEAR-OLD STUDENT
http://www.mlive.com/news/index.ssf/2016/12/why_nestle_pays_next_to_nothin.html,General,24/12/2016-18:30:12,WHY NESTLE PAYS NEXT TO NOTHING FOR MICHIGAN GROUNDWATER
https://www.thestar.com/news/world/2016/12/23/libyan-plane-carrying-118-hijacked-and-diverted-to-malta-reports.html,General,24/12/2016-18:30:12,HIJACKERS SURRENDER AFTER RELEASING HOSTAGES AT MALTA AIRPORT | TORONTO STAR
http://www.aljazeera.com/news/2016/12/passes-resolution-israeli-settlements-161223192709807.html,General,24/12/2016-18:30:12,UN PASSES RESOLUTION ON ENDING ISRAELI SETTLEMENTS. 14 UN SECURITY COUNCIL MEMBERS VOTE IN FAVOUR AS US ABSTAINS IN DEMANDING ISRAEL HALT SETTLEMENTS ON PALESTINIAN LAND.
http://amp.timeinc.net/time/4617295/china-smog-smoking-environment-air-pollution/?source=dam,General,24/12/2016-18:30:12,"CHINA’S SMOG MAY BE RESPONSIBLE FOR 1 IN 3 DEATHS IN THE COUNTRY, NEW RESEARCH SUGGESTS"
http://www.abc15.com/news/crime/isis-sympathizer-in-phoenix-was-plotting-a-lone-wolf-attack,General,24/12/2016-18:30:12,ISIS SYMPATHIZER IN PHOENIX WAS PLOTTING A LONE WOLF ATTACK
http://abcnews.go.com/US/wireStory/appeals-court-tosses-life-sentence-15-theft-44373388,General,24/12/2016-18:30:12,APPEALS COURT TOSSES LIFE SENTENCE FOR $15 THEFT
https://www.theguardian.com/business/2016/dec/22/bitcoin-circulation-hits-record-high-of-14bn,General,24/12/2016-18:30:12,VALUE OF BITCOINS IN CIRCULATION HITS RECORD HIGH OF $14BN
http://www.fox5atlanta.com/news/225350409-story?utm_source=dlvr.it&utm_medium=twitter,General,24/12/2016-18:30:12,RIC FLAIR SWORN IN AS CLAYTON COUNTY DEPUTY
http://www.essex-fire.gov.uk/incidents/i6422/#585e359b33e06,General,24/12/2016-18:30:12,FATAL HOUSE FIRE - A REMINDER TO OTHERS TAKE CARE WITH CANDLES THIS TIME OF YEAR.
http://www.borderlandbeat.com/2016/12/10-years-of-mexicos-war-on-drugs-in.html,General,24/12/2016-18:30:12,"10 YEARS OF MEXICO'S WAR ON DRUGS, 150000+ DEAD"
http://www.cnbc.com/2016/12/23/fbi-probes-fdic-hack-linked-to-chinas-military-sources.html,General,24/12/2016-18:30:12,FBI PROBES FDIC HACK LINKED TO CHINA'S MILITARY: SOURCES
http://www.timesofisrael.com/choosing-not-to-veto-obama-lets-anti-settlement-resolution-pass-at-un-security-council/,General,24/12/2016-18:30:12,"CHOOSING NOT TO VETO, OBAMA LETS ANTI-SETTLEMENT RESOLUTION PASS AT UN SECURITY COUNCIL"
http://www.myrtlebeachonline.com/news/local/article122828784.html,General,24/12/2016-18:30:12,COMMUNITY MOURNS THREE TEENAGE GIRLS KILLED IN BAY ROAD CRASH
http://www.cbsnews.com/news/gene-anthony-quinones-rivera-cops-dad-admits-killing-infant-leaving-body-in-woods/,General,24/12/2016-18:30:12,"COPS: DAD CONFESSES TO KILLING INFANT, LEAVING BODY IN WOODS"
http://www.9news.com/ext/news/nation-now/fbi-exgymnastics-team-doctor-had-37k-child-porn-images/73/6MXgbPUFckiOosWEo6SOGa,General,24/12/2016-18:30:12,FBI: EX-GYMNASTICS TEAM DOCTOR HAD 37K CHILD PORN IMAGES
http://www.latimes.com/local/lanow/la-me-ln-shasta-gas-station-burned-20161223-story.html,General,24/12/2016-18:30:12,KILLER DOUSED GAS STATION CLERK IN FLAMMABLE LIQUID AND THEN BURNED HIM
https://gma.yahoo.com/suspect-road-rage-killing-3-old-boy-said-220104775--abc-news-topstories.html#,General,24/12/2016-18:30:12,SUSPECT IN ROAD RAGE KILLING OF 3-YEAR-OLD BOY SAID CAR WAS FOLLOWING TOO CLOSE
http://www.sfgate.com/crime/article/Family-of-Oakland-Ghost-Ship-fire-victim-to-file-10816035.php,General,24/12/2016-18:30:12,FAMILIES OF 2 OAKLAND WAREHOUSE FIRE VICTIMS FILE 1ST LAWSUITS
http://pix11.com/2016/12/22/police-find-55-pounds-of-fentanyl-in-traffic-stop-in-connecticut/,General,24/12/2016-18:30:12,POLICE FIND 55 POUNDS OF FENTANYL IN TRAFFIC STOP IN CONNECTICUT.
http://www.9news.com/news/local/report-finds-blacks-disproportionately-arrested-in-colorado/377386544,General,24/12/2016-18:30:12,REPORT FINDS BLACKS DISPROPORTIONATELY ARRESTED IN COLORADO
http://abc7news.com/news/first-civil-lawsuits-filed-in-ghost-ship-warehouse-fire--/1670353/,General,24/12/2016-18:30:12,FIRST CIVIL LAWSUITS FILED IN OAKLAND GHOST SHIP WAREHOUSE FIRE
http://www.espn.com/nfl/story/_/id/18341736/minnesota-vikings-plane-skids-runway-safe-landing,General,24/12/2016-18:30:12,MINNESOTA VIKINGS PLANE SLIDES OFF RUNWAY
https://fee.org/articles/at-new-highs-bitcoin-is-a-global-safe-haven-asset/,General,24/12/2016-18:30:12,"AT NEW HIGHS, BITCOIN IS A GLOBAL SAFE HAVEN ASSET | FEE"
http://www.usatoday.com/story/news/nation-now/2016/12/21/4-bodies-nicholas-tartaglione/95687736/,General,24/12/2016-18:30:12,4 BODIES FOUND AT PROPERTY OF RETIRED N.Y. COP
http://abcnews.go.com/Entertainment/wireStory/backlash-kicked-rockettes-picked-inauguration-44367911,General,24/12/2016-18:30:12,ROCKETTES' OWNERS SAY ATTENDANCE AT INAUGURATION IS A CHOICE
https://apnews.com/f8e9d98928db41d18f3f12385a3cb0b2,General,24/12/2016-18:30:14,"OBAMA SIGNS DEFENSE POLICY BILL, OBJECTS ON GUANTANAMO"
http://www.stripes.com/news/us/beale-afb-officials-mum-on-outcome-of-court-martial-over-rape-allegations-1.445987,General,24/12/2016-18:30:14,BEALE AFB OFFICIALS MUM ON OUTCOME OF COURT MARTIAL OVER RAPE ALLEGATIONS
http://www.wbtv.com/story/34109723/revised-mo-statute-increases-punishment-on-grade-school-fights,General,24/12/2016-18:30:14,"NEW MISSOURI LAW MAKES GRADE SCHOOL FIGHTS A FELONY, RESULTING IN UP TO A 4 YEAR SENTENCE"
https://www.washingtonpost.com/national/for-women-heavy-drinking-has-been-normalized-thats-dangerous/2016/12/23/0e701120-c381-11e6-9578-0054287507db_story.html?hpid=hp_hp-top-table-main_bigvino-12pm%3Ahomepage%2Fstory&utm_term=.772bfab26cd0,General,24/12/2016-18:30:14,"FOR WOMEN, HEAVY DRINKING HAS BEEN NORMALIZED. THAT’S DANGEROUS."
https://www.yahoo.com/gma/tennessee-couple-dies-just-hours-apart-nearly-64-045539728--abc-news-topstories.html#,General,24/12/2016-18:30:14,COUPLE DIES HOURS APART AFTER 64 YEARS OF MARRIAGE
http://www.nbcnews.com/news/us-news/ex-lottery-security-chief-charged-rigging-wisconsin-jackpot-n699556,General,24/12/2016-18:30:14,EX-LOTTERY SECURITY CHIEF CHARGED WITH RIGGING WISCONSIN JACKPOT
https://www.theguardian.com/world/live/2016/dec/23/berlin-market-attack-suspect-anis-amri-killed-in-milan-reports-say-live-coverage,General,24/12/2016-18:30:14,"BERLIN MARKET ATTACK SUSPECT KILLED IN MILAN, REPORTS SAY"
http://www.omaha.com/news/crime/man-dies-after-being-shot-during-suspected-robbery-at-millard/article_5e6abef0-c96c-11e6-8e50-138ef248854d.html,General,24/12/2016-18:30:14,2 MEN WEARING CLOWN MASK GUN DOWN OMAHA MAN IN ATTEMPTED ROBBERY.
http://abc11.com/news/reports-of-multiple-people-shot-and-killed-in-wilson-county/1671884/,General,24/12/2016-18:30:14,FOUR PEOPLE SHOT AND KILLED IN WILSON COUNTY
http://www.cnn.com/videos/tv/2016/12/23/fbi-issues-warning-on-isis-threats-in-u-s-lead-perez-live.cnn,General,24/12/2016-18:30:14,FBI WARNS ABOUT ISIS THREAT TO CHURCHES
https://www.yahoo.com/news/teddy-bear-takes-detroit-airport-adventure-being-found-165438396.html,General,24/12/2016-18:30:14,TEDDY BEAR TAKES DETROIT AIRPORT ADVENTURE AFTER BEING FOUND
http://www.cnbc.com/2016/12/22/the-biggest-hedge-fund-in-the-world-is-creating-a-secret-algorithm-to-automate-management.html,General,24/12/2016-18:30:14,THE WORLD'S BIGGEST HEDGE FUND IS CREATING A SECRET ALGORITHM TO AUTOMATE MANAGEMENT
https://www.yahoo.com/news/brazil-sees-murders-soar-rio-drop-sao-paulo-184146886.html,General,24/12/2016-18:30:14,"HOMICIDES CLAIMED MORE LIVES IN BRAZIL FROM 2011 TO 2015 THAN THE SYRIAN CIVIL WAR DURING THE SAME PERIOD, ACCORDING TO THE BRAZILIAN PUBLIC SECURITY FORUM: 278,839 FOR BRAZIL, AGAINST 256,124 IN SYRIA."
http://bigstory.ap.org/article/1c2e6b52f237492bbbe8ca25a3cf5e56/california-pursues-new-pimping-charges-against-backpagecom,General,24/12/2016-18:30:14,CALIFORNIA PURSUES NEW PIMPING CHARGES AGAINST BACKPAGE.COM
http://www.independent.co.uk/news/world/americas/pregnant-waitress-900-tip-christmas-arizona-sarah-clark-a7493246.html,General,24/12/2016-18:30:14,PREGNANT WAITRESS GETS $900 TIP JUST DAYS BEFORE CHRISTMAS
http://www.cbc.ca/news/canada/newfoundland-labrador/stjohns-looks-for-more-cardboard-to-be-recycled-1.3909248,General,24/12/2016-18:30:14,"'TIS THE SEASON TO RECYCLE? ST. JOHN'S LAUNCHES #DEBOXINGDAY - NEWFOUNDLAND & LABRADOR, CANADA"
http://bigstory.ap.org/article/35acbb4e1d334d35b4cc0db05be6dec8/alaskas-bogoslof-volcano-aleutian-islands-erupts-again,General,24/12/2016-18:30:14,ALASKA'S BOGOSLOF VOLCANO IN ALEUTIAN ISLANDS ERUPTS AGAIN
https://www.cnet.com/news/worlds-first-solar-road-opens-in-france/,General,24/12/2016-18:30:14,WORLD'S FIRST SOLAR ROAD OPENS IN FRANCE
https://www.hrw.org/news/2016/12/23/yemen-brazil-made-cluster-munitions-harm-civilians,General,24/12/2016-18:30:14,YEMEN: BRAZIL-MADE CLUSTER MUNITIONS HARM CIVILIANS
http://www.livescience.com/57298-worlds-oldest-gorilla-turns-60.html?,General,24/12/2016-18:30:14,THE FIRST GORILLA BORN IN HUMAN CARE TURNED 60 TODAY (DEC. 22) AT HER HOME IN THE COLUMBUS ZOO AND AQUARIUM IN OHIO.
http://www.foxnews.com/us/2016/12/22/video-shows-texas-officer-forcibly-arresting-woman-daughter.html,General,24/12/2016-18:30:14,"TEXAS OFFICER ON RESTRICTED DUTY AFTER VIDEO SHOWS FORCIBLE ARRESTS OF MOTHER, DAUGHTER"
http://www.bbc.co.uk/news/world-us-canada-38423942,General,24/12/2016-18:30:14,TRUMP OFFICIAL PALADINO UNDER FIRE OVER CRUDE OBAMA REMARKS
https://financialtribune.com/articles/economy-business-and-markets/56003/private-sector-integral-to-sustainable-economic-growth,General,24/12/2016-18:30:14,PRIVATE SECTOR INTEGRAL TO SUSTAINABLE ECONOMIC GROWTH
http://www.npr.org/sections/thetwo-way/2016/12/22/506629695/trump-team-asks-state-dept-to-name-those-working-on-gender-equality,General,24/12/2016-18:30:14,TRUMP TEAM ASKS STATE DEPT. TO NAME THOSE WORKING ON GENDER EQUALITY
http://www.detroitnews.com/story/news/local/michigan/2016/12/21/snyder-signs-historic-energy-plan-law/95705658/,General,24/12/2016-18:30:14,MICHIGAN PASSES LAW REQUIRING UTILITIES TO BUY OR PRODUCE AT LEAST 15 PERCENT OF THEIR ENERGY FROM RENEWABLE SOURCES BY 2022
http://www.aljazeera.com/news/2016/12/egypt-arrests-al-jazeera-news-producer-vacation-161223171209633.html,General,24/12/2016-18:30:16,EGYPT ARRESTS AL JAZEERA NEWS PRODUCER DURING VACATION. SECURITY OFFICIALS SAY MAHMOUD HUSSEIN IS ACCUSED OF ATTEMPTING TO OVERTHROW PRESIDENT ABDEL FATAH EL-SISI'S GOVERNMENT.
http://www.csmonitor.com/World/Making-a-difference/2016/1222/This-woman-has-helped-more-than-4-500-disabled-people-get-jobs,General,24/12/2016-18:30:16,"THIS WOMAN HAS HELPED MORE THAN 4,500 DISABLED PEOPLE GET JOBS"
http://www.cbc.ca/news/canada/montreal/dog-meat-montreal-saved-1.3910596,General,24/12/2016-18:30:16,"SAVED FROM DOG MEAT FESTIVAL, 37 DOGS EN ROUTE TO MONTREAL"
http://www.wifr.com/content/news/Roscoe-boys-unusual-Christmas-wish-catches-the-attention-of-Gustafsons-Furniture-407974845.html,General,24/12/2016-18:30:16,AUTISTIC ROSCOE BOY'S UNUSUAL CHRISTMAS WISH CATCHES THE ATTENTION OF GUSTAFSON'S FURNITURE
http://www.cantonrep.com/news/20161221/stark-man-guilty-of-tainting-womans-orange-juice,General,24/12/2016-18:30:16,MAN MASTURBATES IN WOMAN'S BOTTLE OF ORANGE JUICE. CAUGHT ON SECURITY CAMERA.
http://www.seattletimes.com/seattle-news/environment/another-puget-sound-killer-whale-dies-5th-in-past-year/,General,24/12/2016-18:30:16,ANOTHER PUGET SOUND ORCA DIES — 5TH IN A YEAR
https://www.washingtonpost.com/news/to-your-health/wp/2016/12/22/can-a-hearing-test-identify-a-concussion/,General,24/12/2016-18:30:16,A HEARING TEST MAY BE ABLE TO IDENTIFY A CONCUSSION
http://www.digitaltrends.com/cars/uber-moves-autonomous-cars-to-az-news-details-quotes/,General,24/12/2016-18:30:16,UBER MOVES ITS SELF-DRIVING CARS TO ARIZONA TO ESCAPE CALIFORNIA REGULATORS
https://www.thelocal.de/20161223/live-police-believe-suspect-amri-still-in-berlin-report,General,24/12/2016-18:30:16,ISIS RELEASE VIDEO OF ANIS AMRI SWEARING THEM HIS ALLEGIANCE
https://www.washingtonpost.com/local/public-safety/a-street-sale-of-jordan-shoes-erupts-in-gunfire/2016/11/16/ab866814-ac0d-11e6-a31b-4b6397e625d0_story.html?utm_term=.adf0a6ed1884,General,24/12/2016-18:30:16,A STREET SALE OF JORDAN SHOES ERUPTS IN GUNFIRE
http://www.nzherald.co.nz/world/news/article.cfm?c_id=2&objectid=11772679,General,24/12/2016-18:30:16,"RUSSIAN MAN DRIVES INTO AIRPORT, SAYS HE DID IT FOR LOVE"
http://nbc4i.com/2016/12/23/cleveland-police-officers-2-year-old-son-dies-after-shooting-himself/,General,24/12/2016-18:30:16,CLEVELAND POLICE OFFICER'S 2-YEAR-OLD SON DIES AFTER REPORTEDLY SHOOTING HIMSELF WITH FATHER’S SERVICE WEAPON
http://www.chron.com/news/us/article/The-Latest-Trucker-in-standoff-at-Missouri-rest-10815811.php,General,24/12/2016-18:30:16,THE LATEST: TRUCKER ARRESTED AFTER MISSOURI FREEWAY STANDOFF
http://www.king5.com/tech/science/environment/drone-video-shows-orcas-killing-shark/376306698,General,24/12/2016-18:30:16,DRONE VIDEO SHOWS ORCAS KILLING SHARK
http://www.belfasttelegraph.co.uk/news/world-news/black-man-daryl-davis-convinces-200-ku-klux-klansmen-to-leave-white-supremacist-group-by-befriending-them-35315250.html,General,24/12/2016-18:30:16,BLACK MAN DARYL DAVIS CONVINCES 200 KU KLUX KLANSMEN TO LEAVE WHITE SUPREMACIST GROUP BY BEFRIENDING THEM
http://www.msn.com/en-us/money/markets/meet-the-chinese-billionaire-whos-moving-manufacturing-to-the-us-to-cut-costs/ar-BBxr39m?li=BBmkt5R&ocid=spartandhp,General,24/12/2016-18:30:16,MEET THE CHINESE BILLIONAIRE WHO'S MOVING MANUFACTURING TO THE U.S. TO CUT COSTS
http://porashuna.net/jsc-result-2016-bangladesh/,General,24/12/2016-18:30:16,JSC RESULT 2016 WILL BE PUBLISHED WITHIN FEW DAYS
http://ktla.com/2016/12/23/husband-suspected-of-slitting-throats-of-wife-infant-son-at-texas-home-arrested-in-colorado/,General,24/12/2016-18:30:16,"HUSBAND SUSPECTED OF SLITTING THROATS OF WIFE, INFANT SON AT TEXAS HOME ARRESTED IN COLORADO"
http://www.usatoday.com/story/money/2016/12/21/mcdonalds-sued-because-extra-value-meal-41-cents-more/95697780/,General,24/12/2016-18:30:16,MCDONALD'S SUED BECAUSE 'EXTRA VALUE MEAL' IS 41 CENTS MORE
http://www.reuters.com/article/us-usa-cyber-china-exclusive-idUSKBN14C1UJ?feedType=RSS&feedName=topNews&utm_source=twitter&utm_medium=Social,General,24/12/2016-18:30:16,"THE FBI IS INVESTIGATING HOW HACKERS INFILTRATED COMPUTERS AT THE FEDERAL DEPOSIT INSURANCE CORPORATION FOR SEVERAL YEARS BEGINNING IN 2010 IN A BREACH SENIOR FDIC OFFICIALS BELIEVE WAS SPONSORED BY CHINA'S MILITARY, PEOPLE WITH KNOWLEDGE OF THE MATTER SAID."
http://bigstory.ap.org/article/e07057c8e863431abf7472d8da0e11a0/after-online-threats-gaming-engineer-plans-run-congress,General,24/12/2016-18:30:16,"AFTER ONLINE THREATS, GAMING ENGINEER PLANS RUN FOR CONGRESS"
http://www.timesofmalta.com/articles/view/20161223/local/hijacked-libyan-plane-lands-in-malta.634664,General,24/12/2016-18:30:16,'HIJACKED' LIBYAN PLANE LANDS IN MALTA
http://arstechnica.com/science/2016/12/medical-marijuana-laws-linked-to-fewer-fatal-car-crashes/,General,24/12/2016-18:30:16,STATES THAT ENACT MEDICAL MARIJUANA LAWS SEE DIPS IN FATAL CAR CRASHES
http://www.cbc.ca/beta/news/canada/prince-edward-island/excavator-stops-driver-1.3910172,General,24/12/2016-18:30:16,"DRUNK DRIVER IN CANADA STOPPED BY MAN IN EXCAVATOR, HELD UNTIL POLICE ARRIVED"
http://www.foxnews.com/health/2016/12/23/oklahoma-mom-says-was-shamed-for-using-handicap-spot-while-carrying-disabled-son.html,General,24/12/2016-18:30:16,OKLAHOMA MOM SAYS SHE WAS SHAMED FOR USING HANDICAP SPOT WHILE CARRYING DISABLED SON
http://earthquake.usgs.gov/earthquakes/eventpage/us10007mbu#map,General,24/12/2016-18:30:18,"4.5 EARTHQUAKE IN CIMARRON, NEW MEXICO"
http://woodtv.com/2016/12/23/gov-rick-snyder-signs-law-authorizing-michigan-wolf-hunting/,General,24/12/2016-18:30:18,GOV. RICK SNYDER SIGNS LAW AUTHORIZING MICHIGAN WOLF HUNTING
