url,type,timeretrieved,title
http://www.vox.com/identities/2016/12/22/14053596/north-carolina-hb2-lgbtq-legislature,Politics,22/12/2016-19:38:17,NORTH CAROLINA REPUBLICANS JUST CHOSE ANTI-LGBTQ DISCRIMINATION OVER JOBS FOR THEIR CONSTITUENTSGERMANLOPEZ
http://www.msnbc.com/morning-joe/watch/more-gop-ers-favor-putin-than-obama-poll-839304771958?cid=sm_fb_msnbc,Politics,22/12/2016-19:38:17,MORE REPUBLICANS FAVOR PUTIN THAN OBAMA (NEW POLL)CHEWYLOUIS
http://money.cnn.com/2016/12/22/investing/goldman-sachs-stock-trump-rally/index.html?utm_source=feedburner&utm_medium=feed&utm_campaign=Feed%3A+rss%2Fmoney_latest+%28CNNMoney%3A+Latest+News%29,Politics,22/12/2016-19:38:17,GOLDMAN SACHS ACCOUNTS FOR 24% OF DOW'S SPECTACULAR TRUMP RALLYTHE_BUDDHAVERSE
http://thehill.com/blogs/floor-action/house/311400-dems-propose-sanctions-for-foreign-election-meddling,Politics,22/12/2016-19:38:17,DEMOCRATIC LEGISLATORS HAVE INTRODUCED A BILL THAT WOULD IMPOSE SANCTIONS ON FOREIGN ENTITIES THAT TRY TO INTERFERE IN U.S. ELECTIONS.INTERESTEDIN86
http://www.deathandtaxesmag.com/311664/twitter-needs-shut-down-trump-account-avoid-war/,Politics,22/12/2016-19:38:17,TWITTER NEEDS TO SHUT DOWN TRUMP’S ACCOUNT TO AVOID A WARJKINS20
https://thinkprogress.org/the-texas-health-department-is-spreading-blatant-falsehoods-about-abortion-risks-c28e12b12bf3#.dqlh2vf7l,Politics,22/12/2016-19:38:17,TEXAS SAYS ABORTIONS INCREASE THE RISK OF CANCER AND MENTAL ILLNESS. THAT’S NOT TRUE.STRICTSCRUTINY
https://thinkprogress.org/north-carolina-republicans-failed-to-repeal-hb2-theyre-blaming-everybody-but-themselves-bbfcacb86372#.fgmryfulg,Politics,22/12/2016-19:38:17,NORTH CAROLINA REPUBLICANS FAILED TO REPEAL HB2. THEY’RE BLAMING EVERYBODY BUT THEMSELVES.PENTIJING
http://www.npr.org/sections/thetwo-way/2016/12/22/506629695/trump-team-asks-state-dept-to-name-those-working-on-gender-equality,Politics,22/12/2016-19:38:17,TRUMP TEAM ASKS STATE DEPT. TO NAME THOSE WORKING ON GENDER EQUALITYREADERSEVEN
http://www.seattlepi.com/news/education/article/White-nationalists-raise-millions-with-tax-exempt-10812770.php,Politics,22/12/2016-19:38:17,WHITE NATIONALISTS RAISE MILLIONS WITH TAX-EXEMPT CHARITIESRIDEO
https://www.washingtonpost.com/news/wonk/wp/2016/12/21/under-obamacare-fewer-people-skipped-doctors-visits-due-to-cost/,Politics,22/12/2016-19:38:17,"UNDER OBAMACARE, FEWER PEOPLE SKIPPED DOCTORS’ VISITS BECAUSE OF COSTCRACKIE_CHAN"
http://www.dailywire.com/news/11805/watch-huckabee-defends-trumps-1-trillion-spending-frank-camp,Politics,22/12/2016-19:38:17,WATCH: HUCKABEE DEFENDS TRUMP'S $1 TRILLION SPENDING PACKAGE. HE CONDEMNED OBAMA'S PLAN. WHAT'S THE DIFFERENCE?DEYOUNGREPUBLICANS
http://www.salon.com/2016/12/22/trump-corruption-fail-eric-trumps-pre-inauguration-pay-for-play-scheme-collapses/,Politics,22/12/2016-19:38:17,TRUMP CORRUPTION FAIL: ERIC TRUMP’S PRE-INAUGURATION PAY-FOR-PLAY SCHEME COLLAPSESTBDIV
https://www.washingtonpost.com/news/josh-rogin/wp/2016/12/22/trump-team-asked-state-department-for-info-on-womens-issues-programs-stoking-fears-of-another-witch-hunt/?utm_term=.a735f60aa475,Politics,22/12/2016-19:38:17,"TRUMP TEAM ASKED STATE DEPARTMENT FOR INFO ON WOMEN’S ISSUES PROGRAMS, SPARKING FEARS OF ANOTHER WITCH HUNTARC1ZD"
https://apnews.com/760b4159000b4a1cb1901cb038021cea,Politics,22/12/2016-19:38:17,AP: ERIC TRUMP FOUNDATION FLOUTS CHARITY STANDARDSTRIFECTA
http://www.lgbtqnation.com/2016/12/mike-pences-hometown-bans-controversial-pride-banners-town-square/,Politics,22/12/2016-19:38:17,MIKE PENCE'S HOMETOWN BANS 'CONTROVERSIAL' PRIDE BANNERS FROM TOWN SQUAREQU1NLAN
http://www.newsweek.com/donald-trump-expand-upgrade-nukes-535381,Politics,22/12/2016-19:38:17,DONALD TRUMP: EXPAND NUKES UNTIL 'WORLD COMES TO ITS SENSES'THERECORDCORRECTED
http://www.npr.org/2016/12/21/506302106/journalist-trump-seems-willfully-blind-to-putin-s-real-goals,Politics,22/12/2016-19:38:17,JOURNALIST: TRUMP SEEMS 'WILLFULLY BLIND' TO PUTIN'S REAL GOALSWRAITHTEK
http://www.politico.com/story/2016/12/joe-biden-202-trump-232318,Politics,22/12/2016-19:38:17,BIDEN ON 2020: 'TRUMP’S GONNA BE 74 — I’LL BE 77 AND IN BETTER SHAPE'THELAZYREADER2015
https://talkingpointsmemo.com/livewire/trump-hhs-pick-said-medicare-phaseout-would-pass-next-summer/,Politics,22/12/2016-19:38:17,TRUMP HHS PICK SAID MEDICARE PHASEOUT WOULD PASS NEXT SUMMERTRUMPWEED_
http://edition.cnn.com/2016/12/21/politics/donald-trump-tariffs/index.html?sr=twcnni122216donald-trump-tariffs0905PMVODtopLink&linkId=32684853,Politics,22/12/2016-19:38:17,TRUMP TEAM FLOATS A 10% TARIFF ON IMPORTSJULIAROBART
http://thehill.com/homenews/campaign/311525-gingrich-i-goofed-when-i-said-trump-doesnt-want-to-drain-the-swamp,Politics,22/12/2016-19:38:17,"GINGRICH ADMITS 'BOO-BOO,' SAYS 'DRAINING THE SWAMP IS IN'WYLDCAT"
http://www.msnbc.com/hardball/watch/republicans-fear-backlash-if-they-oppose-trump-838979651748,Politics,22/12/2016-19:38:17,REPUBLICANS FEAR BACKLASH IF THEY OPPOSE TRUMPWITTYNAME83
https://www.washingtonpost.com/local/virginia-politics/trump-vineyard-seeks-labor-department-approval-to-hire-foreign-workers/2016/12/22/f320bea8-c86a-11e6-8bee-54e800ef2a63_story.html?postshare=6921482444091571&tid=ss_tw-bottom&utm_term=.849419a78c03,Politics,22/12/2016-19:38:17,TRUMP VINEYARD SEEKS LABOR DEPARTMENT APPROVAL TO HIRE FOREIGN WORKERSTINYASSGIRAFFE
http://thehill.com/blogs/blog-briefing-room/news/311461-saddam-husseins-daughter-praises-donald-trump,Politics,22/12/2016-19:38:17,SADDAM HUSSEIN'S DAUGHTER PRAISES DONALD TRUMPWARDSALUD
http://www.bbc.co.uk/news/world-us-canada-38410027,Politics,22/12/2016-19:38:17,TRUMP WANTS EXPANDED NUCLEAR CAPABILITYTIPTUPJOE
http://www.independent.co.uk/news/world/americas/donald-trump-carlos-slim-mexico-meeting-washington-dc-lobbying-firm-drain-swamp-corey-lewandowsk-a7489856.html,Politics,22/12/2016-19:38:18,DONALD TRUMP’S MEETING WITH MEXICO’S RICHEST MAN CARLOS SLIM WAS ‘BROKERED’ BY WASHINGTON DC LOBBYING FIRMINTERESTEDIN86
https://www.thestar.com/news/world/2016/12/22/trump-team-is-full-of-conspiracy-theorists-analysis.html,Politics,22/12/2016-19:38:18,TRUMP TEAM IS FULL OF CONSPIRACY THEORISTS: ANALYSISHELPMEREDDITIMBORED
https://www.bloomberg.com/politics/articles/2016-12-22/trump-says-u-s-nuclear-arsenal-must-be-greatly-expanded,Politics,22/12/2016-19:38:18,TRUMP SAYS U.S. NUCLEAR ARSENAL MUST BE ‘GREATLY’ EXPANDEDJLEW24ASU
http://www.nytimes.com/2016/12/22/us/politics/kellyanne-conway-trump-counselor-president-transition.html,Politics,22/12/2016-19:38:18,"KELLYANNE CONWAY, ‘TRUMP WHISPERER,’ WILL BE COUNSELOR TO PRESIDENTQWERTYYODA"
https://www.japantoday.com/category/world/view/continuing-battle-with-media-trump-avoids-news-conferences,Politics,22/12/2016-19:38:18,"CONTINUING BATTLE WITH MEDIA, TRUMP AVOIDS NEWS CONFERENCESNALOWALE"
http://www.commondreams.org/news/2016/12/21/nearly-half-trump-voters-ready-support-his-attack-free-press,Politics,22/12/2016-19:38:18,NEARLY HALF OF TRUMP VOTERS READY TO SUPPORT HIS ATTACK ON FREE PRESSTRUMPWEED_
http://www.motherjones.com/politics/2016/12/heres-how-deal-repeal-bathroom-bill-collapsed,Politics,22/12/2016-19:38:18,NORTH CAROLINA'S BATHROOM BILL IS STILL ON THE BOOKS BECAUSE REPUBLICANS PULLED A BAIT AND SWITCHDREWIEPOODLE
http://www.politico.com/magazine/story/2016/12/donald-trump-corruptible-214541,Politics,22/12/2016-19:38:18,TRUMP COULD BE THE MOST CORRUPTIBLE PRESIDENT EVERANTINATALISTA
http://time.com/4611452/donald-trump-isis-berlin-islam-extremist-terrorism/,Politics,22/12/2016-19:38:18,DONALD TRUMP IS MAKING TERROR ATTACKS LIKELIER. HERE'S HOWDERPEXPRESS
http://www.nytimes.com/2016/12/21/us/health-exchange-enrollment-jumps-even-as-gop-pledges-repeal.html?smid=re-share,Politics,22/12/2016-19:38:18,"HEALTH EXCHANGE ENROLLMENT JUMPS, EVEN AS G.O.P. PLEDGES REPEALCOOLBERN"
http://www.campaignlegalcenter.org/news/press-releases/trump-super-pac-received-illegal-donations-private-prison-company,Politics,22/12/2016-19:38:18,TRUMP SUPER PAC RECEIVED ILLEGAL DONATIONS FROM PRIVATE PRISON COMPANYCARMAC
http://www.salon.com/2016/12/22/gops-next-battle-against-gay-rights-proposed-first-amendment-defense-act-will-use-religious-freedom-to-legalize-discrimination/,Politics,22/12/2016-19:38:18,GOP’S NEXT BATTLE AGAINST GAY RIGHTS : PROPOSED FIRST AMENDMENT DEFENSE ACT WILL USE “RELIGIOUS FREEDOM” TO LEGALIZE DISCRIMINATIONANTINATALISTA
http://www.politico.com/story/2016/12/poll-democrats-independents-no-hillary-clinton-2020-232898,Politics,22/12/2016-19:38:18,POLL: 62 PERCENT OF DEMOCRATS AND INDEPENDENTS DON'T WANT CLINTON TO RUN AGAINFUTURIST110
http://www.independent.co.uk/voices/russian-hacking-fake-news-clinton-emails-i-was-a-victim-of-a-smear-campaign-a7490521.html,Politics,22/12/2016-19:38:18,I WAS A VICTIM OF A RUSSIAN SMEAR CAMPAIGN – I UNDERSTAND THE POWER OF FAKE NEWSKYLEELLEFSEN
https://www.democracynow.org/2016/12/21/former_labor_sec_robert_reich_slams,Politics,22/12/2016-19:38:18,FORMER LABOR SEC. ROBERT REICH SLAMS TRUMP FOR NOMINATING FAST-FOOD CEO WHO OPPOSES BASIC LABOR LAWSSAIGE_VALENTINA
http://www.huffingtonpost.com/entry/bill-huizenga-health-care-reform_us_585b0513e4b0d9a5945716c2,Politics,22/12/2016-19:38:18,GOP CONGRESSMAN URGES SELF-RATIONING OF HEALTH CARE AFTER OBAMACARE REPEALTHEDEBATEMATTERS
http://www.motherjones.com/politics/2016/12/donald-trump-frightening-tweet-nuclear-weapons,Politics,22/12/2016-19:38:18,THIS MAY BE TRUMP'S MOST FRIGHTENING AND DANGEROUS TWEET YETTWOGEE
http://www.cnbc.com/2016/12/22/trump-nukes-tweet-boeing-commentary.html,Politics,22/12/2016-19:38:18,TRUMP'S NUCLEAR TWEET RAISES QUESTION OF 'QUID PRO QUO' FOR DEFENSE CONTRACTORSSPLITTINGENNUI
http://thehill.com/homenews/campaign/311478-lewandowski-draining-the-swamp-is-among-trumps-lower-priorities,Politics,22/12/2016-19:38:18,LEWANDOWSKI: DRAINING SWAMP A LOWER TRUMP PRIORITYLEFTMARKETANARCHIST
https://www.theatlantic.com/politics/archive/2016/12/the-trumps-learn-to-love-the-swamp/511442,Politics,22/12/2016-19:38:18,DONALD TRUMP LEARNS TO LOVE THE SWAMPQWERTYYODA
http://www.cnn.com/2016/12/22/politics/obama-nseers-arab-muslim-registry/index.html,Politics,22/12/2016-19:38:18,OBAMA ADMINISTRATION ENDING PROGRAM ONCE USED TO TRACK MOSTLY ARAB AND MUSLIM MENINTERN3
http://talkingpointsmemo.com/news/white-nationalist-groups-federally-registered-charities?utm_content=bufferf0946&utm_medium=social&utm_source=twitter.com&utm_campaign=buffer,Politics,22/12/2016-19:38:18,WHITE NATIONALIST GROUPS RAISE MILLIONS WITH TAX-EXEMPT CHARITIESANTINATALISTA
http://www.redstate.com/jimjamitis/2016/12/22/newt-gingrich-humiliated-trump-recommits-hackneyed-swamp-metaphor/,Politics,22/12/2016-19:38:18,NEWT GINGRICH HUMILIATED AS TRUMP RECOMMITS TO HACKNEYED SWAMP METAPHORSHITPOSTER123456789
http://money.cnn.com/2016/12/22/news/economy/us-gdp-third-quarter-last-revision/index.html,Politics,22/12/2016-19:38:18,U.S. ECONOMY GREW STRONG 3.5% IN THIRD QUARTERLEFT-COAST-VOTER
http://www.npr.org/sections/thetwo-way/2016/12/22/504031635/you-say-you-re-an-american-but-what-if-you-had-to-prove-it-or-be-deported,Politics,22/12/2016-19:38:18,"YOU SAY YOU'RE AN AMERICAN, BUT WHAT IF YOU HAD TO PROVE IT OR BE DEPORTED?AKAVIRISNAKE"
https://www.buzzfeed.com/craigsilverman/pro-trump-twitter-trolls-and-merkel?utm_term=.hlaNEVqqKo#.he8bxPyykL,Politics,22/12/2016-19:38:20,RUSSIAN TWITTER TROLLS TURNING ATTENTION TO MERKELBUBBA-NATEP
https://www.bloomberg.com/news/articles/2016-12-22/debrief-obama-says-his-daughters-won-t-work-on-wall-street,Politics,22/12/2016-19:38:20,OBAMA SAYS HIS DAUGHTERS WON’T WORK ON WALL STREETGALT1776
https://www.salon.com/2016/12/22/donald-trumps-budget-directors-fannie-mae-and-freddy-mac-bill-would-socialize-risk-and-privatize-profit/,Politics,22/12/2016-19:38:20,DONALD TRUMP’S BUDGET DIRECTOR’S FANNIE MAE AND FREDDIE MAC BILL WOULD SOCIALIZE RISK AND PRIVATIZE PROFITDY0NISUS
http://www.politico.com/story/2016/12/trump-us-nuclear-capability-232920,Politics,22/12/2016-19:38:20,TRUMP PLEDGES TO 'EXPAND' U.S. NUCLEAR CAPABILITYRIFE170
http://www.huffingtonpost.com/entry/kellyanne-conway-trump-conflict-of-interest_us_585be62ee4b0de3a08f4462e?siq0mq381sfldte29,Politics,22/12/2016-19:38:20,KELLYANNE CONWAY SAYS PEOPLE WILL SUFFER IF TRUMP SONS ARE DISCOURAGED FROM RAISING MONEY FOR CHARITYISTHEREANANSWER1
http://money.cnn.com/2016/12/22/investing/cfpb-elizabeth-warren-donald-trump/index.html,Politics,22/12/2016-19:38:20,ELIZABETH WARREN WATCHDOG UNDER SIEGERIDEO
http://www.reuters.com/article/us-usa-trump-nuclear-idUSKBN14B1ZZ?feedType=RSS&feedName=topNews,Politics,22/12/2016-19:38:20,"TRUMP CALLS FOR EXPANDED U.S. NUCLEAR WEAPONS CAPABILITY UNTIL THE WORLD ""COMES TO ITS SENSES""ZIPTNF"
http://globalnews.ca/news/3142903/bill-oreilly-white-establishment-electoral-college/?sf47880357=1,Politics,22/12/2016-19:38:20,BILL O’REILLY SAYS ‘WHITE ESTABLISHMENT’ RISKS LOSING POWER IF ELECTORAL COLLEGE ABOLISHEDONE-OF-THREE
http://thefreethoughtproject.com/school-fights-felony-prison-pipeline/,Politics,22/12/2016-19:38:20,SCHOOL-TO-PRISON PIPELINE COMPLETE — NEW LAW MAKES SCHOOLYARD FIGHTS A FELONYPHEONIX200
http://www.independent.co.uk/voices/donald-trump-nonchalant-nuclear-weapons-attitude-dangerous-a7491331.html,Politics,22/12/2016-19:38:20,TRUMP HAS A NONCHALANT ATTITUDE TO THE WORLD'S DEADLIEST OF WEAPONSFINIXZ
http://www.huffingtonpost.com/entry/david-clarke-jail-deaths-milwaukee_us_585b0041e4b0d9a594570f5a?422fq8jxkgoufvfgvi,Politics,22/12/2016-19:38:20,FEDS CONSIDER CIVIL RIGHTS PROBE OF DEADLY JAIL RUN BY TRUMP ALLY SHERIFF DAVID CLARKERNON
https://www.newyorker.com/news/john-cassidy/ayn-rand-and-corporate-tax-cuts-wont-mend-the-economy,Politics,22/12/2016-19:38:20,CORPORATE TAX CUTS WON’T FIX THE ECONOMYDOLPHINS3
http://www.bostonglobe.com/news/politics/2016/12/22/obama-dismantles-program-before-trump-can-use-for-muslim-registry/xuV3K19SClI1HWdlw36MjL/story.html,Politics,22/12/2016-19:38:20,OBAMA DISMANTLES PROGRAM BEFORE TRUMP CAN USE IT FOR MUSLIM REGISTRYRIZZPOOCH
http://www.seattletimes.com/business/boeing-aerospace/trump-asks-boeing-for-f-18-pitch-citing-tremendous-cost-overruns-of-lockheed-martin-f-35/,Politics,22/12/2016-19:38:20,"TRUMP ASKS BOEING FOR F-18 PITCH, CITING ‘TREMENDOUS’ COST OVERRUNS OF LOCKHEED MARTIN F-35LAWANDDISORDER"
http://www.mcclatchydc.com/news/nation-world/national/article122246359.html,Politics,22/12/2016-19:38:20,PARTIAL REPEAL OF ACA COULD LEAVE 12 MILLION KIDS AND PARENTS UNINSUREDTHOUHASTLOSTAN8TH
http://www.nbcnews.com/health/health-care/more-6-million-sign-obamacare-n698841,Politics,22/12/2016-19:38:20,MORE THAN 6 MILLION SIGN UP FOR OBAMACAREHAPPYANTONINSCALIA
http://nymag.com/daily/intelligencer/2016/12/obama-throws-wrench-in-trumps-plans-for-a-muslim-registry.html,Politics,22/12/2016-19:38:20,OBAMA THROWS A WRENCH IN TRUMP’S PLANS FOR A ‘MUSLIM REGISTRY’BEYOND_UNDERSTANDING
https://thinkprogress.org/missouri-school-felonies-d840e8ec7242#.6fcodfg1u,Politics,22/12/2016-19:38:20,MISSOURI WILL SOON CHARGE STUDENTS WHO GET INTO FIGHTS WITH FELONIES.GRAF_POTATO
https://www.washingtonpost.com/blogs/plum-line/wp/2016/12/22/on-health-care-republicans-are-about-to-give-americans-more-skin-in-the-game-and-theyre-going-to-hate-it/,Politics,22/12/2016-19:38:20,"ON HEALTH CARE, REPUBLICANS ARE ABOUT TO GIVE AMERICANS MORE ‘SKIN IN THE GAME.’ AND THEY’RE GOING TO HATE IT.THERECORDCORRECTED"
https://www.yahoo.com/news/43-days-after-winning-election-trump-still-touchy-about-losing-popular-vote-172318347.html,Politics,22/12/2016-19:38:20,"43 DAYS AFTER WINNING ELECTION, TRUMP STILL TOUCHY ABOUT LOSING POPULAR VOTECURLYBRAC"
http://www.dailymail.co.uk/news/article-4056406/Arrest-Vote-Trump-burning-Mississippi-black-church.html,Politics,22/12/2016-19:38:20,BLACK MAN BURNS DOWN HIS OWN CHURCH IN FAKE HATE CRIMEEXACTLY_
http://www.metro.us/new-york/protesters-call-trump-tower-trump-hotels-in-dial-it-up-campaign-to-fire-steve-bannon/zsJplo---6rvjVOqZ5O5w/,Politics,22/12/2016-19:38:20,"PROTESTERS CALL TRUMP TOWER, TRUMP HOTELS IN 'DIAL IT UP' CAMPAIGNCOMMIEFLIRT"
http://www.npr.org/2016/12/22/506497041/trumps-businesses-could-be-tripped-up-by-a-2012-insider-trading-law,Politics,22/12/2016-19:38:20,TRUMP'S BUSINESSES COULD BE TRIPPED UP BY A 2012 INSIDER TRADING LAWMORCHAINT
http://fortune.com/2016/12/22/donald-trump-china-trade-war/,Politics,22/12/2016-19:38:20,WHY AMERICA WOULD LOSE A TRADE WAR WITH CHINALEFTMARKETANARCHIST
http://www.americanmustacheinstitute.org/2016/12/official-statement-donald-trump%E2%80%99s-unacceptable-mustache-discrimination/,Politics,22/12/2016-19:38:20,OFFICIAL STATEMENT: DONALD TRUMP’S UNACCEPTABLE MUSTACHE DISCRIMINATIONSTEVEBANNONEXPOSED
http://www.cnn.com/2016/12/22/politics/dreamers-trump-immigration/index.html,Politics,22/12/2016-19:38:22,DREAMERS PREPARE FOR FIGHT AGAINST TRUMPBASEDPEDE1337
http://www.usatoday.com/story/money/personalfinance/2016/12/22/obama-helped-bring-back-economy-restless-voters-chose-trump/95742160/,Politics,22/12/2016-19:38:22,"OBAMA HELPED BRING BACK ECONOMY, RESTLESS VOTERS CHOSE TRUMPFIDEL_TRUDEAU"
http://edition.cnn.com/2016/12/22/politics/joe-biden-hillary-clinton-2016-election/index.html?sr=twcnni122316joe-biden-hillary-clinton-2016-election/1204AMStoryLink&linkId=32690817,Politics,22/12/2016-19:38:22,BIDEN: CLINTON NEVER FIGURED OUT WHY SHE WAS RUNNINGMANAFORT
http://massappeal.com/trump-team-says-theyll-kill-the-open-internet-as-soon-as-possible/,Politics,22/12/2016-19:38:22,"TRUMP TEAM SAY THEY'LL KILL THE OPEN INTERNET ""AS SOON AS POSSIBLE""SANANTONIOMANANTONIO"
http://www.reuters.com/article/us-usa-trump-nuclear-statement-idUSKBN14B2AC?il=0,Politics,22/12/2016-19:38:22,TRUMP TWEET REFERRED TO PREVENTING NUCLEAR PROLIFERATION: SPOKESMANLAWANDDISORDER
https://www.theguardian.com/us-news/2016/dec/22/nseers-arab-muslim-tracking-system-dismantled-obama,Politics,22/12/2016-19:38:22,OBAMA ADMINISTRATION DISMANTLING SYSTEM USED TO TRACK ARABS AND MUSLIMSAUBONPAINE
http://www.gallup.com/poll/199445/congressional-approval-averages-weak-2016.aspx?g_source=Politics&g_medium=newsfeed&g_campaign=tiles,Politics,22/12/2016-19:38:22,U.S. CONGRESSIONAL APPROVAL AVERAGES WEAK 17% FOR 2016ALTRUISTPARTY
http://www.latimes.com/nation/politics/trailguide/la-na-trailguide-updates-trump-team-asks-state-department-for-1482435218-htmlstory.html,Politics,22/12/2016-19:38:22,TRUMP TEAM ASKS STATE DEPARTMENT FOR DETAILS ON PROGRAMS AIMED AT HELPING WOMENTHOUHASTLOSTAN8TH
http://www.washingtonexaminer.com/on-conflicts-of-interest-trump-sons-still-doesnt-get-it/article/2610210,Politics,22/12/2016-19:38:22,"ON CONFLICTS OF INTEREST, TRUMP & SONS STILL DOESN'T GET ITDANGUSDINGLEMAN"
http://www.deathandtaxesmag.com/313199/even-many-trump-voters-will-be-pissed-off-as-hell-should-he-defund-planned-parenthood/,Politics,22/12/2016-19:38:22,EVEN MANY TRUMP VOTERS WILL BE ‘PISSED OFF AS HELL’ SHOULD HE DEFUND PLANNED PARENTHOODITNEVERENDS32
http://fusion.net/comic/376942/cartoon-republicans-trump-working-class/,Politics,22/12/2016-19:38:22,CARTOON: THE REPUBLICAN GUIDE TO SCREWING THE WORKING CLASSUNDIGESTION
https://www.washingtonpost.com/news/the-fix/wp/2016/12/22/the-democratic-partys-future-could-be-on-the-line-in-7-hugely-important-governors-races/?utm_term=.2c503c57032d,Politics,22/12/2016-19:38:22,THE DEMOCRATIC PARTY’S FUTURE COULD BE ON THE LINE IN 7 HUGELY IMPORTANT GOVERNOR’S RACESMPCSU
https://www.washingtonpost.com/news/energy-environment/wp/2016/12/22/the-coming-battle-between-the-trump-team-and-economists-over-the-true-cost-of-climate-change/?utm_term=.54e2d00fd997,Politics,22/12/2016-19:38:22,THE COMING BATTLE BETWEEN THE TRUMP TEAM AND ECONOMISTS OVER THE TRUE COST OF CLIMATE CHANGESPLENDA
http://www.politico.com/story/2016/12/obama-farewell-speech-chicago-232928,Politics,22/12/2016-19:38:22,OBAMA PLANNING FAREWELL SPEECH IN CHICAGO NEXT MONTHBURMP_39
https://mobile.nytimes.com/2016/12/22/us/politics/state-department-gender-equality-trump-transition.amp.html,Politics,22/12/2016-19:38:22,TRUMP'S TRANSITION TEAM'S REQUEST ON GENDER EQUALITY RATTLES STATE DEPT.RYUUSHIN
https://foreignpolicy.com/2016/12/22/putin-and-trump-talk-up-need-for-more-nuclear-weapons/,Politics,22/12/2016-19:38:22,PUTIN AND TRUMP TALK UP NEED FOR MORE NUCLEAR WEAPONSMANAFORT
http://www.esquire.com/news-politics/politics/news/a51689/trump-national-security-advisor-austrian-right-wing/?,Politics,22/12/2016-19:38:22,TRUMP'S SONS MIGHT BE THE ONES TO SINK HIMSKOALBROTHER
http://www.businessinsider.com/trumps-approval-rating-lowest-of-last-3-incoming-presidents-2016-12,Politics,22/12/2016-19:38:22,TRUMP'S APPROVAL RATING IS THE LOWEST OF ANY INCOMING PRESIDENT IN NEARLY 25 YEARSJACKSONARBOR
http://www.salon.com/2016/12/22/harry-reid-trashes-democratic-national-committee-the-dnc-has-been-worthless/,Politics,22/12/2016-19:38:22,HARRY REID TRASHES DEMOCRATIC NATIONAL COMMITTEE: “THE DNC HAS BEEN WORTHLESS”DRSGTPEPPER
http://www.npr.org/2016/12/22/506598437/facing-criticism-eric-trump-will-stop-actively-fundraising,Politics,22/12/2016-19:38:22,"FACING CRITICISM, ERIC TRUMP WILL STOP ACTIVELY FUNDRAISING FOR HIS FOUNDATIONTEMPORARYCREATURE"
http://thehill.com/blogs/congress-blog/politics/311527-dont-like-political-correctness-then-stop-saying-merry-christmas,Politics,22/12/2016-19:38:22,DON’T LIKE POLITICAL CORRECTNESS? THEN STOP SAYING 'MERRY CHRISTMAS'AGGIE1391
https://apnews.com/4e14f73be8df4caf90643cd2d757054c/Arrest-in-'Vote-Trump'-burning-of-Mississippi-black-church,Politics,22/12/2016-19:38:22,MISSISSIPPI CHURCH MEMBER CHARGED IN 'VOTE TRUMP' ARSONWSH009
http://www.huffingtonpost.com/entry/mitch-mcconnell-machiavelli-2016_us_58519c78e4b0e411bfd50d1a,Politics,22/12/2016-19:38:22,"MITCH MCCONNELL, A MODERN-DAY MACHIAVELLIJACQUEDSOUZA"
http://www.politico.com/story/2016/12/trump-cabinet-confirmation-battle-232867,Politics,22/12/2016-19:38:22,DEMOCRATS AIM TO LAUNCH COMEBACK WITH CABINET SHOWDOWNJACQUEDSOUZA
http://www.portlandmercury.com/blogtown/2016/12/22/18756620/trumps-transition-team-is-going-after-the-state-departments-gender-equality-programs-now,Politics,22/12/2016-19:38:22,TRUMP'S TRANSITION TEAM IS GOING AFTER THE STATE DEPARTMENT'S GENDER EQUALITY PROGRAMS NOWKAYIMM62
http://www.independent.co.uk/news/world/americas/barack-obama-scrap-nseers-donald-trump-muslim-registry-immigration-a7491146.html,Politics,22/12/2016-19:38:23,BARACK OBAMA TO DISMANTLE US REGISTER SYSTEM BEFORE DONALD TRUMP CAN USE IT TO BAN MUSLIMSFINIXZ
http://www.washingtonpost.com/news/the-fix/wp/2016/12/22/what-the-heck-just-happened-with-north-carolinas-bathroom-bill/,Politics,22/12/2016-19:38:23,WHAT THE HECK JUST HAPPENED WITH NORTH CAROLINA’S ‘BATHROOM BILL’?ROOTBOW
https://talkingpointsmemo.com/livewire/obama-reagan-would-roll-over-in-his-grave-over-gop-support-for-russia,Politics,22/12/2016-19:38:23,OBAMA: 'REAGAN WOULD ROLL OVER IN HIS GRAVE' OVER GOP SUPPORT FOR RUSSIAFELLATIO_BY_TEDCRUZ
https://www.washingtonpost.com/blogs/plum-line/wp/2016/12/22/how-james-comey-and-loretta-lynch-made-donald-trump-the-president-of-the-united-states/,Politics,22/12/2016-19:38:23,HOW JAMES COMEY AND LORETTA LYNCH MADE DONALD TRUMP THE PRESIDENT OF THE UNITED STATESTHERECORDCORRECTED
http://thehill.com/policy/national-security/311519-trump-calls-for-expansion-of-nuclear-capability,Politics,22/12/2016-19:38:23,TRUMP CALLS FOR EXPANSION OF NUCLEAR CAPABILITYTHE_LIBERTARIAN_
http://www.cbsnews.com/news/trump-team-seeks-info-women-gender-equality-programs-at-state-department/,Politics,22/12/2016-19:38:23,TRUMP TEAM SEEKS INFO ON GENDER EQUALITY PROGRAMS AT STATE DEPARTMENTSTUBBAZUBBA
http://www.latimes.com/opinion/topoftheticket/la-na-tt-american-dread-20161220-story.html,Politics,22/12/2016-19:38:23,AMERICANS WHO VOTED AGAINST TRUMP ARE FEELING UNPRECEDENTED DREAD AND DESPAIRTHINKB4WESPEAK
http://www.independent.co.uk/news/people/donald-trump-most-corruptible-us-president-ever-bribe-lobby-business-interest-drain-swamp-a7490751.html,Politics,22/12/2016-19:38:23,DONALD TRUMP 'COULD BE MOST CORRUPTIBLE US PRESIDENT OF ALL TIME'AUSTINZZZ
http://www.wpr.org/report-rate-health-care-inflation-wisconsin-down-obamacare-began,Politics,22/12/2016-19:38:23,REPORT: RATE OF HEALTH CARE INFLATION IN WISCONSIN DOWN SINCE OBAMACARE BEGANGALIENLIFEFORM
http://thehill.com/blogs/blog-briefing-room/news/311449-trump-vineyard-asks-to-have-more-foreign-workers,Politics,22/12/2016-19:38:23,TRUMP VINEYARD ASKS TO HAVE MORE FOREIGN WORKERS: REPORTCYPHERRPUNK
http://www.cnbc.com/2016/12/21/trumps-administration-is-filling-up-with-wealth-and-power-after-populist-campaign.html,Politics,22/12/2016-19:38:23,TRUMP'S ADMINISTRATION IS FILLING UP WITH WEALTH AND POWER AFTER POPULIST CAMPAIGNHEINIEKABOOBLER
http://www.nbcnews.com/news/us-news/trump-tweets-apparent-call-more-us-nuclear-weapons-n699221,Politics,22/12/2016-19:38:23,TRUMP ALARMS EXPERTS WITH CALL FOR 'EXPANDING' U.S. NUCLEAR CAPABILITYDANTHEMAN_WOOT
http://www.nytimes.com/2016/12/22/nyregion/obama-to-dismantle-visitor-registry-before-trump-can-revive-it.html?smid=re-share,Politics,22/12/2016-19:38:23,OBAMA TO DISMANTLE VISITOR REGISTRY BEFORE TRUMP CAN REVIVE ITABGONZO7588
http://www.usnews.com/news/articles/2016-12-22/in-declassified-edward-snowden-report-committee-walks-back-claims-about-intentional-lying,Politics,22/12/2016-19:38:23,"IN DECLASSIFIED EDWARD SNOWDEN REPORT, COMMITTEE WALKS BACK CLAIMS ABOUT 'INTENTIONAL LYING'NOTSCJ"
http://edition.cnn.com/2016/12/22/opinions/trump-america-first-foreign-policy-cristol/,Politics,22/12/2016-19:38:23,AMERICA FIRST' MAKES AMERICA LASTMOONCH1122
http://money.cnn.com/2016/12/22/media/sean-spicer-jason-miller-white-house-press-secretary-donald-trump/,Politics,22/12/2016-19:38:23,"TRUMP PICKS SEAN SPICER AS WHITE HOUSE PRESS SECRETARY, JASON MILLER AS COMMUNICATIONS DIRECTORROW101"
