url,type,timeretrieved,title
https://www.yahoo.com/finance/news/kellyanne-conway-manage-white-house-162520564.html,Politics,22/12/2016-19:38:23,KELLYANNE CONWAY: I CAN MANAGE WHITE HOUSE JOB AND BEING A MOTHER BECAUSE 'I DON'T PLAY GOLF AND I DON'T HAVE A MISTRESS'MRSNELLER
http://www.independent.co.uk/news/world/americas/donald-trump-muslim-ban-registry-berlin-attack-twitter-you-know-my-plans-immigration-racism-a7489611.html,Politics,22/12/2016-19:38:23,DONALD TRUMP STILL WANTS TO BAN MUSLIMS FROM US AND BUILD 'REGISTRY' DESPITE BACKTRACKING AFTER ELECTIONTHETRETHEWAY
http://globalnews.ca/news/3143218/tom-arnold-may-release-the-offensive-apprentice-recordings-of-donald-trump/?sf47956313=1,Politics,22/12/2016-19:38:23,TOM ARNOLD MAY RELEASE THE OFFENSIVE ‘APPRENTICE’ RECORDINGS OF DONALD TRUMPONE-OF-THREE
http://talkingpointsmemo.com/edblog/trump-now-pushing-for-10-import-tariff,Politics,22/12/2016-19:38:23,TRUMP NOW PUSHING FOR 10% IMPORT TARIFFSOUTHTEXASMAMA
http://mobile.reuters.com/article/idUSKBN14B0AA?il=0,Politics,22/12/2016-19:38:23,"CHINA'S FOREIGN MINISTER SAYS RELATIONSHIP WITH USA FACES NEW UNCERTAINTIES, BUT, ""ONE INDIVIDUAL"" WILL NOT IMPEDE TIES.LANGOSTA_9ER"
http://www.cnn.com/2016/12/20/politics/rex-tillerson-tax-returns/index.html,Politics,22/12/2016-19:38:23,DEMS PRESS FOR TILLERSON'S TAX RETURNSMSMANIFESTO
http://mobile.nytimes.com/aponline/2016/12/22/us/politics/ap-us-economy-gdp.html,Politics,22/12/2016-19:38:23,US ECONOMY GREW AT STRONG 3.5 PCT. ANNUAL RATE LAST QUARTERKRISTINEDUPREE
http://www.vox.com/2016/12/22/14053190/obama-nseers-trump-muslim,Politics,22/12/2016-19:38:23,OBAMA JUST MADE IT MUCH HARDER FOR TRUMP TO BUILD HIS “MUSLIM REGISTRY”WENCHETTE
http://www.marketwatch.com/story/trump-tweet-sends-lockheed-shares-down-boeing-shares-rising-2016-12-22,Politics,22/12/2016-19:38:23,"TRUMP TWEET SENDS LOCKHEED SHARES DOWN, BOEING SHARES RISINGHILLARYSIDIOT"
http://www.huffingtonpost.com/entry/was-rudy-giuliani-at-the-center-of-an-fbi-trump-campaign_us_585ad14ce4b014e7c72ed993,Politics,22/12/2016-19:38:25,WAS RUDY GIULIANI AT THE CENTER OF AN FBI-TRUMP CAMPAIGN CONSPIRACY TO STEAL THE ELECTION?SWEDISHFISHALREADY
http://fivethirtyeight.com/features/trumps-cabinet-choices-have-given-a-lot-of-money-to-senators/,Politics,22/12/2016-19:38:25,TRUMP’S CABINET CHOICES HAVE GIVEN A LOT OF MONEY TO SENATORSTACOCAT2112
http://www.dailywire.com/news/11835/trump-team-prepares-cram-down-10-tariff-americans-ben-shapiro?utm_source=facebook&utm_medium=social&utm_content=062316-news&utm_campaign=benshapiro,Politics,22/12/2016-19:38:25,TRUMP TEAM PREPARES TO CRAM DOWN 10% TARIFF ON AMERICANSFIRSTDIMENSIONFILMS
https://newrepublic.com/article/139487/washington-governed-fear-now,Politics,22/12/2016-19:38:25,WASHINGTON IS GOVERNED BY FEAR NOWRNON
http://www.pressherald.com/2016/12/19/collins-draws-contrast-with-trump-on-russia-affordable-care-act/,Politics,22/12/2016-19:38:25,"COLLINS DRAWS CONTRAST WITH TRUMP ON RUSSIA, AFFORDABLE CARE ACTCEAGUILA84"
http://www.pbs.org/newshour/rundown/trump-ditching-drain-swamp-rally-cry-adviser-says/?utm_source=facebook&utm_medium=pbsofficial&utm_campaign=newshour,Politics,22/12/2016-19:38:25,"TRUMP DROPPING ‘DRAIN THE SWAMP’ RALLY CRY, NEWT GINGRICH SAYSPM_ME_VENN_DIAGRAMS"
http://talkingpointsmemo.com/livewire/report-john-bolton-secretary-of-state-bid-derailed-by-mustache,Politics,22/12/2016-19:38:25,"WANT A TRUMP CABINET JOB? APPARENTLY, YOU GOTTA LOSE THE FACIAL HAIRNEO2199"
http://www.vox.com/identities/2016/12/21/14035608/bill-oreilly-electoral-college-race?utm_campaign=vox.social&utm_medium=social&utm_content=voxdotcom&utm_source=facebook,Politics,22/12/2016-19:38:25,BILL O’REILLY’S ARGUMENT FOR THE ELECTORAL COLLEGE: IT KEEPS WHITE VOTERS IN POWERHOMEPREGNANCYKIT
http://thehill.com/policy/finance/311470-us-economy-grows-35-percent,Politics,22/12/2016-19:38:25,U.S. ECONOMY GROWS 3.5 PERCENTSHITPOSTER123456789
https://www.washingtonpost.com/politics/trump-continues-to-sow-confusion-over-his-plan-for-muslims-entering-the-country/2016/12/22/a285f0c2-c864-11e6-bf4b-2c064d32a4bf_story.html?utm_term=.10e311508a8a,Politics,22/12/2016-19:38:25,TRUMP CONTINUES TO SOW CONFUSION OVER HIS PLAN FOR MUSLIMS ENTERING THE COUNTRYMOONCH1122
http://www.cnn.com/2016/12/22/europe/russia-us-relations-frozen/index.html,Politics,22/12/2016-19:38:25,"RUSSIA GIVES US COLD SHOULDER, SAYING RELATIONS BETWEEN COUNTRIES 'FROZEN'INTERN3"
http://thehill.com/homenews/administration/311594-biden-plans-to-live-in-dc-part-time-after-leaving-office,Politics,22/12/2016-19:38:25,BIDEN PLANS TO LIVE IN DC PART TIME AFTER LEAVING OFFICESOMALI_PIR8
https://thinkprogress.org/trump-rexnord-jobs-106e4efa78ed#.nnsa8w5hr,Politics,22/12/2016-19:38:25,"WEEKS AFTER CARRIER DEAL, TRUMP IGNORES INDIANA FACTORY RELOCATING TO MEXICOCOFFE1"
http://thehill.com/homenews/news/311296-gingrich-trump-doesnt-want-to-drain-the-swamp-anymore,Politics,22/12/2016-19:38:25,GINGRICH: TRUMP DOESN'T WANT TO 'DRAIN THE SWAMP' ANYMOREMEDIATECHES
http://qz.com/870540/donald-trump-is-tweeting-about-nukes/,Politics,22/12/2016-19:38:25,DONALD TRUMP IS TWEETING ABOUT NUKESALDOTHEEAPACHE
https://www.cato.org/blog/84-americans-oppose-civil-asset-forfeiture,Politics,22/12/2016-19:38:25,84% OF AMERICANS OPPOSE CIVIL ASSET FORFEITUREWHYWYOMING
https://www.theatlantic.com/technology/archive/2016/12/obama-just-made-it-harder-for-trump-to-create-a-muslim-registry/511505/,Politics,22/12/2016-19:38:25,OBAMA JUST MADE IT HARDER FOR TRUMP TO CREATE A MUSLIM REGISTRYDUBTEEDUB
http://www.cnn.com/2016/12/22/politics/donald-trump-strengthen-expand-nuclear-capability/index.html?sr=fbCNN122216donald-trump-strengthen-expand-nuclear-capability0701PMVODtopLink&linkId=32677702,Politics,22/12/2016-19:38:25,"TRUMP, PUTIN BOTH SEEK TO BOOST THEIR NUCLEAR CAPABILITYREVBROKE"
https://www.washingtonpost.com/world/national-security/donald-trump-says-he-wants-to-greatly-strengthen-and-expand-us-nuclear-capabilitiy-a-radical-break-from-us-foreign-policy/2016/12/22/52745c22-c86e-11e6-85b5-76616a33048d_story.html,Politics,22/12/2016-19:38:25,"DONALD TRUMP SAYS HE WANTS TO ‘GREATLY STRENGTHEN AND EXPAND’ U.S. NUCLEAR CAPABILITIY, A RADICAL BREAK FROM U.S. FOREIGN POLICYIPGOF"
http://www.scpr.org/news/2016/12/22/67481/you-say-you-re-an-american-but-what-if-you-had-to/,Politics,22/12/2016-19:38:25,"YOU SAY YOU'RE AN AMERICAN, BUT WHAT IF YOU HAD TO PROVE IT OR BE DEPORTED?DISCOCRISCO"
http://www.bostonherald.com/news/us_politics/2016/12/trump_us_must_greatly_strengthen_nuclear_capability,Politics,22/12/2016-19:38:25,TRUMP: US MUST 'GREATLY STRENGTHEN' NUCLEAR CAPABILITYSAIGE_VALENTINA
http://www.nytimes.com/2016/12/22/opinion/one-problem-for-democratic-leaders-is-democratic-voters.html,Politics,22/12/2016-19:38:25,ONE PROBLEM FOR DEMOCRATIC LEADERS IS DEMOCRATIC VOTERSPRECIP
http://www.politico.com/story/2016/12/trump-drain-the-swamp-newt-gingrich-232921,Politics,22/12/2016-19:38:25,TRUMP CORRECTS GINGRICH: WE'LL ALWAYS BE TRYING TO DRAIN THE SWAMPMIRYSLOUGH
http://www.cnn.com/2016/12/22/politics/joe-biden-hillary-clinton-2016-election/index.html,Politics,22/12/2016-19:38:25,BIDEN: CLINTON NEVER FIGURED OUT WHY SHE WAS RUNNINGIPSEEDIXIT
http://www.cnbc.com/2016/12/22/the-most-important-thing-from-carl-icahns-40-minute-cnbc-interview.html,Politics,22/12/2016-19:38:25,TRUMP BILLIONAIRE CONFIDANT WARNS OF STOCK MARKET RISK DUE TO CHINA TRADE WARMUSICFAN75
https://www.texastribune.org/2016/12/21/lawsuit-proceeds-against-abbott-over-mock-nativity/,Politics,22/12/2016-19:38:26,LAWSUIT PROCEEDS AGAINST GOV. GREG ABBOTT OVER MOCK NATIVITY DISPLAY1HOBO
http://www.aljazeera.com/news/2016/12/trump-veto-israel-settlement-resolution-161222140850698.html,Politics,22/12/2016-19:38:26,"TRUMP: US SHOULD VETO UN ISRAEL SETTLEMENT RESOLUTION WITH HOURS UNTIL UNSC VOTE, US PRESIDENT-ELECT SAYS MEASURE HALTING SETTLEMENTS WOULD BE ""UNFAIR TO ALL ISRAELIS"".SPURTY_LOADS"
http://www.cnbc.com/2016/12/16/nearly-half-of-republicans-favor-this-kind-of-carbon-tax-contrary-to-gop-platform.html,Politics,22/12/2016-19:38:26,"NEARLY HALF OF REPUBLICANS FAVOR THIS KIND OF CARBON TAX, CONTRARY TO GOP PLATFORMSPLENDA"
https://www.washingtonpost.com/amphtml/world/national-security/donald-trump-says-he-wants-to-greatly-strengthen-and-expand-us-nuclear-capabilitiy-a-radical-break-from-us-foreign-policy/2016/12/22/52745c22-c86e-11e6-85b5-76616a33048d_story.html,Politics,22/12/2016-19:38:26,"DONALD TRUMP SAYS HE WANTS TO ‘GREATLY STRENGTHEN AND EXPAND’ U.S. NUCLEAR CAPABILITY, A RADICAL BREAK FROM U.S. FOREIGN POLICYSQUIRTINGISPEEING"
http://www.vox.com/policy-and-politics/2016/12/22/13959016/trump-meritocracy-white-men,Politics,22/12/2016-19:38:26,"TRUMP’S ""MERITOCRATIC"" APPOINTMENTS HAVE RESULTED IN A LOT OF WHITE MEN IN TOP JOBSINTERN3"
http://www.pbs.org/newshour/rundown/obama-dumps-registry-immigrant-men-mostly-muslims/,Politics,22/12/2016-19:38:26,OBAMA SCRAPS POST-9/11 REGISTRY THAT TARGETED MUSLIM IMMIGRANT MENCIIK
https://www.washingtonpost.com/powerpost/schumer-mccain-could-be-a-winning-team-in-new-congress/2016/12/21/7178da22-c79b-11e6-bf4b-2c064d32a4bf_story.html?postshare=1021482369220688&tid=ss_tw&utm_term=.e88ab7175cc3,Politics,22/12/2016-19:38:26,SENS. SCHUMER AND MCCAIN USED TO HAVE A LOUSY RELATIONSHIP. PRESIDENT-ELECT TRUMP HAS CHANGED THAT.STEVEBANNONEXPOSED
http://www.thedailybeast.com/cheats/2016/12/22/newt-recants-trump-still-wants-to-drain-the-swamp.html,Politics,22/12/2016-19:38:26,NEWT GINGRICH RECANTS: TRUMP STILL WANTS TO ‘DRAIN THE SWAMP’ALDOTHEEAPACHE
https://www.engadget.com/2016/12/22/obama-dismantles-nseers/,Politics,22/12/2016-19:38:26,OBAMA DISMANTLES REGISTRY USED TO TRACK MUSLIMS AND ARABSCANTANKEROUSBLISS
https://www.washingtonpost.com/news/true-crime/wp/2016/12/20/fraternal-order-of-police-asks-walmart-to-stop-selling-black-lives-matter-shirts/?utm_term=.dcdfc13abff1#comments,Politics,22/12/2016-19:38:26,WALMART TO STOP SELLING “BULLETPROOF: BLACK LIVES MATTER” SHIRTS AFTER POLICE PROTESTADAMGERGES
http://www.nytimes.com/2016/12/22/us/politics/state-department-gender-equality-trump-transition.html,Politics,22/12/2016-19:38:26,TRANSITION TEAM’S REQUEST ON GENDER EQUALITY RATTLES STATE DEPT.KICHIGAI
http://www.torontosun.com/2016/12/20/the-worst-candidate-of-2016-hillary-clinton,Politics,22/12/2016-19:38:26,THE WORST CANDIDATE OF 2016: HILLARY CLINTONKJELLPU
http://www.nytimes.com/interactive/2016/12/22/world/americas/trump-nuclear-tweet.html,Politics,22/12/2016-19:38:26,"TRUMP’S NUCLEAR WEAPONS TWEET, TRANSLATED AND EXPLAINEDTHE-AUTARKH"
http://blog.totalvibrant.com/president-vladimir-putin-says-russias-military-stronger-anyones/,Politics,22/12/2016-19:38:26,PRESIDENT VLADIMIR PUTIN SAYS RUSSIA’S MILITARY IS STRONGER THAN ANYONE’SACCOUNTSHOUSE
http://www.politico.com/story/2016/12/kellyanne-conway-counselor-president-trump-232911,Politics,22/12/2016-19:38:26,TRUMP PICKS KELLYANNE CONWAY TO SERVE AS COUNSELOR TO THE PRESIDENTRALPHVISSER
http://www.nationalreview.com/article/443251/donald-trump-abandons-movement-campaign-promises,Politics,22/12/2016-19:38:26,DONALD TRUMP ABANDONS HIS SUPPORTERSMANAFORT
http://www.cnn.com/2016/12/22/politics/state-department-gender-questionnaire/index.html,Politics,22/12/2016-19:38:26,TRUMP TEAM ASKS STATE FOR INFO ON GENDER PROGRAMSCATPOR
https://www.engadget.com/2016/12/22/peter-thiels-startup-helps-authorities-track-illegal-immigrant/,Politics,22/12/2016-19:38:26,PETER THIEL'S STARTUP HELPS AUTHORITIES TRACK ILLEGAL IMMIGRANTSMAIDOMAIDO
http://nymag.com/daily/intelligencer/2016/12/trump-cant-stop-lying-about-the-size-of-his-win.html,Politics,22/12/2016-19:38:26,DONALD TRUMP CAN’T STOP TELLING ORWELLIAN LIES ABOUT THE SIZE OF HIS VICTORYMARJI80
http://www.cnn.com/2016/12/21/politics/donald-trump-hillary-clinton-popular-vote-final-count/index.html,Politics,22/12/2016-19:38:26,IT'S OFFICIAL: CLINTON SWAMPS TRUMP IN POPULAR VOTENEILPOONHANDLER
http://thehill.com/homenews/administration/311543-trump-names-rnc-strategist-spicer-to-press-secretary,Politics,22/12/2016-19:38:26,TRUMP NAMES RNC STRATEGIST SPICER TO PRESS SECRETARYDRDANIELS
http://www.sltrib.com/opinion/4740879-155/editorial-republicans-say-they-will-replace,Politics,22/12/2016-19:38:26,EDITORIAL: REPUBLICANS SAY THEY WILL REPLACE OBAMACARE. THEY’D BETTER.KENATIUS
https://www.yahoo.com/news/snowden-is-still-in-contact-with-russian-intelligence-house-report-charges-143645123.html,Politics,22/12/2016-19:38:26,"SNOWDEN IS STILL IN CONTACT WITH RUSSIAN INTELLIGENCE, HOUSE REPORT CHARGESSEEASEA"
https://www.theguardian.com/us-news/2016/dec/21/mad-alex-donald-trump-letters-abuse-ex-scottish-first-minister?utm_source=esp&utm_medium=Email&utm_campaign=GU+Today+main+NEW+H+categories&utm_term=205292&subid=20826656&CMP=EMCNEWEML6619I2,Politics,22/12/2016-19:38:26,MAD ALEX': DONALD TRUMP LETTERS ABUSE SCOTTISH EX-FIRST MINISTERPWSATKINSON
http://thehill.com/homenews/campaign/311564-rockettes-to-perform-at-trump-inauguration,Politics,22/12/2016-19:38:26,ROCKETTES TO PERFORM AT TRUMP INAUGURATIONIT_WAS_HER_YEAR
http://www.elle.com/culture/career-politics/news/a41600/trump-muslim-ban-berlin/,Politics,22/12/2016-19:38:28,TRUMP SUGGESTS A MUSLIM BAN IS STILL A POSSIBILITYPINKSLIMEISPEOPLE
http://www.salon.com/2016/12/21/newt-gingrichs-hilarious-ethics-lecture-donald-trump-is-so-rich-we-cant-worry-about-it/?utm_source=twitter&utm_medium=socialflow&utm_source=twitter&utm_medium=socialflow,Politics,22/12/2016-19:38:28,NEWT GINGRICH’S SEMI-HILARIOUS ETHICS LECTURE: DONALD TRUMP IS SO RICH WE CAN’T WORRY ABOUT ITANTINATALISTA
http://reason.com/blog/2016/12/22/obama-officially-kills-bush-era-muslim-r,Politics,22/12/2016-19:38:28,OBAMA OFFICIALLY KILLS BUSH-ERA MUSLIM REGISTRY PROGRAM BEFORE TRUMP CAN RESURRECT IT01101011011101000110
http://fortune.com/2016/12/19/social-media-election/?xid=for_fb_sh,Politics,22/12/2016-19:38:28,"DEMOCRATS ARE 3 TIMES MORE LIKELY TO UNFRIEND YOU ON SOCIAL MEDIA, SURVEY SAYSJEFF_THE_NURSE"
http://circa.com/world/cia-director-warns-trump-a-nuclear-arms-race-is-likely-if-iran-deal-is-scrapped,Politics,22/12/2016-19:38:28,CIA DIRECTOR WARNS TRUMP A NUCLEAR ARMS RACE IS LIKELY IF IRAN DEAL IS SCRAPPEDSIRSOLILOQUY
https://www.washingtonpost.com/news/the-fix/wp/2016/12/21/ted-cruz-says-democrats-will-be-historys-biggest-obstructionists-but-what-does-that-word-even-mean/?utm_term=.1a718b5beb53,Politics,22/12/2016-19:38:28,TED CRUZ SAYS DEMOCRATS WILL BE HISTORY’S BIGGEST ‘OBSTRUCTIONISTS.’ ABOUT THAT …DARTHADITYA
http://www.huffingtonpost.ca/2016/12/21/marco-rubio-super-bowl-ads-canada-crtc_n_13769488.html,Politics,22/12/2016-19:38:28,MARCO RUBIO DOESN'T WANT CANADIANS WATCHING U.S. SUPER BOWL ADSCOLLUMMCJINGLEBALLS
http://www.cnbc.com/2016/12/22/wall-street-economic-growth-forecasts-dont-see-a-big-trump-gain.html,Politics,22/12/2016-19:38:28,WALL STREET ECONOMIC GROWTH FORECASTS DON'T SEE A BIG TRUMP GAINRISEOFTHETRUMPWAFFEN
http://www.aol.com/article/2016/12/21/texas-officially-defunds-planned-parenthood/21632548/,Politics,22/12/2016-19:38:28,TEXAS OFFICIALLY DEFUNDS PLANNED PARENTHOODRIFE170
https://www.theatlantic.com/politics/archive/2016/12/ta-nehisi-coates-obama-transcript-ii/511133/,Politics,22/12/2016-19:38:28,"‘BETTER IS GOOD’: OBAMA ON REPARATIONS, CIVIL RIGHTS, AND THE ART OF THE POSSIBLEBLANKVERSE"
http://nypost.com/2016/12/22/trump-says-he-hasnt-given-up-on-vow-to-drain-the-swamp/,Politics,22/12/2016-19:38:28,"TRUMP CORRECTS GINGRICH - SAYS HE VERY MUCH STILL INTENDS TO ""DRAIN THE SWAMP""WORLDNEEDSSADDAM"
https://www.bloomberg.com/view/articles/2016-12-21/the-u-s-is-now-a-country-that-can-be-ignored,Politics,22/12/2016-19:38:28,THE U.S. IS NOW A COUNTRY THAT CAN BE IGNOREDAKITABIJIN
http://www.newsobserver.com/news/politics-government/article122265154.html,Politics,22/12/2016-19:38:28,"A PARTIAL REPEAL OF HEALTH CARE LAW WOULD LEAVE 12 MILLION UNINSURED, SAYS REPORTGALIENLIFEFORM"
http://lawnewz.com/high-profile/gingrich-says-trump-could-use-pardon-power-after-ordering-illegal-acts/,Politics,22/12/2016-19:38:28,GINGRICH SAYS TRUMP COULD USE PARDON POWER AFTER ORDERING ILLEGAL ACTSFLIBBITYANDFLOBBITY
http://www.newyorker.com/news/news-desk/holy-rage-lessons-from-standing-rock,Politics,22/12/2016-19:38:28,HOLY RAGE: LESSONS FROM STANDING ROCKSYMBIOTICPATRIOTIC
https://www.washingtonpost.com/news/monkey-cage/wp/2016/12/21/eight-questions-about-donald-trumps-decision-making-in-a-foreign-policy-crisis/?utm_term=.6a54b843be9f,Politics,22/12/2016-19:38:28,EIGHT QUESTIONS ABOUT DONALD TRUMP’S DECISION-MAKING IN A FOREIGN POLICY CRISISVESTAYEKTA
https://www.washingtonpost.com/news/energy-environment/wp/2016/12/21/trump-says-energy-regulations-are-hurting-economic-growth-the-evidence-says-otherwise/?utm_term=.07abea5ff5bc,Politics,22/12/2016-19:38:28,TRUMP SAYS ENERGY REGULATIONS ARE HURTING ECONOMIC GROWTH. THE EVIDENCE SAYS OTHERWISE.BILLTOWNE
http://www.cnn.com/2016/12/21/politics/north-carolina-bathroom-bill-hb2/index.html,Politics,22/12/2016-19:38:28,NORTH CAROLINA LEGISLATURE FAILS TO REPEAL 'BATHROOM BILL'YA_ABURNEE
http://edition.cnn.com/2016/12/22/politics/donald-trump-strengthen-expand-nuclear-capability/index.html,Politics,22/12/2016-19:38:28,"TRUMP, PUTIN BOTH SEEK TO BOOST THEIR NUCLEAR CAPABILITYMANIAFORBEATLES"
https://thinkprogress.org/national-enquirer-morphs-into-propaganda-rag-for-president-elect-trump-237ffcec7700#.gajct888p,Politics,22/12/2016-19:38:28,NATIONAL ENQUIRER MORPHS INTO PROPAGANDA RAG FOR PRESIDENT-ELECT TRUMPPENTIJING
https://www.washingtonpost.com/news/powerpost/wp/2016/12/22/trump-meets-with-another-conservative-adversary-billionaire-david-koch/?postshare=1381482390248517&tid=ss_tw,Politics,22/12/2016-19:38:28,TRUMP MEETS WITH ANOTHER CONSERVATIVE ADVERSARY: BILLIONAIRE DAVID KOCHMANAFORT
http://www.salon.com/2016/12/16/draintheswamp-donald-trumps-cabinet-of-billionaires-is-worth-more-than-a-third-of-all-americans/,Politics,22/12/2016-19:38:28,#DRAINTHESWAMP: DONALD TRUMP’S CABINET OF BILLIONAIRES IS WORTH MORE THAN A THIRD OF ALL AMERICANSOHSNAPYOUGOTSOLD
http://www.nbcnews.com/politics/congress/sen-corker-committee-won-t-demand-tillerson-s-tax-returns-n699276,Politics,22/12/2016-19:38:28,SEN. CORKER: COMMITTEE WON'T DEMAND TILLERSON'S TAX RETURNSRADICALHEADPHONE
http://www.politico.com/story/2016/12/trump-muslim-ban-kellyanne-conway-232912,Politics,22/12/2016-19:38:28,TRUMP STOKES FEARS HE'LL PURSUE MUSLIM BANESTEBAN-WAS-EATEN
http://www.csmonitor.com/Business/2016/1222/Trump-s-team-considers-a-5-percent-tariff-on-imports-How-serious,Politics,22/12/2016-19:38:28,TRUMP’S TEAM CONSIDERS A 5 PERCENT TARIFF ON IMPORTS: HOW SERIOUS?FAGUZZI
http://www.businessinsider.com/kellyanne-conway-golf-mistress-mother-white-house-job-2016-12,Politics,22/12/2016-19:38:29,KELLYANNE CONWAY: I CAN MANAGE WHITE HOUSE JOB AND BEING A MOTHER BECAUSE 'I DON'T PLAY GOLF AND I DON'T HAVE A MISTRESS'SUBLIME1123
http://thehill.com/policy/international/russia/311536-putin-russia-must-strengthen-its-nuclear-arms,Politics,22/12/2016-19:38:29,PUTIN: RUSSIA MUST STRENGTHEN ITS NUCLEAR ARMSALEJANDRO_LAST_NAME
http://www.politico.com/story/2016/12/trump-inauguration-presidents-232937?cmpid=sf,Politics,22/12/2016-19:38:29,CARTER IS THE ONLY FORMER PRESIDENT TO RSVP FOR TRUMP'S INAUGURATIONTHAT49ER
http://www.philly.com/philly/news/politics/20161222_ap_ae1c8163ac574bb3bd1f3facfca5fb83.html,Politics,22/12/2016-19:38:29,WHITE NATIONALISTS RAISE MILLIONS WITH TAX-EXEMPT CHARITIESDONMANUEL
http://www.huffingtonpost.co.uk/entry/letters-donald-trump-alex-salmond-wind-turbines_uk_585908ede4b0acb6e4b90a9a,Politics,22/12/2016-19:38:29,DONALD TRUMP’S 16 OBSESSIVE LETTERS TO ‘MAD ALEX’ SALMOND ABOUT WIND TURBINE ‘MONSTERS’ IN SCOTLAND REVEALED BY FOINEO2199
http://www.reuters.com/article/us-usa-healthcare-democrats-idUSKBN14B2AS?feedType=RSS&feedName=topNews,Politics,22/12/2016-19:38:29,DEMOCRATS LEAN ON DRUG PRICING AS OBAMACARE REPEAL LOOMSTEMPORARYCREATURE
http://uk.businessinsider.com/how-american-journalists-covered-the-rise-of-hitler-2016-12?r=UK&IR=T,Politics,22/12/2016-19:38:29,HOW AMERICAN JOURNALISTS COVERED THE RISE OF HITLERBDRRR
http://www.charlotteobserver.com/news/politics-government/article121981624.html,Politics,22/12/2016-19:38:29,TRUMP’S PICK FOR COMMERCE SECRETARY SHARES A BUSINESS CIRCLE WITH PUTIN ASSOCIATESWRAITHTEK
http://nypost.com/2016/12/22/the-biggest-danger-for-trump-is-being-captured-by-the-gop/,Politics,22/12/2016-19:38:29,THE BIGGEST DANGER FOR TRUMP IS BEING CAPTURED BY THE GOPMOONCH1122
http://inthesetimes.com/features/trump_left_resistance_racial_justice.html,Politics,22/12/2016-19:38:29,"UNDER TRUMP, RACIAL JUSTICE ACTIVISTS MUST SEEK SOLUTIONS OUTSIDE THE STATEYOUNGBAGELIAN"
http://www.huffingtonpost.com/entry/edward-snowden-russian-intelligence_us_585c05d5e4b0eb5864856e81,Politics,22/12/2016-19:38:29,HOUSE REPORT ACCUSES EDWARD SNOWDEN OF BEING ‘IN CONTACT’ WITH RUSSIAN INTELLIGENCETWOGEE
http://time.com/4608547/donald-trump-republicans-no-mandate/,Politics,22/12/2016-19:38:29,DONALD TRUMP AND THE REPUBLICANS HAVE NO MANDATECOMSIAN43
https://www.theguardian.com/us-news/2016/dec/22/congress-minority-race-donald-trump,Politics,22/12/2016-19:38:29,MINORITY LAWMAKERS VOW TO PUSH BACK AGAINST TRUMP: 'WE'RE NOT A RACIST NATION'ZSREPORT
http://thehill.com/homenews/news/311541-trump-transition-team-asks-state-department-for-information-about-womens-issues,Politics,22/12/2016-19:38:29,TRUMP TRANSITION TEAM ASKS STATE DEPARTMENT FOR INFORMATION ABOUT WOMEN'S ISSUES PROGRAMSMEDIATECHES
http://www.cnn.com/2016/12/21/politics/donald-trump-tariffs/index.html,Politics,22/12/2016-19:38:29,TRUMP TEAM FLOATS TARIFFSATTACKSKUNK
http://www.politico.com/story/2016/12/corey-lewandowski-defends-consulting-firm-232915,Politics,22/12/2016-19:38:29,LEWANDOWSKI: I WON'T ‘BECOME A SWAMP CREATURE’NEO2199
http://www.ibtimes.com/does-obamacare-work-uninsured-rate-declines-across-us-more-people-enroll-coverage-2464224,Politics,22/12/2016-19:38:29,DOES OBAMACARE WORK? UNINSURED RATE DECLINES ACROSS THE US AS MORE PEOPLE ENROLL IN COVERAGEGALIENLIFEFORM
http://www.cbsnews.com/news/andrew-mcclinton-arrested-in-burning-of-black-church-in-mississippi/,Politics,22/12/2016-19:38:29,CONGREGATION MEMBER ARRESTED IN BLACK CHURCH BURNING IN MISSISSIPPILILWHUT
http://www.economist.com/blogs/democracyinamerica/2016/12/capital-letter?fsrc=scn/fb/te/bl/ed/,Politics,22/12/2016-19:38:29,STEPHEN BRYER URGES A REVIEW OF THE DEATH PENALTYNALOWALE
http://www.theolympian.com/opinion/letters-to-the-editor/article117099908.html,Politics,22/12/2016-19:38:29,RANKED CHOICE VOTING IS AN OPTIONBARNABY-JONES
http://www.latimes.com/opinion/topoftheticket/la-na-tt-bernie-beats-trump-20161222-story.html,Politics,22/12/2016-19:38:29,PRESIDENT SANDERS? BERNIE WOULD HAVE BEATEN TRUMPSYMBIOTICPATRIOTIC
http://www.npr.org/2016/12/22/506611986/trump-and-gingrich-disagree-on-that-whole-swamp-draining-thing,Politics,22/12/2016-19:38:29,TRUMP AND GINGRICH DISAGREE ON THAT WHOLE SWAMP-DRAINING THINGISAI76
http://www.cnn.com/2016/12/21/politics/democrats-president-2020-poll/index.html,Politics,22/12/2016-19:38:29,POLL: DEMOCRATS WANT SOMEONE NEW FOR 2020WESSER234
https://www.theatlantic.com/politics/archive/2016/12/how-barack-obama-failed-black-americans/511358/,Politics,22/12/2016-19:38:29,HOW BARACK OBAMA FAILED BLACK AMERICANSIUSHCIUWEIUSH
http://www.cnn.com/videos/politics/2016/12/22/trump-putin-nuclear-capability-starr-lead-dnt.cnn,Politics,22/12/2016-19:38:29,"DID PUTIN, TRUMP JUST HAVE A NUCLEAR STANDOFF?INTERN3"
http://www.sacbee.com/news/nation-world/national/article122376199.html,Politics,22/12/2016-19:38:31,WHITE NATIONALISTS RAISE MILLIONS WITH TAX-EXEMPT CHARITIESCOMMIEFLIRT
https://thinkprogress.org/breaking-north-carolina-republicans-renege-on-deal-to-repeal-hb2-in-full-b2d2ac4e2f18#.opcd1vbvl,Politics,22/12/2016-19:38:31,NORTH CAROLINA REPUBLICANS RENEGE ON DEAL TO REPEAL HB2 ‘IN FULL’MARTIALALEX
https://thinkprogress.org/kasich-minimum-wage-preemption-5b64b08f6efd#.po9acwpk9,Politics,22/12/2016-19:38:31,JOHN KASICH BLOCKS OHIO CITIES FROM RAISING THEIR OWN MINIMUM WAGESQWERTYSAPIENS
http://www.cnn.com/2016/12/21/politics/newt-gingrich-trump-drain-the-swamp/,Politics,22/12/2016-19:38:31,GINGRICH: TRUMP DROPPING 'DRAIN THE SWAMP'NEO2199
http://www.reuters.com/article/idUSKBN14B1VD,Politics,22/12/2016-19:38:31,U.S. FORMALLY ENDS CONTROVERSIAL REGISTRY PROGRAM FOR VISITORSETHANW12
http://in.reuters.com/article/usa-trump-defense-idINKBN14B2H0,Politics,22/12/2016-19:38:31,TRUMP SAYS BECAUSE OF HIGH COST OF F-35 HAS ASKED BOEING TO PRICE OUT 'COMPARABLE F-18'WONDERINGSOCRATES
http://www.houstonpublicmedia.org/articles/news/2016/12/22/181705/texas-is-the-state-with-highest-number-of-judicial-vacancies-in-the-nation/,Politics,22/12/2016-19:38:31,TEXAS IS THE STATE WITH HIGHEST NUMBER OF JUDICIAL VACANCIES IN THE NATIONZSREPORT
http://time.com/4611229/donald-trump-berlin-attack/,Politics,22/12/2016-19:38:31,"DONALD TRUMP ON PROPOSED MUSLIM BAN: ‘YOU KNOW MY PLANS’ ""ALL ALONG, I’VE BEEN PROVEN TO BE RIGHT. 100% CORRECT""SPURTY_LOADS"
http://abcnews.go.com/Politics/trump-reversal-obamas-drilling-ban-difficult-experts/story?id=44323535,Politics,22/12/2016-19:38:31,"TRUMP REVERSAL OF OBAMA'S DRILLING BAN MAY BE DIFFICULT, EXPERTS SAYCYANOCITTAETPROCYON"
http://www.huffingtonpost.com/entry/obamacare-enrollments-outpacing-last-years-sign-ups_us_585ae559e4b0d9a59456f61c,Politics,22/12/2016-19:38:31,"OBAMACARE ENROLLMENTS PASS 6 MILLION, OUTPACING LAST YEAR'S SIGN-UPSBILLTOWNE"
http://www.theepochtimes.com/n3/2201822-poll-62-percent-of-democrats-say-hillary-clinton-shouldnt-run-in-2020/,Politics,22/12/2016-19:38:31,POLL: 62 PERCENT OF DEMOCRATS SAY HILLARY CLINTON SHOULDN’T RUN IN 2020CIIK
