url,type,timeretrieved,title
http://www.al-monitor.com/pulse/originals/2016/12/obama-buy-time-iran-nuclear-deal.html#ixzz4TWn6qfz7,Politics,22/12/2016-19:38:31,"OBAMA ADMINISTRATION, ALLIES TRY TO BUY TIME FOR IRAN NUCLEAR DEALQANARI"
http://www.dallasnews.com/news/texas-politics/2016/12/21/federal-judge-oks-lawsuit-gov-greg-abbott-removal-satirical-nativity,Politics,22/12/2016-19:38:31,FEDERAL JUDGE OKS LAWSUIT AGAINST GOV. GREG ABBOTT OVER REMOVAL OF SATIRICAL NATIVITYTODAYILEARNED83
http://www.dallasnews.com/news/lgbt/2016/12/06/texas-lose-85-billion-anti-gay-transgender-bathroom-laws-passed-study-claims,Politics,22/12/2016-19:38:31,"TEXAS COULD LOSE $8.5B IF ANTI-GAY OR TRANSGENDER BATHROOM LAWS ARE PASSED, STUDY CLAIMSHEEBIEJEEBIES_FERRET"
http://www.dailymail.co.uk/news/article-4059082/Ivanka-Trump-aggressively-confronted-man-JetBlue-sitting-children-screams-father-ruining-country-asks-flight.html,Politics,22/12/2016-19:38:31,SCREAMING LAWYER CHASES DOWN IVANKA TRUMP AND YELLS AT HER WHILE SHE SITS WITH HER KIDS ON FLIGHT TO FLORIDA - AND HIS HILLARY SUPPORTER HUSBAND BOASTS ABOUT THE VERBAL ATTACK BEFORE THEY'RE KICKED OFFKJELLPU
http://thehill.com/blogs/blog-briefing-room/news/311323-trumps-cabinet-has-a-net-worth-greater-than-the-worlds-70,Politics,22/12/2016-19:38:31,TRUMP'S CABINET HAS A NET WORTH GREATER THAN THE WORLD'S 70 SMALLEST COUNTRIESMYELLABELLA
http://www.allgov.com/news/top-stories/wealthy-americans-may-get-hefty-tax-cut-with-repeal-of-obamacare-161218?news=859936,Politics,22/12/2016-19:38:31,WEALTHY AMERICANS MAY GET HEFTY TAX CUT WITH REPEAL OF OBAMACAREMARTINE_V
http://www.nola.com/crime/index.ssf/2016/12/mississippi_church_fire_trump.html,Politics,22/12/2016-19:38:31,ARREST MADE IN MISSISSIPPI 'VOTE TRUMP' CHURCH FIREROWNIK
https://www.washingtonpost.com/world/national-security/in-a-day-of-tweets-trump-suggests-major-change-on-national-security-issues/2016/12/22/4d709da8-c873-11e6-8bee-54e800ef2a63_story.html?utm_term=.d7a12a6efa24,Politics,22/12/2016-19:38:31,"IN A DAY OF TWEETS, TRUMP SUGGESTS MAJOR CHANGE ON NATIONAL SECURITY ISSUESMANAFORT"
http://www.nbcnews.com/politics/white-house/trump-insists-he-ll-drain-swamp-gingrich-walks-back-boo-n699146?cid=sm_fb,Politics,22/12/2016-19:38:31,TRUMP INSISTS HE'LL 'DRAIN THE SWAMP' AS GINGRICH WALKS BACK 'BOO BOO'LUKESMOOTH
http://www.pbs.org/newshour/updates/meet-donald-trumps-doctor/,Politics,22/12/2016-19:38:31,DONALD TRUMP'S DOCTOR BREAKS HIS SILENCE6P6SS6
http://www.commondreams.org/news/2016/12/22/trump-brings-billionaire-bruiser-carl-icahn-gut-government-regulations,Politics,22/12/2016-19:38:31,TRUMP BRINGS ON BILLIONAIRE BRUISER CARL ICAHN TO GUT GOVERNMENT REGULATIONSFATAL_STRATEGY
http://shareblue.com/in-a-final-insult-the-fbi-had-no-probable-cause-for-warrant-that-reopened-email-story/,Politics,22/12/2016-19:38:31,"IN A FINAL INSULT, THE FBI HAD NO PROBABLE CAUSE FOR WARRANT THAT REOPENED EMAIL STORYZIAPOLITICS"
http://edition.cnn.com/2016/12/22/politics/kellyanne-conway-donald-trump-muslim-ban/index.html,Politics,22/12/2016-19:38:31,CONWAY: TRUMP WILL NOT PURSUE IMMIGRATION BAN BASED SOLELY ON RELIGIONTOO_FAR_WEST
http://www.gazettenet.com/Mary-Hall-on-ranked-choice-voting-6245984,Politics,22/12/2016-19:38:31,MARY H. HALL: MAINE ADOPTS RANKED-CHOICE VOTINGBARNABY-JONES
https://socialistworker.org/2016/11/29/nows-the-time-for-socialist-organization,Politics,22/12/2016-19:38:32,NOW'S THE TIME FOR SOCIALIST ORGANIZATIONYOUNGBAGELIAN
https://www.washingtonpost.com/blogs/plum-line/wp/2016/12/21/the-trump-administration-is-already-on-its-way-to-a-new-ethical-low/?hpid=hp_no-name_opinion-card-e%3Ahomepage%2Fstory&utm_term=.90b9801eee5f,Politics,22/12/2016-19:38:32,THE TRUMP ADMINISTRATION IS ALREADY ON ITS WAY TO A NEW ETHICAL LOWDOOKIEA
http://www.cnn.com/2016/12/22/politics/un-vote-israel-settlements/index.html?adkey=bn,Politics,22/12/2016-19:38:32,ISRAELI GOVERNMENT ASKS TRUMP TO PRESSURE OBAMA TO VETO A UN RESOLUTION CONDEMNING SETTLEMENT ACTIVITYMBOLARIS
http://heavy.com/news/2016/12/donald-trump-muslim-ban-registry-comments-today-december-2016-double-down-on-video-clip/,Politics,22/12/2016-19:38:32,DONALD TRUMP SUGGESTS HE STILL PLANS TO INSTITUTE MUSLIM BANYAKINIKUTABEHOUDAI
https://www.theguardian.com/technology/2016/dec/21/oracle-executive-resigns-ceo-safra-catz-donald-trump,Politics,22/12/2016-19:38:32,ORACLE EXECUTIVE PUBLICLY RESIGNS AFTER CEO JOINS TRUMP'S TRANSITION TEAMCONSUMER451
https://www.washingtonpost.com/national/religion/arrest-in-vote-trump-burning-of-mississippi-black-church/2016/12/21/b3641010-c7bd-11e6-acda-59924caa2450_story.html?utm_term=.e37cafcda2c5,Politics,22/12/2016-19:38:32,MISSISSIPPI CHURCH MEMBER CHARGED IN ‘VOTE TRUMP’ ARSONTOPKEKSAVAGE
http://www.cnbc.com/2016/12/22/trump-climate-change-take-action.html,Politics,22/12/2016-19:38:32,OPEN LETTER TO PRESIDENT-ELECT TRUMP—DON'T LISTEN TO THE 'IGNORANT VOICES' ON CLIMATE CHANGESPLENDA
https://www.washingtonpost.com/news/post-politics/wp/2016/12/22/eric-trump-suspends-his-foundations-operations/,Politics,22/12/2016-19:38:32,ERIC TRUMP SUSPENDS HIS FOUNDATION’S OPERATIONSMYELLABELLA
http://dailycaller.com/2016/12/22/exclusive-sen-corkers-height-business-dealings-hurt-his-secretary-of-state-chances/,Politics,22/12/2016-19:38:32,"SEN. CORKER’S HEIGHT, BUSINESS DEALINGS HURT HIS SECRETARY OF STATE CHANCESTAKEASHILL_PILL"
https://www.thenation.com/article/will-obama-cancel-the-loan-debt-of-for-profit-college-victims/,Politics,22/12/2016-19:38:32,WILL OBAMA CANCEL THE LOAN DEBT OF FOR-PROFIT COLLEGE VICTIMS?DISCOCRISCO
http://www.nytimes.com/2016/12/16/upshot/obamacare-donald-trump.html,Politics,22/12/2016-19:38:32,WANT TO GET RID OF OBAMACARE? BE CAREFUL WHAT YOU WISH FOR.SCIENCEISMINE
http://www.foxnews.com/entertainment/2016/12/22/donald-trump-struggling-to-secure-talent-to-perform-at-inauguration.html,Politics,22/12/2016-19:38:32,DONALD TRUMP STRUGGLING TO SECURE TALENT TO PERFORM AT INAUGURATIONKURTCA
http://thehill.com/homenews/campaign/311507-trump-well-always-be-trying-to-drain-the-swamp,Politics,22/12/2016-19:38:32,TRUMP: WE'LL ALWAYS BE TRYING TO 'DRAIN THE SWAMP'JUMBLETON
http://www.vox.com/policy-and-politics/2016/12/21/14025198/trump-undecided-final-weeks-survey,Politics,22/12/2016-19:38:32,SURVEY: TRUMP WON BIG AMONG VOTERS WHO DECIDED IN THE LAST 2 WEEKS OF THE CAMPAIGNDYLANCA
http://www.marketwatch.com/story/newt-gingrich-trump-doesnt-want-to-drain-the-swamp-anymore-2016-12-21,Politics,22/12/2016-19:38:32,NEWT GINGRICH: TRUMP DOESN’T WANT TO ‘DRAIN THE SWAMP’ ANYMORETHEPOLITICALREV
https://www.bloomberg.com/news/articles/2016-12-21/california-drivers-pay-up-for-underfunded-highway-patrol-pension,Politics,22/12/2016-19:38:32,CALIFORNIA DRIVERS PAY FOR UNDERFUNDED STATE PATROL PENSIONNOSOTROS_ROAD_SODIUM
https://www.thenation.com/article/mitch-mcconnell-assaulted-the-constitution-and-got-away-with-it/,Politics,22/12/2016-19:38:32,MITCH MCCONNELL ASSAULTED THE CONSTITUTION (AND GOT AWAY WITH IT)BUCKEYE39
https://www.washingtonpost.com/news/powerpost/wp/2016/12/22/trump-names-sean-spicer-as-press-secretary-rounds-out-comms-staff/?pushid=breaking-news_1482438363&tid=notifi_push_breaking-news&utm_term=.077587473c0c,Politics,22/12/2016-19:38:32,"TRUMP NAMES SEAN SPICER AS PRESS SECRETARY, ROUNDS OUT COMMUNICATIONS STAFFSCENERYEXPLORER"
http://www.reuters.com/article/idUSKBN14B1ZZ,Politics,22/12/2016-19:38:32,TRUMP CALLS FOR EXPANDED U.S. NUCLEAR WEAPONS CAPABILITYETHANW12
http://www.msnbc.com/rachel-maddow-show/trump-tweets-ambiguous-vow-expand-us-nuclear-capability?,Politics,22/12/2016-19:38:32,TRUMP TWEETS AMBIGUOUS VOW TO 'EXPAND' U.S. NUCLEAR CAPABILITYSKOALBROTHER
http://www.newser.com/story/235857/obama-sets-up-roadblock-to-possible-muslim-registry.html,Politics,22/12/2016-19:38:32,OBAMA SETS UP ROADBLOCK TO POSSIBLE MUSLIM REGISTRYTEMPORARYCREATURE
http://www.politico.com/story/2016/12/obama-nseers-muslim-registry-trump-232916,Politics,22/12/2016-19:38:32,OBAMA PULLS REGS THAT COULD HAVE FUELED 'MUSLIM REGISTRY' UNDER TRUMPMOSSBERGGT
http://www.newspk.ml/2016/12/obama-just-made-it-harder-for-trump-to.html,Politics,22/12/2016-19:38:32,OBAMA JUST MADE IT HARDER FOR TRUMP TO CREATE A MUSLIM REGISTRYITILAM
http://www.cnn.com/2016/12/21/politics/hillary-clinton-james-comey-emails-fbi-warrant/index.html,Politics,22/12/2016-19:38:32,COMEY UNDER FIRE AGAIN OVER CLINTON EMAILSBASEDPEDE1337
http://www.cnn.com/2016/12/22/politics/edward-snowden-russia-intelligence/index.html,Politics,22/12/2016-19:38:32,CONGRESSIONAL REPORT: SNOWDEN IN 'CONTACT WITH RUSSIAN INTELLIGENCE'INTERN3
http://edition.cnn.com/2016/12/22/politics/lieberman-new-day-israel-ambassador-settlement-resolution/index.html,Politics,22/12/2016-19:38:36,LIEBERMAN DEFENDS TRUMP'S CONTROVERSIAL ISRAEL AMBASSADOR PICKJULIAROBART
http://www.boston.com/news/politics/2016/12/21/trump-voters-dont-want-trump-to-get-rid-of-elizabeth-warrens-consumer-agency,Politics,22/12/2016-19:38:36,TRUMP VOTERS DON’T WANT TRUMP TO GET RID OF ELIZABETH WARREN’S CONSUMER AGENCYDRAKEB55
http://www.businessinsider.com/trump-asks-boeing-to-compete-with-f35-2016-12,Politics,22/12/2016-19:38:36,TRUMP ASKS BOEING TO PRICE OUT A COMPARABLE JET TO COMPETE WITH F-35YUYUMON
http://www.nbcnews.com/feature/nbc-out/first-amendment-defense-act-would-be-devastating-lgbtq-americans-n698416?,Politics,22/12/2016-19:38:36,FIRST AMENDMENT DEFENSE ACT WOULD BE 'DEVASTATING' FOR LGBTQ AMERICANSTREVOR5EVER
http://www.nytimes.com/2016/12/22/us/politics/trump-says-us-should-expand-its-nuclear-capability.html,Politics,22/12/2016-19:38:36,TRUMP SAYS U.S. SHOULD ‘EXPAND ITS NUCLEAR CAPABILITY’BASEDPEDE1337
http://thehill.com/homenews/administration/311591-biden-clinton-never-figured-out-why-she-was-running,Politics,22/12/2016-19:38:36,BIDEN: CLINTON NEVER FIGURED OUT WHY SHE WAS RUNNINGQUORABOY
https://newrepublic.com/minutes/139446/republicans-already-cowering-fear-donald-trump,Politics,22/12/2016-19:38:36,REPUBLICANS ARE ALREADY COWERING IN FEAR OF DONALD TRUMPWRECKINGCANON
http://thehill.com/homenews/administration/311459-conway-trump-will-have-daily-availability-for-press-when-president,Politics,22/12/2016-19:38:36,CONWAY: PRESS WILL HAVE 'DAILY ACCESS' TO TRUMPWONDERINGSOCRATES
http://www.cnn.com/2016/12/22/politics/tom-perez-dnc-chair-four-governors/index.html,Politics,22/12/2016-19:38:36,FOUR GOVERNORS BACK TOM PEREZ FOR DNC CHAIRIWANTTOODIE
http://www.businessinsider.com/jamie-dimon-jp-morgan-2016-12,Politics,22/12/2016-19:38:36,JAMIE DIMON: CORPORATE AMERICA IS IN A 'RESET MOMENT'W0LF_JK
http://www.pinknews.co.uk/2016/12/12/us-anti-gay-activists-launch-fresh-push-to-export-hatred-around-the-world/,Politics,22/12/2016-19:38:36,US ANTI-GAY ACTIVISTS LAUNCH FRESH PUSH TO EXPORT HATRED AROUND THE WORLDCOMMIEFLIRT
http://thehill.com/homenews/news/311499-wis-republicans-want-answers-about-class-on-whiteness,Politics,22/12/2016-19:38:36,WIS. REPUBLICANS WANT ANSWERS ABOUT CLASS ON 'WHITENESS'JASON7655
http://www.huffingtonpost.com/entry/north-carolina-hb2-repeal_us_585a8f9be4b0d9a5945692e8,Politics,22/12/2016-19:38:36,NORTH CAROLINA FAILS TO REPEAL ANTI-LGBTQ BILLDARTHADITYA
http://www.slate.com/articles/news_and_politics/politics/2016/12/planned_parenthood_focus_groups_reveal_clinton_s_big_blunder.html,Politics,22/12/2016-19:38:36,WHY DID PLANNED PARENTHOOD SUPPORTERS VOTE TRUMP?RNON
https://www.washingtonpost.com/world/national-security/the-attorney-general-could-have-ordered-fbi-director-james-comey-not-to-send-his-bombshell-letter-on-clinton-emails-heres-why-she-didnt/2016/12/21/7824d00a-c5fd-11e6-85b5-76616a33048d_story.html?hpid=hp_hp-top-table-main_comeylynch-715am%3Ahomepage%2Fstory&utm_term=.2176dd42ae4b,Politics,22/12/2016-19:38:36,THE ATTORNEY GENERAL COULD HAVE ORDERED THE FBI NOT TO SEND ITS BOMBSHELL LETTER ON CLINTON. HERE’S WHY SHE DIDN’T.YOURBLOGSUCKSTOO
http://www.nytimes.com/2016/12/22/us/trump-mexico-wall.html?referer=,Politics,22/12/2016-19:38:36,"TRUMP SEEKS PATH FOR MEXICO BARRIER. BUT WILL IT BE A ‘BIG, BEAUTIFUL WALL’?STEVEBANNONEXPOSED"
http://thehill.com/homenews/house/311566-western-southern-states-likely-to-gain-house-seats-in-2022,Politics,22/12/2016-19:38:36,"WESTERN, SOUTHERN STATES LIKELY TO GAIN HOUSE SEATS IN 2022SOMALI_PIR8"
http://www.slate.com/blogs/xx_factor/2016/12/21/texas_purports_to_cut_planned_parenthood_funding_which_is_illegal.html,Politics,22/12/2016-19:38:36,"TEXAS PURPORTS TO CUT PLANNED PARENTHOOD FUNDING, WHICH IT CANNOT LEGALLY DORNON"
http://pagesix.com/2016/12/21/reality-tv-booker-cant-find-gigs-for-trumps-inauguration/,Politics,22/12/2016-19:38:36,REALITY TV BOOKER CAN’T FIND GIGS FOR TRUMP’S INAUGURATIONDYLANCA
http://talkingpointsmemo.com/livewire/conservatives-without-california-trump-won-popular-vote,Politics,22/12/2016-19:38:36,CONSERVATIVES' SPECIAL REVISIONIST MATH: TRUMP WON POPULAR VOTE IF YOU NIX CA!JACKSONARBOR
http://rare.us/story/ron-paul-says-democrats-are-just-playing-politics-with-all-their-russia-hysteria/,Politics,22/12/2016-19:38:36,RON PAUL SAYS DEMOCRATS ARE JUST PLAYING POLITICS WITH ALL THEIR RUSSIA HYSTERIADOUBLEGUNSSOCKCUCKA
http://www.nbcnews.com/politics/2016-election/pay-play-questions-continue-swirl-around-trump-team-n698796?cid=par-twitter-feed_20161221,Politics,22/12/2016-19:38:36,PAY-FOR-PLAY QUESTIONS CONTINUE TO SWIRL AROUND TRUMP TEAMSURFINPIRATE
https://www.buzzfeed.com/jessicagarrison/trump-vineyards-seeks-more-foreign-workers?utm_term=.sr82ZPJ4l#.bgVYKm3dW,Politics,22/12/2016-19:38:36,TRUMP VINEYARD SEEKS MORE FOREIGN WORKERSNEILPOONHANDLER
http://thehill.com/homenews/news/311405-poll-majority-of-dems-and-independents-want-someone-entirely-new-to-be-2020,Politics,22/12/2016-19:38:36,POLL: MAJORITY OF DEMS WANT 'SOMEONE ENTIRELY NEW' TO RUN IN 2020KJELLPU
http://www.politico.com/story/2016/12/edward-snowden-russian-agents-house-report-232917,Politics,22/12/2016-19:38:36,HOUSE REPORT: EDWARD SNODWEN IN CONTACT WITH RUSSIANAAGENTSBRENT8485
http://www.businessinsider.com/putin-poll-favorability-trump-2016-12,Politics,22/12/2016-19:38:37,THERE'S BEEN A BREATHTAKING SWING IN PUTIN'S POPULARITY AMONG REPUBLICANS IN THE TRUMP ERAATHINNES
https://www.theguardian.com/world/2016/dec/22/the-earth-is-flat-trump-is-a-democrat-and-other-great-conspiracy-theories-of-2016,Politics,22/12/2016-19:38:37,"THE EARTH IS FLAT, TRUMP IS A DEMOCRAT … AND OTHER GREAT CONSPIRACY THEORIES OF 2016ORANGUTAN"
http://www.nydailynews.com/news/politics/trump-starts-day-tweets-election-won-6-weeks-article-1.2918589,Politics,22/12/2016-19:38:37,TRUMP BEGINS DAY WITH TWEET STORM ABOUT ELECTION HE WON SIX WEEKS AGODJ_CUNNINGHAM
https://www.thenation.com/article/declassify-the-evidence-of-russian-hacking/,Politics,22/12/2016-19:38:37,﻿DECLASSIFY THE EVIDENCE OF RUSSIAN HACKING!LESSS365
http://thehill.com/blogs/blog-briefing-room/news-campaigns/305603-jane-sanders-absolutely-bernie-could-have-beat-trump,Politics,22/12/2016-19:38:37,JANE SANDERS: 'ABSOLUTELY' BERNIE COULD HAVE BEAT TRUMPKI_NO_AKUMA
http://hosted.ap.org/dynamic/stories/U/US_OBAMA_IMMIGRANT_REGISTRATION?SITE=AP&SECTION=HOME&TEMPLATE=DEFAULT&CTIME=2016-12-22-10-09-10,Politics,22/12/2016-19:38:37,"OBAMA SCRAPS REGISTRY FOR SOME IMMIGRANT MEN, MOSTLY MUSLIMSNOMEEEK"
https://www.washingtonpost.com/world/national-security/trump-obama-on-possible-collision-course-over-israeli-settlement-vote/2016/12/22/3b0e3f1c-c846-11e6-8bee-54e800ef2a63_story.html,Politics,22/12/2016-19:38:37,"TRUMP, OBAMA ON POSSIBLE COLLISION COURSE OVER ISRAELI SETTLEMENT VOTETRUMPWEED_"
http://www.salon.com/2016/12/22/are-donald-trump-and-kellyanne-conway-on-the-same-page-when-it-comes-to-trumps-proposed-muslim-ban/,Politics,22/12/2016-19:38:37,ARE DONALD TRUMP AND KELLYANNE CONWAY ON THE SAME PAGE WHEN IT COMES TO TRUMP’S PROPOSED MUSLIM BAN?MEDIATECHES
http://www.cnn.com/2016/12/22/politics/trump-contradicting-obama/index.html,Politics,22/12/2016-19:38:37,"ONE PRESIDENT AT A TIME? FOR TRUMP, NO QUALMS IN CONTRADICTING OBAMAMAWONTALK"
http://thehill.com/blogs/blog-briefing-room/news/311452-report-trump-considering-early-tariffs-on-imports,Politics,22/12/2016-19:38:37,REPORT: TRUMP CONSIDERING EARLY TARIFFS ON IMPORTSTHOMAS228
https://kansascity.relaymedia.com/amp/entertainment/ent-columns-blogs/stargazing/article122204749.html?utm_medium=referral&utm_campaign=amp&utm_source=www.kansascity.com-RelayMediaAMP,Politics,22/12/2016-19:38:37,"ROBERT REICH SUGGEST INAUGURAL DAY ""FREEDOM CONCERT"" AND PEOPLE ARE TAKING SIDESRANAPARVUS"
http://www.businessinsider.com/r-facebook-says-government-requests-for-account-data-rise-27-percent-2016-12,Politics,22/12/2016-19:38:37,GOVERNMENTS ARE DEMANDING MORE AND MORE INFORMATION ABOUT PEOPLE ON FACEBOOKNALOWALE
http://www.npr.org/sections/thetwo-way/2016/12/21/506495339/lawmakers-seek-better-count-of-advanced-black-lung-disease,Politics,22/12/2016-19:38:37,LAWMAKERS SEEK BETTER COUNT OF ADVANCED BLACK LUNG DISEASE CASESGALIENLIFEFORM
http://www.cnbc.com/2016/12/15/abortion-providers-see-increased-threat-since-trumps-election.html,Politics,22/12/2016-19:38:37,THREATS AT ABORTION CLINICS RISE SINCE TRUMP'S ELECTIONIMMAKEEPRUNNIN
http://ew.com/news/2016/12/22/mormon-tabernacle-choir-trump-inauguration/,Politics,22/12/2016-19:38:37,MORMON TABERNACLE CHOIR TO SING AT DONALD TRUMP'S PRESIDENTIAL INAUGURATIONJUMBLETON
http://edition.cnn.com/2016/12/22/politics/un-vote-israel-settlements/index.html,Politics,22/12/2016-19:38:37,ISRAELIS CALLED TRUMP TO WEIGH IN AHEAD OF UN SECURITY COUNCIL VOTESTEVEBANNONEXPOSED
https://www.washingtonpost.com/news/post-nation/wp/2016/12/21/north-carolina-lawmakers-gather-to-consider-repealing-bathroom-bill/,Politics,22/12/2016-19:38:37,NORTH CAROLINA LAWMAKERS LEAVE ‘BATHROOM BILL’ IN PLACERTFM4R
http://www.sciencemag.org/news/2016/12/us-physics-society-removes-chief-lobbyist-after-controversial-press-release-trump-s,Politics,22/12/2016-19:38:37,U.S. PHYSICS SOCIETY REMOVES CHIEF LOBBYIST AFTER CONTROVERSIAL PRESS RELEASE ON TRUMP’S ELECTIONREDDITREGERTS
https://www.washingtonpost.com/news/acts-of-faith/wp/2016/12/06/american-muslim-leaders-to-trump-reconsider-and-reject-your-bigoted-cabinet-nominees/?utm_term=.7608a2648104,Politics,22/12/2016-19:38:37,AMERICAN MUSLIM LEADERS TO TRUMP: ‘RECONSIDER AND REJECT’ YOUR BIGOTED CABINET NOMINEESDESI_US
https://www.washingtonpost.com/news/powerpost/wp/2016/12/21/house-democrat-appeals-for-special-counsel-to-probe-russian-hacking/,Politics,22/12/2016-19:38:37,HOUSE DEMOCRAT APPEALS FOR SPECIAL COUNSEL TO PROBE RUSSIAN HACKINGOUROBOROS000
http://abcnews.go.com/Politics/trump-sons-skipping-event-promised-donors-access-president/story?id=44329467,Politics,22/12/2016-19:38:37,TRUMP SONS SKIPPING EVENT THAT PROMISED DONORS ACCESS TO PRESIDENT-ELECTSTEPHEN55121
http://www.kentucky.com/news/politics-government/article122292969.html,Politics,22/12/2016-19:38:37,BEVIN DECLARES 2017 THE ‘YEAR OF THE BIBLE’ IN KENTUCKYCOOLCROSBY
http://www.bbc.co.uk/news/uk-scotland-scotland-politics-38397644,Politics,22/12/2016-19:38:37,DONALD TRUMP LETTERS TO ALEX SALMOND PUBLISHEDWHYDOYOUONLYLIE
http://www.latimes.com/nation/la-na-missile-defense-unlimited-20161221-snap-20161221-story.html#nt=oft12aH-1gp2,Politics,22/12/2016-19:38:37,"BY STRIKING A SINGLE WORD, CONGRESS SHAKES UP U.S. NUCLEAR DEFENSE DOCTRINE AND OPENS DOOR TO SPACE ARMS RACEIMNAHA2"
http://www.ibtimes.com/what-first-amendment-defense-act-controversial-bill-under-donald-trump-could-pass-2463898?ref=yfp,Politics,22/12/2016-19:38:37,"WHAT IS THE FIRST AMENDMENT DEFENSE ACT? CONTROVERSIAL BILL UNDER DONALD TRUMP COULD PASS, DISCRIMINATING AGAINST LGBTQ AMERICANSPLANETOFTHEATHEISTS"
https://www.washingtonpost.com/politics/donald-trump-is-holding-a-government-casting-call-hes-seeking-the-look/2016/12/21/703ae8a4-c795-11e6-bf4b-2c064d32a4bf_story.html,Politics,22/12/2016-19:38:39,DONALD TRUMP IS HOLDING A GOVERNMENT CASTING CALL. HE’S SEEKING ‘THE LOOK.’SHYLLAT
http://www.nydailynews.com/news/politics/saddam-hussein-daughter-praises-trump-political-sensibility-article-1.2920095,Politics,22/12/2016-19:38:39,SADDAM HUSSEIN'S DAUGHTER PRAISES TRUMP'S 'POLITICAL SENSIBILITY'KELLYANNE_CUNTAWAY
http://www.politico.com/story/2016/12/un-israeli-settlements-trump-232913,Politics,22/12/2016-19:38:39,TRUMP CALLS ON OBAMA TO VETO U.N. RESOLUTION ON ISRAELI SETTLEMENTSTWOGEE
http://www.cnn.com/2016/12/22/politics/donald-trump-kellyanne-conway-counselor/index.html,Politics,22/12/2016-19:38:39,KELLYANNE CONWAY LANDS TOP WH JOB IN TRUMP ADMINISTRATIONTHONTOR
http://www.reuters.com/article/us-usa-snowden-idUSKBN14B1QB,Politics,22/12/2016-19:38:39,SNOWDEN STILL HAS CONTACTS WITH RUSSIAN INTELLIGENCE: U.S. HOUSE REPORT0AND18
http://www.seattlepi.com/news/politics/article/Inquiry-says-Snowden-in-contact-with-Russia-s-spy-10813140.php,Politics,22/12/2016-19:38:39,INQUIRY SAYS SNOWDEN IN CONTACT WITH RUSSIA'S SPY SERVICESRIDEO
http://www.businessinsider.com/donald-trump-nukes-nuclear-weapons2016-12,Politics,22/12/2016-19:38:39,TRUMP SAYS US MUST 'EXPAND ITS NUCLEAR CAPABILITY' UNTIL 'THE WORLD COMES TO ITS SENSES'ADRIAN667
https://themoscowtimes.com/news/russian-troll-factory-owner-added-to-us-sanctions-list-56600,Politics,22/12/2016-19:38:39,RUSSIAN ‘TROLL FACTORY’ OWNER ADDED TO U.S. SANCTIONS LISTJABBYJABJABSTER
http://www.cnbc.com/2016/12/22/eric-trump-stops-fundraising-for-his-charity-after-scrutiny.html,Politics,22/12/2016-19:38:39,ERIC TRUMP STOPS FUNDRAISING FOR HIS CHARITY AFTER SCRUTINYDANGUSDINGLEMAN
http://www.businessinsider.com/popular-vote-trump-clinton-2016-12,Politics,22/12/2016-19:38:39,THE RESULTS ARE NOW FINAL: CLINTON WINS POPULAR VOTE BY NEARLY 3 MILLIONROGER334
https://newrepublic.com/article/139429/trumps-tweets-threat-national-security,Politics,22/12/2016-19:38:39,TRUMP’S TWEETS ARE A THREAT TO OUR NATIONAL SECURITY301SS
http://www.slate.com/blogs/the_slatest/2016/12/21/trump_s_hiring_people_based_partly_on_their_looks.html,Politics,22/12/2016-19:38:39,DONALD TRUMP IS HIRING PEOPLE FOR HIS ADMINISTRATION BASED PARTLY ON THEIR LOOKSDRSGTPEPPER
http://www.newspk.ml/2016/12/obama-is-dismantling-visitor-tracking.html,Politics,22/12/2016-19:38:39,OBAMA IS DISMANTLING A VISITOR-TRACKING PROGRAM THAT TARGETS MUSLIMSPKNEWSX
http://www.reuters.com/article/idUSKBN14A12I,Politics,22/12/2016-19:38:39,NORTH CAROLINA REBUFFS TRANSGENDER BATHROOM LAW REPEALATSWENSON1
http://talkingpointsmemo.com/livewire/eric-trump-to-stop-raising-money-foundation,Politics,22/12/2016-19:38:39,ERIC TRUMP WILL STOP RAISING MONEY FOR HIS CHARITY TO AVOID ETHICS ‘QUAGMIRE’DANGUSDINGLEMAN
https://thinkprogress.org/bill-oreilly-embraces-white-nationalism-c44fe93f5cf5#.jjfn532u3,Politics,22/12/2016-19:38:39,BILL O’REILLY EMBRACES WHITE NATIONALISMTHEROOTSCREW
https://www.mail.com/news/politics/4851588-latest-trump-urges-veto-un-settlement-resolution.html,Politics,22/12/2016-19:38:39,THE LATEST: TRUMP URGES VETO OF UN SETTLEMENT RESOLUTIONRITARUDZINSKY
http://www.businessinsider.com/trump-peter-navarro-china-national-trade-council-2016-12,Politics,22/12/2016-19:38:39,TRUMP NAMES 'DEATH BY CHINA' AUTHOR AS LEADER OF HIS NEW WHITE HOUSE NATIONAL TRADE COUNCIL.GONZOVERITAS
http://www.thedailybeast.com/cheats/2016/12/22/report-trump-considering-tariff-on-foreign-imports.html?via=mobile&source=copyurl,Politics,22/12/2016-19:38:39,TRUMP CONSIDERING TARIFF ON FOREIGN IMPORTSALDOTHEEAPACHE
http://www.politico.com/story/2016/12/trump-pentagon-defense-budget-232908,Politics,22/12/2016-19:38:39,TRUMP CONVENES PENTAGON BRASS 'TO BRING COSTS DOWN'VRENNY
http://www.salon.com/2016/12/21/drain-the-swamp-of-all-those-p-c-liberals-turns-out-trumpers-dont-care-about-lobbyists-or-plutocrats/,Politics,22/12/2016-19:38:39,“DRAIN THE SWAMP” OF ALL THOSE P.C. LIBERALS! TURNS OUT TRUMPERS DON’T CARE ABOUT LOBBYISTS OR PLUTOCRATSMEDIATECHES
http://www.nytimes.com/2016/12/22/world/middleeast/donald-trump-united-nations-israel-settlements.html?&target=comments&hp&action=click&pgtype=Homepage&modref=HPCommentsRefer&clickSource=story-heading&module=first-column-region&region=top-news&WT.nav=top-news#commentsContainer,Politics,22/12/2016-19:38:39,TRUMP PRESSURES OBAMA OVER U.N. RESOLUTION ON ISRAELI SETTLEMENTSYUUGE_GERMAN_DICK
http://www.cnbc.com/2016/12/20/obamacare-boosted-number-of-people-with-health-insurance-in-every-state.html,Politics,22/12/2016-19:38:39,"HOW TRUMP-SUPPORTING STATES BENEFITED UNDER OBAMACARE: MORE HEALTH INSURANCE, MORE ACCESS TO CAREGALT1776"
https://www.washingtonpost.com/blogs/right-turn/wp/2016/12/21/the-cowardly-gop/,Politics,22/12/2016-19:38:39,THE COWARDLY GOPSHITPOSTER123456789
http://thehill.com/blogs/floor-action/senate/311487-dems-seek-more-vetting-for-trump-nominees-before-hearings,Politics,22/12/2016-19:38:39,DEMS SEEK MORE VETTING FOR TRUMP NOMINEES BEFORE HEARINGSJASON7655
http://www.sfgate.com/nation/article/Jewish-family-Centerville-Elementary-Pennsylvania-10814156.php?cmpid=reddit-desktop,Politics,22/12/2016-19:38:40,JEWISH FAMILY LEAVES TOWN IN FEAR FOLLOWING CONSERVATIVE NEWS STORY COVERAGERILEYWWARRICK
http://www.salon.com/2016/12/22/is-donald-trump-a-traitor-his-path-to-the-white-house-suggests-a-pattern-of-profound-disloyalty/,Politics,22/12/2016-19:38:40,IS DONALD TRUMP A TRAITOR? HIS PATH TO THE WHITE HOUSE SUGGESTS A PATTERN OF PROFOUND DISLOYALTYMADAM1
http://www.cnn.com/2016/12/22/politics/kellyanne-conway-donald-trump-muslim-ban/index.html,Politics,22/12/2016-19:38:40,CONWAY: TRUMP WILL NOT PURSUE IMMIGRATION BAN BASED SOLELY ON RELIGIONALDOTHEEAPACHE
http://www.nbcnews.com/politics/white-house/trump-calls-obama-veto-un-settlement-resolution-n699036?cid=sm_fb,Politics,22/12/2016-19:38:40,TRUMP AND ISRAEL ON A COLLISION COURSE WITH OBAMA OVER UN RESOLUTIONAGGIE1391
