url,type,timeretrieved,title
http://www.nytimes.com/2016/12/21/us/politics/eric-trump-charity.html,Politics,22/12/2016-19:38:46,"TRUMP’S SON, FEARING ‘QUAGMIRE,’ TO STOP SOLICITING FOR CHARITYSPLITTINGENNUI"
http://www.cnbc.com/2016/12/20/how-evan-mcmullin-went-from-fringe-candidate-to-top-trump-irritant.html,Politics,22/12/2016-19:38:46,HOW EVAN MCMULLIN WENT FROM FRINGE CANDIDATE TO TOP TRUMP IRRITANTMEGALOMAN71
http://inthesetimes.com/features/trump_left_resistance_solidarity.html,Politics,22/12/2016-19:38:46,THE ONLY WAY TO DEFEAT TRUMP IS TO UNDERSTAND THAT RACE AND CLASS ARE INSEPARABLEYOUNGBAGELIAN
http://www.politico.com/story/2016/12/donald-trump-nonprofit-group-232798,Politics,22/12/2016-19:38:46,TRUMP ADVISERS SPAR OVER NEW POLITICAL ARMELISEGAY
http://talkingpointsmemo.com/livewire/trump-official-boycotts-israeli-gov-t-meeting-over-exclusion-of-far-right-swede,Politics,22/12/2016-19:38:47,TRUMP TRANSITION OFFICIAL BOYCOTTS ISRAELI GOVT MEETING OVER SNUB OF FAR-RIGHT POLAGGIE1391
http://www.commondreams.org/news/2016/12/21/trumps-half-blind-trust-blasted-absurd,Politics,22/12/2016-19:38:47,"TRUMP'S ""HALF-BLIND"" TRUST BLASTED AS ABSURDOHSNAPYOUGOTSOLD"
http://www.cnbc.com/2016/12/21/china-may-have-been-testing-trump-with-drone-seizure.html,Politics,22/12/2016-19:38:47,CHINA MAY HAVE BEEN TESTING TRUMP WITH DRONE SEIZUREDYLANCA
http://www.nytimes.com/2016/12/16/opinion/trumps-chinese-foreign-policy.html,Politics,22/12/2016-19:38:47,PAX AMERICANA IS OVER6P6SS6
https://www.muckrock.com/news/archives/2016/nov/28/cia-assassination/,Politics,22/12/2016-19:38:47,"SINCE ASSASSINATION IS ILLEGAL, THE CIA SAYS IT HAS NO RECORDS ON HOW IT WOULD DO ITDANWIN"
http://www.bostonglobe.com/opinion/editorials/2016/12/21/harsh-laws-meet-cautious-politics/FgR7GriRdKQtQoRWBrA8uO/story.html,Politics,22/12/2016-19:38:47,"HARSH 1980S LAWS, MEET CAUTIOUS 2016 POLITICSZSREPORT"
http://pilotonline.com/news/government/politics/nation/trump-us-must-greatly-strengthen-nuclear-capability/article_ec3ff4e9-fed2-579d-92ef-c3ad21389c37.html,Politics,22/12/2016-19:38:47,TRUMP: US MUST 'GREATLY STRENGTHEN' NUCLEAR CAPABILITYEEEEEEYYYYYY
http://wncn.com/2016/12/20/questions-about-charlotte-vote-put-hb2-deal-in-jeopardy-ahead-of-special-session/,Politics,22/12/2016-19:38:47,NC GENERAL ASSEMBLY ADJOURNS WITHOUT REPEALING HB2XAYMA
http://www.dailywire.com/news/11798/gingrich-admits-trump-doesnt-want-drain-swamp-now-frank-camp,Politics,22/12/2016-19:38:47,GINGRICH ADMITS TRUMP DOESN’T WANT TO ‘DRAIN THE SWAMP’ NOW THAT HE’S PRESIDENTINCE
http://www.politico.com/story/2016/12/trump-staff-232924,Politics,22/12/2016-19:38:47,TRUMP NAMES HIS WHITE HOUSE COMMUNICATIONS TEAMSOMALI_PIR8
https://www.theguardian.com/us-news/2016/dec/21/carl-icahn-donald-trump-special-adviser-regulation,Politics,22/12/2016-19:38:47,TRUMP ADDS BILLIONAIRE CARL ICAHN TO TEAM AS SPECIAL ADVISER ON REGULATIONCONVICTTV
https://www.washingtonpost.com/opinions/happy-holidays-donald-trump/2016/12/21/74abefa8-c788-11e6-8bee-54e800ef2a63_story.html?hpid=hp_no-name_opinion-card-b%3Ahomepage%2Fstory&utm_term=.bb0dc203a280,Politics,22/12/2016-19:38:47,"HAPPY HOLIDAYS, DONALD TRUMPCHEATO_IN_CHIEF"
http://thehill.com/latino/311333-mexican-ambassador-urges-immigrants-to-apply-for-us-citizenship,Politics,22/12/2016-19:38:47,MEXICAN AMBASSADOR URGES IMMIGRANTS TO APPLY FOR US CITIZENSHIPCOREYLIEBKIND
https://www.theguardian.com/us-news/2016/dec/22/edward-snowden-russia-spy-agency-contact-us-house-report,Politics,22/12/2016-19:38:47,HOUSE REPORT CLAIMS EDWARD SNOWDEN 'HAS CONTACT' WITH RUSSIA SPY AGENCIESIRINDONA
http://www.aol.com/article/news/2016/12/22/gingrich-predicts-most-of-obama-s-legacy-will-disappear-within/21640632/,Politics,22/12/2016-19:38:47,GINGRICH PREDICTS MOST OF OBAMA'S LEGACY WILL 'DISAPPEAR WITHIN A YEAR'THAT49ER
http://abcnews.go.com/US/wireStory/north-carolinas-wide-ranging-bathroom-bill-covers-44319565,Politics,22/12/2016-19:38:47,WHAT NORTH CAROLINA'S WIDE-RANGING 'BATHROOM BILL' COVERSAMANDA_1971
http://time.com/4606111/mike-pence-is-no-ordinary-wingman/,Politics,22/12/2016-19:38:47,MIKE PENCE IS NO ORDINARY WINGMANTHELAZYREADER2015
http://www.forbes.com/sites/nathanvardi/2016/12/21/billionaire-carl-icahn-to-be-trumps-adviser-on-regulatory-overhaul/#2a9c465311ab,Politics,22/12/2016-19:38:47,BILLIONAIRE CARL ICAHN TO BE TRUMP'S ADVISER ON REGULATORY OVERHAULREADERSEVEN
http://abcnews.go.com/Sports/wireStory/north-carolina-lawmakers-meeting-hb2-repeal-44323903,Politics,22/12/2016-19:38:47,"IN BITTER DIVIDE, REPEAL OF NORTH CAROLINA LGBT LAW FAILSDISCOCONSPIRACY"
http://www.theadvocate.com/new_orleans/news/business/article_21c1feb0-c718-11e6-b532-ff59a1116f1f.html,Politics,22/12/2016-19:38:47,LOW-INCOME RESIDENTS BEING OUSTED FROM NEW ORLEANS' AMERICAN CAN CO. AFFORDABLE-HOUSING COMPLEXKSTINFO
http://www.ecowatch.com/stop-trump-cabinet-picks-2157573124.html,Politics,22/12/2016-19:38:47,"AMERICA DON'T BE FOOLED, TRUMP'S CABINET PICKS CAN BE STOPPEDI_AM_ORACLE"
https://www.scientificamerican.com/article/will-trump-negate-obama-rsquo-s-science-legacy/,Politics,22/12/2016-19:38:47,WILL TRUMP NEGATE OBAMA’S SCIENCE LEGACY?THERECORDCORRECTED
http://www.huffingtonpost.com/bj-gallagher/trump-americas-abusive-bo_b_13431634.html,Politics,22/12/2016-19:38:47,TRUMP: ABUSER IN CHIEFBUY_IPHONE_7
http://www.washingtontimes.com/news/2016/dec/21/hhs-touts-record-obamacare-signups-amid-headwinds/,Politics,22/12/2016-19:38:47,ADMINISTRATION TOUTS ‘RECORD’ OBAMACARE SIGNUPS AMID POLITICAL HEADWINDSMICHELLEGAITHER
http://www.thedailybeast.com/articles/2016/12/20/why-do-states-keep-wasting-money-on-doomed-abortion-bills.html,Politics,22/12/2016-19:38:47,WHY DO STATES KEEP WASTING MONEY ON DOOMED ABORTION BILLS?IMMAKEEPRUNNIN
https://hightowerlowdown.org/podcast/what-is-the-trump-fix/?utm_source=feedburner&utm_medium=feed&utm_campaign=Feed%3A+jimhightower+%28Jim+Hightower%27s+Radio+Lowdown%29,Politics,22/12/2016-19:38:49,"WHAT IS THE ""TRUMP FIX?""ALLLIE"
https://reason.com/blog/2016/12/21/oops-rick-perrys-history-of-crony-capita#comment,Politics,22/12/2016-19:38:49,RICK PERRY PUSHED CRONY CAPITALISM IN TEXAS. WILL HE DO THE SAME AT DEPT. OF ENERGY?PREROGATIV
http://www.politico.com/magazine/story/2016/12/bill-de-blasio-trump-new-york-214513,Politics,22/12/2016-19:38:49,DID TRUMP JUST SAVE BILL DE BLASIO'S CAREER?NOTURAVRAGEFISH
https://www.washingtonpost.com/news/the-fix/wp/2016/12/21/bill-oreilly-rose-to-the-defense-of-white-privilege-in-americas-presidential-voting-process/,Politics,22/12/2016-19:38:49,BILL O’REILLY ROSE TO THE DEFENSE OF WHITE PRIVILEGE IN AMERICA’S PRESIDENTIAL VOTING PROCESSDRAK0BSIDIAN
http://www.madhyamam.com/en/international/2016/dec/22/62-democrats-independents-dont-want-clinton-run-again,Politics,22/12/2016-19:38:49,"62% DEMOCRATS, INDEPENDENTS DON'T WANT CLINTON TO RUN AGAINSADAR121"
http://hosted.ap.org/dynamic/stories/U/US_DEFAMATION_VERDICT_CAMPAIGN_AD?SITE=AP&SECTION=HOME&TEMPLATE=DEFAULT&CTIME=2016-12-21-19-07-31,Politics,22/12/2016-19:38:49,KENTUCKY JURY AWARDS $200K FOR 'FALSE' POLITICAL ADODAWN
http://observer.com/2016/12/mike-stone-michigan-democratic-party-assault-battery-against-sanders-supporter/,Politics,22/12/2016-19:38:49,MICHIGAN DEMOCRATIC MEETING BREAKS INTO VIOLENCE AS ESTABLISHMENT DEMS REPEL SANDERS SUPPORTERSPAINTMESUNRISE
http://www.dallasnews.com/news/politics/2016/12/20/eric-trump-donald-trump-jr-distance-dallas-based-nonprofits-inauguration-party,Politics,22/12/2016-19:38:49,"ERIC TRUMP, DONALD TRUMP JR. DISTANCE THEMSELVES FROM DALLAS-BASED NONPROFIT'S INAUGURATION PARTYBEARSNECESSITY"
https://southfront.org/breaking-14-us-led-coalition-military-advisers-captured-by-syrian-special-forces-in-aleppo/,Politics,22/12/2016-19:38:49,14 US-LED COALITION MILITARY ADVISERS CAPTURED BY SYRIAN SPECIAL FORCES IN ALEPPORUSKEEBLUE
https://www.washingtonpost.com/news/post-politics/wp/2016/12/21/trump-on-the-future-of-proposed-muslim-ban-registry-you-know-my-plans/?utm_term=.1195710133bb,Politics,22/12/2016-19:38:49,"TRUMP ON THE FUTURE OF PROPOSED MUSLIM BAN, REGISTRY: ‘YOU KNOW MY PLANS’0XOOO"
http://www.seattletimes.com/business/boeing-aerospace/trump-meeting-with-boeing-lockheed-ceos-today/,Politics,22/12/2016-19:38:49,"BOEING CEO MEETS TRUMP, SAYS AIR FORCE ONE CAN BE BUILT FOR LESS THAN $4BTURN-DOWN-FOR-WHAT"
http://www.cnn.com/2016/12/22/politics/mississippi-transgender-hate-crime/index.html,Politics,22/12/2016-19:38:49,HATE-CRIME CASE RESULT HISTORIC FOR FEDSEASTODLINTN
http://www.businessinsider.com/trump-corporate-tax-cut-impact-2016-12,Politics,22/12/2016-19:38:49,ONE OF TRUMP'S BIGGEST PLANS TO STIMULATE THE ECONOMY WON'T BE GREAT FOR MOST AMERICANSRISEOFTHETRUMPWAFFEN
http://talkingpointsmemo.com/livewire/newt-gingrich-trump-not-using-drain-the-swamp,Politics,22/12/2016-19:38:49,GINGRICH SAYS TRUMP'S NO LONGER INTERESTED IN 'DRAIN THE SWAMP'COOLCROSBY
http://www.cnn.com/2016/12/21/politics/donald-trump-twitter/,Politics,22/12/2016-19:38:49,TRUMP'S STILL GOING WRONG ON TWITTERHIGHSNTURD
http://miamiherald.typepad.com/nakedpolitics/2016/12/keith-ellison-endorses-stephen-bittel-in-miami-dade-democratic-party-race.html,Politics,22/12/2016-19:38:49,KEITH ELLISON TO ENDORSE STEPHEN BITTEL IN MIAMI-DADE DEMOCRATIC PARTY RACEIWANTTOODIE
http://www.independent.co.uk/news/world/americas/fbi-search-warrant-hillary-clinton-emails-james-comey-presidential-election-loses-donald-trump-a7488011.html,Politics,22/12/2016-19:38:49,FBI SEARCH WARRANT BLAMED FOR COSTING HILLARY CLINTON PRESIDENTIAL ELECTION 'SHOULD NEVER HAVE BEEN GRANTED'DARTHADITYA
http://www.thedailybeast.com/articles/2016/12/19/samantha-bee-and-glenn-back-unite-over-trump-it-s-all-of-us-against-trumpism.html?via=desktop&source=Reddit,Politics,22/12/2016-19:38:49,SAMANTHA BEE AND GLENN BECK UNITE OVER TRUMP: ‘IT’S ALL OF US AGAINST TRUMPISM’SUMMEROFEVIDENCE
http://www.bbc.com/news/world-us-canada-38399712,Politics,22/12/2016-19:38:49,TRUMP APPOINTS 'DEATH BY CHINA' AUTHOR AS HEAD OF US TRADE COUNCILSPSHERIDAN
http://www.nytimes.com/interactive/2016/12/22/us/politics/cabinet-removal.html?hp&action=click&pgtype=Homepage&clickSource=image&module=first-column-region&region=top-news&WT.nav=top-news&_r=0,Politics,22/12/2016-19:38:49,HOW HARD IS IT TO GET RID OF A CABINET DEPARTMENT? PRETTY HARD1WHEEL
http://www.cnn.com/2016/12/21/politics/trump-electoral-college-popular-vote-tweets/index.html,Politics,22/12/2016-19:38:49,TRUMP JUST CAN'T GET OVER ELECTION DAYDISCOCRISCO
http://www.nytimes.com/2016/12/21/us/politics/peter-navarro-carl-icahn-trump-china-trade.html,Politics,22/12/2016-19:38:49,"TRUMP TAPS PETER NAVARRO, A CRITIC OF CHINA, FOR A NEW TRADE POSTD0397"
https://www.washingtonpost.com/blogs/right-turn/wp/2016/12/21/retroactive-explanations-for-trumps-actions-dont-make-sense/?hpid=hp_no-name_opinion-card-b%3Ahomepage%2Fstory&utm_term=.1076a98b5cef,Politics,22/12/2016-19:38:49,RETROACTIVE EXPLANATIONS FOR TRUMP’S ACTIONS DON’T MAKE SENSEORANGEANUSMOUTH
http://talkingpointsmemo.com/dc/trump-pick-for-omb-director-wants-to-end-medicare-as-we-know-it//,Politics,22/12/2016-19:38:49,TRUMP’S PICK FOR OMB DIRECTOR HAS VOWED TO 'END MEDICARE AS WE KNOW IT'TRUMP_WEED
https://www.bloomberg.com/news/articles/2016-12-21/trump-adviser-says-he-is-ditching-drain-the-swamp,Politics,22/12/2016-19:38:49,TRUMP ADVISER SAYS HE IS DITCHING 'DRAIN THE SWAMP'JLEW24ASU
https://www.youtube.com/watch?v=jlAw1dhTjv0,Politics,22/12/2016-19:38:50,LET'S TALK: PRESIDENT-ELECT TRUMP'S CONFLICTS OF INTERESTDRAK0BSIDIAN
http://www.vox.com/policy-and-politics/2016/12/21/13988270/comey-investigation-fbi,Politics,22/12/2016-19:38:50,WAS THE WARRANT THE FBI USED FOR ITS FINAL CLINTON INVESTIGATION UNJUSTIFIED?GREYMANBOMBER
http://www.msnbc.com/rachel-maddow/watch/two-officials-charged-in-flint-water-crisis-838218307691,Politics,22/12/2016-19:38:50,TWO EMERGENCY MANAGERS CHARGED IN FLINT TOXIC WATER CRISISARTICUNDO1
https://www.yahoo.com/news/trump-points-to-attacks-in-europe-to-argue-for-muslim-registry-all-along-ive-been-proven-to-be-right-100-correct-224049189.html,Politics,22/12/2016-19:38:50,"TRUMP USES BERLIN ATTACK TO ARGUE FOR MUSLIM REGISTRY: ‘ALL ALONG, I’VE BEEN PROVEN TO BE RIGHT — 100% CORRECT'CURLYBRAC"
http://www.cnbc.com/2016/12/21/trumps-commitment-to-infrastructure-vow-is-being-questioned.html,Politics,22/12/2016-19:38:50,TRUMP'S COMMITMENT TO INFRASTRUCTURE VOW IS BEING QUESTIONEDNOTAXESTRUMP
http://www.thehill.com/homenews/news/311573-scarborough-the-political-landscape-looks-grim-for-dems,Politics,22/12/2016-19:38:50,JOE SCARBOROUGH: 'POLITICAL LANDSCAPE LOOKS GRIM’ FOR DEMSWHOSHABOOBOO
http://www.huffingtonpost.com/entry/hillary-clinton-popular-vote_us_58599647e4b0eb58648446c6,Politics,22/12/2016-19:38:50,FINAL POPULAR VOTE TOTAL SHOWS CLINTON WON ALMOST 3 MILLION MORE BALLOTS THAN TRUMPSYMBOLOPHORUS
https://www.weforum.org/agenda/2016/12/of-course-social-media-is-transforming-politics-but-it-s-not-to-blame-for-brexit-and-trump,Politics,22/12/2016-19:38:50,OF COURSE SOCIAL MEDIA IS TRANSFORMING POLITICS. BUT IT’S NOT TO BLAME FOR BREXIT AND TRUMPALL_RAND0M
http://nationalinterest.org/feature/congress-must-reclaim-its-war-making-powers-18804?page=show,Politics,22/12/2016-19:38:50,CONGRESS MUST RECLAIM ITS WAR-MAKING POWERSCOLLUMMCJINGLEBALLS
http://www.theverge.com/2016/12/21/14012534/palantir-peter-thiel-trump-immigrant-extreme-vetting,Politics,22/12/2016-19:38:50,DOCUMENTS SUGGEST PALANTIR COULD HELP POWER TRUMP'S ‘EXTREME VETTING’ OF IMMIGRANTSRNON
http://hosted.ap.org/dynamic/stories/U/US_CIVIL_LIBERTIES_OVERSIGHT?SITE=AP&SECTION=HOME&TEMPLATE=DEFAULT&CTIME=2016-12-21-20-23-24,Politics,22/12/2016-19:38:50,"BEFORE TRUMP'S PRESIDENCY, US PRIVACY BOARD IN DISARRAYODAWN"
http://www.muslimpress.com/en/tiny/news-106915,Politics,22/12/2016-19:38:50,‘PATRONAGE OF ISRAEL HAS CAUSED NOTHING BUT TROUBLE FOR U.S. IMPERIALISM’FINALIN
http://www.latimes.com/business/la-fi-senate-drug-price-study-20161221-story.html,Politics,22/12/2016-19:38:50,HOW 4 DRUG COMPANIES RAPIDLY RAISED PRICES ON LIFE-SAVING DRUGSGARYHARTMAN
http://www.chicagotribune.com/news/local/politics/ct-rahm-emanuel-personal-emails-met-20161221-story.html,Politics,22/12/2016-19:38:50,"IN LAWSUIT SETTLEMENT, EMANUEL ADMITS USING PERSONAL EMAIL FOR PUBLIC BUSINESSSSTTERRY1"
https://www.washingtonpost.com/opinions/james-comeys-year-of-unintended--and-ruinous--consequences/2016/12/21/459cb0de-c7bb-11e6-8bee-54e800ef2a63_story.html?hpid=hp_no-name_opinion-card-a%3Ahomepage%2Fstory&utm_term=.1ee6bd7dc94a,Politics,22/12/2016-19:38:50,JAMES COMEY’S YEAR OF UNINTENDED — AND RUINOUS — CONSEQUENCES .PROSTATE-APOSTATE
http://www.nola.com/politics/index.ssf/2016/12/governor_brother_fbi.html#incart_most-read_,Politics,22/12/2016-19:38:50,JOHN BEL EDWARDS HAS 'ALL THE CONFIDENCE IN THE WORLD' THAT HIS BROTHER DID NOTHING WRONGTODAYILEARNED83
https://www.washingtonpost.com/news/wonk/wp/2016/12/20/poll-conservatives-most-likely-to-be-offended-by-holiday-greetings/?tid=sm_fb&utm_term=.aed463b84f52,Politics,22/12/2016-19:38:50,POLL: CONSERVATIVES MOST LIKELY TO BE OFFENDED BY HOLIDAY GREETINGSAGGIE1391
http://www.eater.com/2016/12/21/14038332/anthony-bourdain-election-trump-interview,Politics,22/12/2016-19:38:51,ANTHONY BOURDAIN: THE POST-ELECTION INTERVIEWDEMONGOATMONKEY
http://www.cnbc.com/2016/12/21/trump-to-meet-with-boeing-lockheed-martin-ceos-on-wednesday.html,Politics,22/12/2016-19:38:51,"AFTER MEETING WITH TRUMP, BOEING CEO SAYS AIR FORCE ONE WILL COST LESS THAN $4.2 BILLIONNOVACHAM"
http://abcnews.go.com/Politics/wireStory/trump-live-infrastructure-promises-44296626?cid=social_twitter_abcnp,Politics,22/12/2016-19:38:51,TRUMP'S COMMITMENT TO INFRASTRUCTURE VOW IS BEING QUESTIONEDJULIAROBART
http://www.nytimes.com/2016/12/20/world/middleeast/russia-iran-and-turkey-meet-for-syria-talks-excluding-us.html?&target=comments&hp&action=click&pgtype=Homepage&modref=HPCommentsRefer&clickSource=story-heading&module=first-column-region&region=top-news&WT.nav=top-news#commentsContainer,Politics,22/12/2016-19:38:51,"RUSSIA, IRAN AND TURKEY MEET FOR SYRIA TALKS, EXCLUDING U.S.YUUGE_GERMAN_DICK"
https://thinkprogress.org/gingrich-trump-ethics-laws-conflicts-of-interest-kleoptocracy-17d500c1d6c6#.wqha3aku8,Politics,22/12/2016-19:38:51,"GINGRICH SAYS TRUMP CAN’T BE EXPECTED TO FOLLOW ETHICS LAWS, SO CONGRESS SHOULD CHANGE THEM FOR HIMJLEW24ASU"
https://www.washingtonpost.com/politics/whitehouse/the-latest-israeli-envoy-urges-trump-to-move-embassy/2016/12/20/cef9d9d0-c714-11e6-acda-59924caa2450_story.html?utm_term=.0b851642abe7,Politics,22/12/2016-19:38:51,THE LATEST: GINGRICH SAYS TRUMP DISLCAIMS 'DRAIN THE SWAMP'JUTTONC
https://www.theatlantic.com/politics/archive/2016/12/obama-guantanamo-bay/511349/,Politics,22/12/2016-19:38:51,OBAMA'S LAST-DITCH PUSH TO CLOSE GUANTANAMO BAYCIIK
http://www.latimes.com/politics/la-pol-yir-decker-essay-20161213-story.html#nt=oft12aH-1la1,Politics,22/12/2016-19:38:51,"AMERICAN VOTERS WANTED CHANGE IN 2016, BUT WILL THEY GET THE CHANGE THEY WANTED?IMNAHA2"
http://talkingpointsmemo.com/livewire/north-carolina-house-adjourns-no-hb2-repeal,Politics,22/12/2016-19:38:52,NORTH CAROLINA HOUSE ADJOURNS WITHOUT TAKING UP REPEAL OF ANTI-GAY LAWJACKSONARBOR
https://www.washingtonpost.com/opinions/congratulations-trump-welcome-to-hell/2016/12/20/5dbcb166-c6e7-11e6-bf4b-2c064d32a4bf_story.html?hpid=hp_no-name_opinion-card-d%3Ahomepage%2Fstory&utm_term=.19b0d38aac32,Politics,22/12/2016-19:38:52,"CONGRATULATIONS, TRUMP. WELCOME TO HELL.ORANGEANUSMOUTH"
http://www.nytimes.com/2016/12/20/world/europe/russia-rex-tillerson-donald-trump-secretary-of-state.html,Politics,22/12/2016-19:38:52,HOW REX TILLERSON CHANGED HIS TUNE ON RUSSIA AND CAME TO COURT ITS RULERSGALIENLIFEFORM
http://www.ecowatch.com/trump-sons-hunting-trip-2157335722.html,Politics,22/12/2016-19:38:52,TRUMP SONS AUCTIONING OFF $1 MILLION HUNTING TRIP TO CELEBRATE INAUGURATIONDESI_US
http://www.politico.com/story/2016/12/trump-doctor-harold-borstein-interview-232883,Politics,22/12/2016-19:38:52,"TRUMP'S DOCTOR ON HIS HEALTH IN OFFICE: 'IF SOMETHING HAPPENS TO HIM, THEN IT HAPPENS TO HIM'HOGGARD-00"
https://www.eff.org/deeplinks/2016/12/trump-and-his-advisers-net-neutrality?utm_campaign=crowdfire&utm_content=crowdfire&utm_medium=social&utm_source=twitter,Politics,22/12/2016-19:38:52,TRUMP AND HIS ADVISORS ON NET NEUTRALITYSTRIDERSUBZERO
http://arstechnica.com/tech-policy/2016/12/fcc-republicans-vow-to-gut-net-neutrality-rules-as-soon-as-possible/,Politics,22/12/2016-19:38:52,FCC REPUBLICANS VOW TO GUT NET NEUTRALITY RULES “AS SOON AS POSSIBLE”ALLWORKNOPLAYTODAY
http://www.politico.com/story/2016/12/russia-democrats-select-committee-232900,Politics,22/12/2016-19:38:52,SOME DEMS RESIST NEW RUSSIA SELECT COMMITTEENINAWATSON11
https://spectator.org/liberal-women-and-men-are-intolerant/,Politics,22/12/2016-19:38:52,"DEMOCRAT WOMEN MOST LIKELY TO BLOCK ""FRIENDS"" DUE TO OPPOSING POLITICAL VIEWSWORLDNEEDSSADDAM"
http://www.coloradoan.com/story/news/2016/12/20/polis-vows-fight-any-federal-muslim-registry/95659626/,Politics,22/12/2016-19:38:52,POLIS VOWS TO FIGHT ANY FEDERAL MUSLIM REGISTRYFUTURE-THINKER
https://www.washingtonpost.com/news/act-four/wp/2016/12/20/people-who-fear-trump-arent-weak-theyre-being-reasonable/?utm_term=.8cf2b2e52241,Politics,22/12/2016-19:38:52,PEOPLE WHO FEAR TRUMP AREN’T WEAK. THEY’RE BEING REASONABLE.SIVRIBIBER
https://www.washingtonpost.com/news/answer-sheet/wp/2016/12/21/to-trumps-education-pick-the-u-s-public-school-system-is-a-dead-end/?utm_term=.88f914367cca,Politics,22/12/2016-19:38:52,"TO TRUMP’S EDUCATION PICK, THE U.S. PUBLIC SCHOOL SYSTEM IS A ‘DEAD END’RIFE170"
http://thehill.com/policy/healthcare/311428-gop-considers-holding-off-on-repealing-obamacare-taxes,Politics,22/12/2016-19:38:52,GOP CONSIDERS HOLDING OFF ON REPEALING OBAMACARE TAXESSHITPOSTER123456789
http://www.slate.com/blogs/xx_factor/2016/12/20/poll_women_should_be_punished_for_abortions_say_39_percent_of_trump_voters.html,Politics,22/12/2016-19:38:52,"POLL: WOMEN SHOULD BE PUNISHED FOR ABORTIONS, SAY 39 PERCENT OF TRUMP VOTERSAGGIE1391"
http://www.slate.com/blogs/the_slatest/2016/11/23/trump_s_asia_strategy_could_work_out_ok_for_china.html,Politics,22/12/2016-19:38:52,TRUMP’S ASIA STRATEGY MIGHT WORK OUT OK—FOR CHINAMAIDOMAIDO
http://thehill.com/blogs/blog-briefing-room/news/311236-clinton-leads-trump-by-under-3-million-votes-infinal-election,Politics,22/12/2016-19:38:52,CLINTON BEATS TRUMP BY NEARLY 3M IN POPULAR VOTEDELTA_14
https://www.washingtonpost.com/blogs/plum-line/wp/2016/12/21/how-conservatives-will-be-forced-to-fall-in-line-behind-trump/?utm_term=.093a53620ae5,Politics,22/12/2016-19:38:52,HOW CONSERVATIVES WILL BE FORCED TO FALL IN LINE BEHIND TRUMPSIVRIBIBER
http://www.suffolk.edu/news/69619.php#.WFrqs9VMFnE,Politics,22/12/2016-19:38:52,BERNIE SANDERS IS THE 2020 DEMOCRATIC CANDIDATE FRONTRUNNER FOR THE PRESIDENCY ACCORDING TO NEW POLLJBEARD0
http://www.politifact.com/truth-o-meter/statements/2016/dec/18/john-podesta/its-true-wikileaks-dumped-podesta-emails-hour-afte,Politics,22/12/2016-19:38:52,IT'S TRUE: WIKILEAKS DUMPED PODESTA EMAILS HOUR AFTER TRUMP VIDEO SURFACEDARTICUNDO1
http://www.usatoday.com/story/news/politics/2016/12/21/donald-trump-electoral-college-hillary-clinton/95693972/,Politics,22/12/2016-19:38:52,TRUMP MEETS WITH BOEING AND LOCKHEED CEOS ABOUT GOVERNMENT CONTRACTSCREAMIIGIRL
https://www.theguardian.com/commentisfree/2016/dec/21/clintons-democratic-party-donors-recover,Politics,22/12/2016-19:38:52,THE CLINTONS TURNED THE DEMOCRATIC PARTY OVER TO DONORS. CAN IT RECOVER?SANDERSWASROBBED
http://www.dailydot.com/layer8/democrats-want-to-end-the-electoral-college/,Politics,22/12/2016-19:38:52,DICK DURBIN JOINS BERNIE SANDERS IN CALL TO ABOLISH ELECTORAL COLLEGELEDHE
http://www.independent.co.uk/news/world/americas/north-carolina-hb2-anti-lgbt-law-bathroom-bill-transgender-ncga-latest-a7489531.html,Politics,22/12/2016-19:38:52,NORTH CAROLINA REPUBLICANS STALL VOTE TO REPEAL 'ANTI-LGBT' BATHROOM LAWAUSTINZZZ
http://thehill.com/homenews/administration/311417-trump-names-icahn-as-special-adviser-on-regulatory-reform,Politics,22/12/2016-19:38:52,TRUMP NAMES ICAHN AS SPECIAL ADVISERDIESL
http://www.politico.com/story/2016/12/rep-renacci-eyes-ohio-gubernatorial-bid-232910,Politics,22/12/2016-19:38:52,REP. RENACCI EYES OHIO GUBERNATORIAL BIDDAVID_2017
http://www.thestranger.com/slog/2016/12/20/24756261/they-aint-gonna-play-trump-city,Politics,22/12/2016-19:38:53,THEY AIN'T GONNA PLAY TRUMP CITYCRATERMOON
http://www.businessinsider.com/carl-icahn-named-special-adviser-for-regulation-trump-administration-2016-12,Politics,22/12/2016-19:38:53,CARL ICAHN NAMED A SPECIAL ADVISER IN THE TRUMP ADMINISTRATIONQWERTYSAPIENS
http://edition.cnn.com/2016/12/20/politics/rex-tillerson-tax-returns/index.html,Politics,22/12/2016-19:38:53,DEMS PRESS FOR TILLERSON'S TAX RETURNSMANIAFORBEATLES
http://www.bbc.com/news/world-us-canada-38406250,Politics,22/12/2016-19:38:53,TRUMP NAMES KELLYANNE CONWAY AS PRESIDENTIAL COUNSELLORCHRISTOSI
http://www.vanityfair.com/news/2016/12/donald-trump-conflicts-of-interest-impeach,Politics,22/12/2016-19:38:53,THE EVIDENCE TO IMPEACH DONALD TRUMP MAY ALREADY BE HEREALDOTHEEAPACHE
http://www.politico.com/blogs/donald-trump-administration/2016/12/carl-icahn-regulatory-reform-adviser-232901,Politics,22/12/2016-19:38:53,TRUMP TAPS INVESTOR ICAHN TO ADVISE ON REGULATORY REFORMICYFIRZ
https://thinkprogress.org/clinton-won-popular-vote-45ca997fedb1#.1w2kh143t,Politics,22/12/2016-19:38:53,"IT’S OFFICIAL. CLINTON WON THE POPULAR VOTE BY 2,864,974PIKACHUSQUAREPANTS"
https://www.washingtonpost.com/news/post-politics/wp/2016/12/21/trump-on-the-future-of-proposed-muslim-ban-registry-you-know-my-plans/?tid=sm_tw&tid=sm_tw&tid=sm_tw&tid=sm_tw&tid=sm_tw&tid=sm_tw&tid=sm_tw&tid=sm_tw&tid=sm_tw&tid=sm_tw&tid=sm_tw&tid=sm_tw&tid=sm_tw&tid=sm_tw&tid=sm_tw&tid=sm_tw,Politics,22/12/2016-19:38:53,"TRUMP ON THE FUTURE OF PROPOSED MUSLIM BAN, REGISTRY: ‘YOU KNOW MY PLANS’NORMANMAILERSGHOST"
http://www.cnbc.com/2016/12/21/trump-rally-could-be-like-coolidges-roaring-20s-before-depression-nobel-winning-economist-warns.html,Politics,22/12/2016-19:38:53,"TRUMP RALLY COULD BE LIKE COOLIDGE'S ROARING '20S BEFORE DEPRESSION, NOBEL-WINNING ECONOMIST WARNSNURSHAKIL10"
http://thehill.com/blogs/blog-briefing-room/news/311403-hillary-clinton-jeb-bush-on-gqs-least-influential-list,Politics,22/12/2016-19:38:53,"HILLARY CLINTON, JEB BUSH ON GQ'S 'LEAST INFLUENTIAL' LISTREDDITREGERTS"
http://www.vanityfair.com/hollywood/2016/12/apprentice-producer-donald-trump-president?mbid=social_twitter,Politics,22/12/2016-19:38:53,A FORMER APPRENTICE PRODUCER RESPONDS TO DONALD TRUMP BEING ELECTED PRESIDENTI_GET_NERVOUS
http://nymag.com/daily/intelligencer/2016/12/military-plane-flying-around-midtown-was-trump-drill-report.html,Politics,22/12/2016-19:38:53,THAT MILITARY PLANE FLYING AROUND MIDTOWN WAS REPORTEDLY A TEST RUN TO SAVE THE FUTURE PRESIDENTNEILPOONHANDLER
http://www.latimes.com/nation/la-na-us-intervention-foreign-elections-20161213-story.html,Politics,22/12/2016-19:38:53,THE U.S. IS NO STRANGER TO INTERFERING IN THE ELECTIONS OF OTHER COUNTRIESNOVACHAM
http://www.nbcnews.com/news/us-news/gov-chris-christie-tweets-storm-after-revenge-bill-fails-new-n698526,Politics,22/12/2016-19:38:53,GOV. CHRIS CHRISTIE TWEETS UP A STORM AFTER 'REVENGE BILL' FAILS IN NEW JERSEY LEGISLATUREPRETZELWATER
http://thehill.com/policy/energy-environment/311172-republican-senator-house-gop-killed-energy-bill-to-go-to-a-party,Politics,22/12/2016-19:38:53,REPUBLICAN SENATOR: HOUSE GOP KILLED ENERGY BILL TO GO TO A PARTYWYLDCAT
http://nypost.com/2016/12/22/trump-names-kellyanne-conway-as-presidential-counselor/,Politics,22/12/2016-19:38:53,TRUMP NAMES KELLYANNE CONWAY AS PRESIDENTIAL COUNSELORSAMUEL311FAN
